STDOUT:
Results will be saved in /home/philip/projects/llm_inference_code_repo/Circuit-Completion-Using-GNNs/component_classification_with_link_prediction_head/evaluation/FEGIN/results/model_FEGIN_dataset_ltspice_examples
Command line input: python main.py --data ltspice_examples --representation component_pin_net --model FEGIN --layers 2 --hiddens 64 --batch_size 32 --lr 0.001 --emb_size 128 --epochs 100 --save_appendix component_pin_net_L2_H64_BS32_LR0.001_E128 --no_val
 is saved.
-----
ltspice_examples - FEGIN
Using 2 layers, 64 hidden units, h = 2
Loading component_pin_net representation dataset
ENTERED
Training FEGIN on component_pin_net representation
Train: 3558, Test: 846
##################ITERATION #0 ****************************************
 epoch: 0, train_loss: 1.1788, test_loss: 1.0150, test_f1: 0.4212
 epoch: 1, train_loss: 0.9974, test_loss: 0.9230, test_f1: 0.5176
 epoch: 2, train_loss: 0.9573, test_loss: 0.9201, test_f1: 0.5259
 epoch: 3, train_loss: 0.9320, test_loss: 0.8924, test_f1: 0.5170
 epoch: 4, train_loss: 0.9072, test_loss: 0.8648, test_f1: 0.5257
 epoch: 5, train_loss: 0.8962, test_loss: 0.8789, test_f1: 0.5194
 epoch: 6, train_loss: 0.8808, test_loss: 0.8520, test_f1: 0.5569
 epoch: 7, train_loss: 0.8610, test_loss: 0.8199, test_f1: 0.5806
 epoch: 8, train_loss: 0.8541, test_loss: 0.8012, test_f1: 0.6070
 epoch: 9, train_loss: 0.8359, test_loss: 0.8146, test_f1: 0.5494
 epoch: 10, train_loss: 0.8183, test_loss: 0.8313, test_f1: 0.5537
 epoch: 11, train_loss: 0.8234, test_loss: 0.8363, test_f1: 0.5687
 epoch: 12, train_loss: 0.7985, test_loss: 0.7992, test_f1: 0.6356
 epoch: 13, train_loss: 0.8011, test_loss: 0.7514, test_f1: 0.6220
 epoch: 14, train_loss: 0.7700, test_loss: 0.7703, test_f1: 0.6084
 epoch: 15, train_loss: 0.7626, test_loss: 0.8059, test_f1: 0.6056
 epoch: 16, train_loss: 0.7453, test_loss: 0.8305, test_f1: 0.6260
 epoch: 17, train_loss: 0.7326, test_loss: 0.7517, test_f1: 0.6348
 epoch: 18, train_loss: 0.7283, test_loss: 0.8688, test_f1: 0.5791
 epoch: 19, train_loss: 0.7265, test_loss: 0.7299, test_f1: 0.6603
 epoch: 20, train_loss: 0.7202, test_loss: 0.7482, test_f1: 0.6356
 epoch: 21, train_loss: 0.7129, test_loss: 0.7787, test_f1: 0.6778
 epoch: 22, train_loss: 0.7031, test_loss: 0.8100, test_f1: 0.6511
 epoch: 23, train_loss: 0.6794, test_loss: 0.7849, test_f1: 0.6524
 epoch: 24, train_loss: 0.6834, test_loss: 0.7261, test_f1: 0.6571
 epoch: 25, train_loss: 0.6910, test_loss: 0.7916, test_f1: 0.6485
 epoch: 26, train_loss: 0.6792, test_loss: 0.8220, test_f1: 0.6393
 epoch: 27, train_loss: 0.6769, test_loss: 0.7947, test_f1: 0.6379
 epoch: 28, train_loss: 0.6581, test_loss: 0.7986, test_f1: 0.6608
 epoch: 29, train_loss: 0.6593, test_loss: 0.8223, test_f1: 0.6438
 epoch: 30, train_loss: 0.6485, test_loss: 0.7652, test_f1: 0.6378
 epoch: 31, train_loss: 0.6405, test_loss: 0.8336, test_f1: 0.6425
 epoch: 32, train_loss: 0.6248, test_loss: 0.8054, test_f1: 0.6857
 epoch: 33, train_loss: 0.6313, test_loss: 0.8388, test_f1: 0.6396
 epoch: 34, train_loss: 0.6282, test_loss: 0.8391, test_f1: 0.6698
 epoch: 35, train_loss: 0.6130, test_loss: 0.8333, test_f1: 0.6468
 epoch: 36, train_loss: 0.6144, test_loss: 0.8491, test_f1: 0.6672
 epoch: 37, train_loss: 0.6105, test_loss: 0.8331, test_f1: 0.6383
 epoch: 38, train_loss: 0.6060, test_loss: 0.8725, test_f1: 0.6149
 epoch: 39, train_loss: 0.6098, test_loss: 0.8863, test_f1: 0.6519
 epoch: 40, train_loss: 0.5965, test_loss: 0.8644, test_f1: 0.6321
 epoch: 41, train_loss: 0.5891, test_loss: 0.8848, test_f1: 0.6248
 epoch: 42, train_loss: 0.5805, test_loss: 0.8532, test_f1: 0.6539
 epoch: 43, train_loss: 0.5915, test_loss: 0.8558, test_f1: 0.6577
 epoch: 44, train_loss: 0.5876, test_loss: 0.8395, test_f1: 0.6664
 epoch: 45, train_loss: 0.5713, test_loss: 0.8516, test_f1: 0.6600
 epoch: 46, train_loss: 0.5661, test_loss: 0.9121, test_f1: 0.6571
 epoch: 47, train_loss: 0.5727, test_loss: 0.9086, test_f1: 0.6399
 epoch: 48, train_loss: 0.5735, test_loss: 0.8713, test_f1: 0.6222
 epoch: 49, train_loss: 0.5661, test_loss: 0.9500, test_f1: 0.6454
 epoch: 50, train_loss: 0.5546, test_loss: 0.9640, test_f1: 0.6286
 epoch: 51, train_loss: 0.5167, test_loss: 0.9181, test_f1: 0.6477
 epoch: 52, train_loss: 0.5036, test_loss: 0.8771, test_f1: 0.6730
 epoch: 53, train_loss: 0.5051, test_loss: 0.9045, test_f1: 0.6660
 epoch: 54, train_loss: 0.5082, test_loss: 0.8602, test_f1: 0.6638
 epoch: 55, train_loss: 0.4946, test_loss: 0.8944, test_f1: 0.6505
 epoch: 56, train_loss: 0.5049, test_loss: 0.9305, test_f1: 0.6654
 epoch: 57, train_loss: 0.5189, test_loss: 0.9156, test_f1: 0.6670
 epoch: 58, train_loss: 0.4952, test_loss: 0.9672, test_f1: 0.6444
 epoch: 59, train_loss: 0.5047, test_loss: 0.9793, test_f1: 0.6581
 epoch: 60, train_loss: 0.4829, test_loss: 0.9799, test_f1: 0.6514
 epoch: 61, train_loss: 0.4839, test_loss: 0.9437, test_f1: 0.6392
 epoch: 62, train_loss: 0.4883, test_loss: 0.9836, test_f1: 0.6524
 epoch: 63, train_loss: 0.4758, test_loss: 0.9349, test_f1: 0.6612
 epoch: 64, train_loss: 0.4775, test_loss: 0.9195, test_f1: 0.6726
 epoch: 65, train_loss: 0.4724, test_loss: 0.9107, test_f1: 0.6565
 epoch: 66, train_loss: 0.4853, test_loss: 0.9284, test_f1: 0.6760
 epoch: 67, train_loss: 0.4567, test_loss: 0.9729, test_f1: 0.6645
 epoch: 68, train_loss: 0.4591, test_loss: 0.9630, test_f1: 0.6429
 epoch: 69, train_loss: 0.4567, test_loss: 0.9394, test_f1: 0.6689
 epoch: 70, train_loss: 0.4424, test_loss: 1.0366, test_f1: 0.6707
 epoch: 71, train_loss: 0.4587, test_loss: 0.9815, test_f1: 0.6473
 epoch: 72, train_loss: 0.4462, test_loss: 0.9901, test_f1: 0.7041
 epoch: 73, train_loss: 0.4663, test_loss: 0.9386, test_f1: 0.6558
 epoch: 74, train_loss: 0.4307, test_loss: 1.0173, test_f1: 0.6703
 epoch: 75, train_loss: 0.4327, test_loss: 0.9856, test_f1: 0.6612
 epoch: 76, train_loss: 0.4364, test_loss: 1.0032, test_f1: 0.6771
 epoch: 77, train_loss: 0.4473, test_loss: 1.0054, test_f1: 0.6490
 epoch: 78, train_loss: 0.4305, test_loss: 0.9683, test_f1: 0.6718
 epoch: 79, train_loss: 0.4361, test_loss: 0.9439, test_f1: 0.6915
 epoch: 80, train_loss: 0.4409, test_loss: 1.0064, test_f1: 0.6589
 epoch: 81, train_loss: 0.4225, test_loss: 1.0553, test_f1: 0.6473
 epoch: 82, train_loss: 0.4199, test_loss: 1.0111, test_f1: 0.6738
 epoch: 83, train_loss: 0.4339, test_loss: 1.0259, test_f1: 0.6633
 epoch: 84, train_loss: 0.4149, test_loss: 1.0886, test_f1: 0.6451
 epoch: 85, train_loss: 0.4275, test_loss: 1.0154, test_f1: 0.6725
 epoch: 86, train_loss: 0.4202, test_loss: 0.9767, test_f1: 0.7026
 epoch: 87, train_loss: 0.4293, test_loss: 1.0520, test_f1: 0.6622
 epoch: 88, train_loss: 0.4155, test_loss: 1.0049, test_f1: 0.6627
 epoch: 89, train_loss: 0.4186, test_loss: 1.0346, test_f1: 0.6502
 epoch: 90, train_loss: 0.4117, test_loss: 1.0324, test_f1: 0.6626
 epoch: 91, train_loss: 0.4159, test_loss: 1.1485, test_f1: 0.6678
 epoch: 92, train_loss: 0.4046, test_loss: 1.0959, test_f1: 0.6671
 epoch: 93, train_loss: 0.4222, test_loss: 1.1109, test_f1: 0.6829
 epoch: 94, train_loss: 0.4016, test_loss: 1.1166, test_f1: 0.6543
 epoch: 95, train_loss: 0.4109, test_loss: 1.0874, test_f1: 0.6852
 epoch: 96, train_loss: 0.4128, test_loss: 1.1312, test_f1: 0.6517
 epoch: 97, train_loss: 0.4020, test_loss: 1.1193, test_f1: 0.6611
 epoch: 98, train_loss: 0.4019, test_loss: 1.1627, test_f1: 0.6744
 epoch: 99, train_loss: 0.4033, test_loss: 1.1456, test_f1: 0.7000
##################ITERATION #1 ****************************************
 epoch: 0, train_loss: 1.0736, test_loss: 0.9338, test_f1: 0.4861
 epoch: 1, train_loss: 0.9629, test_loss: 0.9227, test_f1: 0.5014
 epoch: 2, train_loss: 0.9315, test_loss: 0.9023, test_f1: 0.4868
 epoch: 3, train_loss: 0.9007, test_loss: 0.8443, test_f1: 0.5520
 epoch: 4, train_loss: 0.8858, test_loss: 0.8246, test_f1: 0.5518
 epoch: 5, train_loss: 0.8695, test_loss: 0.8231, test_f1: 0.5759
 epoch: 6, train_loss: 0.8501, test_loss: 0.8304, test_f1: 0.5400
 epoch: 7, train_loss: 0.8396, test_loss: 0.8203, test_f1: 0.5689
 epoch: 8, train_loss: 0.8310, test_loss: 0.8424, test_f1: 0.5567
 epoch: 9, train_loss: 0.8203, test_loss: 0.7868, test_f1: 0.5903
 epoch: 10, train_loss: 0.7865, test_loss: 0.8218, test_f1: 0.6081
 epoch: 11, train_loss: 0.7971, test_loss: 0.7681, test_f1: 0.5841
 epoch: 12, train_loss: 0.7769, test_loss: 0.7616, test_f1: 0.6342
 epoch: 13, train_loss: 0.7772, test_loss: 0.7154, test_f1: 0.6796
 epoch: 14, train_loss: 0.7548, test_loss: 0.7322, test_f1: 0.6499
 epoch: 15, train_loss: 0.7477, test_loss: 0.8118, test_f1: 0.6353
 epoch: 16, train_loss: 0.7235, test_loss: 0.7472, test_f1: 0.6451
 epoch: 17, train_loss: 0.7332, test_loss: 0.7813, test_f1: 0.6286
 epoch: 18, train_loss: 0.7242, test_loss: 0.6620, test_f1: 0.6882
 epoch: 19, train_loss: 0.7007, test_loss: 0.7984, test_f1: 0.6360
 epoch: 20, train_loss: 0.6932, test_loss: 0.7336, test_f1: 0.6675
 epoch: 21, train_loss: 0.6890, test_loss: 0.7751, test_f1: 0.6525
 epoch: 22, train_loss: 0.6813, test_loss: 0.6950, test_f1: 0.6619
 epoch: 23, train_loss: 0.6695, test_loss: 0.7040, test_f1: 0.6844
 epoch: 24, train_loss: 0.6798, test_loss: 0.7234, test_f1: 0.6769
 epoch: 25, train_loss: 0.6563, test_loss: 0.7552, test_f1: 0.6668
 epoch: 26, train_loss: 0.6526, test_loss: 0.7383, test_f1: 0.6679
 epoch: 27, train_loss: 0.6482, test_loss: 0.7572, test_f1: 0.6861
 epoch: 28, train_loss: 0.6515, test_loss: 0.7839, test_f1: 0.6880
 epoch: 29, train_loss: 0.6456, test_loss: 0.7200, test_f1: 0.6669
 epoch: 30, train_loss: 0.6316, test_loss: 0.7386, test_f1: 0.6513
 epoch: 31, train_loss: 0.6232, test_loss: 0.7840, test_f1: 0.6770
 epoch: 32, train_loss: 0.6180, test_loss: 0.8378, test_f1: 0.6902
 epoch: 33, train_loss: 0.6149, test_loss: 0.8605, test_f1: 0.6668
 epoch: 34, train_loss: 0.6148, test_loss: 0.8148, test_f1: 0.6804
 epoch: 35, train_loss: 0.6035, test_loss: 0.8007, test_f1: 0.6621
 epoch: 36, train_loss: 0.6129, test_loss: 0.8291, test_f1: 0.6749
 epoch: 37, train_loss: 0.5897, test_loss: 0.8251, test_f1: 0.6682
 epoch: 38, train_loss: 0.6103, test_loss: 0.8055, test_f1: 0.6901
 epoch: 39, train_loss: 0.5873, test_loss: 0.8253, test_f1: 0.6806
 epoch: 40, train_loss: 0.5799, test_loss: 0.8319, test_f1: 0.6518
 epoch: 41, train_loss: 0.5739, test_loss: 0.7900, test_f1: 0.6632
 epoch: 42, train_loss: 0.5766, test_loss: 0.8273, test_f1: 0.6944
 epoch: 43, train_loss: 0.5765, test_loss: 0.7810, test_f1: 0.6914
 epoch: 44, train_loss: 0.5681, test_loss: 0.7603, test_f1: 0.6676
 epoch: 45, train_loss: 0.5557, test_loss: 0.8103, test_f1: 0.6756
 epoch: 46, train_loss: 0.5254, test_loss: 0.8217, test_f1: 0.6890
 epoch: 47, train_loss: 0.5584, test_loss: 0.8250, test_f1: 0.6732
 epoch: 48, train_loss: 0.5512, test_loss: 0.8407, test_f1: 0.6789
 epoch: 49, train_loss: 0.5418, test_loss: 0.8517, test_f1: 0.6795
 epoch: 50, train_loss: 0.5541, test_loss: 0.8020, test_f1: 0.6764
 epoch: 51, train_loss: 0.5027, test_loss: 0.8108, test_f1: 0.6857
 epoch: 52, train_loss: 0.5066, test_loss: 0.8916, test_f1: 0.6770
 epoch: 53, train_loss: 0.4805, test_loss: 0.9639, test_f1: 0.6784
 epoch: 54, train_loss: 0.4914, test_loss: 0.8959, test_f1: 0.6706
 epoch: 55, train_loss: 0.4862, test_loss: 0.9350, test_f1: 0.6732
 epoch: 56, train_loss: 0.4834, test_loss: 0.9523, test_f1: 0.6712
 epoch: 57, train_loss: 0.4772, test_loss: 0.9013, test_f1: 0.6835
 epoch: 58, train_loss: 0.4687, test_loss: 0.9136, test_f1: 0.6865
 epoch: 59, train_loss: 0.4584, test_loss: 0.9878, test_f1: 0.6693
 epoch: 60, train_loss: 0.4716, test_loss: 0.9290, test_f1: 0.7050
 epoch: 61, train_loss: 0.4758, test_loss: 0.9963, test_f1: 0.6830
 epoch: 62, train_loss: 0.4564, test_loss: 1.0054, test_f1: 0.6654
 epoch: 63, train_loss: 0.4417, test_loss: 0.9916, test_f1: 0.6798
 epoch: 64, train_loss: 0.4434, test_loss: 0.9991, test_f1: 0.6635
 epoch: 65, train_loss: 0.4497, test_loss: 1.0037, test_f1: 0.6598
 epoch: 66, train_loss: 0.4445, test_loss: 1.0540, test_f1: 0.6680
 epoch: 67, train_loss: 0.4508, test_loss: 1.0870, test_f1: 0.6608
 epoch: 68, train_loss: 0.4454, test_loss: 1.0020, test_f1: 0.6639
 epoch: 69, train_loss: 0.4271, test_loss: 1.0646, test_f1: 0.6946
 epoch: 70, train_loss: 0.4432, test_loss: 1.0343, test_f1: 0.6830
 epoch: 71, train_loss: 0.4221, test_loss: 1.1134, test_f1: 0.6836
 epoch: 72, train_loss: 0.4388, test_loss: 1.0112, test_f1: 0.6970
 epoch: 73, train_loss: 0.4136, test_loss: 1.0293, test_f1: 0.6926
 epoch: 74, train_loss: 0.4164, test_loss: 1.1004, test_f1: 0.6784
 epoch: 75, train_loss: 0.4313, test_loss: 1.0232, test_f1: 0.6727
 epoch: 76, train_loss: 0.4222, test_loss: 1.0483, test_f1: 0.6851
 epoch: 77, train_loss: 0.4447, test_loss: 0.9167, test_f1: 0.7236
 epoch: 78, train_loss: 0.4086, test_loss: 1.0805, test_f1: 0.6893
 epoch: 79, train_loss: 0.4032, test_loss: 1.0980, test_f1: 0.6755
 epoch: 80, train_loss: 0.4165, test_loss: 1.1535, test_f1: 0.6786
 epoch: 81, train_loss: 0.4098, test_loss: 1.1770, test_f1: 0.6843
 epoch: 82, train_loss: 0.4087, test_loss: 1.0759, test_f1: 0.6966
 epoch: 83, train_loss: 0.4073, test_loss: 1.1314, test_f1: 0.6721
 epoch: 84, train_loss: 0.4170, test_loss: 1.2090, test_f1: 0.6545
 epoch: 85, train_loss: 0.4109, test_loss: 1.0977, test_f1: 0.6839
 epoch: 86, train_loss: 0.4271, test_loss: 1.2364, test_f1: 0.6789
 epoch: 87, train_loss: 0.3968, test_loss: 1.1246, test_f1: 0.6899
 epoch: 88, train_loss: 0.3839, test_loss: 1.1980, test_f1: 0.6968
 epoch: 89, train_loss: 0.4022, test_loss: 1.0992, test_f1: 0.6802
 epoch: 90, train_loss: 0.3977, test_loss: 1.1070, test_f1: 0.6885
 epoch: 91, train_loss: 0.4050, test_loss: 1.1282, test_f1: 0.6769
 epoch: 92, train_loss: 0.3868, test_loss: 1.2434, test_f1: 0.6528
 epoch: 93, train_loss: 0.3780, test_loss: 1.1734, test_f1: 0.6738
 epoch: 94, train_loss: 0.3716, test_loss: 1.2194, test_f1: 0.6914
 epoch: 95, train_loss: 0.3688, test_loss: 1.2632, test_f1: 0.6804
 epoch: 96, train_loss: 0.3856, test_loss: 1.1860, test_f1: 0.6896
 epoch: 97, train_loss: 0.3766, test_loss: 1.1956, test_f1: 0.6822
 epoch: 98, train_loss: 0.3835, test_loss: 1.1694, test_f1: 0.6817
 epoch: 99, train_loss: 0.3882, test_loss: 1.1815, test_f1: 0.6897
##################ITERATION #2 ****************************************
 epoch: 0, train_loss: 1.1095, test_loss: 0.9941, test_f1: 0.5021
 epoch: 1, train_loss: 0.9759, test_loss: 0.8905, test_f1: 0.5096
 epoch: 2, train_loss: 0.9423, test_loss: 0.8843, test_f1: 0.5213
 epoch: 3, train_loss: 0.9209, test_loss: 0.8323, test_f1: 0.5527
 epoch: 4, train_loss: 0.8878, test_loss: 0.8545, test_f1: 0.5766
 epoch: 5, train_loss: 0.8809, test_loss: 0.8541, test_f1: 0.5670
 epoch: 6, train_loss: 0.8629, test_loss: 0.7935, test_f1: 0.5761
 epoch: 7, train_loss: 0.8330, test_loss: 0.7934, test_f1: 0.6067
 epoch: 8, train_loss: 0.8158, test_loss: 0.7727, test_f1: 0.5969
 epoch: 9, train_loss: 0.8236, test_loss: 0.7895, test_f1: 0.5983
 epoch: 10, train_loss: 0.7901, test_loss: 0.7508, test_f1: 0.6084
 epoch: 11, train_loss: 0.7800, test_loss: 0.7473, test_f1: 0.6298
 epoch: 12, train_loss: 0.7562, test_loss: 0.7260, test_f1: 0.6119
 epoch: 13, train_loss: 0.7689, test_loss: 0.7972, test_f1: 0.6057
 epoch: 14, train_loss: 0.7602, test_loss: 0.7485, test_f1: 0.6121
 epoch: 15, train_loss: 0.7262, test_loss: 0.7315, test_f1: 0.6539
 epoch: 16, train_loss: 0.7347, test_loss: 0.7140, test_f1: 0.6809
 epoch: 17, train_loss: 0.7170, test_loss: 0.7215, test_f1: 0.6324
 epoch: 18, train_loss: 0.7172, test_loss: 0.7373, test_f1: 0.6615
 epoch: 19, train_loss: 0.6865, test_loss: 0.6899, test_f1: 0.6550
 epoch: 20, train_loss: 0.6912, test_loss: 0.7450, test_f1: 0.6617
 epoch: 21, train_loss: 0.6926, test_loss: 0.7141, test_f1: 0.6628
 epoch: 22, train_loss: 0.6759, test_loss: 0.7508, test_f1: 0.6355
 epoch: 23, train_loss: 0.6825, test_loss: 0.7445, test_f1: 0.6374
 epoch: 24, train_loss: 0.6611, test_loss: 0.7129, test_f1: 0.6809
 epoch: 25, train_loss: 0.6579, test_loss: 0.7390, test_f1: 0.6267
 epoch: 26, train_loss: 0.6550, test_loss: 0.7537, test_f1: 0.6561
 epoch: 27, train_loss: 0.6270, test_loss: 0.7715, test_f1: 0.6508
 epoch: 28, train_loss: 0.6482, test_loss: 0.7273, test_f1: 0.6612
 epoch: 29, train_loss: 0.6239, test_loss: 0.8083, test_f1: 0.6775
 epoch: 30, train_loss: 0.6350, test_loss: 0.7344, test_f1: 0.6542
 epoch: 31, train_loss: 0.6177, test_loss: 0.7139, test_f1: 0.6629
 epoch: 32, train_loss: 0.6012, test_loss: 0.7209, test_f1: 0.6712
 epoch: 33, train_loss: 0.6119, test_loss: 0.7840, test_f1: 0.6534
 epoch: 34, train_loss: 0.5951, test_loss: 0.8278, test_f1: 0.6399
 epoch: 35, train_loss: 0.6072, test_loss: 0.8332, test_f1: 0.6514
 epoch: 36, train_loss: 0.5999, test_loss: 0.6830, test_f1: 0.6770
 epoch: 37, train_loss: 0.5811, test_loss: 0.8267, test_f1: 0.6310
 epoch: 38, train_loss: 0.5913, test_loss: 0.7457, test_f1: 0.6893
 epoch: 39, train_loss: 0.5805, test_loss: 0.7401, test_f1: 0.6667
 epoch: 40, train_loss: 0.5718, test_loss: 0.8326, test_f1: 0.6574
 epoch: 41, train_loss: 0.5947, test_loss: 0.6977, test_f1: 0.6627
 epoch: 42, train_loss: 0.5423, test_loss: 0.8051, test_f1: 0.6724
 epoch: 43, train_loss: 0.5510, test_loss: 0.7851, test_f1: 0.6779
 epoch: 44, train_loss: 0.5213, test_loss: 0.8431, test_f1: 0.6671
 epoch: 45, train_loss: 0.5540, test_loss: 0.8543, test_f1: 0.6697
 epoch: 46, train_loss: 0.5385, test_loss: 0.8546, test_f1: 0.7000
 epoch: 47, train_loss: 0.5436, test_loss: 0.8858, test_f1: 0.6549
 epoch: 48, train_loss: 0.5443, test_loss: 0.8515, test_f1: 0.6778
 epoch: 49, train_loss: 0.5314, test_loss: 0.8742, test_f1: 0.6788
 epoch: 50, train_loss: 0.5238, test_loss: 0.9069, test_f1: 0.6467
 epoch: 51, train_loss: 0.4887, test_loss: 0.8232, test_f1: 0.6931
 epoch: 52, train_loss: 0.4820, test_loss: 0.8922, test_f1: 0.6624
 epoch: 53, train_loss: 0.4772, test_loss: 0.9032, test_f1: 0.6606
 epoch: 54, train_loss: 0.4661, test_loss: 0.8844, test_f1: 0.6822
 epoch: 55, train_loss: 0.4698, test_loss: 0.9136, test_f1: 0.6729
 epoch: 56, train_loss: 0.4426, test_loss: 0.9200, test_f1: 0.6660
 epoch: 57, train_loss: 0.4603, test_loss: 0.9022, test_f1: 0.6667
 epoch: 58, train_loss: 0.4474, test_loss: 0.9111, test_f1: 0.6716
 epoch: 59, train_loss: 0.4546, test_loss: 0.9227, test_f1: 0.6769
 epoch: 60, train_loss: 0.4355, test_loss: 0.9384, test_f1: 0.6646
 epoch: 61, train_loss: 0.4391, test_loss: 0.9573, test_f1: 0.6685
 epoch: 62, train_loss: 0.4355, test_loss: 0.9170, test_f1: 0.6714
 epoch: 63, train_loss: 0.4301, test_loss: 0.9698, test_f1: 0.6789
 epoch: 64, train_loss: 0.4492, test_loss: 0.9930, test_f1: 0.6861
 epoch: 65, train_loss: 0.4278, test_loss: 0.9628, test_f1: 0.6695
 epoch: 66, train_loss: 0.4344, test_loss: 0.9839, test_f1: 0.6756
 epoch: 67, train_loss: 0.4219, test_loss: 1.0168, test_f1: 0.6816
 epoch: 68, train_loss: 0.4372, test_loss: 0.9816, test_f1: 0.6757
 epoch: 69, train_loss: 0.4292, test_loss: 1.0656, test_f1: 0.6805
 epoch: 70, train_loss: 0.4152, test_loss: 1.0522, test_f1: 0.6920
 epoch: 71, train_loss: 0.4093, test_loss: 1.0425, test_f1: 0.7095
 epoch: 72, train_loss: 0.4061, test_loss: 1.0514, test_f1: 0.6747
 epoch: 73, train_loss: 0.4023, test_loss: 1.0128, test_f1: 0.7033
 epoch: 74, train_loss: 0.4025, test_loss: 1.0367, test_f1: 0.6727
 epoch: 75, train_loss: 0.4083, test_loss: 0.9919, test_f1: 0.6960
 epoch: 76, train_loss: 0.4016, test_loss: 1.0666, test_f1: 0.6991
 epoch: 77, train_loss: 0.3972, test_loss: 1.1134, test_f1: 0.6704
 epoch: 78, train_loss: 0.4015, test_loss: 1.0996, test_f1: 0.6786
 epoch: 79, train_loss: 0.4124, test_loss: 1.0660, test_f1: 0.6865
 epoch: 80, train_loss: 0.3884, test_loss: 1.1154, test_f1: 0.6808
 epoch: 81, train_loss: 0.3878, test_loss: 1.0913, test_f1: 0.6926
 epoch: 82, train_loss: 0.3918, test_loss: 1.1745, test_f1: 0.6665
 epoch: 83, train_loss: 0.3820, test_loss: 1.1025, test_f1: 0.6810
 epoch: 84, train_loss: 0.3933, test_loss: 1.1793, test_f1: 0.6706
 epoch: 85, train_loss: 0.3915, test_loss: 1.0709, test_f1: 0.7112
 epoch: 86, train_loss: 0.3894, test_loss: 1.2091, test_f1: 0.6679
 epoch: 87, train_loss: 0.3770, test_loss: 1.2049, test_f1: 0.6719
 epoch: 88, train_loss: 0.3684, test_loss: 1.1871, test_f1: 0.6767
 epoch: 89, train_loss: 0.3728, test_loss: 1.2125, test_f1: 0.6845
 epoch: 90, train_loss: 0.3861, test_loss: 1.2471, test_f1: 0.6732
 epoch: 91, train_loss: 0.3741, test_loss: 1.2732, test_f1: 0.6732
 epoch: 92, train_loss: 0.3721, test_loss: 1.2631, test_f1: 0.6880
 epoch: 93, train_loss: 0.3595, test_loss: 1.1446, test_f1: 0.6949
 epoch: 94, train_loss: 0.3533, test_loss: 1.2226, test_f1: 0.6775
 epoch: 95, train_loss: 0.3786, test_loss: 1.2123, test_f1: 0.6936
 epoch: 96, train_loss: 0.3599, test_loss: 1.1614, test_f1: 0.6903
 epoch: 97, train_loss: 0.3591, test_loss: 1.2044, test_f1: 0.6917
 epoch: 98, train_loss: 0.3662, test_loss: 1.1796, test_f1: 0.6614
 epoch: 99, train_loss: 0.3592, test_loss: 1.2090, test_f1: 0.6869
##################ITERATION #3 ****************************************
 epoch: 0, train_loss: 1.1379, test_loss: 0.9876, test_f1: 0.5142
 epoch: 1, train_loss: 0.9874, test_loss: 0.8996, test_f1: 0.5389
 epoch: 2, train_loss: 0.9599, test_loss: 0.8994, test_f1: 0.5268
 epoch: 3, train_loss: 0.9248, test_loss: 0.9073, test_f1: 0.5623
 epoch: 4, train_loss: 0.8960, test_loss: 0.8624, test_f1: 0.5930
 epoch: 5, train_loss: 0.8779, test_loss: 0.8138, test_f1: 0.5989
 epoch: 6, train_loss: 0.8707, test_loss: 0.8928, test_f1: 0.5963
 epoch: 7, train_loss: 0.8547, test_loss: 0.8791, test_f1: 0.5560
 epoch: 8, train_loss: 0.8315, test_loss: 0.7724, test_f1: 0.6261
 epoch: 9, train_loss: 0.8169, test_loss: 0.8454, test_f1: 0.6209
 epoch: 10, train_loss: 0.8021, test_loss: 0.7885, test_f1: 0.6278
 epoch: 11, train_loss: 0.7980, test_loss: 0.7698, test_f1: 0.6450
 epoch: 12, train_loss: 0.7931, test_loss: 0.8319, test_f1: 0.6294
 epoch: 13, train_loss: 0.7597, test_loss: 0.8185, test_f1: 0.6191
 epoch: 14, train_loss: 0.7563, test_loss: 0.7253, test_f1: 0.6323
 epoch: 15, train_loss: 0.7507, test_loss: 0.7235, test_f1: 0.6717
 epoch: 16, train_loss: 0.7408, test_loss: 0.7274, test_f1: 0.6746
 epoch: 17, train_loss: 0.7395, test_loss: 0.7243, test_f1: 0.6671
 epoch: 18, train_loss: 0.7326, test_loss: 0.7361, test_f1: 0.6441
 epoch: 19, train_loss: 0.7189, test_loss: 0.7657, test_f1: 0.6467
 epoch: 20, train_loss: 0.7176, test_loss: 0.7289, test_f1: 0.6517
 epoch: 21, train_loss: 0.7138, test_loss: 0.7315, test_f1: 0.6689
 epoch: 22, train_loss: 0.7038, test_loss: 0.6745, test_f1: 0.6954
 epoch: 23, train_loss: 0.6978, test_loss: 0.7053, test_f1: 0.6644
 epoch: 24, train_loss: 0.6856, test_loss: 0.7805, test_f1: 0.6559
 epoch: 25, train_loss: 0.6743, test_loss: 0.7355, test_f1: 0.6378
 epoch: 26, train_loss: 0.6691, test_loss: 0.7494, test_f1: 0.6449
 epoch: 27, train_loss: 0.6706, test_loss: 0.7738, test_f1: 0.6337
 epoch: 28, train_loss: 0.6568, test_loss: 0.7166, test_f1: 0.6404
 epoch: 29, train_loss: 0.6437, test_loss: 0.7030, test_f1: 0.6690
 epoch: 30, train_loss: 0.6406, test_loss: 0.8071, test_f1: 0.6343
 epoch: 31, train_loss: 0.6399, test_loss: 0.7300, test_f1: 0.6292
 epoch: 32, train_loss: 0.6228, test_loss: 0.7099, test_f1: 0.6687
 epoch: 33, train_loss: 0.6280, test_loss: 0.7028, test_f1: 0.6756
 epoch: 34, train_loss: 0.6254, test_loss: 0.8081, test_f1: 0.6582
 epoch: 35, train_loss: 0.6111, test_loss: 0.7235, test_f1: 0.6607
 epoch: 36, train_loss: 0.6253, test_loss: 0.7859, test_f1: 0.6500
 epoch: 37, train_loss: 0.6067, test_loss: 0.8134, test_f1: 0.6416
 epoch: 38, train_loss: 0.5949, test_loss: 0.7890, test_f1: 0.6456
 epoch: 39, train_loss: 0.6001, test_loss: 0.7773, test_f1: 0.6328
 epoch: 40, train_loss: 0.5916, test_loss: 0.8299, test_f1: 0.6598
 epoch: 41, train_loss: 0.5815, test_loss: 0.8219, test_f1: 0.6813
 epoch: 42, train_loss: 0.5873, test_loss: 0.7292, test_f1: 0.6737
 epoch: 43, train_loss: 0.5817, test_loss: 0.8061, test_f1: 0.6447
 epoch: 44, train_loss: 0.5678, test_loss: 0.7496, test_f1: 0.6632
 epoch: 45, train_loss: 0.5681, test_loss: 0.7807, test_f1: 0.6704
 epoch: 46, train_loss: 0.5744, test_loss: 0.7834, test_f1: 0.6506
 epoch: 47, train_loss: 0.5616, test_loss: 0.7732, test_f1: 0.6632
 epoch: 48, train_loss: 0.5378, test_loss: 0.8064, test_f1: 0.6448
 epoch: 49, train_loss: 0.5319, test_loss: 0.8643, test_f1: 0.6375
 epoch: 50, train_loss: 0.5393, test_loss: 0.8755, test_f1: 0.6581
 epoch: 51, train_loss: 0.5166, test_loss: 0.8370, test_f1: 0.6555
 epoch: 52, train_loss: 0.5003, test_loss: 0.8600, test_f1: 0.6556
 epoch: 53, train_loss: 0.4899, test_loss: 0.8478, test_f1: 0.6574
 epoch: 54, train_loss: 0.4967, test_loss: 0.8909, test_f1: 0.6350
 epoch: 55, train_loss: 0.4862, test_loss: 0.9256, test_f1: 0.6672
 epoch: 56, train_loss: 0.4848, test_loss: 0.8712, test_f1: 0.6837
 epoch: 57, train_loss: 0.4832, test_loss: 0.9251, test_f1: 0.6581
 epoch: 58, train_loss: 0.4773, test_loss: 0.9239, test_f1: 0.6447
 epoch: 59, train_loss: 0.4779, test_loss: 0.8765, test_f1: 0.6580
 epoch: 60, train_loss: 0.4784, test_loss: 1.0044, test_f1: 0.6365
 epoch: 61, train_loss: 0.4800, test_loss: 0.9909, test_f1: 0.6549
 epoch: 62, train_loss: 0.4677, test_loss: 0.9481, test_f1: 0.6570
 epoch: 63, train_loss: 0.4601, test_loss: 0.9091, test_f1: 0.6659
 epoch: 64, train_loss: 0.4627, test_loss: 0.9868, test_f1: 0.6526
 epoch: 65, train_loss: 0.4581, test_loss: 0.9534, test_f1: 0.6501
 epoch: 66, train_loss: 0.4451, test_loss: 0.9942, test_f1: 0.6511
 epoch: 67, train_loss: 0.4451, test_loss: 1.0536, test_f1: 0.6463
 epoch: 68, train_loss: 0.4495, test_loss: 0.9998, test_f1: 0.6438
 epoch: 69, train_loss: 0.4357, test_loss: 1.0100, test_f1: 0.6562
 epoch: 70, train_loss: 0.4283, test_loss: 1.0476, test_f1: 0.6328
 epoch: 71, train_loss: 0.4275, test_loss: 0.9967, test_f1: 0.6396
 epoch: 72, train_loss: 0.4264, test_loss: 0.9895, test_f1: 0.6498
 epoch: 73, train_loss: 0.4267, test_loss: 1.0252, test_f1: 0.6336
 epoch: 74, train_loss: 0.4265, test_loss: 1.0604, test_f1: 0.6359
 epoch: 75, train_loss: 0.4269, test_loss: 1.0547, test_f1: 0.6537
 epoch: 76, train_loss: 0.4380, test_loss: 1.0279, test_f1: 0.6606
 epoch: 77, train_loss: 0.4103, test_loss: 1.0515, test_f1: 0.6527
 epoch: 78, train_loss: 0.4224, test_loss: 1.0207, test_f1: 0.6495
 epoch: 79, train_loss: 0.4157, test_loss: 0.9905, test_f1: 0.6569
 epoch: 80, train_loss: 0.4165, test_loss: 1.0873, test_f1: 0.6499
 epoch: 81, train_loss: 0.4157, test_loss: 1.0314, test_f1: 0.6622
 epoch: 82, train_loss: 0.4286, test_loss: 1.0646, test_f1: 0.6588
 epoch: 83, train_loss: 0.4011, test_loss: 1.0842, test_f1: 0.6614
 epoch: 84, train_loss: 0.4233, test_loss: 0.9890, test_f1: 0.6700
 epoch: 85, train_loss: 0.4153, test_loss: 0.9792, test_f1: 0.6517
 epoch: 86, train_loss: 0.4016, test_loss: 1.1373, test_f1: 0.6537
 epoch: 87, train_loss: 0.4027, test_loss: 1.1188, test_f1: 0.6421
 epoch: 88, train_loss: 0.4057, test_loss: 1.0759, test_f1: 0.6391
 epoch: 89, train_loss: 0.3923, test_loss: 1.0512, test_f1: 0.6849
 epoch: 90, train_loss: 0.3954, test_loss: 1.1003, test_f1: 0.6649
 epoch: 91, train_loss: 0.4079, test_loss: 1.1633, test_f1: 0.6512
 epoch: 92, train_loss: 0.3740, test_loss: 1.1739, test_f1: 0.6438
 epoch: 93, train_loss: 0.3952, test_loss: 1.0639, test_f1: 0.6500
 epoch: 94, train_loss: 0.4021, test_loss: 1.0746, test_f1: 0.6456
 epoch: 95, train_loss: 0.4028, test_loss: 1.2267, test_f1: 0.6586
 epoch: 96, train_loss: 0.3953, test_loss: 1.0821, test_f1: 0.6471
 epoch: 97, train_loss: 0.4043, test_loss: 1.1865, test_f1: 0.6499
 epoch: 98, train_loss: 0.3692, test_loss: 1.1697, test_f1: 0.6513
 epoch: 99, train_loss: 0.3995, test_loss: 1.1714, test_f1: 0.6389
##################ITERATION #4 ****************************************
 epoch: 0, train_loss: 1.2434, test_loss: 0.9994, test_f1: 0.5133
 epoch: 1, train_loss: 1.0207, test_loss: 0.9698, test_f1: 0.5531
 epoch: 2, train_loss: 0.9815, test_loss: 0.9344, test_f1: 0.5543
 epoch: 3, train_loss: 0.9528, test_loss: 0.8832, test_f1: 0.5416
 epoch: 4, train_loss: 0.9231, test_loss: 0.8722, test_f1: 0.5295
 epoch: 5, train_loss: 0.9124, test_loss: 0.9164, test_f1: 0.5397
 epoch: 6, train_loss: 0.8950, test_loss: 0.8637, test_f1: 0.5267
 epoch: 7, train_loss: 0.8738, test_loss: 0.8482, test_f1: 0.5212
 epoch: 8, train_loss: 0.8617, test_loss: 0.8037, test_f1: 0.5925
 epoch: 9, train_loss: 0.8388, test_loss: 0.8921, test_f1: 0.6234
 epoch: 10, train_loss: 0.8136, test_loss: 0.9080, test_f1: 0.5989
 epoch: 11, train_loss: 0.8251, test_loss: 0.8270, test_f1: 0.6199
 epoch: 12, train_loss: 0.7944, test_loss: 0.8345, test_f1: 0.5649
 epoch: 13, train_loss: 0.7912, test_loss: 0.8026, test_f1: 0.5760
 epoch: 14, train_loss: 0.7788, test_loss: 0.8037, test_f1: 0.6287
 epoch: 15, train_loss: 0.7698, test_loss: 0.7815, test_f1: 0.6600
 epoch: 16, train_loss: 0.7603, test_loss: 0.8082, test_f1: 0.6322
 epoch: 17, train_loss: 0.7509, test_loss: 0.8104, test_f1: 0.6405
 epoch: 18, train_loss: 0.7437, test_loss: 0.7520, test_f1: 0.6304
 epoch: 19, train_loss: 0.7320, test_loss: 0.8308, test_f1: 0.6207
 epoch: 20, train_loss: 0.7278, test_loss: 0.8541, test_f1: 0.5941
 epoch: 21, train_loss: 0.7135, test_loss: 0.7817, test_f1: 0.6203
 epoch: 22, train_loss: 0.7227, test_loss: 0.8088, test_f1: 0.6357
 epoch: 23, train_loss: 0.7029, test_loss: 0.8207, test_f1: 0.6704
 epoch: 24, train_loss: 0.6949, test_loss: 0.7950, test_f1: 0.6622
 epoch: 25, train_loss: 0.6920, test_loss: 0.7707, test_f1: 0.6732
 epoch: 26, train_loss: 0.6675, test_loss: 0.8379, test_f1: 0.6354
 epoch: 27, train_loss: 0.6864, test_loss: 0.7367, test_f1: 0.6526
 epoch: 28, train_loss: 0.6643, test_loss: 0.7952, test_f1: 0.6493
 epoch: 29, train_loss: 0.6668, test_loss: 0.8055, test_f1: 0.6518
 epoch: 30, train_loss: 0.6402, test_loss: 0.7692, test_f1: 0.6477
 epoch: 31, train_loss: 0.6373, test_loss: 0.7664, test_f1: 0.6547
 epoch: 32, train_loss: 0.6560, test_loss: 0.7730, test_f1: 0.6260
 epoch: 33, train_loss: 0.6516, test_loss: 0.7584, test_f1: 0.6551
 epoch: 34, train_loss: 0.6431, test_loss: 0.7995, test_f1: 0.6513
 epoch: 35, train_loss: 0.6159, test_loss: 0.7705, test_f1: 0.6708
 epoch: 36, train_loss: 0.6258, test_loss: 0.8922, test_f1: 0.6358
 epoch: 37, train_loss: 0.6021, test_loss: 0.8264, test_f1: 0.6423
 epoch: 38, train_loss: 0.5993, test_loss: 0.8141, test_f1: 0.6287
 epoch: 39, train_loss: 0.6212, test_loss: 0.8077, test_f1: 0.6756
 epoch: 40, train_loss: 0.5964, test_loss: 0.8202, test_f1: 0.6555
 epoch: 41, train_loss: 0.5890, test_loss: 0.8267, test_f1: 0.6706
 epoch: 42, train_loss: 0.5853, test_loss: 0.7630, test_f1: 0.6538
 epoch: 43, train_loss: 0.5887, test_loss: 0.8205, test_f1: 0.6510
 epoch: 44, train_loss: 0.5902, test_loss: 0.8038, test_f1: 0.6686
 epoch: 45, train_loss: 0.5684, test_loss: 0.8857, test_f1: 0.6527
 epoch: 46, train_loss: 0.5651, test_loss: 0.8861, test_f1: 0.6735
 epoch: 47, train_loss: 0.5500, test_loss: 0.7935, test_f1: 0.6652
 epoch: 48, train_loss: 0.5748, test_loss: 0.7151, test_f1: 0.6708
 epoch: 49, train_loss: 0.5435, test_loss: 0.8158, test_f1: 0.6754
 epoch: 50, train_loss: 0.5499, test_loss: 0.8575, test_f1: 0.6285
 epoch: 51, train_loss: 0.5371, test_loss: 0.7936, test_f1: 0.6730
 epoch: 52, train_loss: 0.5029, test_loss: 0.8217, test_f1: 0.6749
 epoch: 53, train_loss: 0.4891, test_loss: 0.8544, test_f1: 0.6889
 epoch: 54, train_loss: 0.5051, test_loss: 0.8309, test_f1: 0.6678
 epoch: 55, train_loss: 0.4790, test_loss: 0.8295, test_f1: 0.6905
 epoch: 56, train_loss: 0.4956, test_loss: 0.8606, test_f1: 0.6633
 epoch: 57, train_loss: 0.4878, test_loss: 0.8167, test_f1: 0.7065
 epoch: 58, train_loss: 0.4986, test_loss: 0.9052, test_f1: 0.6825
 epoch: 59, train_loss: 0.4880, test_loss: 0.9043, test_f1: 0.6767
 epoch: 60, train_loss: 0.4846, test_loss: 0.8922, test_f1: 0.6837
 epoch: 61, train_loss: 0.4798, test_loss: 0.8812, test_f1: 0.6645
 epoch: 62, train_loss: 0.4638, test_loss: 0.8663, test_f1: 0.6967
 epoch: 63, train_loss: 0.4793, test_loss: 0.8898, test_f1: 0.6806
 epoch: 64, train_loss: 0.4670, test_loss: 0.8616, test_f1: 0.6674
 epoch: 65, train_loss: 0.4587, test_loss: 0.8809, test_f1: 0.6735
 epoch: 66, train_loss: 0.4580, test_loss: 0.9442, test_f1: 0.6718
 epoch: 67, train_loss: 0.4581, test_loss: 0.9247, test_f1: 0.6948
 epoch: 68, train_loss: 0.4565, test_loss: 0.9400, test_f1: 0.6620
 epoch: 69, train_loss: 0.4531, test_loss: 0.8796, test_f1: 0.6859
 epoch: 70, train_loss: 0.4446, test_loss: 0.8859, test_f1: 0.6702
 epoch: 71, train_loss: 0.4448, test_loss: 0.9877, test_f1: 0.6725
 epoch: 72, train_loss: 0.4505, test_loss: 0.9513, test_f1: 0.7072
 epoch: 73, train_loss: 0.4399, test_loss: 0.9376, test_f1: 0.7042
 epoch: 74, train_loss: 0.4388, test_loss: 0.9296, test_f1: 0.6841
 epoch: 75, train_loss: 0.4507, test_loss: 0.9477, test_f1: 0.6692
 epoch: 76, train_loss: 0.4435, test_loss: 0.8779, test_f1: 0.6809
 epoch: 77, train_loss: 0.4392, test_loss: 0.9271, test_f1: 0.6976
 epoch: 78, train_loss: 0.4242, test_loss: 0.9352, test_f1: 0.7011
 epoch: 79, train_loss: 0.4120, test_loss: 0.9241, test_f1: 0.6886
 epoch: 80, train_loss: 0.4166, test_loss: 0.9618, test_f1: 0.6885
 epoch: 81, train_loss: 0.4368, test_loss: 0.8772, test_f1: 0.6934
 epoch: 82, train_loss: 0.4378, test_loss: 0.9602, test_f1: 0.6818
 epoch: 83, train_loss: 0.4361, test_loss: 0.9682, test_f1: 0.6840
 epoch: 84, train_loss: 0.4514, test_loss: 0.9348, test_f1: 0.6706
 epoch: 85, train_loss: 0.4178, test_loss: 0.9124, test_f1: 0.6873
 epoch: 86, train_loss: 0.4258, test_loss: 0.9289, test_f1: 0.6823
 epoch: 87, train_loss: 0.4167, test_loss: 0.9855, test_f1: 0.7317
 epoch: 88, train_loss: 0.4121, test_loss: 1.0375, test_f1: 0.7107
 epoch: 89, train_loss: 0.4142, test_loss: 1.0156, test_f1: 0.7073
 epoch: 90, train_loss: 0.4278, test_loss: 0.9386, test_f1: 0.6758
 epoch: 91, train_loss: 0.3950, test_loss: 0.9965, test_f1: 0.6867
 epoch: 92, train_loss: 0.4067, test_loss: 0.9675, test_f1: 0.6840
 epoch: 93, train_loss: 0.4023, test_loss: 0.9607, test_f1: 0.6842
 epoch: 94, train_loss: 0.3983, test_loss: 0.9849, test_f1: 0.6831
 epoch: 95, train_loss: 0.3986, test_loss: 1.0534, test_f1: 0.6922
 epoch: 96, train_loss: 0.4100, test_loss: 0.9757, test_f1: 0.6958
 epoch: 97, train_loss: 0.4012, test_loss: 0.9873, test_f1: 0.6700
 epoch: 98, train_loss: 0.3982, test_loss: 1.0197, test_f1: 0.6619
 epoch: 99, train_loss: 0.3805, test_loss: 1.0257, test_f1: 0.6750
##################ITERATION #5 ****************************************
 epoch: 0, train_loss: 1.2097, test_loss: 0.9433, test_f1: 0.5320
 epoch: 1, train_loss: 0.9823, test_loss: 0.9280, test_f1: 0.5466
 epoch: 2, train_loss: 0.9528, test_loss: 0.9014, test_f1: 0.5582
 epoch: 3, train_loss: 0.9368, test_loss: 0.9040, test_f1: 0.5536
 epoch: 4, train_loss: 0.9089, test_loss: 0.8599, test_f1: 0.5601
 epoch: 5, train_loss: 0.8812, test_loss: 0.8433, test_f1: 0.5714
 epoch: 6, train_loss: 0.8828, test_loss: 0.8046, test_f1: 0.6132
 epoch: 7, train_loss: 0.8585, test_loss: 0.8010, test_f1: 0.5952
 epoch: 8, train_loss: 0.8510, test_loss: 0.8174, test_f1: 0.6605
 epoch: 9, train_loss: 0.8317, test_loss: 0.8077, test_f1: 0.6428
 epoch: 10, train_loss: 0.8162, test_loss: 0.7313, test_f1: 0.6455
 epoch: 11, train_loss: 0.7986, test_loss: 0.7756, test_f1: 0.6247
 epoch: 12, train_loss: 0.7928, test_loss: 0.7245, test_f1: 0.6698
 epoch: 13, train_loss: 0.7826, test_loss: 0.7327, test_f1: 0.6730
 epoch: 14, train_loss: 0.7711, test_loss: 0.7671, test_f1: 0.6559
 epoch: 15, train_loss: 0.7535, test_loss: 0.7491, test_f1: 0.6299
 epoch: 16, train_loss: 0.7502, test_loss: 0.7416, test_f1: 0.6502
 epoch: 17, train_loss: 0.7393, test_loss: 0.7291, test_f1: 0.6723
 epoch: 18, train_loss: 0.7258, test_loss: 0.7552, test_f1: 0.6291
 epoch: 19, train_loss: 0.7023, test_loss: 0.7032, test_f1: 0.6711
 epoch: 20, train_loss: 0.6987, test_loss: 0.6968, test_f1: 0.6591
 epoch: 21, train_loss: 0.7048, test_loss: 0.8013, test_f1: 0.6500
 epoch: 22, train_loss: 0.7118, test_loss: 0.7690, test_f1: 0.6685
 epoch: 23, train_loss: 0.6811, test_loss: 0.7096, test_f1: 0.6890
 epoch: 24, train_loss: 0.6898, test_loss: 0.7440, test_f1: 0.6772
 epoch: 25, train_loss: 0.6637, test_loss: 0.7805, test_f1: 0.6776
 epoch: 26, train_loss: 0.6706, test_loss: 0.7795, test_f1: 0.6632
 epoch: 27, train_loss: 0.6703, test_loss: 0.7628, test_f1: 0.6691
 epoch: 28, train_loss: 0.6760, test_loss: 0.7716, test_f1: 0.6859
 epoch: 29, train_loss: 0.6469, test_loss: 0.7511, test_f1: 0.6658
 epoch: 30, train_loss: 0.6439, test_loss: 0.7354, test_f1: 0.6898
 epoch: 31, train_loss: 0.6583, test_loss: 0.7362, test_f1: 0.6785
 epoch: 32, train_loss: 0.6429, test_loss: 0.7001, test_f1: 0.6621
 epoch: 33, train_loss: 0.6321, test_loss: 0.7153, test_f1: 0.6586
 epoch: 34, train_loss: 0.6345, test_loss: 0.7431, test_f1: 0.6679
 epoch: 35, train_loss: 0.6399, test_loss: 0.7417, test_f1: 0.6836
 epoch: 36, train_loss: 0.6099, test_loss: 0.7282, test_f1: 0.6770
 epoch: 37, train_loss: 0.6112, test_loss: 0.7924, test_f1: 0.6768
 epoch: 38, train_loss: 0.6027, test_loss: 0.7822, test_f1: 0.6745
 epoch: 39, train_loss: 0.6004, test_loss: 0.7606, test_f1: 0.6800
 epoch: 40, train_loss: 0.5966, test_loss: 0.8214, test_f1: 0.6590
 epoch: 41, train_loss: 0.5874, test_loss: 0.7812, test_f1: 0.6863
 epoch: 42, train_loss: 0.6056, test_loss: 0.7693, test_f1: 0.6843
 epoch: 43, train_loss: 0.5800, test_loss: 0.7543, test_f1: 0.6685
 epoch: 44, train_loss: 0.5652, test_loss: 0.7767, test_f1: 0.6456
 epoch: 45, train_loss: 0.5772, test_loss: 0.7065, test_f1: 0.6954
 epoch: 46, train_loss: 0.5671, test_loss: 0.7235, test_f1: 0.6668
 epoch: 47, train_loss: 0.5709, test_loss: 0.7574, test_f1: 0.6950
 epoch: 48, train_loss: 0.5491, test_loss: 0.7750, test_f1: 0.6776
 epoch: 49, train_loss: 0.5536, test_loss: 0.8046, test_f1: 0.6645
 epoch: 50, train_loss: 0.5594, test_loss: 0.7619, test_f1: 0.6836
 epoch: 51, train_loss: 0.5226, test_loss: 0.7916, test_f1: 0.7040
 epoch: 52, train_loss: 0.4974, test_loss: 0.8179, test_f1: 0.7103
 epoch: 53, train_loss: 0.4906, test_loss: 0.7967, test_f1: 0.6840
 epoch: 54, train_loss: 0.5002, test_loss: 0.7936, test_f1: 0.7151
 epoch: 55, train_loss: 0.4886, test_loss: 0.7993, test_f1: 0.6994
 epoch: 56, train_loss: 0.4703, test_loss: 0.7813, test_f1: 0.6859
 epoch: 57, train_loss: 0.4867, test_loss: 0.7961, test_f1: 0.6853
 epoch: 58, train_loss: 0.4753, test_loss: 0.8332, test_f1: 0.6678
 epoch: 59, train_loss: 0.4711, test_loss: 0.8328, test_f1: 0.6797
 epoch: 60, train_loss: 0.4809, test_loss: 0.8704, test_f1: 0.6862
 epoch: 61, train_loss: 0.4761, test_loss: 0.8630, test_f1: 0.6774
 epoch: 62, train_loss: 0.4579, test_loss: 0.8696, test_f1: 0.6902
 epoch: 63, train_loss: 0.4675, test_loss: 0.8858, test_f1: 0.6822
 epoch: 64, train_loss: 0.4791, test_loss: 0.8738, test_f1: 0.6931
 epoch: 65, train_loss: 0.4586, test_loss: 0.9625, test_f1: 0.6661
 epoch: 66, train_loss: 0.4728, test_loss: 0.8852, test_f1: 0.6964
 epoch: 67, train_loss: 0.4521, test_loss: 0.8624, test_f1: 0.6886
 epoch: 68, train_loss: 0.4316, test_loss: 0.9626, test_f1: 0.6733
 epoch: 69, train_loss: 0.4633, test_loss: 0.9678, test_f1: 0.6562
 epoch: 70, train_loss: 0.4397, test_loss: 0.9308, test_f1: 0.6761
 epoch: 71, train_loss: 0.4481, test_loss: 0.9004, test_f1: 0.6842
 epoch: 72, train_loss: 0.4292, test_loss: 0.9060, test_f1: 0.6989
 epoch: 73, train_loss: 0.4307, test_loss: 0.9182, test_f1: 0.6846
 epoch: 74, train_loss: 0.4201, test_loss: 0.9432, test_f1: 0.7032
 epoch: 75, train_loss: 0.4453, test_loss: 0.9310, test_f1: 0.6958
 epoch: 76, train_loss: 0.4277, test_loss: 0.9898, test_f1: 0.6836
 epoch: 77, train_loss: 0.4370, test_loss: 0.9971, test_f1: 0.6731
 epoch: 78, train_loss: 0.4235, test_loss: 1.0008, test_f1: 0.6820
 epoch: 79, train_loss: 0.4128, test_loss: 0.9288, test_f1: 0.6932
 epoch: 80, train_loss: 0.4393, test_loss: 1.0145, test_f1: 0.6939
 epoch: 81, train_loss: 0.4224, test_loss: 1.0128, test_f1: 0.6807
 epoch: 82, train_loss: 0.4244, test_loss: 0.9494, test_f1: 0.6899
 epoch: 83, train_loss: 0.4085, test_loss: 1.0880, test_f1: 0.6820
 epoch: 84, train_loss: 0.4250, test_loss: 1.0190, test_f1: 0.6780
 epoch: 85, train_loss: 0.4075, test_loss: 1.0588, test_f1: 0.6743
 epoch: 86, train_loss: 0.4039, test_loss: 1.0138, test_f1: 0.6858
 epoch: 87, train_loss: 0.4189, test_loss: 1.0754, test_f1: 0.6684
 epoch: 88, train_loss: 0.4142, test_loss: 1.0482, test_f1: 0.6674
 epoch: 89, train_loss: 0.4005, test_loss: 1.1126, test_f1: 0.6492
 epoch: 90, train_loss: 0.4219, test_loss: 1.0841, test_f1: 0.6780
 epoch: 91, train_loss: 0.3961, test_loss: 1.1099, test_f1: 0.6759
 epoch: 92, train_loss: 0.3957, test_loss: 1.0916, test_f1: 0.6801
 epoch: 93, train_loss: 0.3932, test_loss: 1.1075, test_f1: 0.6706
 epoch: 94, train_loss: 0.3840, test_loss: 0.9716, test_f1: 0.6769
 epoch: 95, train_loss: 0.4032, test_loss: 1.0547, test_f1: 0.6982
 epoch: 96, train_loss: 0.4106, test_loss: 1.1086, test_f1: 0.6819
 epoch: 97, train_loss: 0.3863, test_loss: 1.0867, test_f1: 0.6819
 epoch: 98, train_loss: 0.3913, test_loss: 1.0718, test_f1: 0.6763
 epoch: 99, train_loss: 0.3960, test_loss: 1.0253, test_f1: 0.6803
##################ITERATION #6 ****************************************
 epoch: 0, train_loss: 1.1689, test_loss: 0.9463, test_f1: 0.5007
 epoch: 1, train_loss: 0.9812, test_loss: 0.9737, test_f1: 0.5466
 epoch: 2, train_loss: 0.9543, test_loss: 0.9801, test_f1: 0.5451
 epoch: 3, train_loss: 0.9229, test_loss: 0.8734, test_f1: 0.5640
 epoch: 4, train_loss: 0.9112, test_loss: 0.9187, test_f1: 0.5868
 epoch: 5, train_loss: 0.8978, test_loss: 0.8997, test_f1: 0.5539
 epoch: 6, train_loss: 0.8971, test_loss: 0.8923, test_f1: 0.5879
 epoch: 7, train_loss: 0.8782, test_loss: 0.8992, test_f1: 0.5658
 epoch: 8, train_loss: 0.8618, test_loss: 0.8314, test_f1: 0.5916
 epoch: 9, train_loss: 0.8367, test_loss: 0.8632, test_f1: 0.6216
 epoch: 10, train_loss: 0.8306, test_loss: 0.8304, test_f1: 0.6066
 epoch: 11, train_loss: 0.8153, test_loss: 0.8123, test_f1: 0.5987
 epoch: 12, train_loss: 0.8034, test_loss: 0.8587, test_f1: 0.5987
 epoch: 13, train_loss: 0.7933, test_loss: 0.8105, test_f1: 0.5850
 epoch: 14, train_loss: 0.7853, test_loss: 0.8378, test_f1: 0.6469
 epoch: 15, train_loss: 0.7620, test_loss: 0.7835, test_f1: 0.6504
 epoch: 16, train_loss: 0.7667, test_loss: 0.8172, test_f1: 0.6860
 epoch: 17, train_loss: 0.7460, test_loss: 0.7696, test_f1: 0.6660
 epoch: 18, train_loss: 0.7435, test_loss: 0.8185, test_f1: 0.6532
 epoch: 19, train_loss: 0.7240, test_loss: 0.8897, test_f1: 0.6469
 epoch: 20, train_loss: 0.7344, test_loss: 0.7913, test_f1: 0.6604
 epoch: 21, train_loss: 0.7291, test_loss: 0.8086, test_f1: 0.6509
 epoch: 22, train_loss: 0.6906, test_loss: 0.8368, test_f1: 0.6407
 epoch: 23, train_loss: 0.6772, test_loss: 0.8236, test_f1: 0.6519
 epoch: 24, train_loss: 0.6988, test_loss: 0.8256, test_f1: 0.6577
 epoch: 25, train_loss: 0.6730, test_loss: 0.8451, test_f1: 0.6642
 epoch: 26, train_loss: 0.6635, test_loss: 0.8494, test_f1: 0.6491
 epoch: 27, train_loss: 0.6573, test_loss: 0.8595, test_f1: 0.6594
 epoch: 28, train_loss: 0.6695, test_loss: 0.8415, test_f1: 0.6520
 epoch: 29, train_loss: 0.6519, test_loss: 0.8228, test_f1: 0.6360
 epoch: 30, train_loss: 0.6537, test_loss: 0.8527, test_f1: 0.6470
 epoch: 31, train_loss: 0.6447, test_loss: 0.8059, test_f1: 0.6661
 epoch: 32, train_loss: 0.6340, test_loss: 0.7974, test_f1: 0.6922
 epoch: 33, train_loss: 0.6205, test_loss: 0.8465, test_f1: 0.6757
 epoch: 34, train_loss: 0.6225, test_loss: 0.8241, test_f1: 0.6522
 epoch: 35, train_loss: 0.5917, test_loss: 0.9233, test_f1: 0.6189
 epoch: 36, train_loss: 0.6050, test_loss: 0.8560, test_f1: 0.6498
 epoch: 37, train_loss: 0.6126, test_loss: 0.8438, test_f1: 0.6494
 epoch: 38, train_loss: 0.6099, test_loss: 0.8860, test_f1: 0.6487
 epoch: 39, train_loss: 0.5914, test_loss: 0.8269, test_f1: 0.6678
 epoch: 40, train_loss: 0.5800, test_loss: 0.8449, test_f1: 0.6541
 epoch: 41, train_loss: 0.5953, test_loss: 0.8533, test_f1: 0.6360
 epoch: 42, train_loss: 0.5831, test_loss: 0.9133, test_f1: 0.6488
 epoch: 43, train_loss: 0.5729, test_loss: 0.8582, test_f1: 0.6787
 epoch: 44, train_loss: 0.5842, test_loss: 0.8881, test_f1: 0.6595
 epoch: 45, train_loss: 0.5847, test_loss: 0.8816, test_f1: 0.6731
 epoch: 46, train_loss: 0.5700, test_loss: 0.8427, test_f1: 0.6594
 epoch: 47, train_loss: 0.5661, test_loss: 0.8638, test_f1: 0.6653
 epoch: 48, train_loss: 0.5558, test_loss: 0.8609, test_f1: 0.6975
 epoch: 49, train_loss: 0.5506, test_loss: 0.8952, test_f1: 0.6754
 epoch: 50, train_loss: 0.5468, test_loss: 0.8635, test_f1: 0.6693
 epoch: 51, train_loss: 0.5114, test_loss: 0.8410, test_f1: 0.6983
 epoch: 52, train_loss: 0.5137, test_loss: 0.8650, test_f1: 0.6637
 epoch: 53, train_loss: 0.5069, test_loss: 0.9128, test_f1: 0.6599
 epoch: 54, train_loss: 0.4950, test_loss: 0.9002, test_f1: 0.6611
 epoch: 55, train_loss: 0.4942, test_loss: 0.8819, test_f1: 0.6921
 epoch: 56, train_loss: 0.4752, test_loss: 0.9270, test_f1: 0.6547
 epoch: 57, train_loss: 0.4715, test_loss: 0.9933, test_f1: 0.6605
 epoch: 58, train_loss: 0.4802, test_loss: 0.9150, test_f1: 0.6739
 epoch: 59, train_loss: 0.4734, test_loss: 0.9607, test_f1: 0.6756
 epoch: 60, train_loss: 0.4850, test_loss: 0.9289, test_f1: 0.6680
 epoch: 61, train_loss: 0.4770, test_loss: 0.9202, test_f1: 0.6720
 epoch: 62, train_loss: 0.4751, test_loss: 0.9156, test_f1: 0.6554
 epoch: 63, train_loss: 0.4649, test_loss: 0.9046, test_f1: 0.6823
 epoch: 64, train_loss: 0.4592, test_loss: 0.9604, test_f1: 0.6509
 epoch: 65, train_loss: 0.4611, test_loss: 1.0172, test_f1: 0.6578
 epoch: 66, train_loss: 0.4518, test_loss: 0.9908, test_f1: 0.6506
 epoch: 67, train_loss: 0.4562, test_loss: 0.9738, test_f1: 0.6555
 epoch: 68, train_loss: 0.4502, test_loss: 1.0111, test_f1: 0.6461
 epoch: 69, train_loss: 0.4282, test_loss: 1.0036, test_f1: 0.6587
 epoch: 70, train_loss: 0.4413, test_loss: 1.0383, test_f1: 0.6609
 epoch: 71, train_loss: 0.4323, test_loss: 1.0170, test_f1: 0.6673
 epoch: 72, train_loss: 0.4258, test_loss: 0.9849, test_f1: 0.6683
 epoch: 73, train_loss: 0.4280, test_loss: 1.0306, test_f1: 0.6752
 epoch: 74, train_loss: 0.4450, test_loss: 1.0442, test_f1: 0.6686
 epoch: 75, train_loss: 0.4367, test_loss: 0.9947, test_f1: 0.6654
 epoch: 76, train_loss: 0.4294, test_loss: 0.9991, test_f1: 0.6933
 epoch: 77, train_loss: 0.4174, test_loss: 1.0303, test_f1: 0.6791
 epoch: 78, train_loss: 0.4101, test_loss: 1.0450, test_f1: 0.6603
 epoch: 79, train_loss: 0.4142, test_loss: 1.0145, test_f1: 0.6598
 epoch: 80, train_loss: 0.4201, test_loss: 1.0980, test_f1: 0.6453
 epoch: 81, train_loss: 0.4347, test_loss: 1.0506, test_f1: 0.6702
 epoch: 82, train_loss: 0.4099, test_loss: 1.0511, test_f1: 0.6756
 epoch: 83, train_loss: 0.4242, test_loss: 1.0644, test_f1: 0.6720
 epoch: 84, train_loss: 0.4487, test_loss: 1.0273, test_f1: 0.6807
 epoch: 85, train_loss: 0.4011, test_loss: 1.0462, test_f1: 0.6641
 epoch: 86, train_loss: 0.4199, test_loss: 1.0370, test_f1: 0.6683
 epoch: 87, train_loss: 0.4088, test_loss: 1.1236, test_f1: 0.6507
 epoch: 88, train_loss: 0.4139, test_loss: 1.0981, test_f1: 0.6739
 epoch: 89, train_loss: 0.4084, test_loss: 0.9695, test_f1: 0.6838
 epoch: 90, train_loss: 0.3951, test_loss: 1.0562, test_f1: 0.6652
 epoch: 91, train_loss: 0.3987, test_loss: 1.0802, test_f1: 0.6739
 epoch: 92, train_loss: 0.3954, test_loss: 1.1215, test_f1: 0.6637
 epoch: 93, train_loss: 0.3902, test_loss: 1.0643, test_f1: 0.6829
 epoch: 94, train_loss: 0.4075, test_loss: 1.0550, test_f1: 0.6767
 epoch: 95, train_loss: 0.3945, test_loss: 1.0970, test_f1: 0.6679
 epoch: 96, train_loss: 0.4029, test_loss: 1.1061, test_f1: 0.6819
 epoch: 97, train_loss: 0.3728, test_loss: 1.0934, test_f1: 0.6593
 epoch: 98, train_loss: 0.4007, test_loss: 1.0972, test_f1: 0.6759
 epoch: 99, train_loss: 0.3799, test_loss: 1.1200, test_f1: 0.6625
##################ITERATION #7 ****************************************
 epoch: 0, train_loss: 1.2462, test_loss: 0.9302, test_f1: 0.5284
 epoch: 1, train_loss: 0.9869, test_loss: 0.9230, test_f1: 0.5511
 epoch: 2, train_loss: 0.9478, test_loss: 0.9048, test_f1: 0.5349
 epoch: 3, train_loss: 0.9267, test_loss: 0.8833, test_f1: 0.5660
 epoch: 4, train_loss: 0.9049, test_loss: 0.8540, test_f1: 0.5700
 epoch: 5, train_loss: 0.8867, test_loss: 0.8906, test_f1: 0.5518
 epoch: 6, train_loss: 0.8776, test_loss: 0.8032, test_f1: 0.6193
 epoch: 7, train_loss: 0.8593, test_loss: 0.8812, test_f1: 0.5437
 epoch: 8, train_loss: 0.8340, test_loss: 0.8331, test_f1: 0.5975
 epoch: 9, train_loss: 0.8351, test_loss: 0.7692, test_f1: 0.6050
 epoch: 10, train_loss: 0.8141, test_loss: 0.7549, test_f1: 0.6384
 epoch: 11, train_loss: 0.8048, test_loss: 0.8299, test_f1: 0.6152
 epoch: 12, train_loss: 0.7848, test_loss: 0.7531, test_f1: 0.6119
 epoch: 13, train_loss: 0.7822, test_loss: 0.7615, test_f1: 0.6243
 epoch: 14, train_loss: 0.7680, test_loss: 0.7833, test_f1: 0.6578
 epoch: 15, train_loss: 0.7477, test_loss: 0.7720, test_f1: 0.6641
 epoch: 16, train_loss: 0.7240, test_loss: 0.8076, test_f1: 0.6320
 epoch: 17, train_loss: 0.7454, test_loss: 0.7744, test_f1: 0.6365
 epoch: 18, train_loss: 0.7268, test_loss: 0.7855, test_f1: 0.6533
 epoch: 19, train_loss: 0.7237, test_loss: 0.7591, test_f1: 0.6681
 epoch: 20, train_loss: 0.7139, test_loss: 0.7580, test_f1: 0.6798
 epoch: 21, train_loss: 0.6925, test_loss: 0.8037, test_f1: 0.6866
 epoch: 22, train_loss: 0.6753, test_loss: 0.7535, test_f1: 0.6590
 epoch: 23, train_loss: 0.6745, test_loss: 0.7420, test_f1: 0.6704
 epoch: 24, train_loss: 0.6871, test_loss: 0.7445, test_f1: 0.6425
 epoch: 25, train_loss: 0.6623, test_loss: 0.7593, test_f1: 0.6946
 epoch: 26, train_loss: 0.6660, test_loss: 0.8470, test_f1: 0.6781
 epoch: 27, train_loss: 0.6469, test_loss: 0.7750, test_f1: 0.6482
 epoch: 28, train_loss: 0.6426, test_loss: 0.8514, test_f1: 0.6495
 epoch: 29, train_loss: 0.6544, test_loss: 0.8102, test_f1: 0.6673
 epoch: 30, train_loss: 0.6402, test_loss: 0.8236, test_f1: 0.6631
 epoch: 31, train_loss: 0.6416, test_loss: 0.7743, test_f1: 0.6928
 epoch: 32, train_loss: 0.6214, test_loss: 0.8119, test_f1: 0.6796
 epoch: 33, train_loss: 0.6205, test_loss: 0.7832, test_f1: 0.6666
 epoch: 34, train_loss: 0.6484, test_loss: 0.7684, test_f1: 0.6922
 epoch: 35, train_loss: 0.6205, test_loss: 0.8168, test_f1: 0.6775
 epoch: 36, train_loss: 0.6044, test_loss: 0.8338, test_f1: 0.6846
 epoch: 37, train_loss: 0.6277, test_loss: 0.8264, test_f1: 0.6637
 epoch: 38, train_loss: 0.6122, test_loss: 0.8626, test_f1: 0.6676
 epoch: 39, train_loss: 0.6131, test_loss: 0.8147, test_f1: 0.6657
 epoch: 40, train_loss: 0.5632, test_loss: 0.8370, test_f1: 0.6754
 epoch: 41, train_loss: 0.5848, test_loss: 0.8267, test_f1: 0.6901
 epoch: 42, train_loss: 0.5957, test_loss: 0.8446, test_f1: 0.6691
 epoch: 43, train_loss: 0.5691, test_loss: 0.8148, test_f1: 0.6758
 epoch: 44, train_loss: 0.5651, test_loss: 0.8374, test_f1: 0.6806
 epoch: 45, train_loss: 0.5637, test_loss: 0.8410, test_f1: 0.6958
 epoch: 46, train_loss: 0.5566, test_loss: 0.8845, test_f1: 0.6778
 epoch: 47, train_loss: 0.5621, test_loss: 0.8470, test_f1: 0.6845
 epoch: 48, train_loss: 0.5698, test_loss: 0.7850, test_f1: 0.6995
 epoch: 49, train_loss: 0.5580, test_loss: 0.7946, test_f1: 0.6767
 epoch: 50, train_loss: 0.5488, test_loss: 0.8383, test_f1: 0.6586
 epoch: 51, train_loss: 0.5186, test_loss: 0.8706, test_f1: 0.6722
 epoch: 52, train_loss: 0.5020, test_loss: 0.8468, test_f1: 0.6780
 epoch: 53, train_loss: 0.4985, test_loss: 0.8049, test_f1: 0.6864
 epoch: 54, train_loss: 0.4958, test_loss: 0.8414, test_f1: 0.6832
 epoch: 55, train_loss: 0.4811, test_loss: 0.8364, test_f1: 0.6791
 epoch: 56, train_loss: 0.4884, test_loss: 0.8404, test_f1: 0.6792
 epoch: 57, train_loss: 0.4760, test_loss: 0.8892, test_f1: 0.6861
 epoch: 58, train_loss: 0.4760, test_loss: 0.8679, test_f1: 0.7003
 epoch: 59, train_loss: 0.4511, test_loss: 0.9094, test_f1: 0.6623
 epoch: 60, train_loss: 0.4717, test_loss: 0.8841, test_f1: 0.6691
 epoch: 61, train_loss: 0.4633, test_loss: 0.9034, test_f1: 0.6807
 epoch: 62, train_loss: 0.4601, test_loss: 0.8868, test_f1: 0.6982
 epoch: 63, train_loss: 0.4561, test_loss: 0.9354, test_f1: 0.6842
 epoch: 64, train_loss: 0.4406, test_loss: 0.9264, test_f1: 0.6979
 epoch: 65, train_loss: 0.4537, test_loss: 0.9128, test_f1: 0.6828
 epoch: 66, train_loss: 0.4425, test_loss: 0.9418, test_f1: 0.6844
 epoch: 67, train_loss: 0.4494, test_loss: 0.9455, test_f1: 0.6797
 epoch: 68, train_loss: 0.4451, test_loss: 0.9862, test_f1: 0.6809
 epoch: 69, train_loss: 0.4451, test_loss: 0.9315, test_f1: 0.6791
 epoch: 70, train_loss: 0.4492, test_loss: 0.9532, test_f1: 0.6642
 epoch: 71, train_loss: 0.4338, test_loss: 0.9576, test_f1: 0.6821
 epoch: 72, train_loss: 0.4459, test_loss: 0.9178, test_f1: 0.6853
 epoch: 73, train_loss: 0.4429, test_loss: 0.9472, test_f1: 0.6856
 epoch: 74, train_loss: 0.4280, test_loss: 0.9793, test_f1: 0.6701
 epoch: 75, train_loss: 0.4142, test_loss: 1.0339, test_f1: 0.6794
 epoch: 76, train_loss: 0.4248, test_loss: 0.9855, test_f1: 0.6802
 epoch: 77, train_loss: 0.4223, test_loss: 1.0090, test_f1: 0.6738
 epoch: 78, train_loss: 0.4255, test_loss: 0.9913, test_f1: 0.6678
 epoch: 79, train_loss: 0.4272, test_loss: 1.0235, test_f1: 0.6632
 epoch: 80, train_loss: 0.4356, test_loss: 1.0168, test_f1: 0.6621
 epoch: 81, train_loss: 0.4116, test_loss: 1.0236, test_f1: 0.6922
 epoch: 82, train_loss: 0.4184, test_loss: 0.9504, test_f1: 0.6906
 epoch: 83, train_loss: 0.4047, test_loss: 1.0479, test_f1: 0.6832
 epoch: 84, train_loss: 0.4105, test_loss: 0.9882, test_f1: 0.6749
 epoch: 85, train_loss: 0.4133, test_loss: 1.1404, test_f1: 0.6866
 epoch: 86, train_loss: 0.4030, test_loss: 1.0234, test_f1: 0.6794
 epoch: 87, train_loss: 0.4098, test_loss: 1.0066, test_f1: 0.6753
 epoch: 88, train_loss: 0.3979, test_loss: 1.0147, test_f1: 0.6602
 epoch: 89, train_loss: 0.4169, test_loss: 1.0014, test_f1: 0.7055
 epoch: 90, train_loss: 0.4038, test_loss: 1.0850, test_f1: 0.6689
 epoch: 91, train_loss: 0.3964, test_loss: 1.0562, test_f1: 0.6623
 epoch: 92, train_loss: 0.3814, test_loss: 1.0237, test_f1: 0.7076
 epoch: 93, train_loss: 0.3985, test_loss: 1.1052, test_f1: 0.6825
 epoch: 94, train_loss: 0.3829, test_loss: 1.0409, test_f1: 0.6923
 epoch: 95, train_loss: 0.3916, test_loss: 1.0570, test_f1: 0.6748
 epoch: 96, train_loss: 0.3722, test_loss: 1.0634, test_f1: 0.6635
 epoch: 97, train_loss: 0.3801, test_loss: 1.0060, test_f1: 0.6766
 epoch: 98, train_loss: 0.3733, test_loss: 1.0628, test_f1: 0.6768
 epoch: 99, train_loss: 0.3743, test_loss: 1.1236, test_f1: 0.6647
##################ITERATION #8 ****************************************
 epoch: 0, train_loss: 1.2005, test_loss: 1.0377, test_f1: 0.4818
 epoch: 1, train_loss: 1.0106, test_loss: 0.9792, test_f1: 0.5079
 epoch: 2, train_loss: 0.9547, test_loss: 0.9448, test_f1: 0.5149
 epoch: 3, train_loss: 0.9346, test_loss: 0.9528, test_f1: 0.5169
 epoch: 4, train_loss: 0.9317, test_loss: 0.8926, test_f1: 0.5097
 epoch: 5, train_loss: 0.9017, test_loss: 0.9281, test_f1: 0.5554
 epoch: 6, train_loss: 0.8830, test_loss: 0.8790, test_f1: 0.5322
 epoch: 7, train_loss: 0.8701, test_loss: 0.8531, test_f1: 0.5337
 epoch: 8, train_loss: 0.8688, test_loss: 0.8535, test_f1: 0.5406
 epoch: 9, train_loss: 0.8545, test_loss: 0.8356, test_f1: 0.5919
 epoch: 10, train_loss: 0.8177, test_loss: 0.8335, test_f1: 0.5931
 epoch: 11, train_loss: 0.8095, test_loss: 0.7577, test_f1: 0.6130
 epoch: 12, train_loss: 0.7951, test_loss: 0.7538, test_f1: 0.6211
 epoch: 13, train_loss: 0.7860, test_loss: 0.7782, test_f1: 0.6067
 epoch: 14, train_loss: 0.7943, test_loss: 0.8255, test_f1: 0.6137
 epoch: 15, train_loss: 0.7771, test_loss: 0.7957, test_f1: 0.5984
 epoch: 16, train_loss: 0.7648, test_loss: 0.7724, test_f1: 0.5955
 epoch: 17, train_loss: 0.7452, test_loss: 0.7126, test_f1: 0.6272
 epoch: 18, train_loss: 0.7473, test_loss: 0.7502, test_f1: 0.6242
 epoch: 19, train_loss: 0.7298, test_loss: 0.7212, test_f1: 0.6408
 epoch: 20, train_loss: 0.7257, test_loss: 0.7406, test_f1: 0.6342
 epoch: 21, train_loss: 0.7173, test_loss: 0.7958, test_f1: 0.6143
 epoch: 22, train_loss: 0.6983, test_loss: 0.8110, test_f1: 0.5820
 epoch: 23, train_loss: 0.6913, test_loss: 0.7510, test_f1: 0.6217
 epoch: 24, train_loss: 0.7011, test_loss: 0.7325, test_f1: 0.6582
 epoch: 25, train_loss: 0.6879, test_loss: 0.7625, test_f1: 0.6273
 epoch: 26, train_loss: 0.6690, test_loss: 0.6971, test_f1: 0.6481
 epoch: 27, train_loss: 0.6589, test_loss: 0.7256, test_f1: 0.6278
 epoch: 28, train_loss: 0.6751, test_loss: 0.7028, test_f1: 0.6461
 epoch: 29, train_loss: 0.6451, test_loss: 0.7720, test_f1: 0.6183
 epoch: 30, train_loss: 0.6453, test_loss: 0.7220, test_f1: 0.6436
 epoch: 31, train_loss: 0.6380, test_loss: 0.7865, test_f1: 0.6313
 epoch: 32, train_loss: 0.6304, test_loss: 0.7640, test_f1: 0.6263
 epoch: 33, train_loss: 0.6158, test_loss: 0.8125, test_f1: 0.6516
 epoch: 34, train_loss: 0.6276, test_loss: 0.7662, test_f1: 0.6612
 epoch: 35, train_loss: 0.6239, test_loss: 0.7538, test_f1: 0.6629
 epoch: 36, train_loss: 0.6133, test_loss: 0.7971, test_f1: 0.6204
 epoch: 37, train_loss: 0.5963, test_loss: 0.7598, test_f1: 0.6485
 epoch: 38, train_loss: 0.6168, test_loss: 0.7575, test_f1: 0.6316
 epoch: 39, train_loss: 0.5941, test_loss: 0.6923, test_f1: 0.6801
 epoch: 40, train_loss: 0.5931, test_loss: 0.8146, test_f1: 0.6435
 epoch: 41, train_loss: 0.5669, test_loss: 0.7995, test_f1: 0.6446
 epoch: 42, train_loss: 0.5936, test_loss: 0.7768, test_f1: 0.6345
 epoch: 43, train_loss: 0.5740, test_loss: 0.8225, test_f1: 0.6453
 epoch: 44, train_loss: 0.5784, test_loss: 0.7255, test_f1: 0.6568
 epoch: 45, train_loss: 0.5762, test_loss: 0.7809, test_f1: 0.6507
 epoch: 46, train_loss: 0.5595, test_loss: 0.8847, test_f1: 0.6602
 epoch: 47, train_loss: 0.5543, test_loss: 0.7586, test_f1: 0.6504
 epoch: 48, train_loss: 0.5352, test_loss: 0.7384, test_f1: 0.6737
 epoch: 49, train_loss: 0.5329, test_loss: 0.7220, test_f1: 0.6623
 epoch: 50, train_loss: 0.5457, test_loss: 0.7622, test_f1: 0.6460
 epoch: 51, train_loss: 0.5095, test_loss: 0.7659, test_f1: 0.6482
 epoch: 52, train_loss: 0.5113, test_loss: 0.7414, test_f1: 0.6668
 epoch: 53, train_loss: 0.4864, test_loss: 0.8402, test_f1: 0.6471
 epoch: 54, train_loss: 0.4982, test_loss: 0.8075, test_f1: 0.6540
 epoch: 55, train_loss: 0.4905, test_loss: 0.8390, test_f1: 0.6463
 epoch: 56, train_loss: 0.4814, test_loss: 0.8415, test_f1: 0.6305
 epoch: 57, train_loss: 0.4676, test_loss: 0.8399, test_f1: 0.6606
 epoch: 58, train_loss: 0.4701, test_loss: 0.7980, test_f1: 0.6697
 epoch: 59, train_loss: 0.4652, test_loss: 0.8160, test_f1: 0.6521
 epoch: 60, train_loss: 0.4619, test_loss: 0.8790, test_f1: 0.6481
 epoch: 61, train_loss: 0.4592, test_loss: 0.8358, test_f1: 0.6658
 epoch: 62, train_loss: 0.4450, test_loss: 0.8534, test_f1: 0.6514
 epoch: 63, train_loss: 0.4582, test_loss: 0.8578, test_f1: 0.6569
 epoch: 64, train_loss: 0.4616, test_loss: 0.8266, test_f1: 0.6687
 epoch: 65, train_loss: 0.4490, test_loss: 0.8822, test_f1: 0.6461
 epoch: 66, train_loss: 0.4559, test_loss: 0.8495, test_f1: 0.6739
 epoch: 67, train_loss: 0.4253, test_loss: 0.9407, test_f1: 0.6456
 epoch: 68, train_loss: 0.4670, test_loss: 0.8900, test_f1: 0.6479
 epoch: 69, train_loss: 0.4379, test_loss: 0.8852, test_f1: 0.6612
 epoch: 70, train_loss: 0.4360, test_loss: 0.8888, test_f1: 0.6290
 epoch: 71, train_loss: 0.4352, test_loss: 0.8950, test_f1: 0.6682
 epoch: 72, train_loss: 0.4488, test_loss: 0.8799, test_f1: 0.6677
 epoch: 73, train_loss: 0.4133, test_loss: 0.9107, test_f1: 0.6543
 epoch: 74, train_loss: 0.4346, test_loss: 0.8850, test_f1: 0.6649
 epoch: 75, train_loss: 0.4295, test_loss: 0.9631, test_f1: 0.6420
 epoch: 76, train_loss: 0.4393, test_loss: 0.9113, test_f1: 0.6400
 epoch: 77, train_loss: 0.4397, test_loss: 0.8857, test_f1: 0.6702
 epoch: 78, train_loss: 0.4274, test_loss: 0.9190, test_f1: 0.6716
 epoch: 79, train_loss: 0.4093, test_loss: 0.9395, test_f1: 0.6636
 epoch: 80, train_loss: 0.4076, test_loss: 0.9512, test_f1: 0.6662
 epoch: 81, train_loss: 0.4185, test_loss: 0.9820, test_f1: 0.6466
 epoch: 82, train_loss: 0.4155, test_loss: 0.9132, test_f1: 0.6799
 epoch: 83, train_loss: 0.4168, test_loss: 0.9780, test_f1: 0.6667
 epoch: 84, train_loss: 0.4143, test_loss: 0.9425, test_f1: 0.6750
 epoch: 85, train_loss: 0.4085, test_loss: 0.9698, test_f1: 0.6584
 epoch: 86, train_loss: 0.3883, test_loss: 0.9652, test_f1: 0.6595
 epoch: 87, train_loss: 0.4063, test_loss: 0.9435, test_f1: 0.6794
 epoch: 88, train_loss: 0.3944, test_loss: 0.9866, test_f1: 0.6527
 epoch: 89, train_loss: 0.3968, test_loss: 1.0076, test_f1: 0.6596
 epoch: 90, train_loss: 0.3887, test_loss: 0.9962, test_f1: 0.6696
 epoch: 91, train_loss: 0.3867, test_loss: 1.0522, test_f1: 0.6625
 epoch: 92, train_loss: 0.3870, test_loss: 1.0138, test_f1: 0.6403
 epoch: 93, train_loss: 0.3843, test_loss: 0.9582, test_f1: 0.6582
 epoch: 94, train_loss: 0.3890, test_loss: 1.0283, test_f1: 0.6612
 epoch: 95, train_loss: 0.3865, test_loss: 1.0780, test_f1: 0.6445
 epoch: 96, train_loss: 0.3904, test_loss: 1.0394, test_f1: 0.6741
 epoch: 97, train_loss: 0.3758, test_loss: 1.0027, test_f1: 0.6869
 epoch: 98, train_loss: 0.3850, test_loss: 1.0177, test_f1: 0.6430
 epoch: 99, train_loss: 0.3803, test_loss: 0.9946, test_f1: 0.6616
##################ITERATION #9 ****************************************
 epoch: 0, train_loss: 1.2429, test_loss: 0.9921, test_f1: 0.4601
 epoch: 1, train_loss: 1.0014, test_loss: 0.9028, test_f1: 0.5137
 epoch: 2, train_loss: 0.9527, test_loss: 0.9064, test_f1: 0.5303
 epoch: 3, train_loss: 0.9416, test_loss: 0.8650, test_f1: 0.5394
 epoch: 4, train_loss: 0.9085, test_loss: 0.8429, test_f1: 0.5287
 epoch: 5, train_loss: 0.8803, test_loss: 0.8456, test_f1: 0.5711
 epoch: 6, train_loss: 0.8747, test_loss: 0.8143, test_f1: 0.5765
 epoch: 7, train_loss: 0.8504, test_loss: 0.8496, test_f1: 0.5732
 epoch: 8, train_loss: 0.8441, test_loss: 0.8237, test_f1: 0.6116
 epoch: 9, train_loss: 0.8355, test_loss: 0.8091, test_f1: 0.5827
 epoch: 10, train_loss: 0.8021, test_loss: 0.7948, test_f1: 0.6055
 epoch: 11, train_loss: 0.8038, test_loss: 0.7915, test_f1: 0.6290
 epoch: 12, train_loss: 0.7846, test_loss: 0.7761, test_f1: 0.6293
 epoch: 13, train_loss: 0.7788, test_loss: 0.7926, test_f1: 0.6463
 epoch: 14, train_loss: 0.7563, test_loss: 0.7606, test_f1: 0.6445
 epoch: 15, train_loss: 0.7503, test_loss: 0.7467, test_f1: 0.6359
 epoch: 16, train_loss: 0.7490, test_loss: 0.7781, test_f1: 0.6529
 epoch: 17, train_loss: 0.7388, test_loss: 0.7980, test_f1: 0.6120
 epoch: 18, train_loss: 0.7358, test_loss: 0.8196, test_f1: 0.6383
 epoch: 19, train_loss: 0.7290, test_loss: 0.7536, test_f1: 0.6645
 epoch: 20, train_loss: 0.7198, test_loss: 0.7510, test_f1: 0.6468
 epoch: 21, train_loss: 0.7011, test_loss: 0.7966, test_f1: 0.6389
 epoch: 22, train_loss: 0.6807, test_loss: 0.7907, test_f1: 0.6528
 epoch: 23, train_loss: 0.6707, test_loss: 0.8135, test_f1: 0.6507
 epoch: 24, train_loss: 0.6735, test_loss: 0.8014, test_f1: 0.6509
 epoch: 25, train_loss: 0.6841, test_loss: 0.8210, test_f1: 0.6527
 epoch: 26, train_loss: 0.6615, test_loss: 0.7755, test_f1: 0.6501
 epoch: 27, train_loss: 0.6649, test_loss: 0.7983, test_f1: 0.6594
 epoch: 28, train_loss: 0.6462, test_loss: 0.8076, test_f1: 0.6520
 epoch: 29, train_loss: 0.6424, test_loss: 0.8613, test_f1: 0.6736
 epoch: 30, train_loss: 0.6323, test_loss: 0.7919, test_f1: 0.6598
 epoch: 31, train_loss: 0.6390, test_loss: 0.8020, test_f1: 0.6380
 epoch: 32, train_loss: 0.6189, test_loss: 0.8186, test_f1: 0.6422
 epoch: 33, train_loss: 0.6328, test_loss: 0.8509, test_f1: 0.6639
 epoch: 34, train_loss: 0.6257, test_loss: 0.8423, test_f1: 0.6716
 epoch: 35, train_loss: 0.6284, test_loss: 0.8378, test_f1: 0.6580
 epoch: 36, train_loss: 0.6081, test_loss: 0.8356, test_f1: 0.6245
 epoch: 37, train_loss: 0.6051, test_loss: 0.8718, test_f1: 0.6557
 epoch: 38, train_loss: 0.5963, test_loss: 0.8486, test_f1: 0.6616
 epoch: 39, train_loss: 0.5976, test_loss: 0.8715, test_f1: 0.6445
 epoch: 40, train_loss: 0.6091, test_loss: 0.9385, test_f1: 0.6478
 epoch: 41, train_loss: 0.5907, test_loss: 0.8472, test_f1: 0.6508
 epoch: 42, train_loss: 0.5754, test_loss: 0.8753, test_f1: 0.6601
 epoch: 43, train_loss: 0.5677, test_loss: 0.8758, test_f1: 0.6443
 epoch: 44, train_loss: 0.5585, test_loss: 0.8757, test_f1: 0.6648
 epoch: 45, train_loss: 0.5610, test_loss: 0.9078, test_f1: 0.6515
 epoch: 46, train_loss: 0.5655, test_loss: 0.7992, test_f1: 0.6806
 epoch: 47, train_loss: 0.5624, test_loss: 0.8846, test_f1: 0.6713
 epoch: 48, train_loss: 0.5295, test_loss: 0.8911, test_f1: 0.6838
 epoch: 49, train_loss: 0.5546, test_loss: 0.8534, test_f1: 0.6614
 epoch: 50, train_loss: 0.5458, test_loss: 0.9488, test_f1: 0.6644
 epoch: 51, train_loss: 0.5250, test_loss: 0.8412, test_f1: 0.6693
 epoch: 52, train_loss: 0.4868, test_loss: 0.8748, test_f1: 0.6957
 epoch: 53, train_loss: 0.4908, test_loss: 0.8760, test_f1: 0.6692
 epoch: 54, train_loss: 0.4830, test_loss: 0.8820, test_f1: 0.6515
 epoch: 55, train_loss: 0.4754, test_loss: 0.9150, test_f1: 0.6622
 epoch: 56, train_loss: 0.4993, test_loss: 0.8823, test_f1: 0.6640
 epoch: 57, train_loss: 0.4719, test_loss: 0.8917, test_f1: 0.6802
 epoch: 58, train_loss: 0.4795, test_loss: 0.9317, test_f1: 0.6697
 epoch: 59, train_loss: 0.4565, test_loss: 0.9053, test_f1: 0.6625
 epoch: 60, train_loss: 0.4806, test_loss: 0.8765, test_f1: 0.6870
 epoch: 61, train_loss: 0.4665, test_loss: 0.9282, test_f1: 0.6835
 epoch: 62, train_loss: 0.4655, test_loss: 0.9982, test_f1: 0.6546
 epoch: 63, train_loss: 0.4630, test_loss: 0.9260, test_f1: 0.6614
 epoch: 64, train_loss: 0.4565, test_loss: 0.9675, test_f1: 0.6556
 epoch: 65, train_loss: 0.4405, test_loss: 0.9455, test_f1: 0.6592
 epoch: 66, train_loss: 0.4702, test_loss: 0.8737, test_f1: 0.6870
 epoch: 67, train_loss: 0.4677, test_loss: 0.9347, test_f1: 0.6938
 epoch: 68, train_loss: 0.4616, test_loss: 0.9500, test_f1: 0.6661
 epoch: 69, train_loss: 0.4455, test_loss: 0.9302, test_f1: 0.6649
 epoch: 70, train_loss: 0.4266, test_loss: 1.0088, test_f1: 0.6806
 epoch: 71, train_loss: 0.4529, test_loss: 0.8349, test_f1: 0.6738
 epoch: 72, train_loss: 0.4342, test_loss: 0.9330, test_f1: 0.6781
 epoch: 73, train_loss: 0.4431, test_loss: 0.8784, test_f1: 0.6798
 epoch: 74, train_loss: 0.4294, test_loss: 0.9687, test_f1: 0.6708
 epoch: 75, train_loss: 0.4419, test_loss: 0.9889, test_f1: 0.6620
 epoch: 76, train_loss: 0.4130, test_loss: 1.0292, test_f1: 0.6715
 epoch: 77, train_loss: 0.4112, test_loss: 0.9818, test_f1: 0.6715
 epoch: 78, train_loss: 0.4129, test_loss: 1.0435, test_f1: 0.6759
 epoch: 79, train_loss: 0.4017, test_loss: 1.0859, test_f1: 0.6806
 epoch: 80, train_loss: 0.4185, test_loss: 1.1315, test_f1: 0.6684
 epoch: 81, train_loss: 0.4062, test_loss: 1.0480, test_f1: 0.6861
 epoch: 82, train_loss: 0.4172, test_loss: 1.0483, test_f1: 0.6648
 epoch: 83, train_loss: 0.4122, test_loss: 0.9343, test_f1: 0.6796
 epoch: 84, train_loss: 0.4173, test_loss: 1.0007, test_f1: 0.6692
 epoch: 85, train_loss: 0.4086, test_loss: 1.0374, test_f1: 0.6756
 epoch: 86, train_loss: 0.4015, test_loss: 1.0297, test_f1: 0.6820
 epoch: 87, train_loss: 0.4072, test_loss: 1.0052, test_f1: 0.6604
 epoch: 88, train_loss: 0.3733, test_loss: 0.9264, test_f1: 0.6680
 epoch: 89, train_loss: 0.3875, test_loss: 1.0455, test_f1: 0.6741
 epoch: 90, train_loss: 0.3989, test_loss: 1.0215, test_f1: 0.6812
 epoch: 91, train_loss: 0.4036, test_loss: 0.9810, test_f1: 0.6855
 epoch: 92, train_loss: 0.4471, test_loss: 0.9801, test_f1: 0.6629
 epoch: 93, train_loss: 0.3820, test_loss: 1.0873, test_f1: 0.6647
 epoch: 94, train_loss: 0.3697, test_loss: 1.0756, test_f1: 0.6674
 epoch: 95, train_loss: 0.3931, test_loss: 1.0802, test_f1: 0.6666
 epoch: 96, train_loss: 0.3588, test_loss: 1.1814, test_f1: 0.6647
 epoch: 97, train_loss: 0.3955, test_loss: 1.1413, test_f1: 0.6578
 epoch: 98, train_loss: 0.3936, test_loss: 1.0417, test_f1: 0.6582
 epoch: 99, train_loss: 0.3723, test_loss: 0.9983, test_f1: 0.6769

Training completed in 1103.22 seconds
Best F1: 0.7317 at epoch 87
Mean F1 across iterations: 0.7070  0.0131
========================FINAL RESULTS================================
FEGIN weighted F1: 0.7317  0.0131
python main.py --data ltspice_examples --representation component_pin_net --model FEGIN --layers 2 --hiddens 64 --batch_size 32 --lr 0.001 --emb_size 128 --epochs 100 --save_appendix component_pin_net_L2_H64_BS32_LR0.001_E128 --no_val
-----



STDERR:
  File "main.py", line 370, in <module>
    main()
  File "main.py", line 254, in main
    dataset = dataset_class(
  File "/home/philip/projects/llm_inference_code_repo/Circuit-Completion-Using-GNNs/component_classification_with_link_prediction_head/evaluation/FEGIN/kernel/circuit_datasets.py", line 15, in __init__
    self.data, self.slices = torch.load(self.processed_paths[0])
  File "/home/philip/.local/lib/python3.8/site-packages/torch/serialization.py", line 1040, in load
    warnings.warn(
  File "/usr/lib/python3.8/warnings.py", line 109, in _showwarnmsg
    sw(msg.message, msg.category, msg.filename, msg.lineno,
  File "main.py", line 47, in warn_with_traceback
    traceback.print_stack(file=log)
/home/philip/projects/llm_inference_code_repo/Circuit-Completion-Using-GNNs/component_classification_with_link_prediction_head/evaluation/FEGIN/kernel/circuit_datasets.py:15: FutureWarning: You are using `torch.load` with `weights_only=False` (the current default value), which uses the default pickle module implicitly. It is possible to construct malicious pickle data which will execute arbitrary code during unpickling (See https://github.com/pytorch/pytorch/blob/main/SECURITY.md#untrusted-models for more details). In a future release, the default value for `weights_only` will be flipped to `True`. This limits the functions that could be executed during unpickling. Arbitrary objects will no longer be allowed to be loaded via this mode unless they are explicitly allowlisted by the user via `torch.serialization.add_safe_globals`. We recommend you start setting `weights_only=True` for any use case where you don't have full control of the loaded file. Please open an issue on GitHub for any issues related to this experimental feature.
  self.data, self.slices = torch.load(self.processed_paths[0])
