STDOUT:
Results will be saved in /home/philip/projects/ltspice_examples_code_repo/Circuit-Completion-Using-GNNs/component_classification_with_link_prediction_head/evaluation/FEGIN/results/model_FEGIN_dataset_ltspice_demos
Command line input: python main.py --data ltspice_demos --representation component_component --model FEGIN --layers 5 --hiddens 128 --batch_size 256 --lr 0.001 --emb_size 250 --epochs 100 --save_appendix component_component_L5_H128_BS256_LR0.001_E250 --no_val
 is saved.
-----
ltspice_demos - FEGIN
Using 5 layers, 128 hidden units, h = 2
Loading component_component representation dataset
ENTERED
Training FEGIN on component_component representation
Train: 1565, Test: 383
##################ITERATION #0 ****************************************
 epoch: 0, train_loss: 1.3418, test_loss: 1.3395, test_f1: 0.1437
 epoch: 1, train_loss: 1.2093, test_loss: 1.3048, test_f1: 0.3575
 epoch: 2, train_loss: 1.1681, test_loss: 1.3018, test_f1: 0.3571
 epoch: 3, train_loss: 1.1208, test_loss: 1.2940, test_f1: 0.3583
 epoch: 4, train_loss: 1.0857, test_loss: 1.3007, test_f1: 0.3762
 epoch: 5, train_loss: 1.0529, test_loss: 1.2618, test_f1: 0.3701
 epoch: 6, train_loss: 1.0220, test_loss: 1.2340, test_f1: 0.3850
 epoch: 7, train_loss: 0.9833, test_loss: 1.1836, test_f1: 0.4707
 epoch: 8, train_loss: 0.9605, test_loss: 1.1936, test_f1: 0.4533
 epoch: 9, train_loss: 0.9326, test_loss: 1.2032, test_f1: 0.4776
 epoch: 10, train_loss: 0.9264, test_loss: 1.2221, test_f1: 0.4996
 epoch: 11, train_loss: 0.9011, test_loss: 1.1760, test_f1: 0.5459
 epoch: 12, train_loss: 0.8633, test_loss: 1.2392, test_f1: 0.4873
 epoch: 13, train_loss: 0.8301, test_loss: 1.3508, test_f1: 0.4639
 epoch: 14, train_loss: 0.8308, test_loss: 1.3195, test_f1: 0.4873
 epoch: 15, train_loss: 0.8285, test_loss: 1.2552, test_f1: 0.5336
 epoch: 16, train_loss: 0.7947, test_loss: 1.5400, test_f1: 0.5000
 epoch: 17, train_loss: 0.7892, test_loss: 1.2859, test_f1: 0.5511
 epoch: 18, train_loss: 0.7524, test_loss: 1.2108, test_f1: 0.5690
 epoch: 19, train_loss: 0.7616, test_loss: 1.2944, test_f1: 0.5313
 epoch: 20, train_loss: 0.7627, test_loss: 1.2273, test_f1: 0.5178
 epoch: 21, train_loss: 0.7456, test_loss: 1.1752, test_f1: 0.5815
 epoch: 22, train_loss: 0.7101, test_loss: 1.3189, test_f1: 0.5009
 epoch: 23, train_loss: 0.7125, test_loss: 1.3530, test_f1: 0.5450
 epoch: 24, train_loss: 0.6810, test_loss: 1.4667, test_f1: 0.4598
 epoch: 25, train_loss: 0.6733, test_loss: 1.4532, test_f1: 0.4670
 epoch: 26, train_loss: 0.6294, test_loss: 1.4209, test_f1: 0.5342
 epoch: 27, train_loss: 0.6478, test_loss: 1.4415, test_f1: 0.5420
 epoch: 28, train_loss: 0.6065, test_loss: 1.2425, test_f1: 0.5797
 epoch: 29, train_loss: 0.6158, test_loss: 1.4507, test_f1: 0.5327
 epoch: 30, train_loss: 0.6401, test_loss: 1.5907, test_f1: 0.5141
 epoch: 31, train_loss: 0.6565, test_loss: 1.6432, test_f1: 0.5028
 epoch: 32, train_loss: 0.7412, test_loss: 2.3249, test_f1: 0.3889
 epoch: 33, train_loss: 0.7430, test_loss: 1.7657, test_f1: 0.3826
 epoch: 34, train_loss: 0.7071, test_loss: 1.5427, test_f1: 0.4433
 epoch: 35, train_loss: 0.6793, test_loss: 1.5805, test_f1: 0.5258
 epoch: 36, train_loss: 0.6396, test_loss: 1.4881, test_f1: 0.5706
 epoch: 37, train_loss: 0.6368, test_loss: 1.5506, test_f1: 0.5678
 epoch: 38, train_loss: 0.6325, test_loss: 1.6662, test_f1: 0.5315
 epoch: 39, train_loss: 0.5833, test_loss: 1.6448, test_f1: 0.5343
 epoch: 40, train_loss: 0.6208, test_loss: 1.5199, test_f1: 0.5521
 epoch: 41, train_loss: 0.5898, test_loss: 1.4984, test_f1: 0.5694
 epoch: 42, train_loss: 0.5787, test_loss: 1.6804, test_f1: 0.5536
 epoch: 43, train_loss: 0.5674, test_loss: 1.6619, test_f1: 0.5307
 epoch: 44, train_loss: 0.5645, test_loss: 1.6161, test_f1: 0.5237
 epoch: 45, train_loss: 0.5364, test_loss: 1.7758, test_f1: 0.5055
 epoch: 46, train_loss: 0.5552, test_loss: 1.7077, test_f1: 0.5419
 epoch: 47, train_loss: 0.5862, test_loss: 1.9887, test_f1: 0.5100
 epoch: 48, train_loss: 0.6159, test_loss: 1.7272, test_f1: 0.5782
 epoch: 49, train_loss: 0.5854, test_loss: 1.7060, test_f1: 0.5279
 epoch: 50, train_loss: 0.5512, test_loss: 1.6037, test_f1: 0.5311
 epoch: 51, train_loss: 0.5031, test_loss: 1.6415, test_f1: 0.5510
 epoch: 52, train_loss: 0.4979, test_loss: 1.5739, test_f1: 0.5616
 epoch: 53, train_loss: 0.5043, test_loss: 1.6711, test_f1: 0.5439
 epoch: 54, train_loss: 0.5025, test_loss: 1.6693, test_f1: 0.5343
 epoch: 55, train_loss: 0.4949, test_loss: 1.6795, test_f1: 0.4881
 epoch: 56, train_loss: 0.4633, test_loss: 1.6329, test_f1: 0.5467
 epoch: 57, train_loss: 0.4472, test_loss: 1.6148, test_f1: 0.5297
 epoch: 58, train_loss: 0.4530, test_loss: 1.6901, test_f1: 0.5616
 epoch: 59, train_loss: 0.4431, test_loss: 1.7119, test_f1: 0.5712
 epoch: 60, train_loss: 0.4214, test_loss: 1.7630, test_f1: 0.5472
 epoch: 61, train_loss: 0.4130, test_loss: 1.7990, test_f1: 0.5606
 epoch: 62, train_loss: 0.4303, test_loss: 1.7337, test_f1: 0.5507
 epoch: 63, train_loss: 0.4185, test_loss: 1.7372, test_f1: 0.5458
 epoch: 64, train_loss: 0.3931, test_loss: 1.7126, test_f1: 0.5547
 epoch: 65, train_loss: 0.4109, test_loss: 1.7088, test_f1: 0.5586
 epoch: 66, train_loss: 0.4000, test_loss: 1.7457, test_f1: 0.5712
 epoch: 67, train_loss: 0.3853, test_loss: 1.8109, test_f1: 0.5678
 epoch: 68, train_loss: 0.4041, test_loss: 1.7901, test_f1: 0.5614
 epoch: 69, train_loss: 0.3861, test_loss: 1.6858, test_f1: 0.5970
 epoch: 70, train_loss: 0.3798, test_loss: 1.7539, test_f1: 0.5653
 epoch: 71, train_loss: 0.3708, test_loss: 1.7598, test_f1: 0.5599
 epoch: 72, train_loss: 0.3621, test_loss: 1.7505, test_f1: 0.5597
 epoch: 73, train_loss: 0.3518, test_loss: 1.8109, test_f1: 0.5486
 epoch: 74, train_loss: 0.3599, test_loss: 2.0045, test_f1: 0.5221
 epoch: 75, train_loss: 0.3577, test_loss: 1.9725, test_f1: 0.5756
 epoch: 76, train_loss: 0.3681, test_loss: 2.0201, test_f1: 0.5523
 epoch: 77, train_loss: 0.3354, test_loss: 2.1059, test_f1: 0.5183
 epoch: 78, train_loss: 0.3504, test_loss: 2.2967, test_f1: 0.5219
 epoch: 79, train_loss: 0.3571, test_loss: 2.2402, test_f1: 0.5587
 epoch: 80, train_loss: 0.3525, test_loss: 2.0358, test_f1: 0.5551
 epoch: 81, train_loss: 0.3597, test_loss: 2.0583, test_f1: 0.5407
 epoch: 82, train_loss: 0.3612, test_loss: 2.1450, test_f1: 0.5559
 epoch: 83, train_loss: 0.3780, test_loss: 2.2714, test_f1: 0.5256
 epoch: 84, train_loss: 0.3586, test_loss: 2.2341, test_f1: 0.5238
 epoch: 85, train_loss: 0.3499, test_loss: 2.0386, test_f1: 0.5552
 epoch: 86, train_loss: 0.3490, test_loss: 2.0004, test_f1: 0.5347
 epoch: 87, train_loss: 0.3320, test_loss: 1.9952, test_f1: 0.5683
 epoch: 88, train_loss: 0.3238, test_loss: 2.1780, test_f1: 0.5250
 epoch: 89, train_loss: 0.3322, test_loss: 2.0892, test_f1: 0.5499
 epoch: 90, train_loss: 0.3298, test_loss: 2.1154, test_f1: 0.5619
 epoch: 91, train_loss: 0.3332, test_loss: 2.3101, test_f1: 0.5314
 epoch: 92, train_loss: 0.3278, test_loss: 2.3904, test_f1: 0.5496
 epoch: 93, train_loss: 0.2992, test_loss: 2.3287, test_f1: 0.5688
 epoch: 94, train_loss: 0.3175, test_loss: 2.0316, test_f1: 0.5855
 epoch: 95, train_loss: 0.3070, test_loss: 2.0570, test_f1: 0.5614
 epoch: 96, train_loss: 0.3063, test_loss: 2.0776, test_f1: 0.5399
 epoch: 97, train_loss: 0.2881, test_loss: 2.4950, test_f1: 0.5531
 epoch: 98, train_loss: 0.2796, test_loss: 2.5776, test_f1: 0.5409
 epoch: 99, train_loss: 0.3338, test_loss: 2.4514, test_f1: 0.5469
##################ITERATION #1 ****************************************
 epoch: 0, train_loss: 1.2541, test_loss: 1.3213, test_f1: 0.3107
 epoch: 1, train_loss: 1.1280, test_loss: 1.2711, test_f1: 0.3627
 epoch: 2, train_loss: 1.0673, test_loss: 1.2163, test_f1: 0.4526
 epoch: 3, train_loss: 1.0193, test_loss: 1.1913, test_f1: 0.4647
 epoch: 4, train_loss: 0.9607, test_loss: 1.1977, test_f1: 0.4439
 epoch: 5, train_loss: 0.9159, test_loss: 1.1784, test_f1: 0.5083
 epoch: 6, train_loss: 0.8828, test_loss: 1.1490, test_f1: 0.5561
 epoch: 7, train_loss: 0.8585, test_loss: 1.1635, test_f1: 0.5332
 epoch: 8, train_loss: 0.8282, test_loss: 1.2203, test_f1: 0.5177
 epoch: 9, train_loss: 0.7907, test_loss: 1.1704, test_f1: 0.5843
 epoch: 10, train_loss: 0.7632, test_loss: 1.2591, test_f1: 0.5410
 epoch: 11, train_loss: 0.7783, test_loss: 1.4649, test_f1: 0.5194
 epoch: 12, train_loss: 0.7690, test_loss: 1.6420, test_f1: 0.5082
 epoch: 13, train_loss: 0.7611, test_loss: 1.4847, test_f1: 0.5391
 epoch: 14, train_loss: 0.7457, test_loss: 1.4180, test_f1: 0.5282
 epoch: 15, train_loss: 0.7423, test_loss: 1.4909, test_f1: 0.5286
 epoch: 16, train_loss: 0.7111, test_loss: 1.5177, test_f1: 0.5302
 epoch: 17, train_loss: 0.6713, test_loss: 1.4204, test_f1: 0.5283
 epoch: 18, train_loss: 0.6424, test_loss: 1.4205, test_f1: 0.5714
 epoch: 19, train_loss: 0.6252, test_loss: 1.6158, test_f1: 0.5511
 epoch: 20, train_loss: 0.6583, test_loss: 1.6362, test_f1: 0.5186
 epoch: 21, train_loss: 0.6756, test_loss: 1.6253, test_f1: 0.5603
 epoch: 22, train_loss: 0.6225, test_loss: 1.6186, test_f1: 0.5431
 epoch: 23, train_loss: 0.5807, test_loss: 1.5402, test_f1: 0.5868
 epoch: 24, train_loss: 0.5579, test_loss: 1.6832, test_f1: 0.5830
 epoch: 25, train_loss: 0.5749, test_loss: 2.3042, test_f1: 0.5818
 epoch: 26, train_loss: 0.6112, test_loss: 2.0689, test_f1: 0.5138
 epoch: 27, train_loss: 0.5935, test_loss: 1.7276, test_f1: 0.5689
 epoch: 28, train_loss: 0.6075, test_loss: 1.7108, test_f1: 0.5266
 epoch: 29, train_loss: 0.5798, test_loss: 1.8760, test_f1: 0.5183
 epoch: 30, train_loss: 0.5760, test_loss: 1.9095, test_f1: 0.5337
 epoch: 31, train_loss: 0.6431, test_loss: 2.1696, test_f1: 0.4997
 epoch: 32, train_loss: 0.6510, test_loss: 1.8877, test_f1: 0.5662
 epoch: 33, train_loss: 0.5956, test_loss: 2.0300, test_f1: 0.5006
 epoch: 34, train_loss: 0.5682, test_loss: 2.2708, test_f1: 0.5444
 epoch: 35, train_loss: 0.5062, test_loss: 2.2664, test_f1: 0.5469
 epoch: 36, train_loss: 0.5053, test_loss: 2.2273, test_f1: 0.4984
 epoch: 37, train_loss: 0.5323, test_loss: 2.3460, test_f1: 0.4601
 epoch: 38, train_loss: 0.5059, test_loss: 2.3081, test_f1: 0.4987
 epoch: 39, train_loss: 0.4960, test_loss: 2.1897, test_f1: 0.5188
 epoch: 40, train_loss: 0.5167, test_loss: 2.6426, test_f1: 0.5136
 epoch: 41, train_loss: 0.5138, test_loss: 2.4614, test_f1: 0.5393
 epoch: 42, train_loss: 0.5021, test_loss: 2.5746, test_f1: 0.5472
 epoch: 43, train_loss: 0.5104, test_loss: 2.4132, test_f1: 0.5579
 epoch: 44, train_loss: 0.5111, test_loss: 2.2308, test_f1: 0.5751
 epoch: 45, train_loss: 0.4860, test_loss: 2.2316, test_f1: 0.5714
 epoch: 46, train_loss: 0.4803, test_loss: 1.9715, test_f1: 0.5599
 epoch: 47, train_loss: 0.4469, test_loss: 2.1557, test_f1: 0.5561
 epoch: 48, train_loss: 0.4279, test_loss: 2.3653, test_f1: 0.5543
 epoch: 49, train_loss: 0.4303, test_loss: 2.7846, test_f1: 0.5322
 epoch: 50, train_loss: 0.4352, test_loss: 2.5507, test_f1: 0.5459
 epoch: 51, train_loss: 0.4066, test_loss: 2.7757, test_f1: 0.5839
 epoch: 52, train_loss: 0.3898, test_loss: 2.6206, test_f1: 0.5382
 epoch: 53, train_loss: 0.3568, test_loss: 2.7507, test_f1: 0.5624
 epoch: 54, train_loss: 0.3752, test_loss: 2.8494, test_f1: 0.5532
 epoch: 55, train_loss: 0.3714, test_loss: 2.9093, test_f1: 0.5590
 epoch: 56, train_loss: 0.3385, test_loss: 3.2038, test_f1: 0.5690
 epoch: 57, train_loss: 0.3370, test_loss: 3.1367, test_f1: 0.5489
 epoch: 58, train_loss: 0.3406, test_loss: 3.0800, test_f1: 0.5754
 epoch: 59, train_loss: 0.3462, test_loss: 2.9258, test_f1: 0.5622
 epoch: 60, train_loss: 0.3498, test_loss: 3.0446, test_f1: 0.5565
 epoch: 61, train_loss: 0.3443, test_loss: 3.1870, test_f1: 0.5475
 epoch: 62, train_loss: 0.3206, test_loss: 3.5786, test_f1: 0.5409
 epoch: 63, train_loss: 0.3310, test_loss: 3.6566, test_f1: 0.5228
 epoch: 64, train_loss: 0.3245, test_loss: 3.1158, test_f1: 0.5699
 epoch: 65, train_loss: 0.3220, test_loss: 2.8808, test_f1: 0.5828
 epoch: 66, train_loss: 0.3374, test_loss: 2.8712, test_f1: 0.5863
 epoch: 67, train_loss: 0.3579, test_loss: 3.0112, test_f1: 0.5943
 epoch: 68, train_loss: 0.3460, test_loss: 2.7351, test_f1: 0.5687
 epoch: 69, train_loss: 0.3608, test_loss: 2.6901, test_f1: 0.5459
 epoch: 70, train_loss: 0.3221, test_loss: 2.4668, test_f1: 0.5316
 epoch: 71, train_loss: 0.3343, test_loss: 2.5752, test_f1: 0.5194
 epoch: 72, train_loss: 0.3177, test_loss: 2.4912, test_f1: 0.5407
 epoch: 73, train_loss: 0.3117, test_loss: 2.2935, test_f1: 0.5857
 epoch: 74, train_loss: 0.3160, test_loss: 2.4635, test_f1: 0.5480
 epoch: 75, train_loss: 0.3162, test_loss: 2.7371, test_f1: 0.5323
 epoch: 76, train_loss: 0.3424, test_loss: 2.7560, test_f1: 0.5451
 epoch: 77, train_loss: 0.3069, test_loss: 2.7732, test_f1: 0.5177
 epoch: 78, train_loss: 0.3076, test_loss: 2.9546, test_f1: 0.5234
 epoch: 79, train_loss: 0.2912, test_loss: 2.6629, test_f1: 0.5499
 epoch: 80, train_loss: 0.2780, test_loss: 2.4737, test_f1: 0.5949
 epoch: 81, train_loss: 0.2840, test_loss: 2.6654, test_f1: 0.5594
 epoch: 82, train_loss: 0.2820, test_loss: 3.0840, test_f1: 0.5276
 epoch: 83, train_loss: 0.2795, test_loss: 2.9515, test_f1: 0.5400
 epoch: 84, train_loss: 0.3234, test_loss: 3.0522, test_f1: 0.5630
 epoch: 85, train_loss: 0.3160, test_loss: 2.7722, test_f1: 0.5419
 epoch: 86, train_loss: 0.3254, test_loss: 2.9687, test_f1: 0.5285
 epoch: 87, train_loss: 0.3064, test_loss: 3.1018, test_f1: 0.5395
 epoch: 88, train_loss: 0.2898, test_loss: 3.0358, test_f1: 0.5285
 epoch: 89, train_loss: 0.3058, test_loss: 2.6241, test_f1: 0.5660
 epoch: 90, train_loss: 0.2645, test_loss: 2.8016, test_f1: 0.5789
 epoch: 91, train_loss: 0.2606, test_loss: 3.1436, test_f1: 0.5673
 epoch: 92, train_loss: 0.2630, test_loss: 2.8177, test_f1: 0.5540
 epoch: 93, train_loss: 0.2660, test_loss: 2.7160, test_f1: 0.5471
 epoch: 94, train_loss: 0.2589, test_loss: 2.7267, test_f1: 0.5323
 epoch: 95, train_loss: 0.2460, test_loss: 2.7074, test_f1: 0.5646
 epoch: 96, train_loss: 0.2711, test_loss: 2.6240, test_f1: 0.5734
 epoch: 97, train_loss: 0.2831, test_loss: 2.8770, test_f1: 0.5447
 epoch: 98, train_loss: 0.3296, test_loss: 3.1763, test_f1: 0.5419
 epoch: 99, train_loss: 0.2737, test_loss: 3.4080, test_f1: 0.5177
##################ITERATION #2 ****************************************
 epoch: 0, train_loss: 1.2443, test_loss: 1.3669, test_f1: 0.1365
 epoch: 1, train_loss: 1.1014, test_loss: 1.3122, test_f1: 0.1478
 epoch: 2, train_loss: 1.0483, test_loss: 1.2559, test_f1: 0.3637
 epoch: 3, train_loss: 1.0019, test_loss: 1.2174, test_f1: 0.4402
 epoch: 4, train_loss: 0.9712, test_loss: 1.2319, test_f1: 0.4802
 epoch: 5, train_loss: 0.9220, test_loss: 1.2437, test_f1: 0.4802
 epoch: 6, train_loss: 0.9202, test_loss: 1.2050, test_f1: 0.4885
 epoch: 7, train_loss: 0.8701, test_loss: 1.1968, test_f1: 0.5676
 epoch: 8, train_loss: 0.8476, test_loss: 1.2887, test_f1: 0.4531
 epoch: 9, train_loss: 0.8091, test_loss: 1.2735, test_f1: 0.4475
 epoch: 10, train_loss: 0.8027, test_loss: 1.3784, test_f1: 0.4628
 epoch: 11, train_loss: 0.7658, test_loss: 1.4463, test_f1: 0.4848
 epoch: 12, train_loss: 0.7424, test_loss: 1.4066, test_f1: 0.5794
 epoch: 13, train_loss: 0.7520, test_loss: 1.4883, test_f1: 0.5539
 epoch: 14, train_loss: 0.7581, test_loss: 1.5058, test_f1: 0.4768
 epoch: 15, train_loss: 0.7463, test_loss: 1.4252, test_f1: 0.5538
 epoch: 16, train_loss: 0.7332, test_loss: 1.4667, test_f1: 0.5239
 epoch: 17, train_loss: 0.7467, test_loss: 1.4882, test_f1: 0.5740
 epoch: 18, train_loss: 0.7458, test_loss: 1.4637, test_f1: 0.5350
 epoch: 19, train_loss: 0.7543, test_loss: 1.5763, test_f1: 0.5304
 epoch: 20, train_loss: 0.7533, test_loss: 1.5053, test_f1: 0.5414
 epoch: 21, train_loss: 0.7112, test_loss: 1.6059, test_f1: 0.5118
 epoch: 22, train_loss: 0.6909, test_loss: 1.4769, test_f1: 0.5100
 epoch: 23, train_loss: 0.6425, test_loss: 1.5639, test_f1: 0.4993
 epoch: 24, train_loss: 0.6427, test_loss: 1.6190, test_f1: 0.5353
 epoch: 25, train_loss: 0.6220, test_loss: 1.7331, test_f1: 0.5062
 epoch: 26, train_loss: 0.6197, test_loss: 1.6607, test_f1: 0.5136
 epoch: 27, train_loss: 0.6750, test_loss: 1.8577, test_f1: 0.4795
 epoch: 28, train_loss: 0.6400, test_loss: 1.9445, test_f1: 0.4985
 epoch: 29, train_loss: 0.6265, test_loss: 1.6016, test_f1: 0.5645
 epoch: 30, train_loss: 0.6013, test_loss: 1.5572, test_f1: 0.5510
 epoch: 31, train_loss: 0.5924, test_loss: 1.5904, test_f1: 0.5377
 epoch: 32, train_loss: 0.6567, test_loss: 1.6408, test_f1: 0.5442
 epoch: 33, train_loss: 0.5908, test_loss: 1.4938, test_f1: 0.5318
 epoch: 34, train_loss: 0.6016, test_loss: 1.7538, test_f1: 0.4691
 epoch: 35, train_loss: 0.5535, test_loss: 1.8363, test_f1: 0.5577
 epoch: 36, train_loss: 0.5755, test_loss: 1.9842, test_f1: 0.5352
 epoch: 37, train_loss: 0.5759, test_loss: 2.1930, test_f1: 0.5389
 epoch: 38, train_loss: 0.5370, test_loss: 1.9926, test_f1: 0.5192
 epoch: 39, train_loss: 0.4990, test_loss: 2.2810, test_f1: 0.5390
 epoch: 40, train_loss: 0.5052, test_loss: 1.9409, test_f1: 0.5406
 epoch: 41, train_loss: 0.4993, test_loss: 2.8003, test_f1: 0.5508
 epoch: 42, train_loss: 0.5631, test_loss: 2.6277, test_f1: 0.5233
 epoch: 43, train_loss: 0.5477, test_loss: 2.2191, test_f1: 0.5050
 epoch: 44, train_loss: 0.5798, test_loss: 2.3672, test_f1: 0.4816
 epoch: 45, train_loss: 0.5577, test_loss: 2.4435, test_f1: 0.4798
 epoch: 46, train_loss: 0.5514, test_loss: 2.1290, test_f1: 0.4985
 epoch: 47, train_loss: 0.5182, test_loss: 1.9456, test_f1: 0.4623
 epoch: 48, train_loss: 0.4861, test_loss: 2.1076, test_f1: 0.4996
 epoch: 49, train_loss: 0.4531, test_loss: 2.1586, test_f1: 0.4878
 epoch: 50, train_loss: 0.4506, test_loss: 2.4355, test_f1: 0.4838
 epoch: 51, train_loss: 0.4190, test_loss: 2.3799, test_f1: 0.5121
 epoch: 52, train_loss: 0.4010, test_loss: 2.3282, test_f1: 0.5380
 epoch: 53, train_loss: 0.4014, test_loss: 2.0962, test_f1: 0.5392
 epoch: 54, train_loss: 0.3907, test_loss: 1.9263, test_f1: 0.5372
 epoch: 55, train_loss: 0.3995, test_loss: 2.0530, test_f1: 0.5081
 epoch: 56, train_loss: 0.4092, test_loss: 2.5707, test_f1: 0.4687
 epoch: 57, train_loss: 0.4120, test_loss: 2.4533, test_f1: 0.5208
 epoch: 58, train_loss: 0.3754, test_loss: 2.2021, test_f1: 0.5260
 epoch: 59, train_loss: 0.3775, test_loss: 2.1641, test_f1: 0.5268
 epoch: 60, train_loss: 0.3901, test_loss: 2.2781, test_f1: 0.5229
 epoch: 61, train_loss: 0.3664, test_loss: 2.1751, test_f1: 0.5220
 epoch: 62, train_loss: 0.3385, test_loss: 2.1335, test_f1: 0.5246
 epoch: 63, train_loss: 0.3363, test_loss: 2.2171, test_f1: 0.5358
 epoch: 64, train_loss: 0.3607, test_loss: 2.4478, test_f1: 0.5460
 epoch: 65, train_loss: 0.3366, test_loss: 2.2274, test_f1: 0.5302
 epoch: 66, train_loss: 0.3318, test_loss: 2.2226, test_f1: 0.5450
 epoch: 67, train_loss: 0.3192, test_loss: 2.2820, test_f1: 0.5506
 epoch: 68, train_loss: 0.3577, test_loss: 2.2956, test_f1: 0.5639
 epoch: 69, train_loss: 0.3535, test_loss: 2.1616, test_f1: 0.5799
 epoch: 70, train_loss: 0.3305, test_loss: 2.1509, test_f1: 0.5599
 epoch: 71, train_loss: 0.3111, test_loss: 2.2825, test_f1: 0.5349
 epoch: 72, train_loss: 0.3552, test_loss: 2.4229, test_f1: 0.5145
 epoch: 73, train_loss: 0.3469, test_loss: 2.6959, test_f1: 0.5506
 epoch: 74, train_loss: 0.3309, test_loss: 2.6121, test_f1: 0.5832
 epoch: 75, train_loss: 0.3139, test_loss: 2.3771, test_f1: 0.5972
 epoch: 76, train_loss: 0.3232, test_loss: 2.4474, test_f1: 0.5728
 epoch: 77, train_loss: 0.3035, test_loss: 2.6422, test_f1: 0.5311
 epoch: 78, train_loss: 0.3256, test_loss: 2.5874, test_f1: 0.5215
 epoch: 79, train_loss: 0.3457, test_loss: 2.6482, test_f1: 0.5116
 epoch: 80, train_loss: 0.3325, test_loss: 2.7497, test_f1: 0.5255
 epoch: 81, train_loss: 0.3310, test_loss: 2.8973, test_f1: 0.5484
 epoch: 82, train_loss: 0.3319, test_loss: 2.7209, test_f1: 0.5695
 epoch: 83, train_loss: 0.3198, test_loss: 2.5316, test_f1: 0.5566
 epoch: 84, train_loss: 0.3098, test_loss: 2.6612, test_f1: 0.5642
 epoch: 85, train_loss: 0.3155, test_loss: 2.7281, test_f1: 0.5126
 epoch: 86, train_loss: 0.3193, test_loss: 3.0381, test_f1: 0.5220
 epoch: 87, train_loss: 0.3164, test_loss: 3.3524, test_f1: 0.5266
 epoch: 88, train_loss: 0.3292, test_loss: 3.0299, test_f1: 0.5529
 epoch: 89, train_loss: 0.3099, test_loss: 2.6838, test_f1: 0.5653
 epoch: 90, train_loss: 0.2974, test_loss: 2.7747, test_f1: 0.5568
 epoch: 91, train_loss: 0.2947, test_loss: 2.8868, test_f1: 0.5375
 epoch: 92, train_loss: 0.2999, test_loss: 2.7553, test_f1: 0.5387
 epoch: 93, train_loss: 0.3034, test_loss: 2.9011, test_f1: 0.5546
 epoch: 94, train_loss: 0.2844, test_loss: 3.0417, test_f1: 0.5327
 epoch: 95, train_loss: 0.2805, test_loss: 3.2967, test_f1: 0.5145
 epoch: 96, train_loss: 0.3041, test_loss: 3.1863, test_f1: 0.5613
 epoch: 97, train_loss: 0.3047, test_loss: 2.9732, test_f1: 0.5661
 epoch: 98, train_loss: 0.2645, test_loss: 2.8026, test_f1: 0.5420
 epoch: 99, train_loss: 0.2723, test_loss: 2.7489, test_f1: 0.5356
##################ITERATION #3 ****************************************
 epoch: 0, train_loss: 1.2128, test_loss: 1.3271, test_f1: 0.1365
 epoch: 1, train_loss: 1.0714, test_loss: 1.3061, test_f1: 0.1474
 epoch: 2, train_loss: 1.0331, test_loss: 1.2468, test_f1: 0.2084
 epoch: 3, train_loss: 0.9829, test_loss: 1.2083, test_f1: 0.3409
 epoch: 4, train_loss: 0.9428, test_loss: 1.1896, test_f1: 0.5089
 epoch: 5, train_loss: 0.9114, test_loss: 1.1920, test_f1: 0.5295
 epoch: 6, train_loss: 0.9065, test_loss: 1.1040, test_f1: 0.5451
 epoch: 7, train_loss: 0.8733, test_loss: 1.1297, test_f1: 0.4466
 epoch: 8, train_loss: 0.8620, test_loss: 1.1175, test_f1: 0.5350
 epoch: 9, train_loss: 0.8248, test_loss: 1.1786, test_f1: 0.4882
 epoch: 10, train_loss: 0.7909, test_loss: 1.1174, test_f1: 0.5549
 epoch: 11, train_loss: 0.7940, test_loss: 1.1505, test_f1: 0.5474
 epoch: 12, train_loss: 0.8040, test_loss: 1.1793, test_f1: 0.5660
 epoch: 13, train_loss: 0.7753, test_loss: 1.2774, test_f1: 0.5621
 epoch: 14, train_loss: 0.7519, test_loss: 1.2407, test_f1: 0.5625
 epoch: 15, train_loss: 0.7382, test_loss: 1.2690, test_f1: 0.5829
 epoch: 16, train_loss: 0.7678, test_loss: 1.3992, test_f1: 0.5374
 epoch: 17, train_loss: 0.8014, test_loss: 1.4514, test_f1: 0.5057
 epoch: 18, train_loss: 0.7568, test_loss: 1.2722, test_f1: 0.5702
 epoch: 19, train_loss: 0.7859, test_loss: 1.4140, test_f1: 0.5121
 epoch: 20, train_loss: 0.7411, test_loss: 1.2824, test_f1: 0.5761
 epoch: 21, train_loss: 0.6820, test_loss: 1.2309, test_f1: 0.5321
 epoch: 22, train_loss: 0.6571, test_loss: 1.3574, test_f1: 0.5243
 epoch: 23, train_loss: 0.6685, test_loss: 1.4200, test_f1: 0.5377
 epoch: 24, train_loss: 0.6499, test_loss: 1.3306, test_f1: 0.5584
 epoch: 25, train_loss: 0.6417, test_loss: 1.3730, test_f1: 0.5555
 epoch: 26, train_loss: 0.6529, test_loss: 1.4181, test_f1: 0.5734
 epoch: 27, train_loss: 0.6197, test_loss: 1.4956, test_f1: 0.4969
 epoch: 28, train_loss: 0.6213, test_loss: 1.4953, test_f1: 0.4845
 epoch: 29, train_loss: 0.6246, test_loss: 1.6270, test_f1: 0.5047
 epoch: 30, train_loss: 0.5975, test_loss: 1.6919, test_f1: 0.4818
 epoch: 31, train_loss: 0.6201, test_loss: 1.5558, test_f1: 0.4549
 epoch: 32, train_loss: 0.6012, test_loss: 1.4618, test_f1: 0.5104
 epoch: 33, train_loss: 0.5688, test_loss: 1.4504, test_f1: 0.5635
 epoch: 34, train_loss: 0.5844, test_loss: 1.4782, test_f1: 0.5539
 epoch: 35, train_loss: 0.5747, test_loss: 1.5208, test_f1: 0.5558
 epoch: 36, train_loss: 0.5433, test_loss: 1.4983, test_f1: 0.5337
 epoch: 37, train_loss: 0.5194, test_loss: 1.5579, test_f1: 0.5468
 epoch: 38, train_loss: 0.5369, test_loss: 1.6669, test_f1: 0.5541
 epoch: 39, train_loss: 0.5529, test_loss: 1.6540, test_f1: 0.5771
 epoch: 40, train_loss: 0.5813, test_loss: 1.6312, test_f1: 0.5182
 epoch: 41, train_loss: 0.5790, test_loss: 1.5894, test_f1: 0.5795
 epoch: 42, train_loss: 0.5526, test_loss: 1.9294, test_f1: 0.5292
 epoch: 43, train_loss: 0.5266, test_loss: 2.5654, test_f1: 0.5240
 epoch: 44, train_loss: 0.5071, test_loss: 2.5227, test_f1: 0.5427
 epoch: 45, train_loss: 0.4854, test_loss: 2.3691, test_f1: 0.5314
 epoch: 46, train_loss: 0.5199, test_loss: 2.4004, test_f1: 0.5668
 epoch: 47, train_loss: 0.4978, test_loss: 1.6417, test_f1: 0.5376
 epoch: 48, train_loss: 0.5241, test_loss: 1.8192, test_f1: 0.5337
 epoch: 49, train_loss: 0.4875, test_loss: 1.8800, test_f1: 0.5566
 epoch: 50, train_loss: 0.5006, test_loss: 2.0039, test_f1: 0.5629
 epoch: 51, train_loss: 0.4690, test_loss: 1.8050, test_f1: 0.5879
 epoch: 52, train_loss: 0.4370, test_loss: 1.7526, test_f1: 0.5861
 epoch: 53, train_loss: 0.4330, test_loss: 1.8174, test_f1: 0.5808
 epoch: 54, train_loss: 0.3987, test_loss: 1.9950, test_f1: 0.5479
 epoch: 55, train_loss: 0.3996, test_loss: 2.1417, test_f1: 0.5498
 epoch: 56, train_loss: 0.3995, test_loss: 2.0819, test_f1: 0.5625
 epoch: 57, train_loss: 0.3701, test_loss: 2.0886, test_f1: 0.5539
 epoch: 58, train_loss: 0.3690, test_loss: 1.9734, test_f1: 0.5507
 epoch: 59, train_loss: 0.3766, test_loss: 1.9673, test_f1: 0.5570
 epoch: 60, train_loss: 0.3464, test_loss: 1.9797, test_f1: 0.5719
 epoch: 61, train_loss: 0.3534, test_loss: 2.1213, test_f1: 0.5696
 epoch: 62, train_loss: 0.3335, test_loss: 2.2249, test_f1: 0.5454
 epoch: 63, train_loss: 0.3885, test_loss: 2.1577, test_f1: 0.5619
 epoch: 64, train_loss: 0.3712, test_loss: 2.0546, test_f1: 0.5649
 epoch: 65, train_loss: 0.3757, test_loss: 2.2393, test_f1: 0.5422
 epoch: 66, train_loss: 0.3780, test_loss: 2.1814, test_f1: 0.5254
 epoch: 67, train_loss: 0.3507, test_loss: 1.9672, test_f1: 0.5690
 epoch: 68, train_loss: 0.3527, test_loss: 2.0127, test_f1: 0.5432
 epoch: 69, train_loss: 0.3366, test_loss: 2.2674, test_f1: 0.5303
 epoch: 70, train_loss: 0.3188, test_loss: 2.0499, test_f1: 0.5796
 epoch: 71, train_loss: 0.3358, test_loss: 1.8326, test_f1: 0.6153
 epoch: 72, train_loss: 0.3224, test_loss: 1.8638, test_f1: 0.6171
 epoch: 73, train_loss: 0.3623, test_loss: 2.0942, test_f1: 0.5940
 epoch: 74, train_loss: 0.3821, test_loss: 2.0400, test_f1: 0.6003
 epoch: 75, train_loss: 0.3650, test_loss: 1.9294, test_f1: 0.5897
 epoch: 76, train_loss: 0.3480, test_loss: 1.9630, test_f1: 0.5586
 epoch: 77, train_loss: 0.3488, test_loss: 2.1368, test_f1: 0.5685
 epoch: 78, train_loss: 0.3428, test_loss: 2.2682, test_f1: 0.5616
 epoch: 79, train_loss: 0.3296, test_loss: 2.1386, test_f1: 0.5648
 epoch: 80, train_loss: 0.3535, test_loss: 1.9972, test_f1: 0.5765
 epoch: 81, train_loss: 0.3293, test_loss: 2.1977, test_f1: 0.5867
 epoch: 82, train_loss: 0.3340, test_loss: 2.2275, test_f1: 0.5750
 epoch: 83, train_loss: 0.2996, test_loss: 2.0166, test_f1: 0.5883
 epoch: 84, train_loss: 0.2909, test_loss: 2.1798, test_f1: 0.5532
 epoch: 85, train_loss: 0.2878, test_loss: 2.2110, test_f1: 0.5890
 epoch: 86, train_loss: 0.2864, test_loss: 2.3874, test_f1: 0.5687
 epoch: 87, train_loss: 0.2944, test_loss: 2.3009, test_f1: 0.5650
 epoch: 88, train_loss: 0.3123, test_loss: 2.3369, test_f1: 0.5719
 epoch: 89, train_loss: 0.3331, test_loss: 2.4102, test_f1: 0.5430
 epoch: 90, train_loss: 0.3557, test_loss: 2.0090, test_f1: 0.5782
 epoch: 91, train_loss: 0.3048, test_loss: 2.1009, test_f1: 0.5190
 epoch: 92, train_loss: 0.3138, test_loss: 2.0271, test_f1: 0.5525
 epoch: 93, train_loss: 0.3326, test_loss: 2.0317, test_f1: 0.5722
 epoch: 94, train_loss: 0.3145, test_loss: 2.0977, test_f1: 0.5506
 epoch: 95, train_loss: 0.3276, test_loss: 1.9961, test_f1: 0.5840
 epoch: 96, train_loss: 0.3570, test_loss: 2.0972, test_f1: 0.5622
 epoch: 97, train_loss: 0.3682, test_loss: 2.0911, test_f1: 0.5587
 epoch: 98, train_loss: 0.3976, test_loss: 2.1113, test_f1: 0.5378
 epoch: 99, train_loss: 0.3737, test_loss: 1.8113, test_f1: 0.5889
##################ITERATION #4 ****************************************
 epoch: 0, train_loss: 1.2766, test_loss: 1.4378, test_f1: 0.1836
 epoch: 1, train_loss: 1.1289, test_loss: 1.3486, test_f1: 0.3084
 epoch: 2, train_loss: 1.0593, test_loss: 1.2592, test_f1: 0.3684
 epoch: 3, train_loss: 1.0279, test_loss: 1.2207, test_f1: 0.3246
 epoch: 4, train_loss: 0.9846, test_loss: 1.1512, test_f1: 0.4663
 epoch: 5, train_loss: 0.9444, test_loss: 1.1467, test_f1: 0.4293
 epoch: 6, train_loss: 0.9129, test_loss: 1.1290, test_f1: 0.5088
 epoch: 7, train_loss: 0.8790, test_loss: 1.1197, test_f1: 0.4916
 epoch: 8, train_loss: 0.8679, test_loss: 1.0938, test_f1: 0.5372
 epoch: 9, train_loss: 0.8287, test_loss: 1.2021, test_f1: 0.4966
 epoch: 10, train_loss: 0.8033, test_loss: 1.2754, test_f1: 0.4860
 epoch: 11, train_loss: 0.7991, test_loss: 1.1446, test_f1: 0.5603
 epoch: 12, train_loss: 0.7800, test_loss: 1.1384, test_f1: 0.5919
 epoch: 13, train_loss: 0.7980, test_loss: 1.2206, test_f1: 0.5775
 epoch: 14, train_loss: 0.7666, test_loss: 1.2995, test_f1: 0.5005
 epoch: 15, train_loss: 0.7445, test_loss: 1.2938, test_f1: 0.5101
 epoch: 16, train_loss: 0.7360, test_loss: 1.3564, test_f1: 0.5225
 epoch: 17, train_loss: 0.7141, test_loss: 1.3124, test_f1: 0.5749
 epoch: 18, train_loss: 0.7166, test_loss: 1.3482, test_f1: 0.5425
 epoch: 19, train_loss: 0.7116, test_loss: 1.5105, test_f1: 0.4794
 epoch: 20, train_loss: 0.7220, test_loss: 1.3227, test_f1: 0.5519
 epoch: 21, train_loss: 0.6880, test_loss: 1.5715, test_f1: 0.4167
 epoch: 22, train_loss: 0.7266, test_loss: 1.3746, test_f1: 0.5189
 epoch: 23, train_loss: 0.6960, test_loss: 1.5653, test_f1: 0.5126
 epoch: 24, train_loss: 0.6778, test_loss: 1.4009, test_f1: 0.5764
 epoch: 25, train_loss: 0.6435, test_loss: 1.4380, test_f1: 0.5822
 epoch: 26, train_loss: 0.6461, test_loss: 1.5926, test_f1: 0.5418
 epoch: 27, train_loss: 0.6279, test_loss: 1.3053, test_f1: 0.5557
 epoch: 28, train_loss: 0.6011, test_loss: 1.5060, test_f1: 0.5387
 epoch: 29, train_loss: 0.5838, test_loss: 1.7428, test_f1: 0.4999
 epoch: 30, train_loss: 0.5708, test_loss: 1.6695, test_f1: 0.5115
 epoch: 31, train_loss: 0.5750, test_loss: 1.7687, test_f1: 0.5103
 epoch: 32, train_loss: 0.5741, test_loss: 1.5366, test_f1: 0.5507
 epoch: 33, train_loss: 0.5975, test_loss: 1.7006, test_f1: 0.5468
 epoch: 34, train_loss: 0.5701, test_loss: 1.6230, test_f1: 0.5544
 epoch: 35, train_loss: 0.5984, test_loss: 1.6311, test_f1: 0.5467
 epoch: 36, train_loss: 0.5898, test_loss: 1.5506, test_f1: 0.5623
 epoch: 37, train_loss: 0.5674, test_loss: 2.0161, test_f1: 0.4533
 epoch: 38, train_loss: 0.5762, test_loss: 1.6236, test_f1: 0.5929
 epoch: 39, train_loss: 0.5555, test_loss: 1.7545, test_f1: 0.5522
 epoch: 40, train_loss: 0.5886, test_loss: 1.5951, test_f1: 0.5469
 epoch: 41, train_loss: 0.5637, test_loss: 1.8209, test_f1: 0.5196
 epoch: 42, train_loss: 0.6161, test_loss: 2.2031, test_f1: 0.4887
 epoch: 43, train_loss: 0.6013, test_loss: 2.3119, test_f1: 0.4462
 epoch: 44, train_loss: 0.6470, test_loss: 1.8998, test_f1: 0.4883
 epoch: 45, train_loss: 0.6585, test_loss: 1.7045, test_f1: 0.4951
 epoch: 46, train_loss: 0.5770, test_loss: 1.7910, test_f1: 0.4983
 epoch: 47, train_loss: 0.5509, test_loss: 2.1463, test_f1: 0.5602
 epoch: 48, train_loss: 0.5152, test_loss: 1.6706, test_f1: 0.4871
 epoch: 49, train_loss: 0.5313, test_loss: 1.7115, test_f1: 0.5604
 epoch: 50, train_loss: 0.5077, test_loss: 1.7064, test_f1: 0.5371
 epoch: 51, train_loss: 0.4959, test_loss: 1.8011, test_f1: 0.5158
 epoch: 52, train_loss: 0.4672, test_loss: 1.8277, test_f1: 0.5450
 epoch: 53, train_loss: 0.4322, test_loss: 1.8886, test_f1: 0.5760
 epoch: 54, train_loss: 0.4415, test_loss: 1.9602, test_f1: 0.5579
 epoch: 55, train_loss: 0.4297, test_loss: 1.9215, test_f1: 0.5512
 epoch: 56, train_loss: 0.4345, test_loss: 1.7712, test_f1: 0.5881
 epoch: 57, train_loss: 0.4296, test_loss: 2.0518, test_f1: 0.5587
 epoch: 58, train_loss: 0.4326, test_loss: 2.0342, test_f1: 0.5358
 epoch: 59, train_loss: 0.4145, test_loss: 1.9931, test_f1: 0.5230
 epoch: 60, train_loss: 0.3925, test_loss: 1.9479, test_f1: 0.5541
 epoch: 61, train_loss: 0.3922, test_loss: 1.9359, test_f1: 0.5455
 epoch: 62, train_loss: 0.3879, test_loss: 1.8610, test_f1: 0.5767
 epoch: 63, train_loss: 0.3968, test_loss: 2.1394, test_f1: 0.5508
 epoch: 64, train_loss: 0.3955, test_loss: 1.9919, test_f1: 0.5572
 epoch: 65, train_loss: 0.3944, test_loss: 1.8227, test_f1: 0.5968
 epoch: 66, train_loss: 0.3952, test_loss: 1.8532, test_f1: 0.5620
 epoch: 67, train_loss: 0.3826, test_loss: 1.8738, test_f1: 0.5667
 epoch: 68, train_loss: 0.3988, test_loss: 2.0871, test_f1: 0.5183
 epoch: 69, train_loss: 0.3578, test_loss: 2.2542, test_f1: 0.5499
 epoch: 70, train_loss: 0.3474, test_loss: 2.2999, test_f1: 0.5459
 epoch: 71, train_loss: 0.3628, test_loss: 2.3871, test_f1: 0.5382
 epoch: 72, train_loss: 0.3794, test_loss: 2.2683, test_f1: 0.5588
 epoch: 73, train_loss: 0.3666, test_loss: 2.3699, test_f1: 0.5553
 epoch: 74, train_loss: 0.3503, test_loss: 2.2326, test_f1: 0.5593
 epoch: 75, train_loss: 0.3652, test_loss: 2.1298, test_f1: 0.5361
 epoch: 76, train_loss: 0.3612, test_loss: 2.2690, test_f1: 0.5362
 epoch: 77, train_loss: 0.3604, test_loss: 2.5701, test_f1: 0.5005
 epoch: 78, train_loss: 0.3363, test_loss: 2.4856, test_f1: 0.5328
 epoch: 79, train_loss: 0.3344, test_loss: 2.2083, test_f1: 0.5500
 epoch: 80, train_loss: 0.3834, test_loss: 2.0353, test_f1: 0.5539
 epoch: 81, train_loss: 0.4255, test_loss: 2.1964, test_f1: 0.5405
 epoch: 82, train_loss: 0.4341, test_loss: 2.4699, test_f1: 0.5439
 epoch: 83, train_loss: 0.4195, test_loss: 2.2054, test_f1: 0.5846
 epoch: 84, train_loss: 0.3894, test_loss: 2.2526, test_f1: 0.5533
 epoch: 85, train_loss: 0.3579, test_loss: 2.3664, test_f1: 0.5448
 epoch: 86, train_loss: 0.3434, test_loss: 2.3815, test_f1: 0.5621
 epoch: 87, train_loss: 0.3227, test_loss: 2.2930, test_f1: 0.5825
 epoch: 88, train_loss: 0.3224, test_loss: 2.2747, test_f1: 0.5754
 epoch: 89, train_loss: 0.2978, test_loss: 2.2945, test_f1: 0.5848
 epoch: 90, train_loss: 0.3032, test_loss: 2.2966, test_f1: 0.5758
 epoch: 91, train_loss: 0.3067, test_loss: 2.3023, test_f1: 0.5473
 epoch: 92, train_loss: 0.3211, test_loss: 2.3687, test_f1: 0.5723
 epoch: 93, train_loss: 0.3099, test_loss: 2.5721, test_f1: 0.5464
 epoch: 94, train_loss: 0.2950, test_loss: 2.6841, test_f1: 0.5645
 epoch: 95, train_loss: 0.2977, test_loss: 2.7895, test_f1: 0.5592
 epoch: 96, train_loss: 0.2896, test_loss: 2.7637, test_f1: 0.5854
 epoch: 97, train_loss: 0.2780, test_loss: 2.6926, test_f1: 0.5726
 epoch: 98, train_loss: 0.2951, test_loss: 2.4904, test_f1: 0.5575
 epoch: 99, train_loss: 0.3103, test_loss: 2.4212, test_f1: 0.5796
##################ITERATION #5 ****************************************
 epoch: 0, train_loss: 1.2592, test_loss: 1.3791, test_f1: 0.1365
 epoch: 1, train_loss: 1.1281, test_loss: 1.3133, test_f1: 0.1457
 epoch: 2, train_loss: 1.0565, test_loss: 1.3058, test_f1: 0.1745
 epoch: 3, train_loss: 1.0161, test_loss: 1.2653, test_f1: 0.2529
 epoch: 4, train_loss: 0.9723, test_loss: 1.1872, test_f1: 0.3990
 epoch: 5, train_loss: 0.9314, test_loss: 1.1870, test_f1: 0.5127
 epoch: 6, train_loss: 0.9294, test_loss: 1.2129, test_f1: 0.4652
 epoch: 7, train_loss: 0.8915, test_loss: 1.2170, test_f1: 0.4409
 epoch: 8, train_loss: 0.8607, test_loss: 1.1881, test_f1: 0.5162
 epoch: 9, train_loss: 0.8396, test_loss: 1.2766, test_f1: 0.4860
 epoch: 10, train_loss: 0.8083, test_loss: 1.3852, test_f1: 0.4961
 epoch: 11, train_loss: 0.8013, test_loss: 1.2311, test_f1: 0.5529
 epoch: 12, train_loss: 0.8266, test_loss: 1.3008, test_f1: 0.5708
 epoch: 13, train_loss: 0.8291, test_loss: 1.4233, test_f1: 0.4852
 epoch: 14, train_loss: 0.8522, test_loss: 1.3667, test_f1: 0.5285
 epoch: 15, train_loss: 0.8194, test_loss: 1.2962, test_f1: 0.5270
 epoch: 16, train_loss: 0.7687, test_loss: 1.3725, test_f1: 0.4975
 epoch: 17, train_loss: 0.7715, test_loss: 1.3208, test_f1: 0.4794
 epoch: 18, train_loss: 0.7388, test_loss: 1.3063, test_f1: 0.5324
 epoch: 19, train_loss: 0.7113, test_loss: 1.4460, test_f1: 0.4994
 epoch: 20, train_loss: 0.7236, test_loss: 1.2382, test_f1: 0.5688
 epoch: 21, train_loss: 0.6942, test_loss: 1.3257, test_f1: 0.4820
 epoch: 22, train_loss: 0.6801, test_loss: 1.3732, test_f1: 0.5338
 epoch: 23, train_loss: 0.7107, test_loss: 1.3435, test_f1: 0.5200
 epoch: 24, train_loss: 0.6680, test_loss: 1.2374, test_f1: 0.5656
 epoch: 25, train_loss: 0.6757, test_loss: 1.3253, test_f1: 0.4926
 epoch: 26, train_loss: 0.6498, test_loss: 1.4552, test_f1: 0.5447
 epoch: 27, train_loss: 0.6517, test_loss: 1.6045, test_f1: 0.5230
 epoch: 28, train_loss: 0.6319, test_loss: 1.6190, test_f1: 0.5090
 epoch: 29, train_loss: 0.6039, test_loss: 1.5017, test_f1: 0.5417
 epoch: 30, train_loss: 0.6405, test_loss: 1.6379, test_f1: 0.5661
 epoch: 31, train_loss: 0.7016, test_loss: 1.6796, test_f1: 0.5382
 epoch: 32, train_loss: 0.6543, test_loss: 1.5297, test_f1: 0.5737
 epoch: 33, train_loss: 0.6584, test_loss: 1.4502, test_f1: 0.5719
 epoch: 34, train_loss: 0.6464, test_loss: 1.6503, test_f1: 0.5173
 epoch: 35, train_loss: 0.6260, test_loss: 1.6797, test_f1: 0.5189
 epoch: 36, train_loss: 0.5746, test_loss: 1.4909, test_f1: 0.5178
 epoch: 37, train_loss: 0.5797, test_loss: 1.5795, test_f1: 0.5012
 epoch: 38, train_loss: 0.5646, test_loss: 1.6985, test_f1: 0.4921
 epoch: 39, train_loss: 0.6061, test_loss: 1.6654, test_f1: 0.5149
 epoch: 40, train_loss: 0.5901, test_loss: 1.4277, test_f1: 0.5567
 epoch: 41, train_loss: 0.6231, test_loss: 1.5998, test_f1: 0.5264
 epoch: 42, train_loss: 0.5922, test_loss: 1.3998, test_f1: 0.5608
 epoch: 43, train_loss: 0.6002, test_loss: 1.4932, test_f1: 0.5543
 epoch: 44, train_loss: 0.5796, test_loss: 1.4890, test_f1: 0.5437
 epoch: 45, train_loss: 0.5781, test_loss: 1.5049, test_f1: 0.5226
 epoch: 46, train_loss: 0.5767, test_loss: 1.7552, test_f1: 0.5040
 epoch: 47, train_loss: 0.5268, test_loss: 1.6322, test_f1: 0.4954
 epoch: 48, train_loss: 0.5289, test_loss: 1.5598, test_f1: 0.5013
 epoch: 49, train_loss: 0.5378, test_loss: 1.4365, test_f1: 0.5209
 epoch: 50, train_loss: 0.5263, test_loss: 1.4756, test_f1: 0.5090
 epoch: 51, train_loss: 0.5161, test_loss: 1.5715, test_f1: 0.5135
 epoch: 52, train_loss: 0.4984, test_loss: 1.6202, test_f1: 0.5707
 epoch: 53, train_loss: 0.4801, test_loss: 1.6664, test_f1: 0.5283
 epoch: 54, train_loss: 0.4917, test_loss: 1.6230, test_f1: 0.5127
 epoch: 55, train_loss: 0.4490, test_loss: 1.6146, test_f1: 0.5267
 epoch: 56, train_loss: 0.4532, test_loss: 1.6603, test_f1: 0.5054
 epoch: 57, train_loss: 0.4315, test_loss: 1.8696, test_f1: 0.5009
 epoch: 58, train_loss: 0.4357, test_loss: 1.7212, test_f1: 0.5685
 epoch: 59, train_loss: 0.4262, test_loss: 1.6856, test_f1: 0.5572
 epoch: 60, train_loss: 0.4334, test_loss: 1.6477, test_f1: 0.5580
 epoch: 61, train_loss: 0.4264, test_loss: 1.6269, test_f1: 0.5927
 epoch: 62, train_loss: 0.4141, test_loss: 1.7054, test_f1: 0.5623
 epoch: 63, train_loss: 0.3917, test_loss: 1.7494, test_f1: 0.5518
 epoch: 64, train_loss: 0.3994, test_loss: 1.7560, test_f1: 0.5339
 epoch: 65, train_loss: 0.3772, test_loss: 1.6629, test_f1: 0.5983
 epoch: 66, train_loss: 0.3734, test_loss: 1.7131, test_f1: 0.5642
 epoch: 67, train_loss: 0.3924, test_loss: 1.6567, test_f1: 0.5317
 epoch: 68, train_loss: 0.3843, test_loss: 1.7546, test_f1: 0.5140
 epoch: 69, train_loss: 0.3871, test_loss: 1.8100, test_f1: 0.5339
 epoch: 70, train_loss: 0.3825, test_loss: 1.7222, test_f1: 0.5460
 epoch: 71, train_loss: 0.3433, test_loss: 1.9144, test_f1: 0.5582
 epoch: 72, train_loss: 0.3361, test_loss: 1.9228, test_f1: 0.5334
 epoch: 73, train_loss: 0.3311, test_loss: 1.9261, test_f1: 0.5349
 epoch: 74, train_loss: 0.3392, test_loss: 1.9906, test_f1: 0.5415
 epoch: 75, train_loss: 0.3343, test_loss: 1.8982, test_f1: 0.5632
 epoch: 76, train_loss: 0.3301, test_loss: 1.9825, test_f1: 0.5269
 epoch: 77, train_loss: 0.3436, test_loss: 2.0459, test_f1: 0.5224
 epoch: 78, train_loss: 0.3360, test_loss: 2.0268, test_f1: 0.5699
 epoch: 79, train_loss: 0.3431, test_loss: 2.2449, test_f1: 0.5523
 epoch: 80, train_loss: 0.3718, test_loss: 2.4766, test_f1: 0.5184
 epoch: 81, train_loss: 0.3890, test_loss: 2.2520, test_f1: 0.5348
 epoch: 82, train_loss: 0.4181, test_loss: 2.0630, test_f1: 0.5279
 epoch: 83, train_loss: 0.4402, test_loss: 1.9158, test_f1: 0.5391
 epoch: 84, train_loss: 0.4070, test_loss: 1.9545, test_f1: 0.5658
 epoch: 85, train_loss: 0.3550, test_loss: 2.0016, test_f1: 0.5688
 epoch: 86, train_loss: 0.3556, test_loss: 2.0342, test_f1: 0.5527
 epoch: 87, train_loss: 0.3633, test_loss: 1.9310, test_f1: 0.5553
 epoch: 88, train_loss: 0.3536, test_loss: 1.8708, test_f1: 0.5504
 epoch: 89, train_loss: 0.3736, test_loss: 2.1130, test_f1: 0.5442
 epoch: 90, train_loss: 0.3847, test_loss: 2.2810, test_f1: 0.5218
 epoch: 91, train_loss: 0.3821, test_loss: 2.4737, test_f1: 0.5441
 epoch: 92, train_loss: 0.3864, test_loss: 2.6561, test_f1: 0.4975
 epoch: 93, train_loss: 0.3800, test_loss: 2.4385, test_f1: 0.5354
 epoch: 94, train_loss: 0.3522, test_loss: 2.0993, test_f1: 0.5536
 epoch: 95, train_loss: 0.3413, test_loss: 2.1640, test_f1: 0.5407
 epoch: 96, train_loss: 0.3398, test_loss: 2.0931, test_f1: 0.5674
 epoch: 97, train_loss: 0.3250, test_loss: 2.3464, test_f1: 0.5511
 epoch: 98, train_loss: 0.3067, test_loss: 2.3273, test_f1: 0.5441
 epoch: 99, train_loss: 0.3006, test_loss: 2.5046, test_f1: 0.5648
##################ITERATION #6 ****************************************
 epoch: 0, train_loss: 1.2657, test_loss: 1.3391, test_f1: 0.1365
 epoch: 1, train_loss: 1.1350, test_loss: 1.3143, test_f1: 0.2378
 epoch: 2, train_loss: 1.0756, test_loss: 1.2986, test_f1: 0.3983
 epoch: 3, train_loss: 1.0210, test_loss: 1.2289, test_f1: 0.4316
 epoch: 4, train_loss: 0.9767, test_loss: 1.1695, test_f1: 0.4688
 epoch: 5, train_loss: 0.9471, test_loss: 1.1724, test_f1: 0.4514
 epoch: 6, train_loss: 0.8989, test_loss: 1.1220, test_f1: 0.5418
 epoch: 7, train_loss: 0.8727, test_loss: 1.0921, test_f1: 0.6068
 epoch: 8, train_loss: 0.8570, test_loss: 1.1873, test_f1: 0.5408
 epoch: 9, train_loss: 0.8838, test_loss: 1.2056, test_f1: 0.5566
 epoch: 10, train_loss: 0.8299, test_loss: 1.2182, test_f1: 0.5386
 epoch: 11, train_loss: 0.8172, test_loss: 1.2726, test_f1: 0.5011
 epoch: 12, train_loss: 0.8140, test_loss: 1.2521, test_f1: 0.5280
 epoch: 13, train_loss: 0.7761, test_loss: 1.2265, test_f1: 0.5472
 epoch: 14, train_loss: 0.7460, test_loss: 1.1475, test_f1: 0.5807
 epoch: 15, train_loss: 0.7507, test_loss: 1.2526, test_f1: 0.5594
 epoch: 16, train_loss: 0.7074, test_loss: 1.4221, test_f1: 0.5495
 epoch: 17, train_loss: 0.7057, test_loss: 1.4665, test_f1: 0.5030
 epoch: 18, train_loss: 0.7293, test_loss: 1.7546, test_f1: 0.5146
 epoch: 19, train_loss: 0.7017, test_loss: 1.5590, test_f1: 0.5226
 epoch: 20, train_loss: 0.6960, test_loss: 1.5016, test_f1: 0.5370
 epoch: 21, train_loss: 0.6694, test_loss: 1.6516, test_f1: 0.5266
 epoch: 22, train_loss: 0.6763, test_loss: 1.2947, test_f1: 0.5247
 epoch: 23, train_loss: 0.6702, test_loss: 1.2592, test_f1: 0.5711
 epoch: 24, train_loss: 0.6537, test_loss: 1.3638, test_f1: 0.5486
 epoch: 25, train_loss: 0.6565, test_loss: 1.2553, test_f1: 0.5564
 epoch: 26, train_loss: 0.6858, test_loss: 1.4584, test_f1: 0.5365
 epoch: 27, train_loss: 0.6611, test_loss: 1.6656, test_f1: 0.5074
 epoch: 28, train_loss: 0.6403, test_loss: 1.6609, test_f1: 0.5355
 epoch: 29, train_loss: 0.6256, test_loss: 1.4675, test_f1: 0.6072
 epoch: 30, train_loss: 0.6146, test_loss: 1.8732, test_f1: 0.5539
 epoch: 31, train_loss: 0.6008, test_loss: 1.7463, test_f1: 0.5606
 epoch: 32, train_loss: 0.5753, test_loss: 1.5820, test_f1: 0.5579
 epoch: 33, train_loss: 0.6386, test_loss: 1.7602, test_f1: 0.4888
 epoch: 34, train_loss: 0.6203, test_loss: 1.5598, test_f1: 0.5841
 epoch: 35, train_loss: 0.6372, test_loss: 1.6938, test_f1: 0.5394
 epoch: 36, train_loss: 0.6266, test_loss: 1.7415, test_f1: 0.4962
 epoch: 37, train_loss: 0.6755, test_loss: 1.7201, test_f1: 0.4108
 epoch: 38, train_loss: 0.7033, test_loss: 1.5950, test_f1: 0.5078
 epoch: 39, train_loss: 0.6700, test_loss: 1.1773, test_f1: 0.5535
 epoch: 40, train_loss: 0.6611, test_loss: 1.2609, test_f1: 0.5684
 epoch: 41, train_loss: 0.6433, test_loss: 1.3836, test_f1: 0.5228
 epoch: 42, train_loss: 0.6125, test_loss: 1.4185, test_f1: 0.5645
 epoch: 43, train_loss: 0.5921, test_loss: 1.3828, test_f1: 0.5657
 epoch: 44, train_loss: 0.5825, test_loss: 1.4670, test_f1: 0.5632
 epoch: 45, train_loss: 0.5859, test_loss: 1.4610, test_f1: 0.5677
 epoch: 46, train_loss: 0.5809, test_loss: 1.4224, test_f1: 0.5761
 epoch: 47, train_loss: 0.5562, test_loss: 1.4836, test_f1: 0.5774
 epoch: 48, train_loss: 0.5623, test_loss: 1.7743, test_f1: 0.4869
 epoch: 49, train_loss: 0.5767, test_loss: 1.5847, test_f1: 0.5494
 epoch: 50, train_loss: 0.5427, test_loss: 1.5498, test_f1: 0.5794
 epoch: 51, train_loss: 0.5212, test_loss: 1.6306, test_f1: 0.5483
 epoch: 52, train_loss: 0.5054, test_loss: 1.6350, test_f1: 0.5561
 epoch: 53, train_loss: 0.4750, test_loss: 1.5646, test_f1: 0.5570
 epoch: 54, train_loss: 0.4560, test_loss: 1.6081, test_f1: 0.5683
 epoch: 55, train_loss: 0.4313, test_loss: 1.6281, test_f1: 0.5856
 epoch: 56, train_loss: 0.4282, test_loss: 1.6771, test_f1: 0.5751
 epoch: 57, train_loss: 0.4235, test_loss: 1.7855, test_f1: 0.5548
 epoch: 58, train_loss: 0.4408, test_loss: 2.0957, test_f1: 0.5050
 epoch: 59, train_loss: 0.4596, test_loss: 2.1137, test_f1: 0.4803
 epoch: 60, train_loss: 0.4504, test_loss: 1.7813, test_f1: 0.5241
 epoch: 61, train_loss: 0.4850, test_loss: 1.7094, test_f1: 0.5440
 epoch: 62, train_loss: 0.4886, test_loss: 1.6352, test_f1: 0.5690
 epoch: 63, train_loss: 0.4527, test_loss: 1.7559, test_f1: 0.5258
 epoch: 64, train_loss: 0.4411, test_loss: 1.6451, test_f1: 0.5852
 epoch: 65, train_loss: 0.4074, test_loss: 1.7462, test_f1: 0.5994
 epoch: 66, train_loss: 0.4157, test_loss: 1.7878, test_f1: 0.5863
 epoch: 67, train_loss: 0.4124, test_loss: 1.6396, test_f1: 0.5732
 epoch: 68, train_loss: 0.4387, test_loss: 1.7838, test_f1: 0.5648
 epoch: 69, train_loss: 0.4146, test_loss: 1.8999, test_f1: 0.5746
 epoch: 70, train_loss: 0.3833, test_loss: 1.7279, test_f1: 0.5676
 epoch: 71, train_loss: 0.3875, test_loss: 1.8037, test_f1: 0.5460
 epoch: 72, train_loss: 0.3626, test_loss: 1.8146, test_f1: 0.5327
 epoch: 73, train_loss: 0.3948, test_loss: 1.8541, test_f1: 0.5329
 epoch: 74, train_loss: 0.3824, test_loss: 1.8913, test_f1: 0.5712
 epoch: 75, train_loss: 0.3876, test_loss: 1.9630, test_f1: 0.5712
 epoch: 76, train_loss: 0.3706, test_loss: 1.9855, test_f1: 0.5693
 epoch: 77, train_loss: 0.3557, test_loss: 2.0073, test_f1: 0.5604
 epoch: 78, train_loss: 0.3420, test_loss: 1.9822, test_f1: 0.5500
 epoch: 79, train_loss: 0.3666, test_loss: 1.9671, test_f1: 0.5541
 epoch: 80, train_loss: 0.3564, test_loss: 1.9002, test_f1: 0.5546
 epoch: 81, train_loss: 0.3414, test_loss: 2.1475, test_f1: 0.5594
 epoch: 82, train_loss: 0.3449, test_loss: 1.9957, test_f1: 0.6002
 epoch: 83, train_loss: 0.3640, test_loss: 2.0988, test_f1: 0.5733
 epoch: 84, train_loss: 0.3601, test_loss: 2.0559, test_f1: 0.5617
 epoch: 85, train_loss: 0.3670, test_loss: 2.0403, test_f1: 0.5750
 epoch: 86, train_loss: 0.3790, test_loss: 2.3243, test_f1: 0.5173
 epoch: 87, train_loss: 0.4085, test_loss: 1.8438, test_f1: 0.5943
 epoch: 88, train_loss: 0.3823, test_loss: 1.7769, test_f1: 0.5665
 epoch: 89, train_loss: 0.3611, test_loss: 1.8671, test_f1: 0.5589
 epoch: 90, train_loss: 0.3386, test_loss: 2.0887, test_f1: 0.5197
 epoch: 91, train_loss: 0.3688, test_loss: 2.0799, test_f1: 0.5275
 epoch: 92, train_loss: 0.3359, test_loss: 1.9264, test_f1: 0.5576
 epoch: 93, train_loss: 0.3497, test_loss: 2.0652, test_f1: 0.5427
 epoch: 94, train_loss: 0.3662, test_loss: 1.9718, test_f1: 0.5546
 epoch: 95, train_loss: 0.3489, test_loss: 1.9919, test_f1: 0.5687
 epoch: 96, train_loss: 0.3530, test_loss: 2.0979, test_f1: 0.5559
 epoch: 97, train_loss: 0.3338, test_loss: 2.0727, test_f1: 0.5554
 epoch: 98, train_loss: 0.3371, test_loss: 2.1015, test_f1: 0.5586
 epoch: 99, train_loss: 0.3315, test_loss: 2.2989, test_f1: 0.5352
##################ITERATION #7 ****************************************
 epoch: 0, train_loss: 1.2756, test_loss: 1.4042, test_f1: 0.1653
 epoch: 1, train_loss: 1.1050, test_loss: 1.3324, test_f1: 0.1806
 epoch: 2, train_loss: 1.0319, test_loss: 1.3234, test_f1: 0.2275
 epoch: 3, train_loss: 1.0100, test_loss: 1.2706, test_f1: 0.2773
 epoch: 4, train_loss: 0.9587, test_loss: 1.2308, test_f1: 0.4384
 epoch: 5, train_loss: 0.9233, test_loss: 1.2087, test_f1: 0.4277
 epoch: 6, train_loss: 0.8847, test_loss: 1.1499, test_f1: 0.4088
 epoch: 7, train_loss: 0.8506, test_loss: 1.1103, test_f1: 0.5601
 epoch: 8, train_loss: 0.8354, test_loss: 1.1358, test_f1: 0.5236
 epoch: 9, train_loss: 0.8030, test_loss: 1.1146, test_f1: 0.5728
 epoch: 10, train_loss: 0.8047, test_loss: 1.1291, test_f1: 0.5239
 epoch: 11, train_loss: 0.8028, test_loss: 1.1282, test_f1: 0.5390
 epoch: 12, train_loss: 0.7700, test_loss: 1.1744, test_f1: 0.5290
 epoch: 13, train_loss: 0.7473, test_loss: 1.0607, test_f1: 0.5720
 epoch: 14, train_loss: 0.7230, test_loss: 1.2151, test_f1: 0.5603
 epoch: 15, train_loss: 0.7040, test_loss: 1.1316, test_f1: 0.5831
 epoch: 16, train_loss: 0.7081, test_loss: 1.2373, test_f1: 0.5440
 epoch: 17, train_loss: 0.7287, test_loss: 1.1801, test_f1: 0.5695
 epoch: 18, train_loss: 0.7060, test_loss: 1.2653, test_f1: 0.5890
 epoch: 19, train_loss: 0.6666, test_loss: 1.3651, test_f1: 0.5364
 epoch: 20, train_loss: 0.6812, test_loss: 1.4142, test_f1: 0.5140
 epoch: 21, train_loss: 0.6869, test_loss: 1.3708, test_f1: 0.5527
 epoch: 22, train_loss: 0.6740, test_loss: 1.5116, test_f1: 0.5375
 epoch: 23, train_loss: 0.6996, test_loss: 1.5698, test_f1: 0.5240
 epoch: 24, train_loss: 0.6984, test_loss: 1.4322, test_f1: 0.5221
 epoch: 25, train_loss: 0.6464, test_loss: 1.5365, test_f1: 0.4797
 epoch: 26, train_loss: 0.6460, test_loss: 1.2896, test_f1: 0.5713
 epoch: 27, train_loss: 0.6345, test_loss: 1.4147, test_f1: 0.5527
 epoch: 28, train_loss: 0.6360, test_loss: 1.3671, test_f1: 0.5558
 epoch: 29, train_loss: 0.6217, test_loss: 1.2974, test_f1: 0.5964
 epoch: 30, train_loss: 0.6134, test_loss: 1.2574, test_f1: 0.5760
 epoch: 31, train_loss: 0.6389, test_loss: 1.4647, test_f1: 0.5504
 epoch: 32, train_loss: 0.6266, test_loss: 1.5770, test_f1: 0.5448
 epoch: 33, train_loss: 0.6027, test_loss: 1.3940, test_f1: 0.5682
 epoch: 34, train_loss: 0.5931, test_loss: 1.4118, test_f1: 0.5546
 epoch: 35, train_loss: 0.5602, test_loss: 1.6140, test_f1: 0.5584
 epoch: 36, train_loss: 0.5823, test_loss: 1.5974, test_f1: 0.5739
 epoch: 37, train_loss: 0.5279, test_loss: 1.6816, test_f1: 0.5774
 epoch: 38, train_loss: 0.5064, test_loss: 1.5416, test_f1: 0.5320
 epoch: 39, train_loss: 0.5482, test_loss: 1.4733, test_f1: 0.5598
 epoch: 40, train_loss: 0.6038, test_loss: 1.3844, test_f1: 0.5699
 epoch: 41, train_loss: 0.5823, test_loss: 1.7422, test_f1: 0.4687
 epoch: 42, train_loss: 0.5664, test_loss: 1.6412, test_f1: 0.5174
 epoch: 43, train_loss: 0.5483, test_loss: 1.4446, test_f1: 0.5610
 epoch: 44, train_loss: 0.5638, test_loss: 1.3570, test_f1: 0.5983
 epoch: 45, train_loss: 0.5835, test_loss: 1.4559, test_f1: 0.5350
 epoch: 46, train_loss: 0.5561, test_loss: 1.4164, test_f1: 0.5406
 epoch: 47, train_loss: 0.5255, test_loss: 1.4378, test_f1: 0.5472
 epoch: 48, train_loss: 0.4950, test_loss: 1.7170, test_f1: 0.5475
 epoch: 49, train_loss: 0.4860, test_loss: 1.7389, test_f1: 0.5319
 epoch: 50, train_loss: 0.4656, test_loss: 1.6563, test_f1: 0.5410
 epoch: 51, train_loss: 0.4564, test_loss: 1.6728, test_f1: 0.5497
 epoch: 52, train_loss: 0.4284, test_loss: 1.7583, test_f1: 0.5571
 epoch: 53, train_loss: 0.4116, test_loss: 1.7621, test_f1: 0.5485
 epoch: 54, train_loss: 0.3915, test_loss: 1.7397, test_f1: 0.5397
 epoch: 55, train_loss: 0.3985, test_loss: 1.7743, test_f1: 0.5727
 epoch: 56, train_loss: 0.4066, test_loss: 1.8121, test_f1: 0.5635
 epoch: 57, train_loss: 0.4271, test_loss: 1.8535, test_f1: 0.5756
 epoch: 58, train_loss: 0.4023, test_loss: 1.8024, test_f1: 0.5747
 epoch: 59, train_loss: 0.3996, test_loss: 1.7178, test_f1: 0.5990
 epoch: 60, train_loss: 0.3744, test_loss: 1.8490, test_f1: 0.5736
 epoch: 61, train_loss: 0.3732, test_loss: 1.8054, test_f1: 0.5684
 epoch: 62, train_loss: 0.3631, test_loss: 1.9349, test_f1: 0.5736
 epoch: 63, train_loss: 0.3984, test_loss: 1.9907, test_f1: 0.5607
 epoch: 64, train_loss: 0.3921, test_loss: 1.7246, test_f1: 0.5678
 epoch: 65, train_loss: 0.3777, test_loss: 1.8087, test_f1: 0.5468
 epoch: 66, train_loss: 0.3807, test_loss: 2.0384, test_f1: 0.5472
 epoch: 67, train_loss: 0.3577, test_loss: 2.0259, test_f1: 0.5572
 epoch: 68, train_loss: 0.3662, test_loss: 1.9717, test_f1: 0.5563
 epoch: 69, train_loss: 0.3286, test_loss: 2.2074, test_f1: 0.5517
 epoch: 70, train_loss: 0.3592, test_loss: 2.2882, test_f1: 0.5338
 epoch: 71, train_loss: 0.3553, test_loss: 2.0379, test_f1: 0.5657
 epoch: 72, train_loss: 0.3312, test_loss: 2.1457, test_f1: 0.5710
 epoch: 73, train_loss: 0.3309, test_loss: 2.2269, test_f1: 0.5661
 epoch: 74, train_loss: 0.3289, test_loss: 2.1913, test_f1: 0.5635
 epoch: 75, train_loss: 0.3029, test_loss: 2.1502, test_f1: 0.5606
 epoch: 76, train_loss: 0.2998, test_loss: 2.3631, test_f1: 0.5436
 epoch: 77, train_loss: 0.3251, test_loss: 2.3889, test_f1: 0.5529
 epoch: 78, train_loss: 0.3168, test_loss: 2.2973, test_f1: 0.5635
 epoch: 79, train_loss: 0.3145, test_loss: 2.1922, test_f1: 0.5845
 epoch: 80, train_loss: 0.3170, test_loss: 2.0858, test_f1: 0.5675
 epoch: 81, train_loss: 0.3335, test_loss: 2.4260, test_f1: 0.5822
 epoch: 82, train_loss: 0.2864, test_loss: 2.4927, test_f1: 0.5799
 epoch: 83, train_loss: 0.3015, test_loss: 2.3137, test_f1: 0.5716
 epoch: 84, train_loss: 0.2824, test_loss: 2.2796, test_f1: 0.5614
 epoch: 85, train_loss: 0.2884, test_loss: 2.2353, test_f1: 0.5610
 epoch: 86, train_loss: 0.2723, test_loss: 2.2835, test_f1: 0.5616
 epoch: 87, train_loss: 0.2888, test_loss: 2.3400, test_f1: 0.5452
 epoch: 88, train_loss: 0.2735, test_loss: 2.2003, test_f1: 0.5644
 epoch: 89, train_loss: 0.2764, test_loss: 2.3382, test_f1: 0.5742
 epoch: 90, train_loss: 0.2909, test_loss: 2.2391, test_f1: 0.6088
 epoch: 91, train_loss: 0.2671, test_loss: 2.2003, test_f1: 0.5844
 epoch: 92, train_loss: 0.2797, test_loss: 2.2658, test_f1: 0.5571
 epoch: 93, train_loss: 0.3025, test_loss: 2.2828, test_f1: 0.5430
 epoch: 94, train_loss: 0.2918, test_loss: 2.2998, test_f1: 0.5471
 epoch: 95, train_loss: 0.2913, test_loss: 2.3454, test_f1: 0.5408
 epoch: 96, train_loss: 0.2985, test_loss: 2.4053, test_f1: 0.5485
 epoch: 97, train_loss: 0.2756, test_loss: 2.3180, test_f1: 0.5962
 epoch: 98, train_loss: 0.2946, test_loss: 2.2574, test_f1: 0.6133
 epoch: 99, train_loss: 0.2888, test_loss: 2.3492, test_f1: 0.5831
##################ITERATION #8 ****************************************
 epoch: 0, train_loss: 1.2613, test_loss: 1.3421, test_f1: 0.1970
 epoch: 1, train_loss: 1.1406, test_loss: 1.3282, test_f1: 0.1425
 epoch: 2, train_loss: 1.0753, test_loss: 1.2565, test_f1: 0.3168
 epoch: 3, train_loss: 1.0369, test_loss: 1.2566, test_f1: 0.3995
 epoch: 4, train_loss: 1.0003, test_loss: 1.2284, test_f1: 0.3985
 epoch: 5, train_loss: 0.9827, test_loss: 1.2075, test_f1: 0.4068
 epoch: 6, train_loss: 0.9422, test_loss: 1.1590, test_f1: 0.4477
 epoch: 7, train_loss: 0.9122, test_loss: 1.1455, test_f1: 0.4922
 epoch: 8, train_loss: 0.8896, test_loss: 1.1848, test_f1: 0.5240
 epoch: 9, train_loss: 0.8723, test_loss: 1.2169, test_f1: 0.5049
 epoch: 10, train_loss: 0.8510, test_loss: 1.1213, test_f1: 0.5632
 epoch: 11, train_loss: 0.8654, test_loss: 1.1787, test_f1: 0.4636
 epoch: 12, train_loss: 0.8427, test_loss: 1.2200, test_f1: 0.4891
 epoch: 13, train_loss: 0.8319, test_loss: 1.1872, test_f1: 0.5065
 epoch: 14, train_loss: 0.7788, test_loss: 1.2505, test_f1: 0.5071
 epoch: 15, train_loss: 0.7581, test_loss: 1.3096, test_f1: 0.5226
 epoch: 16, train_loss: 0.7494, test_loss: 1.3376, test_f1: 0.5133
 epoch: 17, train_loss: 0.7469, test_loss: 1.1986, test_f1: 0.5106
 epoch: 18, train_loss: 0.7279, test_loss: 1.2099, test_f1: 0.5287
 epoch: 19, train_loss: 0.7088, test_loss: 1.3030, test_f1: 0.5075
 epoch: 20, train_loss: 0.6698, test_loss: 1.2895, test_f1: 0.5371
 epoch: 21, train_loss: 0.6580, test_loss: 1.4105, test_f1: 0.5161
 epoch: 22, train_loss: 0.6654, test_loss: 1.7344, test_f1: 0.4625
 epoch: 23, train_loss: 0.6598, test_loss: 1.6096, test_f1: 0.5315
 epoch: 24, train_loss: 0.6561, test_loss: 1.4193, test_f1: 0.5361
 epoch: 25, train_loss: 0.6235, test_loss: 1.4511, test_f1: 0.5081
 epoch: 26, train_loss: 0.6159, test_loss: 1.5482, test_f1: 0.5317
 epoch: 27, train_loss: 0.6198, test_loss: 1.6268, test_f1: 0.5898
 epoch: 28, train_loss: 0.5885, test_loss: 1.4719, test_f1: 0.5379
 epoch: 29, train_loss: 0.6660, test_loss: 1.4411, test_f1: 0.5272
 epoch: 30, train_loss: 0.6540, test_loss: 1.8509, test_f1: 0.4762
 epoch: 31, train_loss: 0.6545, test_loss: 1.7230, test_f1: 0.5045
 epoch: 32, train_loss: 0.6113, test_loss: 1.6557, test_f1: 0.5262
 epoch: 33, train_loss: 0.5714, test_loss: 1.6345, test_f1: 0.5200
 epoch: 34, train_loss: 0.5526, test_loss: 1.5837, test_f1: 0.5434
 epoch: 35, train_loss: 0.5896, test_loss: 1.5272, test_f1: 0.5642
 epoch: 36, train_loss: 0.5649, test_loss: 1.7096, test_f1: 0.5548
 epoch: 37, train_loss: 0.5937, test_loss: 1.7553, test_f1: 0.5493
 epoch: 38, train_loss: 0.5634, test_loss: 1.5543, test_f1: 0.5738
 epoch: 39, train_loss: 0.5321, test_loss: 1.7469, test_f1: 0.5056
 epoch: 40, train_loss: 0.5525, test_loss: 1.6528, test_f1: 0.4922
 epoch: 41, train_loss: 0.5422, test_loss: 1.7731, test_f1: 0.4933
 epoch: 42, train_loss: 0.5764, test_loss: 1.7117, test_f1: 0.4977
 epoch: 43, train_loss: 0.5568, test_loss: 1.4001, test_f1: 0.5697
 epoch: 44, train_loss: 0.5460, test_loss: 1.8362, test_f1: 0.5536
 epoch: 45, train_loss: 0.5538, test_loss: 2.0567, test_f1: 0.4865
 epoch: 46, train_loss: 0.5141, test_loss: 1.9428, test_f1: 0.5202
 epoch: 47, train_loss: 0.5109, test_loss: 1.7593, test_f1: 0.5214
 epoch: 48, train_loss: 0.4659, test_loss: 1.5887, test_f1: 0.5611
 epoch: 49, train_loss: 0.4843, test_loss: 1.4743, test_f1: 0.5980
 epoch: 50, train_loss: 0.4945, test_loss: 1.5635, test_f1: 0.5602
 epoch: 51, train_loss: 0.4378, test_loss: 1.6106, test_f1: 0.5909
 epoch: 52, train_loss: 0.4067, test_loss: 1.5851, test_f1: 0.5920
 epoch: 53, train_loss: 0.4423, test_loss: 1.6301, test_f1: 0.5635
 epoch: 54, train_loss: 0.4138, test_loss: 1.6718, test_f1: 0.5784
 epoch: 55, train_loss: 0.4060, test_loss: 1.6706, test_f1: 0.5803
 epoch: 56, train_loss: 0.3899, test_loss: 1.7737, test_f1: 0.5650
 epoch: 57, train_loss: 0.3851, test_loss: 1.7888, test_f1: 0.5715
 epoch: 58, train_loss: 0.3690, test_loss: 1.9622, test_f1: 0.5396
 epoch: 59, train_loss: 0.3708, test_loss: 1.8088, test_f1: 0.5880
 epoch: 60, train_loss: 0.3763, test_loss: 1.8310, test_f1: 0.5597
 epoch: 61, train_loss: 0.3950, test_loss: 1.8948, test_f1: 0.5757
 epoch: 62, train_loss: 0.3718, test_loss: 2.0598, test_f1: 0.5840
 epoch: 63, train_loss: 0.3552, test_loss: 1.9845, test_f1: 0.5689
 epoch: 64, train_loss: 0.3607, test_loss: 1.9675, test_f1: 0.5836
 epoch: 65, train_loss: 0.3486, test_loss: 2.2569, test_f1: 0.5869
 epoch: 66, train_loss: 0.3542, test_loss: 2.0748, test_f1: 0.5748
 epoch: 67, train_loss: 0.3824, test_loss: 2.3301, test_f1: 0.5445
 epoch: 68, train_loss: 0.3702, test_loss: 2.0159, test_f1: 0.5876
 epoch: 69, train_loss: 0.3970, test_loss: 1.7470, test_f1: 0.6068
 epoch: 70, train_loss: 0.3644, test_loss: 1.6497, test_f1: 0.5901
 epoch: 71, train_loss: 0.3491, test_loss: 1.8406, test_f1: 0.5501
 epoch: 72, train_loss: 0.3353, test_loss: 2.0369, test_f1: 0.5592
 epoch: 73, train_loss: 0.3189, test_loss: 2.0326, test_f1: 0.5907
 epoch: 74, train_loss: 0.3226, test_loss: 1.9829, test_f1: 0.5698
 epoch: 75, train_loss: 0.3394, test_loss: 1.8667, test_f1: 0.5761
 epoch: 76, train_loss: 0.3086, test_loss: 1.8139, test_f1: 0.5882
 epoch: 77, train_loss: 0.3215, test_loss: 1.9009, test_f1: 0.5859
 epoch: 78, train_loss: 0.3080, test_loss: 2.1275, test_f1: 0.5756
 epoch: 79, train_loss: 0.3051, test_loss: 2.2987, test_f1: 0.5534
 epoch: 80, train_loss: 0.3352, test_loss: 2.0606, test_f1: 0.5844
 epoch: 81, train_loss: 0.3537, test_loss: 2.1036, test_f1: 0.5706
 epoch: 82, train_loss: 0.3559, test_loss: 2.3881, test_f1: 0.4805
 epoch: 83, train_loss: 0.3527, test_loss: 2.1853, test_f1: 0.5381
 epoch: 84, train_loss: 0.3434, test_loss: 2.3106, test_f1: 0.5440
 epoch: 85, train_loss: 0.3159, test_loss: 2.1186, test_f1: 0.5791
 epoch: 86, train_loss: 0.2994, test_loss: 2.1443, test_f1: 0.5665
 epoch: 87, train_loss: 0.3387, test_loss: 2.3184, test_f1: 0.5283
 epoch: 88, train_loss: 0.3295, test_loss: 2.3551, test_f1: 0.5493
 epoch: 89, train_loss: 0.3120, test_loss: 2.1791, test_f1: 0.5753
 epoch: 90, train_loss: 0.3131, test_loss: 2.2031, test_f1: 0.5511
 epoch: 91, train_loss: 0.3292, test_loss: 2.4838, test_f1: 0.5182
 epoch: 92, train_loss: 0.3264, test_loss: 2.4809, test_f1: 0.5436
 epoch: 93, train_loss: 0.3517, test_loss: 2.2637, test_f1: 0.5873
 epoch: 94, train_loss: 0.3301, test_loss: 2.2261, test_f1: 0.5497
 epoch: 95, train_loss: 0.3404, test_loss: 2.2107, test_f1: 0.5037
 epoch: 96, train_loss: 0.3051, test_loss: 2.0024, test_f1: 0.5424
 epoch: 97, train_loss: 0.3218, test_loss: 2.0259, test_f1: 0.5619
 epoch: 98, train_loss: 0.3051, test_loss: 1.9285, test_f1: 0.5662
 epoch: 99, train_loss: 0.2739, test_loss: 2.0446, test_f1: 0.5643
##################ITERATION #9 ****************************************
 epoch: 0, train_loss: 1.2602, test_loss: 1.4515, test_f1: 0.1686
 epoch: 1, train_loss: 1.0966, test_loss: 1.3374, test_f1: 0.1365
 epoch: 2, train_loss: 1.0277, test_loss: 1.3171, test_f1: 0.2205
 epoch: 3, train_loss: 1.0145, test_loss: 1.3139, test_f1: 0.3546
 epoch: 4, train_loss: 0.9425, test_loss: 1.2058, test_f1: 0.4516
 epoch: 5, train_loss: 0.9178, test_loss: 1.2016, test_f1: 0.5349
 epoch: 6, train_loss: 0.8825, test_loss: 1.2633, test_f1: 0.4944
 epoch: 7, train_loss: 0.8627, test_loss: 1.0995, test_f1: 0.5614
 epoch: 8, train_loss: 0.8417, test_loss: 1.2196, test_f1: 0.5140
 epoch: 9, train_loss: 0.8053, test_loss: 1.3115, test_f1: 0.5020
 epoch: 10, train_loss: 0.8076, test_loss: 1.4442, test_f1: 0.5672
 epoch: 11, train_loss: 0.7840, test_loss: 1.3275, test_f1: 0.5963
 epoch: 12, train_loss: 0.7770, test_loss: 1.3887, test_f1: 0.5569
 epoch: 13, train_loss: 0.7680, test_loss: 1.3870, test_f1: 0.5479
 epoch: 14, train_loss: 0.7559, test_loss: 1.3299, test_f1: 0.5585
 epoch: 15, train_loss: 0.7392, test_loss: 1.3768, test_f1: 0.5857
 epoch: 16, train_loss: 0.7340, test_loss: 1.5413, test_f1: 0.5352
 epoch: 17, train_loss: 0.7434, test_loss: 1.4341, test_f1: 0.5674
 epoch: 18, train_loss: 0.7236, test_loss: 1.2713, test_f1: 0.5639
 epoch: 19, train_loss: 0.7096, test_loss: 1.2675, test_f1: 0.5369
 epoch: 20, train_loss: 0.7304, test_loss: 1.2072, test_f1: 0.5283
 epoch: 21, train_loss: 0.7147, test_loss: 1.3113, test_f1: 0.5489
 epoch: 22, train_loss: 0.6589, test_loss: 1.4521, test_f1: 0.5523
 epoch: 23, train_loss: 0.6671, test_loss: 1.4360, test_f1: 0.5591
 epoch: 24, train_loss: 0.6454, test_loss: 1.5664, test_f1: 0.5373
 epoch: 25, train_loss: 0.6490, test_loss: 1.5497, test_f1: 0.5881
 epoch: 26, train_loss: 0.6592, test_loss: 1.6216, test_f1: 0.5170
 epoch: 27, train_loss: 0.6513, test_loss: 1.4696, test_f1: 0.5405
 epoch: 28, train_loss: 0.6537, test_loss: 1.4968, test_f1: 0.5096
 epoch: 29, train_loss: 0.6355, test_loss: 1.6393, test_f1: 0.5386
 epoch: 30, train_loss: 0.6659, test_loss: 1.4529, test_f1: 0.5613
 epoch: 31, train_loss: 0.6429, test_loss: 1.6492, test_f1: 0.4649
 epoch: 32, train_loss: 0.6428, test_loss: 1.5086, test_f1: 0.5765
 epoch: 33, train_loss: 0.6102, test_loss: 1.7795, test_f1: 0.5397
 epoch: 34, train_loss: 0.6248, test_loss: 1.5868, test_f1: 0.5383
 epoch: 35, train_loss: 0.5953, test_loss: 1.4409, test_f1: 0.5572
 epoch: 36, train_loss: 0.5638, test_loss: 1.4829, test_f1: 0.5581
 epoch: 37, train_loss: 0.5487, test_loss: 1.6753, test_f1: 0.5304
 epoch: 38, train_loss: 0.5544, test_loss: 1.7525, test_f1: 0.5140
 epoch: 39, train_loss: 0.5772, test_loss: 1.9096, test_f1: 0.4951
 epoch: 40, train_loss: 0.6055, test_loss: 2.3744, test_f1: 0.4941
 epoch: 41, train_loss: 0.6080, test_loss: 1.7044, test_f1: 0.5015
 epoch: 42, train_loss: 0.6143, test_loss: 1.5403, test_f1: 0.5586
 epoch: 43, train_loss: 0.5874, test_loss: 1.4527, test_f1: 0.5416
 epoch: 44, train_loss: 0.5729, test_loss: 1.3529, test_f1: 0.5566
 epoch: 45, train_loss: 0.5602, test_loss: 1.3938, test_f1: 0.5513
 epoch: 46, train_loss: 0.5819, test_loss: 1.4837, test_f1: 0.5556
 epoch: 47, train_loss: 0.5403, test_loss: 1.4986, test_f1: 0.5602
 epoch: 48, train_loss: 0.5375, test_loss: 1.5040, test_f1: 0.5764
 epoch: 49, train_loss: 0.5052, test_loss: 1.7051, test_f1: 0.5493
 epoch: 50, train_loss: 0.5064, test_loss: 1.7773, test_f1: 0.5764
 epoch: 51, train_loss: 0.4810, test_loss: 1.7577, test_f1: 0.5828
 epoch: 52, train_loss: 0.4898, test_loss: 1.7769, test_f1: 0.5532
 epoch: 53, train_loss: 0.4983, test_loss: 1.7544, test_f1: 0.5706
 epoch: 54, train_loss: 0.4744, test_loss: 1.7396, test_f1: 0.5720
 epoch: 55, train_loss: 0.4625, test_loss: 1.6793, test_f1: 0.5771
 epoch: 56, train_loss: 0.4466, test_loss: 1.6729, test_f1: 0.5549
 epoch: 57, train_loss: 0.4091, test_loss: 1.7824, test_f1: 0.5632
 epoch: 58, train_loss: 0.4050, test_loss: 1.7085, test_f1: 0.5587
 epoch: 59, train_loss: 0.4490, test_loss: 1.8551, test_f1: 0.5653
 epoch: 60, train_loss: 0.4367, test_loss: 2.1156, test_f1: 0.5584
 epoch: 61, train_loss: 0.4385, test_loss: 1.9909, test_f1: 0.5865
 epoch: 62, train_loss: 0.4308, test_loss: 1.8526, test_f1: 0.5929
 epoch: 63, train_loss: 0.3981, test_loss: 1.8800, test_f1: 0.5699
 epoch: 64, train_loss: 0.3939, test_loss: 1.9324, test_f1: 0.5570
 epoch: 65, train_loss: 0.3796, test_loss: 1.9388, test_f1: 0.5354
 epoch: 66, train_loss: 0.4013, test_loss: 1.8427, test_f1: 0.5751
 epoch: 67, train_loss: 0.3701, test_loss: 1.8661, test_f1: 0.5781
 epoch: 68, train_loss: 0.3908, test_loss: 2.0851, test_f1: 0.5305
 epoch: 69, train_loss: 0.3790, test_loss: 1.9198, test_f1: 0.5648
 epoch: 70, train_loss: 0.3979, test_loss: 1.9352, test_f1: 0.5415
 epoch: 71, train_loss: 0.4129, test_loss: 1.9249, test_f1: 0.5593
 epoch: 72, train_loss: 0.4011, test_loss: 1.9323, test_f1: 0.5514
 epoch: 73, train_loss: 0.3928, test_loss: 1.8598, test_f1: 0.5850
 epoch: 74, train_loss: 0.3684, test_loss: 2.0323, test_f1: 0.5664
 epoch: 75, train_loss: 0.3738, test_loss: 1.9905, test_f1: 0.5359
 epoch: 76, train_loss: 0.3847, test_loss: 1.8502, test_f1: 0.5475
 epoch: 77, train_loss: 0.3777, test_loss: 1.8932, test_f1: 0.5454
 epoch: 78, train_loss: 0.3659, test_loss: 1.9156, test_f1: 0.5527
 epoch: 79, train_loss: 0.3733, test_loss: 1.8871, test_f1: 0.5709
 epoch: 80, train_loss: 0.3773, test_loss: 1.8484, test_f1: 0.5761
 epoch: 81, train_loss: 0.3750, test_loss: 1.9490, test_f1: 0.5620
 epoch: 82, train_loss: 0.3318, test_loss: 2.0666, test_f1: 0.5533
 epoch: 83, train_loss: 0.3461, test_loss: 2.1524, test_f1: 0.5497
 epoch: 84, train_loss: 0.3174, test_loss: 2.2449, test_f1: 0.5587
 epoch: 85, train_loss: 0.3103, test_loss: 2.3261, test_f1: 0.5353
 epoch: 86, train_loss: 0.3028, test_loss: 2.3700, test_f1: 0.5374
 epoch: 87, train_loss: 0.3328, test_loss: 2.1847, test_f1: 0.5759
 epoch: 88, train_loss: 0.3275, test_loss: 2.2086, test_f1: 0.5765
 epoch: 89, train_loss: 0.3210, test_loss: 2.3698, test_f1: 0.5302
 epoch: 90, train_loss: 0.3728, test_loss: 2.3630, test_f1: 0.5375
 epoch: 91, train_loss: 0.3632, test_loss: 2.3561, test_f1: 0.5374
 epoch: 92, train_loss: 0.3208, test_loss: 2.3997, test_f1: 0.5467
 epoch: 93, train_loss: 0.3360, test_loss: 2.5541, test_f1: 0.5472
 epoch: 94, train_loss: 0.3298, test_loss: 2.3831, test_f1: 0.5686
 epoch: 95, train_loss: 0.3094, test_loss: 2.1469, test_f1: 0.5655
 epoch: 96, train_loss: 0.3122, test_loss: 2.1621, test_f1: 0.5809
 epoch: 97, train_loss: 0.3049, test_loss: 2.2936, test_f1: 0.5724
 epoch: 98, train_loss: 0.2940, test_loss: 2.3326, test_f1: 0.5598
 epoch: 99, train_loss: 0.3123, test_loss: 2.2220, test_f1: 0.5523

Training completed in 310.78 seconds
Best F1: 0.6171 at epoch 72
Mean F1 across iterations: 0.6025  0.0076
========================FINAL RESULTS================================
FEGIN weighted F1: 0.6171  0.0076
python main.py --data ltspice_demos --representation component_component --model FEGIN --layers 5 --hiddens 128 --batch_size 256 --lr 0.001 --emb_size 250 --epochs 100 --save_appendix component_component_L5_H128_BS256_LR0.001_E250 --no_val
-----



STDERR:
  File "main.py", line 370, in <module>
    main()
  File "main.py", line 254, in main
    dataset = dataset_class(
  File "/home/philip/projects/ltspice_examples_code_repo/Circuit-Completion-Using-GNNs/component_classification_with_link_prediction_head/evaluation/FEGIN/kernel/circuit_datasets.py", line 15, in __init__
    self.data, self.slices = torch.load(self.processed_paths[0])
  File "/home/philip/.local/lib/python3.8/site-packages/torch/serialization.py", line 1040, in load
    warnings.warn(
  File "/usr/lib/python3.8/warnings.py", line 109, in _showwarnmsg
    sw(msg.message, msg.category, msg.filename, msg.lineno,
  File "main.py", line 47, in warn_with_traceback
    traceback.print_stack(file=log)
/home/philip/projects/ltspice_examples_code_repo/Circuit-Completion-Using-GNNs/component_classification_with_link_prediction_head/evaluation/FEGIN/kernel/circuit_datasets.py:15: FutureWarning: You are using `torch.load` with `weights_only=False` (the current default value), which uses the default pickle module implicitly. It is possible to construct malicious pickle data which will execute arbitrary code during unpickling (See https://github.com/pytorch/pytorch/blob/main/SECURITY.md#untrusted-models for more details). In a future release, the default value for `weights_only` will be flipped to `True`. This limits the functions that could be executed during unpickling. Arbitrary objects will no longer be allowed to be loaded via this mode unless they are explicitly allowlisted by the user via `torch.serialization.add_safe_globals`. We recommend you start setting `weights_only=True` for any use case where you don't have full control of the loaded file. Please open an issue on GitHub for any issues related to this experimental feature.
  self.data, self.slices = torch.load(self.processed_paths[0])
