STDOUT:
Results will be saved in /home/philip/projects/ltspice_examples_code_repo/Circuit-Completion-Using-GNNs/component_classification_with_link_prediction_head/evaluation/FEGIN/results/model_FEGIN_dataset_ltspice_demos
Command line input: python main.py --data ltspice_demos --representation component_pin_net --model FEGIN --layers 2 --hiddens 64 --batch_size 256 --lr 0.01 --emb_size 128 --epochs 100 --save_appendix component_pin_net_L2_H64_BS256_LR0.01_E128 --no_val
 is saved.
-----
ltspice_demos - FEGIN
Using 2 layers, 64 hidden units, h = 2
Loading component_pin_net representation dataset
ENTERED
Training FEGIN on component_pin_net representation
Train: 1565, Test: 383
##################ITERATION #0 ****************************************
 epoch: 0, train_loss: 1.2458, test_loss: 1.3367, test_f1: 0.3409
 epoch: 1, train_loss: 1.0943, test_loss: 1.7306, test_f1: 0.1365
 epoch: 2, train_loss: 1.0325, test_loss: 1.4858, test_f1: 0.2778
 epoch: 3, train_loss: 0.9921, test_loss: 1.5183, test_f1: 0.1627
 epoch: 4, train_loss: 0.9651, test_loss: 1.3588, test_f1: 0.2934
 epoch: 5, train_loss: 0.9410, test_loss: 1.3158, test_f1: 0.2402
 epoch: 6, train_loss: 0.9218, test_loss: 1.2994, test_f1: 0.3222
 epoch: 7, train_loss: 0.9295, test_loss: 1.0476, test_f1: 0.5565
 epoch: 8, train_loss: 0.8917, test_loss: 1.0292, test_f1: 0.5666
 epoch: 9, train_loss: 0.8786, test_loss: 1.0493, test_f1: 0.5317
 epoch: 10, train_loss: 0.8549, test_loss: 0.9966, test_f1: 0.4849
 epoch: 11, train_loss: 0.8675, test_loss: 1.1118, test_f1: 0.3719
 epoch: 12, train_loss: 0.8546, test_loss: 1.2323, test_f1: 0.4051
 epoch: 13, train_loss: 0.8568, test_loss: 0.9430, test_f1: 0.5475
 epoch: 14, train_loss: 0.8319, test_loss: 1.0192, test_f1: 0.5300
 epoch: 15, train_loss: 0.8304, test_loss: 1.2651, test_f1: 0.4805
 epoch: 16, train_loss: 0.8042, test_loss: 2.5267, test_f1: 0.2712
 epoch: 17, train_loss: 0.7725, test_loss: 1.1711, test_f1: 0.5068
 epoch: 18, train_loss: 0.7454, test_loss: 1.1947, test_f1: 0.4972
 epoch: 19, train_loss: 0.7553, test_loss: 1.4621, test_f1: 0.4363
 epoch: 20, train_loss: 0.7312, test_loss: 1.3013, test_f1: 0.4671
 epoch: 21, train_loss: 0.7424, test_loss: 1.3415, test_f1: 0.4869
 epoch: 22, train_loss: 0.6983, test_loss: 1.2540, test_f1: 0.5133
 epoch: 23, train_loss: 0.7367, test_loss: 1.1262, test_f1: 0.5254
 epoch: 24, train_loss: 0.7048, test_loss: 1.0021, test_f1: 0.5885
 epoch: 25, train_loss: 0.6882, test_loss: 1.0263, test_f1: 0.5547
 epoch: 26, train_loss: 0.7199, test_loss: 0.9503, test_f1: 0.5228
 epoch: 27, train_loss: 0.7189, test_loss: 0.9901, test_f1: 0.5750
 epoch: 28, train_loss: 0.7010, test_loss: 1.0651, test_f1: 0.5517
 epoch: 29, train_loss: 0.6613, test_loss: 1.0364, test_f1: 0.6175
 epoch: 30, train_loss: 0.6474, test_loss: 1.0226, test_f1: 0.6407
 epoch: 31, train_loss: 0.6779, test_loss: 1.0181, test_f1: 0.5885
 epoch: 32, train_loss: 0.6687, test_loss: 1.1362, test_f1: 0.5793
 epoch: 33, train_loss: 0.6811, test_loss: 1.3257, test_f1: 0.5182
 epoch: 34, train_loss: 0.6858, test_loss: 0.9949, test_f1: 0.5794
 epoch: 35, train_loss: 0.6611, test_loss: 1.0038, test_f1: 0.6421
 epoch: 36, train_loss: 0.6540, test_loss: 1.0097, test_f1: 0.5897
 epoch: 37, train_loss: 0.5981, test_loss: 1.2183, test_f1: 0.5760
 epoch: 38, train_loss: 0.5859, test_loss: 1.1081, test_f1: 0.5829
 epoch: 39, train_loss: 0.6402, test_loss: 1.0702, test_f1: 0.5692
 epoch: 40, train_loss: 0.5774, test_loss: 1.0593, test_f1: 0.6358
 epoch: 41, train_loss: 0.6054, test_loss: 1.1801, test_f1: 0.5505
 epoch: 42, train_loss: 0.5973, test_loss: 1.5316, test_f1: 0.5695
 epoch: 43, train_loss: 0.5780, test_loss: 1.3317, test_f1: 0.6057
 epoch: 44, train_loss: 0.5661, test_loss: 1.1964, test_f1: 0.5592
 epoch: 45, train_loss: 0.5807, test_loss: 2.3016, test_f1: 0.5339
 epoch: 46, train_loss: 0.5861, test_loss: 1.0249, test_f1: 0.6349
 epoch: 47, train_loss: 0.5915, test_loss: 1.2670, test_f1: 0.5513
 epoch: 48, train_loss: 0.6265, test_loss: 2.7706, test_f1: 0.4748
 epoch: 49, train_loss: 0.5860, test_loss: 1.7400, test_f1: 0.5774
 epoch: 50, train_loss: 0.5708, test_loss: 1.3361, test_f1: 0.6335
 epoch: 51, train_loss: 0.5597, test_loss: 1.2313, test_f1: 0.6371
 epoch: 52, train_loss: 0.5271, test_loss: 1.3469, test_f1: 0.6402
 epoch: 53, train_loss: 0.5043, test_loss: 1.4470, test_f1: 0.5769
 epoch: 54, train_loss: 0.5009, test_loss: 1.2351, test_f1: 0.6011
 epoch: 55, train_loss: 0.5085, test_loss: 1.3767, test_f1: 0.6317
 epoch: 56, train_loss: 0.4865, test_loss: 1.2714, test_f1: 0.6360
 epoch: 57, train_loss: 0.4709, test_loss: 1.4414, test_f1: 0.6253
 epoch: 58, train_loss: 0.4490, test_loss: 1.4271, test_f1: 0.6150
 epoch: 59, train_loss: 0.4822, test_loss: 1.3097, test_f1: 0.6119
 epoch: 60, train_loss: 0.4672, test_loss: 1.3493, test_f1: 0.6068
 epoch: 61, train_loss: 0.4517, test_loss: 1.4238, test_f1: 0.6299
 epoch: 62, train_loss: 0.4263, test_loss: 1.4342, test_f1: 0.6478
 epoch: 63, train_loss: 0.4079, test_loss: 1.3819, test_f1: 0.6616
 epoch: 64, train_loss: 0.4076, test_loss: 1.3359, test_f1: 0.6260
 epoch: 65, train_loss: 0.4400, test_loss: 1.8080, test_f1: 0.5571
 epoch: 66, train_loss: 0.5053, test_loss: 1.3735, test_f1: 0.6006
 epoch: 67, train_loss: 0.4382, test_loss: 1.5391, test_f1: 0.5954
 epoch: 68, train_loss: 0.4437, test_loss: 1.4984, test_f1: 0.6498
 epoch: 69, train_loss: 0.4233, test_loss: 1.6920, test_f1: 0.6586
 epoch: 70, train_loss: 0.4222, test_loss: 1.9161, test_f1: 0.5387
 epoch: 71, train_loss: 0.4163, test_loss: 1.6211, test_f1: 0.6626
 epoch: 72, train_loss: 0.4178, test_loss: 1.7689, test_f1: 0.6164
 epoch: 73, train_loss: 0.4223, test_loss: 1.4863, test_f1: 0.6329
 epoch: 74, train_loss: 0.4274, test_loss: 1.7031, test_f1: 0.6247
 epoch: 75, train_loss: 0.4274, test_loss: 1.6614, test_f1: 0.6160
 epoch: 76, train_loss: 0.3976, test_loss: 1.5487, test_f1: 0.5889
 epoch: 77, train_loss: 0.3917, test_loss: 1.4521, test_f1: 0.6094
 epoch: 78, train_loss: 0.3956, test_loss: 1.4531, test_f1: 0.5469
 epoch: 79, train_loss: 0.3857, test_loss: 1.4325, test_f1: 0.5922
 epoch: 80, train_loss: 0.3999, test_loss: 1.6162, test_f1: 0.6155
 epoch: 81, train_loss: 0.3751, test_loss: 1.8159, test_f1: 0.6004
 epoch: 82, train_loss: 0.3653, test_loss: 1.7358, test_f1: 0.5726
 epoch: 83, train_loss: 0.3742, test_loss: 1.7124, test_f1: 0.6083
 epoch: 84, train_loss: 0.3484, test_loss: 1.5433, test_f1: 0.5874
 epoch: 85, train_loss: 0.3657, test_loss: 1.9392, test_f1: 0.6114
 epoch: 86, train_loss: 0.3754, test_loss: 1.8906, test_f1: 0.6082
 epoch: 87, train_loss: 0.3483, test_loss: 1.7854, test_f1: 0.6345
 epoch: 88, train_loss: 0.3166, test_loss: 2.2026, test_f1: 0.6336
 epoch: 89, train_loss: 0.3726, test_loss: 1.8665, test_f1: 0.5819
 epoch: 90, train_loss: 0.3449, test_loss: 1.9528, test_f1: 0.6373
 epoch: 91, train_loss: 0.3418, test_loss: 1.9261, test_f1: 0.6182
 epoch: 92, train_loss: 0.3296, test_loss: 2.0157, test_f1: 0.5636
 epoch: 93, train_loss: 0.3535, test_loss: 2.0291, test_f1: 0.5557
 epoch: 94, train_loss: 0.3038, test_loss: 2.2098, test_f1: 0.5765
 epoch: 95, train_loss: 0.3123, test_loss: 1.6947, test_f1: 0.5769
 epoch: 96, train_loss: 0.3530, test_loss: 1.5498, test_f1: 0.6016
 epoch: 97, train_loss: 0.3258, test_loss: 1.6835, test_f1: 0.6461
 epoch: 98, train_loss: 0.3068, test_loss: 2.1398, test_f1: 0.6396
 epoch: 99, train_loss: 0.3386, test_loss: 1.8836, test_f1: 0.6375
##################ITERATION #1 ****************************************
 epoch: 0, train_loss: 1.1891, test_loss: 1.3229, test_f1: 0.2281
 epoch: 1, train_loss: 1.0240, test_loss: 1.2789, test_f1: 0.2281
 epoch: 2, train_loss: 0.9830, test_loss: 1.2884, test_f1: 0.2845
 epoch: 3, train_loss: 0.9493, test_loss: 1.1124, test_f1: 0.4360
 epoch: 4, train_loss: 0.9070, test_loss: 1.0888, test_f1: 0.4600
 epoch: 5, train_loss: 0.8947, test_loss: 1.0539, test_f1: 0.5446
 epoch: 6, train_loss: 0.8761, test_loss: 1.0365, test_f1: 0.5381
 epoch: 7, train_loss: 0.8538, test_loss: 1.0061, test_f1: 0.5496
 epoch: 8, train_loss: 0.8228, test_loss: 0.9919, test_f1: 0.5750
 epoch: 9, train_loss: 0.8056, test_loss: 0.9640, test_f1: 0.5666
 epoch: 10, train_loss: 0.7960, test_loss: 1.0477, test_f1: 0.4759
 epoch: 11, train_loss: 0.7930, test_loss: 1.1458, test_f1: 0.4652
 epoch: 12, train_loss: 0.8303, test_loss: 1.6012, test_f1: 0.3047
 epoch: 13, train_loss: 0.8064, test_loss: 1.0533, test_f1: 0.5334
 epoch: 14, train_loss: 0.7928, test_loss: 1.0745, test_f1: 0.5258
 epoch: 15, train_loss: 0.7714, test_loss: 1.0037, test_f1: 0.5522
 epoch: 16, train_loss: 0.7626, test_loss: 1.1294, test_f1: 0.5059
 epoch: 17, train_loss: 0.7504, test_loss: 1.0522, test_f1: 0.5706
 epoch: 18, train_loss: 0.7259, test_loss: 1.1587, test_f1: 0.5296
 epoch: 19, train_loss: 0.7290, test_loss: 1.0648, test_f1: 0.6024
 epoch: 20, train_loss: 0.7217, test_loss: 1.1065, test_f1: 0.5566
 epoch: 21, train_loss: 0.7105, test_loss: 1.0108, test_f1: 0.5545
 epoch: 22, train_loss: 0.6929, test_loss: 1.1889, test_f1: 0.5327
 epoch: 23, train_loss: 0.6821, test_loss: 1.1825, test_f1: 0.5008
 epoch: 24, train_loss: 0.6597, test_loss: 1.0985, test_f1: 0.6244
 epoch: 25, train_loss: 0.6632, test_loss: 1.1547, test_f1: 0.6077
 epoch: 26, train_loss: 0.6700, test_loss: 2.0279, test_f1: 0.3993
 epoch: 27, train_loss: 0.6476, test_loss: 1.1131, test_f1: 0.5918
 epoch: 28, train_loss: 0.6563, test_loss: 1.0951, test_f1: 0.5559
 epoch: 29, train_loss: 0.6664, test_loss: 1.1063, test_f1: 0.5448
 epoch: 30, train_loss: 0.6409, test_loss: 1.5366, test_f1: 0.4057
 epoch: 31, train_loss: 0.6398, test_loss: 1.2140, test_f1: 0.5227
 epoch: 32, train_loss: 0.6233, test_loss: 1.1791, test_f1: 0.6267
 epoch: 33, train_loss: 0.5936, test_loss: 1.2951, test_f1: 0.5703
 epoch: 34, train_loss: 0.5764, test_loss: 1.4725, test_f1: 0.5527
 epoch: 35, train_loss: 0.6062, test_loss: 1.4094, test_f1: 0.5801
 epoch: 36, train_loss: 0.5821, test_loss: 1.3190, test_f1: 0.5858
 epoch: 37, train_loss: 0.5986, test_loss: 1.2087, test_f1: 0.5664
 epoch: 38, train_loss: 0.5747, test_loss: 1.1004, test_f1: 0.6262
 epoch: 39, train_loss: 0.5630, test_loss: 1.2973, test_f1: 0.5901
 epoch: 40, train_loss: 0.5492, test_loss: 1.5944, test_f1: 0.4892
 epoch: 41, train_loss: 0.5451, test_loss: 2.4215, test_f1: 0.4583
 epoch: 42, train_loss: 0.6039, test_loss: 3.0860, test_f1: 0.4813
 epoch: 43, train_loss: 0.5826, test_loss: 1.3237, test_f1: 0.5473
 epoch: 44, train_loss: 0.6134, test_loss: 1.1798, test_f1: 0.5300
 epoch: 45, train_loss: 0.5712, test_loss: 1.1083, test_f1: 0.6301
 epoch: 46, train_loss: 0.5652, test_loss: 1.0995, test_f1: 0.5978
 epoch: 47, train_loss: 0.6471, test_loss: 1.8860, test_f1: 0.3860
 epoch: 48, train_loss: 0.6613, test_loss: 1.8929, test_f1: 0.4296
 epoch: 49, train_loss: 0.6203, test_loss: 2.2026, test_f1: 0.4993
 epoch: 50, train_loss: 0.5830, test_loss: 1.3439, test_f1: 0.5937
 epoch: 51, train_loss: 0.5443, test_loss: 1.3064, test_f1: 0.5806
 epoch: 52, train_loss: 0.5215, test_loss: 1.1437, test_f1: 0.5959
 epoch: 53, train_loss: 0.5115, test_loss: 1.2375, test_f1: 0.5991
 epoch: 54, train_loss: 0.4820, test_loss: 1.4594, test_f1: 0.5691
 epoch: 55, train_loss: 0.4621, test_loss: 1.2965, test_f1: 0.5921
 epoch: 56, train_loss: 0.4904, test_loss: 1.3717, test_f1: 0.5723
 epoch: 57, train_loss: 0.4580, test_loss: 1.3257, test_f1: 0.5932
 epoch: 58, train_loss: 0.4645, test_loss: 1.5076, test_f1: 0.5494
 epoch: 59, train_loss: 0.4427, test_loss: 1.5164, test_f1: 0.5551
 epoch: 60, train_loss: 0.4602, test_loss: 1.5159, test_f1: 0.5637
 epoch: 61, train_loss: 0.4557, test_loss: 1.3732, test_f1: 0.5871
 epoch: 62, train_loss: 0.4378, test_loss: 1.5717, test_f1: 0.5258
 epoch: 63, train_loss: 0.4517, test_loss: 1.6199, test_f1: 0.5503
 epoch: 64, train_loss: 0.4068, test_loss: 1.3298, test_f1: 0.6042
 epoch: 65, train_loss: 0.4176, test_loss: 1.3600, test_f1: 0.6068
 epoch: 66, train_loss: 0.3819, test_loss: 1.5039, test_f1: 0.5949
 epoch: 67, train_loss: 0.4016, test_loss: 1.4770, test_f1: 0.6096
 epoch: 68, train_loss: 0.3863, test_loss: 1.5317, test_f1: 0.6172
 epoch: 69, train_loss: 0.3575, test_loss: 1.7104, test_f1: 0.5928
 epoch: 70, train_loss: 0.4489, test_loss: 1.9023, test_f1: 0.4626
 epoch: 71, train_loss: 0.4184, test_loss: 1.7743, test_f1: 0.5868
 epoch: 72, train_loss: 0.4011, test_loss: 1.3073, test_f1: 0.6149
 epoch: 73, train_loss: 0.4902, test_loss: 1.6205, test_f1: 0.5704
 epoch: 74, train_loss: 0.4572, test_loss: 1.6638, test_f1: 0.5951
 epoch: 75, train_loss: 0.4317, test_loss: 1.7311, test_f1: 0.5086
 epoch: 76, train_loss: 0.4536, test_loss: 1.9351, test_f1: 0.5773
 epoch: 77, train_loss: 0.4280, test_loss: 1.7606, test_f1: 0.5466
 epoch: 78, train_loss: 0.4236, test_loss: 1.4183, test_f1: 0.6035
 epoch: 79, train_loss: 0.4021, test_loss: 1.4001, test_f1: 0.6571
 epoch: 80, train_loss: 0.4171, test_loss: 1.5195, test_f1: 0.6274
 epoch: 81, train_loss: 0.3816, test_loss: 1.7425, test_f1: 0.5845
 epoch: 82, train_loss: 0.3690, test_loss: 2.0530, test_f1: 0.5642
 epoch: 83, train_loss: 0.3697, test_loss: 1.9856, test_f1: 0.5069
 epoch: 84, train_loss: 0.3520, test_loss: 2.2422, test_f1: 0.4817
 epoch: 85, train_loss: 0.3558, test_loss: 2.3538, test_f1: 0.5724
 epoch: 86, train_loss: 0.3375, test_loss: 2.0496, test_f1: 0.5869
 epoch: 87, train_loss: 0.3546, test_loss: 1.7866, test_f1: 0.5679
 epoch: 88, train_loss: 0.3580, test_loss: 2.1490, test_f1: 0.5524
 epoch: 89, train_loss: 0.3314, test_loss: 1.6210, test_f1: 0.5862
 epoch: 90, train_loss: 0.3370, test_loss: 1.8338, test_f1: 0.5733
 epoch: 91, train_loss: 0.3376, test_loss: 1.8265, test_f1: 0.5951
 epoch: 92, train_loss: 0.3135, test_loss: 1.7499, test_f1: 0.6261
 epoch: 93, train_loss: 0.3153, test_loss: 1.9291, test_f1: 0.5897
 epoch: 94, train_loss: 0.3432, test_loss: 1.9725, test_f1: 0.5805
 epoch: 95, train_loss: 0.2874, test_loss: 1.8082, test_f1: 0.5899
 epoch: 96, train_loss: 0.2787, test_loss: 2.0133, test_f1: 0.5872
 epoch: 97, train_loss: 0.3082, test_loss: 1.8918, test_f1: 0.5894
 epoch: 98, train_loss: 0.3115, test_loss: 2.2530, test_f1: 0.5774
 epoch: 99, train_loss: 0.2681, test_loss: 2.3503, test_f1: 0.5699
##################ITERATION #2 ****************************************
 epoch: 0, train_loss: 1.4788, test_loss: 1.5621, test_f1: 0.1738
 epoch: 1, train_loss: 1.0468, test_loss: 1.4574, test_f1: 0.2584
 epoch: 2, train_loss: 0.9823, test_loss: 1.4880, test_f1: 0.2787
 epoch: 3, train_loss: 0.9430, test_loss: 1.4177, test_f1: 0.2483
 epoch: 4, train_loss: 0.9140, test_loss: 1.2941, test_f1: 0.3114
 epoch: 5, train_loss: 0.9022, test_loss: 1.1190, test_f1: 0.4910
 epoch: 6, train_loss: 0.8830, test_loss: 1.0833, test_f1: 0.5171
 epoch: 7, train_loss: 0.8752, test_loss: 1.0628, test_f1: 0.4619
 epoch: 8, train_loss: 0.8509, test_loss: 2.3941, test_f1: 0.4349
 epoch: 9, train_loss: 0.8622, test_loss: 0.9880, test_f1: 0.5780
 epoch: 10, train_loss: 0.8404, test_loss: 1.0387, test_f1: 0.4968
 epoch: 11, train_loss: 0.8359, test_loss: 1.2017, test_f1: 0.4730
 epoch: 12, train_loss: 0.8289, test_loss: 1.2073, test_f1: 0.4723
 epoch: 13, train_loss: 0.8050, test_loss: 1.1151, test_f1: 0.4869
 epoch: 14, train_loss: 0.7878, test_loss: 1.7877, test_f1: 0.3688
 epoch: 15, train_loss: 0.7713, test_loss: 1.9900, test_f1: 0.4270
 epoch: 16, train_loss: 0.7842, test_loss: 1.1964, test_f1: 0.4579
 epoch: 17, train_loss: 0.7564, test_loss: 1.1053, test_f1: 0.5329
 epoch: 18, train_loss: 0.7552, test_loss: 1.1068, test_f1: 0.5290
 epoch: 19, train_loss: 0.7525, test_loss: 1.4050, test_f1: 0.5105
 epoch: 20, train_loss: 0.7273, test_loss: 1.0408, test_f1: 0.5231
 epoch: 21, train_loss: 0.7064, test_loss: 1.1000, test_f1: 0.4983
 epoch: 22, train_loss: 0.7172, test_loss: 1.2382, test_f1: 0.5171
 epoch: 23, train_loss: 0.7029, test_loss: 1.0666, test_f1: 0.5837
 epoch: 24, train_loss: 0.6677, test_loss: 1.0470, test_f1: 0.6020
 epoch: 25, train_loss: 0.6697, test_loss: 1.5790, test_f1: 0.4851
 epoch: 26, train_loss: 0.6831, test_loss: 1.1852, test_f1: 0.5764
 epoch: 27, train_loss: 0.6687, test_loss: 1.6327, test_f1: 0.5408
 epoch: 28, train_loss: 0.6837, test_loss: 2.0532, test_f1: 0.5049
 epoch: 29, train_loss: 0.6520, test_loss: 1.1744, test_f1: 0.5058
 epoch: 30, train_loss: 0.6667, test_loss: 1.1195, test_f1: 0.5475
 epoch: 31, train_loss: 0.6425, test_loss: 1.1150, test_f1: 0.5411
 epoch: 32, train_loss: 0.6313, test_loss: 1.0909, test_f1: 0.5972
 epoch: 33, train_loss: 0.6397, test_loss: 1.0544, test_f1: 0.5996
 epoch: 34, train_loss: 0.6260, test_loss: 1.9393, test_f1: 0.5048
 epoch: 35, train_loss: 0.6073, test_loss: 1.3947, test_f1: 0.5452
 epoch: 36, train_loss: 0.6233, test_loss: 1.6874, test_f1: 0.5318
 epoch: 37, train_loss: 0.6209, test_loss: 1.6041, test_f1: 0.5601
 epoch: 38, train_loss: 0.6283, test_loss: 2.0353, test_f1: 0.5484
 epoch: 39, train_loss: 0.6191, test_loss: 1.2784, test_f1: 0.5535
 epoch: 40, train_loss: 0.6193, test_loss: 1.5167, test_f1: 0.5812
 epoch: 41, train_loss: 0.5843, test_loss: 1.4696, test_f1: 0.5328
 epoch: 42, train_loss: 0.5856, test_loss: 1.2235, test_f1: 0.5714
 epoch: 43, train_loss: 0.6132, test_loss: 1.1726, test_f1: 0.5965
 epoch: 44, train_loss: 0.5947, test_loss: 1.2114, test_f1: 0.5829
 epoch: 45, train_loss: 0.6000, test_loss: 2.3138, test_f1: 0.5456
 epoch: 46, train_loss: 0.6227, test_loss: 1.2139, test_f1: 0.5706
 epoch: 47, train_loss: 0.5744, test_loss: 1.9167, test_f1: 0.5586
 epoch: 48, train_loss: 0.5563, test_loss: 2.0530, test_f1: 0.5172
 epoch: 49, train_loss: 0.5433, test_loss: 1.5863, test_f1: 0.5291
 epoch: 50, train_loss: 0.6004, test_loss: 1.1628, test_f1: 0.5565
 epoch: 51, train_loss: 0.5619, test_loss: 1.2196, test_f1: 0.6171
 epoch: 52, train_loss: 0.5422, test_loss: 1.3817, test_f1: 0.5864
 epoch: 53, train_loss: 0.5354, test_loss: 1.5471, test_f1: 0.6009
 epoch: 54, train_loss: 0.5160, test_loss: 1.8518, test_f1: 0.6244
 epoch: 55, train_loss: 0.4989, test_loss: 1.5679, test_f1: 0.5792
 epoch: 56, train_loss: 0.4904, test_loss: 1.4080, test_f1: 0.5480
 epoch: 57, train_loss: 0.4679, test_loss: 1.4638, test_f1: 0.5970
 epoch: 58, train_loss: 0.4862, test_loss: 1.4084, test_f1: 0.6367
 epoch: 59, train_loss: 0.4767, test_loss: 1.9600, test_f1: 0.6208
 epoch: 60, train_loss: 0.4531, test_loss: 1.5539, test_f1: 0.6141
 epoch: 61, train_loss: 0.4516, test_loss: 1.4501, test_f1: 0.5967
 epoch: 62, train_loss: 0.4235, test_loss: 1.7547, test_f1: 0.6156
 epoch: 63, train_loss: 0.4277, test_loss: 1.7138, test_f1: 0.6184
 epoch: 64, train_loss: 0.4708, test_loss: 1.6255, test_f1: 0.5807
 epoch: 65, train_loss: 0.4505, test_loss: 1.5327, test_f1: 0.6179
 epoch: 66, train_loss: 0.4238, test_loss: 1.7931, test_f1: 0.6120
 epoch: 67, train_loss: 0.4108, test_loss: 1.8439, test_f1: 0.6074
 epoch: 68, train_loss: 0.3861, test_loss: 1.7100, test_f1: 0.6053
 epoch: 69, train_loss: 0.4221, test_loss: 2.0594, test_f1: 0.5993
 epoch: 70, train_loss: 0.4398, test_loss: 1.6414, test_f1: 0.5471
 epoch: 71, train_loss: 0.4075, test_loss: 1.5303, test_f1: 0.6389
 epoch: 72, train_loss: 0.4242, test_loss: 1.5675, test_f1: 0.5983
 epoch: 73, train_loss: 0.3913, test_loss: 1.8162, test_f1: 0.6104
 epoch: 74, train_loss: 0.3918, test_loss: 2.4523, test_f1: 0.5933
 epoch: 75, train_loss: 0.3741, test_loss: 2.2264, test_f1: 0.6135
 epoch: 76, train_loss: 0.3934, test_loss: 1.8823, test_f1: 0.6073
 epoch: 77, train_loss: 0.4058, test_loss: 1.9808, test_f1: 0.6286
 epoch: 78, train_loss: 0.3822, test_loss: 2.0215, test_f1: 0.5774
 epoch: 79, train_loss: 0.3775, test_loss: 1.8273, test_f1: 0.5504
 epoch: 80, train_loss: 0.3927, test_loss: 1.7599, test_f1: 0.6231
 epoch: 81, train_loss: 0.3654, test_loss: 1.3360, test_f1: 0.6446
 epoch: 82, train_loss: 0.3677, test_loss: 1.4356, test_f1: 0.6536
 epoch: 83, train_loss: 0.3756, test_loss: 1.5137, test_f1: 0.5955
 epoch: 84, train_loss: 0.3810, test_loss: 1.6187, test_f1: 0.5823
 epoch: 85, train_loss: 0.3610, test_loss: 1.9456, test_f1: 0.5772
 epoch: 86, train_loss: 0.3567, test_loss: 1.8864, test_f1: 0.6232
 epoch: 87, train_loss: 0.3780, test_loss: 1.7690, test_f1: 0.6111
 epoch: 88, train_loss: 0.3970, test_loss: 2.0401, test_f1: 0.5744
 epoch: 89, train_loss: 0.4093, test_loss: 2.1340, test_f1: 0.5849
 epoch: 90, train_loss: 0.4094, test_loss: 1.8498, test_f1: 0.6140
 epoch: 91, train_loss: 0.4062, test_loss: 1.7492, test_f1: 0.6128
 epoch: 92, train_loss: 0.3893, test_loss: 1.6363, test_f1: 0.6213
 epoch: 93, train_loss: 0.3662, test_loss: 2.0219, test_f1: 0.6152
 epoch: 94, train_loss: 0.3645, test_loss: 2.7659, test_f1: 0.5922
 epoch: 95, train_loss: 0.3486, test_loss: 2.4605, test_f1: 0.5934
 epoch: 96, train_loss: 0.3543, test_loss: 2.1433, test_f1: 0.6268
 epoch: 97, train_loss: 0.3426, test_loss: 1.9645, test_f1: 0.5953
 epoch: 98, train_loss: 0.3454, test_loss: 2.4980, test_f1: 0.5953
 epoch: 99, train_loss: 0.3135, test_loss: 1.9133, test_f1: 0.5989
##################ITERATION #3 ****************************************
 epoch: 0, train_loss: 1.2877, test_loss: 1.4780, test_f1: 0.2281
 epoch: 1, train_loss: 1.0292, test_loss: 1.5076, test_f1: 0.1417
 epoch: 2, train_loss: 0.9614, test_loss: 1.5564, test_f1: 0.2617
 epoch: 3, train_loss: 0.9284, test_loss: 1.4804, test_f1: 0.2187
 epoch: 4, train_loss: 0.9039, test_loss: 1.3253, test_f1: 0.3040
 epoch: 5, train_loss: 0.8889, test_loss: 1.3507, test_f1: 0.3342
 epoch: 6, train_loss: 0.8428, test_loss: 1.1040, test_f1: 0.5303
 epoch: 7, train_loss: 0.8332, test_loss: 1.0882, test_f1: 0.5083
 epoch: 8, train_loss: 0.8208, test_loss: 1.1637, test_f1: 0.5514
 epoch: 9, train_loss: 0.8287, test_loss: 1.0880, test_f1: 0.4967
 epoch: 10, train_loss: 0.8146, test_loss: 1.0776, test_f1: 0.4935
 epoch: 11, train_loss: 0.7801, test_loss: 1.0276, test_f1: 0.5929
 epoch: 12, train_loss: 0.7689, test_loss: 1.4170, test_f1: 0.3700
 epoch: 13, train_loss: 0.8217, test_loss: 1.4073, test_f1: 0.4961
 epoch: 14, train_loss: 0.7939, test_loss: 1.0976, test_f1: 0.5372
 epoch: 15, train_loss: 0.7649, test_loss: 1.0464, test_f1: 0.5642
 epoch: 16, train_loss: 0.7269, test_loss: 1.0277, test_f1: 0.5642
 epoch: 17, train_loss: 0.7253, test_loss: 1.3092, test_f1: 0.5422
 epoch: 18, train_loss: 0.7360, test_loss: 1.1122, test_f1: 0.5643
 epoch: 19, train_loss: 0.7058, test_loss: 1.1113, test_f1: 0.4873
 epoch: 20, train_loss: 0.7018, test_loss: 1.1052, test_f1: 0.5742
 epoch: 21, train_loss: 0.7121, test_loss: 1.2050, test_f1: 0.5347
 epoch: 22, train_loss: 0.7119, test_loss: 1.4628, test_f1: 0.5268
 epoch: 23, train_loss: 0.6899, test_loss: 1.5217, test_f1: 0.5144
 epoch: 24, train_loss: 0.6807, test_loss: 1.1724, test_f1: 0.5513
 epoch: 25, train_loss: 0.6630, test_loss: 1.0979, test_f1: 0.5867
 epoch: 26, train_loss: 0.6586, test_loss: 1.1445, test_f1: 0.5681
 epoch: 27, train_loss: 0.6586, test_loss: 1.1464, test_f1: 0.5560
 epoch: 28, train_loss: 0.6906, test_loss: 1.1984, test_f1: 0.5865
 epoch: 29, train_loss: 0.6703, test_loss: 1.1309, test_f1: 0.5620
 epoch: 30, train_loss: 0.6693, test_loss: 1.2780, test_f1: 0.5304
 epoch: 31, train_loss: 0.6542, test_loss: 1.2140, test_f1: 0.5205
 epoch: 32, train_loss: 0.6067, test_loss: 1.6560, test_f1: 0.4750
 epoch: 33, train_loss: 0.6323, test_loss: 1.5329, test_f1: 0.5065
 epoch: 34, train_loss: 0.6567, test_loss: 1.3394, test_f1: 0.4613
 epoch: 35, train_loss: 0.6514, test_loss: 1.2345, test_f1: 0.5707
 epoch: 36, train_loss: 0.6085, test_loss: 1.1386, test_f1: 0.5859
 epoch: 37, train_loss: 0.6370, test_loss: 1.2280, test_f1: 0.5665
 epoch: 38, train_loss: 0.6033, test_loss: 1.2735, test_f1: 0.6170
 epoch: 39, train_loss: 0.5944, test_loss: 1.3706, test_f1: 0.5472
 epoch: 40, train_loss: 0.5813, test_loss: 1.4806, test_f1: 0.5559
 epoch: 41, train_loss: 0.5499, test_loss: 1.1644, test_f1: 0.5789
 epoch: 42, train_loss: 0.5460, test_loss: 1.1244, test_f1: 0.6405
 epoch: 43, train_loss: 0.5897, test_loss: 1.1897, test_f1: 0.5362
 epoch: 44, train_loss: 0.5701, test_loss: 1.0779, test_f1: 0.5974
 epoch: 45, train_loss: 0.5441, test_loss: 1.3389, test_f1: 0.5770
 epoch: 46, train_loss: 0.5153, test_loss: 1.3146, test_f1: 0.6150
 epoch: 47, train_loss: 0.5199, test_loss: 1.5014, test_f1: 0.5586
 epoch: 48, train_loss: 0.5428, test_loss: 1.3155, test_f1: 0.6209
 epoch: 49, train_loss: 0.5438, test_loss: 1.6339, test_f1: 0.4304
 epoch: 50, train_loss: 0.5079, test_loss: 1.2814, test_f1: 0.5454
 epoch: 51, train_loss: 0.5049, test_loss: 1.0884, test_f1: 0.5833
 epoch: 52, train_loss: 0.4794, test_loss: 1.0882, test_f1: 0.6274
 epoch: 53, train_loss: 0.4651, test_loss: 1.4980, test_f1: 0.5724
 epoch: 54, train_loss: 0.4507, test_loss: 1.6262, test_f1: 0.5277
 epoch: 55, train_loss: 0.4386, test_loss: 1.3684, test_f1: 0.5625
 epoch: 56, train_loss: 0.4660, test_loss: 1.4876, test_f1: 0.5559
 epoch: 57, train_loss: 0.4267, test_loss: 1.6608, test_f1: 0.5944
 epoch: 58, train_loss: 0.4331, test_loss: 2.0936, test_f1: 0.5418
 epoch: 59, train_loss: 0.4347, test_loss: 1.6260, test_f1: 0.5859
 epoch: 60, train_loss: 0.4263, test_loss: 1.3806, test_f1: 0.5849
 epoch: 61, train_loss: 0.4291, test_loss: 1.3081, test_f1: 0.6365
 epoch: 62, train_loss: 0.4132, test_loss: 1.5978, test_f1: 0.5982
 epoch: 63, train_loss: 0.4090, test_loss: 1.4623, test_f1: 0.5853
 epoch: 64, train_loss: 0.4212, test_loss: 1.2752, test_f1: 0.6177
 epoch: 65, train_loss: 0.4084, test_loss: 1.2401, test_f1: 0.6084
 epoch: 66, train_loss: 0.4297, test_loss: 1.1921, test_f1: 0.6091
 epoch: 67, train_loss: 0.4093, test_loss: 1.2397, test_f1: 0.5975
 epoch: 68, train_loss: 0.4733, test_loss: 1.2642, test_f1: 0.6462
 epoch: 69, train_loss: 0.4319, test_loss: 1.1186, test_f1: 0.6601
 epoch: 70, train_loss: 0.4138, test_loss: 1.1544, test_f1: 0.6388
 epoch: 71, train_loss: 0.4304, test_loss: 1.3483, test_f1: 0.6359
 epoch: 72, train_loss: 0.3902, test_loss: 1.3144, test_f1: 0.6399
 epoch: 73, train_loss: 0.3904, test_loss: 1.8829, test_f1: 0.5530
 epoch: 74, train_loss: 0.4015, test_loss: 1.5584, test_f1: 0.5782
 epoch: 75, train_loss: 0.4127, test_loss: 1.4795, test_f1: 0.6220
 epoch: 76, train_loss: 0.4242, test_loss: 1.2597, test_f1: 0.6105
 epoch: 77, train_loss: 0.4268, test_loss: 1.3248, test_f1: 0.6398
 epoch: 78, train_loss: 0.4214, test_loss: 1.4187, test_f1: 0.6021
 epoch: 79, train_loss: 0.4179, test_loss: 2.1577, test_f1: 0.4665
 epoch: 80, train_loss: 0.4321, test_loss: 1.6032, test_f1: 0.5585
 epoch: 81, train_loss: 0.3971, test_loss: 1.2394, test_f1: 0.5791
 epoch: 82, train_loss: 0.3738, test_loss: 1.2546, test_f1: 0.6170
 epoch: 83, train_loss: 0.3716, test_loss: 1.2593, test_f1: 0.6269
 epoch: 84, train_loss: 0.3691, test_loss: 1.3154, test_f1: 0.6218
 epoch: 85, train_loss: 0.3330, test_loss: 1.3802, test_f1: 0.6271
 epoch: 86, train_loss: 0.3649, test_loss: 1.4907, test_f1: 0.5935
 epoch: 87, train_loss: 0.3412, test_loss: 1.4695, test_f1: 0.6023
 epoch: 88, train_loss: 0.3293, test_loss: 1.5149, test_f1: 0.5726
 epoch: 89, train_loss: 0.3568, test_loss: 1.5046, test_f1: 0.5905
 epoch: 90, train_loss: 0.3561, test_loss: 1.8139, test_f1: 0.5846
 epoch: 91, train_loss: 0.4073, test_loss: 1.9461, test_f1: 0.5486
 epoch: 92, train_loss: 0.4089, test_loss: 1.6838, test_f1: 0.5879
 epoch: 93, train_loss: 0.3980, test_loss: 2.2938, test_f1: 0.5497
 epoch: 94, train_loss: 0.3508, test_loss: 1.6214, test_f1: 0.5938
 epoch: 95, train_loss: 0.3489, test_loss: 1.5359, test_f1: 0.6035
 epoch: 96, train_loss: 0.3268, test_loss: 1.5594, test_f1: 0.5956
 epoch: 97, train_loss: 0.3069, test_loss: 1.7901, test_f1: 0.6043
 epoch: 98, train_loss: 0.3534, test_loss: 1.7250, test_f1: 0.5657
 epoch: 99, train_loss: 0.3754, test_loss: 1.3958, test_f1: 0.6216
##################ITERATION #4 ****************************************
 epoch: 0, train_loss: 1.5187, test_loss: 1.5652, test_f1: 0.1824
 epoch: 1, train_loss: 1.1399, test_loss: 1.4553, test_f1: 0.2281
 epoch: 2, train_loss: 0.9873, test_loss: 1.3094, test_f1: 0.3230
 epoch: 3, train_loss: 0.9399, test_loss: 1.2237, test_f1: 0.4557
 epoch: 4, train_loss: 0.9068, test_loss: 1.1224, test_f1: 0.5285
 epoch: 5, train_loss: 0.8900, test_loss: 1.0750, test_f1: 0.5365
 epoch: 6, train_loss: 0.8542, test_loss: 1.0840, test_f1: 0.4803
 epoch: 7, train_loss: 0.8470, test_loss: 1.2495, test_f1: 0.3863
 epoch: 8, train_loss: 0.8392, test_loss: 0.9912, test_f1: 0.5546
 epoch: 9, train_loss: 0.8171, test_loss: 1.0318, test_f1: 0.5510
 epoch: 10, train_loss: 0.8127, test_loss: 1.0245, test_f1: 0.5764
 epoch: 11, train_loss: 0.7977, test_loss: 1.0796, test_f1: 0.5525
 epoch: 12, train_loss: 0.7854, test_loss: 1.0769, test_f1: 0.5963
 epoch: 13, train_loss: 0.7654, test_loss: 1.0062, test_f1: 0.5772
 epoch: 14, train_loss: 0.7564, test_loss: 1.0015, test_f1: 0.6248
 epoch: 15, train_loss: 0.7473, test_loss: 1.0949, test_f1: 0.5477
 epoch: 16, train_loss: 0.7477, test_loss: 1.5029, test_f1: 0.4020
 epoch: 17, train_loss: 0.7427, test_loss: 1.0071, test_f1: 0.5766
 epoch: 18, train_loss: 0.7284, test_loss: 1.1515, test_f1: 0.5409
 epoch: 19, train_loss: 0.7254, test_loss: 1.0562, test_f1: 0.5485
 epoch: 20, train_loss: 0.7080, test_loss: 1.0558, test_f1: 0.5759
 epoch: 21, train_loss: 0.7223, test_loss: 1.2063, test_f1: 0.5989
 epoch: 22, train_loss: 0.7393, test_loss: 1.1465, test_f1: 0.5766
 epoch: 23, train_loss: 0.6988, test_loss: 1.2039, test_f1: 0.5891
 epoch: 24, train_loss: 0.7027, test_loss: 1.1231, test_f1: 0.5645
 epoch: 25, train_loss: 0.6605, test_loss: 1.1134, test_f1: 0.5598
 epoch: 26, train_loss: 0.6750, test_loss: 1.1357, test_f1: 0.5641
 epoch: 27, train_loss: 0.6424, test_loss: 1.4231, test_f1: 0.5215
 epoch: 28, train_loss: 0.6398, test_loss: 1.2883, test_f1: 0.4958
 epoch: 29, train_loss: 0.6525, test_loss: 1.2807, test_f1: 0.4615
 epoch: 30, train_loss: 0.6754, test_loss: 1.1431, test_f1: 0.5537
 epoch: 31, train_loss: 0.6674, test_loss: 1.2189, test_f1: 0.5451
 epoch: 32, train_loss: 0.6273, test_loss: 1.2520, test_f1: 0.5262
 epoch: 33, train_loss: 0.6338, test_loss: 1.2454, test_f1: 0.4899
 epoch: 34, train_loss: 0.6159, test_loss: 1.2479, test_f1: 0.5404
 epoch: 35, train_loss: 0.6359, test_loss: 1.2078, test_f1: 0.5701
 epoch: 36, train_loss: 0.6265, test_loss: 1.1882, test_f1: 0.5753
 epoch: 37, train_loss: 0.5879, test_loss: 1.3282, test_f1: 0.5061
 epoch: 38, train_loss: 0.6190, test_loss: 1.1667, test_f1: 0.5976
 epoch: 39, train_loss: 0.5953, test_loss: 1.3494, test_f1: 0.4929
 epoch: 40, train_loss: 0.5823, test_loss: 1.4733, test_f1: 0.4377
 epoch: 41, train_loss: 0.5687, test_loss: 1.3371, test_f1: 0.5492
 epoch: 42, train_loss: 0.5999, test_loss: 1.0287, test_f1: 0.6147
 epoch: 43, train_loss: 0.5900, test_loss: 1.3122, test_f1: 0.5455
 epoch: 44, train_loss: 0.5813, test_loss: 1.6788, test_f1: 0.5253
 epoch: 45, train_loss: 0.5542, test_loss: 1.1653, test_f1: 0.6307
 epoch: 46, train_loss: 0.5667, test_loss: 1.0646, test_f1: 0.6155
 epoch: 47, train_loss: 0.5277, test_loss: 2.0527, test_f1: 0.5021
 epoch: 48, train_loss: 0.5345, test_loss: 1.3639, test_f1: 0.5498
 epoch: 49, train_loss: 0.5406, test_loss: 1.3248, test_f1: 0.5455
 epoch: 50, train_loss: 0.5435, test_loss: 1.1723, test_f1: 0.5544
 epoch: 51, train_loss: 0.5631, test_loss: 1.2226, test_f1: 0.5940
 epoch: 52, train_loss: 0.5078, test_loss: 1.1861, test_f1: 0.5978
 epoch: 53, train_loss: 0.4882, test_loss: 1.1621, test_f1: 0.6387
 epoch: 54, train_loss: 0.4713, test_loss: 1.2825, test_f1: 0.6049
 epoch: 55, train_loss: 0.4544, test_loss: 1.2138, test_f1: 0.5991
 epoch: 56, train_loss: 0.4508, test_loss: 1.2155, test_f1: 0.6543
 epoch: 57, train_loss: 0.4311, test_loss: 1.3233, test_f1: 0.5599
 epoch: 58, train_loss: 0.4730, test_loss: 1.2498, test_f1: 0.6049
 epoch: 59, train_loss: 0.4447, test_loss: 1.2850, test_f1: 0.5819
 epoch: 60, train_loss: 0.4451, test_loss: 1.2607, test_f1: 0.5995
 epoch: 61, train_loss: 0.4754, test_loss: 1.1589, test_f1: 0.6046
 epoch: 62, train_loss: 0.4701, test_loss: 1.3328, test_f1: 0.6316
 epoch: 63, train_loss: 0.4528, test_loss: 1.9195, test_f1: 0.5097
 epoch: 64, train_loss: 0.4193, test_loss: 1.5722, test_f1: 0.5548
 epoch: 65, train_loss: 0.4161, test_loss: 1.3934, test_f1: 0.6276
 epoch: 66, train_loss: 0.4169, test_loss: 1.2329, test_f1: 0.6467
 epoch: 67, train_loss: 0.4037, test_loss: 1.3489, test_f1: 0.6258
 epoch: 68, train_loss: 0.3974, test_loss: 1.5562, test_f1: 0.5774
 epoch: 69, train_loss: 0.4060, test_loss: 1.4052, test_f1: 0.6354
 epoch: 70, train_loss: 0.3777, test_loss: 1.3926, test_f1: 0.5874
 epoch: 71, train_loss: 0.3685, test_loss: 1.4629, test_f1: 0.5904
 epoch: 72, train_loss: 0.3621, test_loss: 1.5994, test_f1: 0.6090
 epoch: 73, train_loss: 0.3712, test_loss: 1.6459, test_f1: 0.6121
 epoch: 74, train_loss: 0.3617, test_loss: 1.5554, test_f1: 0.6076
 epoch: 75, train_loss: 0.3904, test_loss: 1.8152, test_f1: 0.5543
 epoch: 76, train_loss: 0.3989, test_loss: 1.8116, test_f1: 0.5642
 epoch: 77, train_loss: 0.3874, test_loss: 1.7463, test_f1: 0.5680
 epoch: 78, train_loss: 0.3907, test_loss: 1.7538, test_f1: 0.6243
 epoch: 79, train_loss: 0.3750, test_loss: 1.8483, test_f1: 0.5950
 epoch: 80, train_loss: 0.3869, test_loss: 2.2623, test_f1: 0.5173
 epoch: 81, train_loss: 0.3507, test_loss: 2.0222, test_f1: 0.5826
 epoch: 82, train_loss: 0.3316, test_loss: 1.4974, test_f1: 0.6551
 epoch: 83, train_loss: 0.3511, test_loss: 1.6318, test_f1: 0.5957
 epoch: 84, train_loss: 0.3599, test_loss: 2.0197, test_f1: 0.5175
 epoch: 85, train_loss: 0.3495, test_loss: 1.7423, test_f1: 0.5748
 epoch: 86, train_loss: 0.3420, test_loss: 1.7694, test_f1: 0.5946
 epoch: 87, train_loss: 0.3823, test_loss: 1.7909, test_f1: 0.6307
 epoch: 88, train_loss: 0.4075, test_loss: 1.8126, test_f1: 0.5877
 epoch: 89, train_loss: 0.3885, test_loss: 1.4452, test_f1: 0.5977
 epoch: 90, train_loss: 0.4112, test_loss: 1.6872, test_f1: 0.6147
 epoch: 91, train_loss: 0.3702, test_loss: 1.8463, test_f1: 0.6041
 epoch: 92, train_loss: 0.4119, test_loss: 1.8764, test_f1: 0.6313
 epoch: 93, train_loss: 0.3589, test_loss: 2.1746, test_f1: 0.5945
 epoch: 94, train_loss: 0.3543, test_loss: 1.6742, test_f1: 0.6493
 epoch: 95, train_loss: 0.3680, test_loss: 1.7912, test_f1: 0.6034
 epoch: 96, train_loss: 0.3909, test_loss: 2.3760, test_f1: 0.4937
 epoch: 97, train_loss: 0.3630, test_loss: 1.7130, test_f1: 0.5699
 epoch: 98, train_loss: 0.3745, test_loss: 1.5391, test_f1: 0.6382
 epoch: 99, train_loss: 0.3713, test_loss: 1.5299, test_f1: 0.6132
##################ITERATION #5 ****************************************
 epoch: 0, train_loss: 1.6055, test_loss: 1.5192, test_f1: 0.1365
 epoch: 1, train_loss: 1.0235, test_loss: 1.4391, test_f1: 0.2281
 epoch: 2, train_loss: 0.9565, test_loss: 1.4258, test_f1: 0.2851
 epoch: 3, train_loss: 0.9120, test_loss: 1.3051, test_f1: 0.3938
 epoch: 4, train_loss: 0.8762, test_loss: 1.3335, test_f1: 0.3055
 epoch: 5, train_loss: 0.8539, test_loss: 1.1641, test_f1: 0.4593
 epoch: 6, train_loss: 0.8318, test_loss: 1.1979, test_f1: 0.4050
 epoch: 7, train_loss: 0.7950, test_loss: 1.2853, test_f1: 0.3848
 epoch: 8, train_loss: 0.7833, test_loss: 1.7296, test_f1: 0.2625
 epoch: 9, train_loss: 0.7931, test_loss: 1.4362, test_f1: 0.3883
 epoch: 10, train_loss: 0.8311, test_loss: 1.2360, test_f1: 0.4217
 epoch: 11, train_loss: 0.8299, test_loss: 1.7961, test_f1: 0.3897
 epoch: 12, train_loss: 0.7894, test_loss: 1.0262, test_f1: 0.5612
 epoch: 13, train_loss: 0.7480, test_loss: 1.0841, test_f1: 0.4831
 epoch: 14, train_loss: 0.7309, test_loss: 1.1636, test_f1: 0.5121
 epoch: 15, train_loss: 0.7300, test_loss: 1.2467, test_f1: 0.4714
 epoch: 16, train_loss: 0.7063, test_loss: 1.0358, test_f1: 0.6009
 epoch: 17, train_loss: 0.7026, test_loss: 1.1674, test_f1: 0.4981
 epoch: 18, train_loss: 0.6821, test_loss: 1.0398, test_f1: 0.5302
 epoch: 19, train_loss: 0.6737, test_loss: 1.0839, test_f1: 0.5299
 epoch: 20, train_loss: 0.6868, test_loss: 1.2403, test_f1: 0.5400
 epoch: 21, train_loss: 0.6505, test_loss: 2.0343, test_f1: 0.3733
 epoch: 22, train_loss: 0.7430, test_loss: 1.1411, test_f1: 0.5566
 epoch: 23, train_loss: 0.7427, test_loss: 1.3775, test_f1: 0.4585
 epoch: 24, train_loss: 0.6998, test_loss: 1.1534, test_f1: 0.5705
 epoch: 25, train_loss: 0.6738, test_loss: 1.2786, test_f1: 0.5500
 epoch: 26, train_loss: 0.6676, test_loss: 1.0972, test_f1: 0.5294
 epoch: 27, train_loss: 0.6652, test_loss: 1.2154, test_f1: 0.4872
 epoch: 28, train_loss: 0.6453, test_loss: 1.8575, test_f1: 0.4564
 epoch: 29, train_loss: 0.6630, test_loss: 1.3797, test_f1: 0.4773
 epoch: 30, train_loss: 0.6224, test_loss: 1.3083, test_f1: 0.4890
 epoch: 31, train_loss: 0.6363, test_loss: 1.2146, test_f1: 0.5249
 epoch: 32, train_loss: 0.6246, test_loss: 1.0877, test_f1: 0.5601
 epoch: 33, train_loss: 0.6305, test_loss: 1.1721, test_f1: 0.5295
 epoch: 34, train_loss: 0.6214, test_loss: 1.0148, test_f1: 0.5756
 epoch: 35, train_loss: 0.6096, test_loss: 1.2849, test_f1: 0.5227
 epoch: 36, train_loss: 0.5978, test_loss: 1.1737, test_f1: 0.5873
 epoch: 37, train_loss: 0.5783, test_loss: 1.1825, test_f1: 0.5462
 epoch: 38, train_loss: 0.6038, test_loss: 1.2339, test_f1: 0.5534
 epoch: 39, train_loss: 0.6175, test_loss: 1.2267, test_f1: 0.4800
 epoch: 40, train_loss: 0.5771, test_loss: 1.6283, test_f1: 0.4963
 epoch: 41, train_loss: 0.5762, test_loss: 1.7018, test_f1: 0.4790
 epoch: 42, train_loss: 0.5759, test_loss: 2.4439, test_f1: 0.4613
 epoch: 43, train_loss: 0.5654, test_loss: 2.0712, test_f1: 0.5137
 epoch: 44, train_loss: 0.6372, test_loss: 1.7046, test_f1: 0.5016
 epoch: 45, train_loss: 0.6046, test_loss: 1.4227, test_f1: 0.5206
 epoch: 46, train_loss: 0.5627, test_loss: 1.3583, test_f1: 0.5100
 epoch: 47, train_loss: 0.6392, test_loss: 1.1833, test_f1: 0.5424
 epoch: 48, train_loss: 0.5553, test_loss: 1.2215, test_f1: 0.5676
 epoch: 49, train_loss: 0.5312, test_loss: 1.3289, test_f1: 0.5882
 epoch: 50, train_loss: 0.5049, test_loss: 1.2774, test_f1: 0.6419
 epoch: 51, train_loss: 0.4776, test_loss: 1.3755, test_f1: 0.6083
 epoch: 52, train_loss: 0.4998, test_loss: 1.7753, test_f1: 0.5565
 epoch: 53, train_loss: 0.4937, test_loss: 1.3308, test_f1: 0.5568
 epoch: 54, train_loss: 0.4759, test_loss: 1.3681, test_f1: 0.5696
 epoch: 55, train_loss: 0.4758, test_loss: 1.4069, test_f1: 0.5713
 epoch: 56, train_loss: 0.4670, test_loss: 1.4138, test_f1: 0.5725
 epoch: 57, train_loss: 0.4406, test_loss: 1.4127, test_f1: 0.5975
 epoch: 58, train_loss: 0.4273, test_loss: 1.5907, test_f1: 0.5913
 epoch: 59, train_loss: 0.4315, test_loss: 1.4487, test_f1: 0.6337
 epoch: 60, train_loss: 0.4196, test_loss: 1.3584, test_f1: 0.5758
 epoch: 61, train_loss: 0.4031, test_loss: 1.4860, test_f1: 0.5524
 epoch: 62, train_loss: 0.4481, test_loss: 1.5940, test_f1: 0.5786
 epoch: 63, train_loss: 0.4183, test_loss: 1.7410, test_f1: 0.5758
 epoch: 64, train_loss: 0.4335, test_loss: 1.6581, test_f1: 0.5533
 epoch: 65, train_loss: 0.4181, test_loss: 1.7655, test_f1: 0.5106
 epoch: 66, train_loss: 0.4068, test_loss: 1.5439, test_f1: 0.5880
 epoch: 67, train_loss: 0.4142, test_loss: 1.4458, test_f1: 0.6065
 epoch: 68, train_loss: 0.4117, test_loss: 1.5222, test_f1: 0.5616
 epoch: 69, train_loss: 0.3919, test_loss: 1.8159, test_f1: 0.5458
 epoch: 70, train_loss: 0.3921, test_loss: 1.5781, test_f1: 0.5664
 epoch: 71, train_loss: 0.4068, test_loss: 1.6676, test_f1: 0.5723
 epoch: 72, train_loss: 0.3991, test_loss: 1.7115, test_f1: 0.5776
 epoch: 73, train_loss: 0.3786, test_loss: 1.8674, test_f1: 0.5609
 epoch: 74, train_loss: 0.3734, test_loss: 1.8864, test_f1: 0.5693
 epoch: 75, train_loss: 0.3701, test_loss: 1.6332, test_f1: 0.5955
 epoch: 76, train_loss: 0.3836, test_loss: 1.4918, test_f1: 0.5626
 epoch: 77, train_loss: 0.3869, test_loss: 1.5123, test_f1: 0.5759
 epoch: 78, train_loss: 0.3744, test_loss: 1.7644, test_f1: 0.5742
 epoch: 79, train_loss: 0.3795, test_loss: 1.9348, test_f1: 0.5825
 epoch: 80, train_loss: 0.3938, test_loss: 1.7003, test_f1: 0.6113
 epoch: 81, train_loss: 0.4383, test_loss: 1.6848, test_f1: 0.6127
 epoch: 82, train_loss: 0.4388, test_loss: 1.6653, test_f1: 0.5989
 epoch: 83, train_loss: 0.4275, test_loss: 1.5163, test_f1: 0.5739
 epoch: 84, train_loss: 0.3718, test_loss: 1.5535, test_f1: 0.5707
 epoch: 85, train_loss: 0.3738, test_loss: 1.7533, test_f1: 0.5437
 epoch: 86, train_loss: 0.3675, test_loss: 1.8243, test_f1: 0.5912
 epoch: 87, train_loss: 0.3365, test_loss: 1.6737, test_f1: 0.5818
 epoch: 88, train_loss: 0.3417, test_loss: 1.7135, test_f1: 0.6422
 epoch: 89, train_loss: 0.3749, test_loss: 1.7787, test_f1: 0.6106
 epoch: 90, train_loss: 0.4037, test_loss: 2.1572, test_f1: 0.6018
 epoch: 91, train_loss: 0.4065, test_loss: 1.9906, test_f1: 0.5475
 epoch: 92, train_loss: 0.3591, test_loss: 1.7036, test_f1: 0.5974
 epoch: 93, train_loss: 0.3597, test_loss: 2.4736, test_f1: 0.5208
 epoch: 94, train_loss: 0.3627, test_loss: 2.6074, test_f1: 0.4985
 epoch: 95, train_loss: 0.3628, test_loss: 1.7640, test_f1: 0.5591
 epoch: 96, train_loss: 0.3471, test_loss: 1.9498, test_f1: 0.5459
 epoch: 97, train_loss: 0.3480, test_loss: 1.9598, test_f1: 0.5997
 epoch: 98, train_loss: 0.3438, test_loss: 2.0984, test_f1: 0.6151
 epoch: 99, train_loss: 0.3187, test_loss: 2.2412, test_f1: 0.6191
##################ITERATION #6 ****************************************
 epoch: 0, train_loss: 1.7394, test_loss: 1.7091, test_f1: 0.1844
 epoch: 1, train_loss: 1.0854, test_loss: 1.5230, test_f1: 0.1365
 epoch: 2, train_loss: 1.0056, test_loss: 1.4431, test_f1: 0.1459
 epoch: 3, train_loss: 0.9646, test_loss: 1.3454, test_f1: 0.3476
 epoch: 4, train_loss: 0.9356, test_loss: 1.2103, test_f1: 0.4429
 epoch: 5, train_loss: 0.9283, test_loss: 1.1178, test_f1: 0.4740
 epoch: 6, train_loss: 0.8863, test_loss: 1.0909, test_f1: 0.4881
 epoch: 7, train_loss: 0.8859, test_loss: 1.0488, test_f1: 0.5229
 epoch: 8, train_loss: 0.8683, test_loss: 1.0566, test_f1: 0.4882
 epoch: 9, train_loss: 0.8363, test_loss: 1.3656, test_f1: 0.4514
 epoch: 10, train_loss: 0.8328, test_loss: 1.2120, test_f1: 0.4336
 epoch: 11, train_loss: 0.8106, test_loss: 1.5721, test_f1: 0.4532
 epoch: 12, train_loss: 0.8098, test_loss: 1.2649, test_f1: 0.4050
 epoch: 13, train_loss: 0.7983, test_loss: 1.5339, test_f1: 0.4551
 epoch: 14, train_loss: 0.8108, test_loss: 1.0535, test_f1: 0.5900
 epoch: 15, train_loss: 0.7867, test_loss: 1.1262, test_f1: 0.5343
 epoch: 16, train_loss: 0.7762, test_loss: 1.1418, test_f1: 0.5235
 epoch: 17, train_loss: 0.7520, test_loss: 1.2521, test_f1: 0.5617
 epoch: 18, train_loss: 0.7366, test_loss: 1.0778, test_f1: 0.5651
 epoch: 19, train_loss: 0.7388, test_loss: 1.1006, test_f1: 0.5376
 epoch: 20, train_loss: 0.7344, test_loss: 1.4067, test_f1: 0.5051
 epoch: 21, train_loss: 0.7337, test_loss: 1.3941, test_f1: 0.4676
 epoch: 22, train_loss: 0.7740, test_loss: 1.1337, test_f1: 0.5538
 epoch: 23, train_loss: 0.7940, test_loss: 1.2886, test_f1: 0.4677
 epoch: 24, train_loss: 0.7896, test_loss: 1.4507, test_f1: 0.4274
 epoch: 25, train_loss: 0.7458, test_loss: 1.3907, test_f1: 0.4635
 epoch: 26, train_loss: 0.7373, test_loss: 1.1825, test_f1: 0.5592
 epoch: 27, train_loss: 0.7188, test_loss: 1.2404, test_f1: 0.5978
 epoch: 28, train_loss: 0.6933, test_loss: 1.3666, test_f1: 0.5789
 epoch: 29, train_loss: 0.6859, test_loss: 1.2142, test_f1: 0.5150
 epoch: 30, train_loss: 0.6427, test_loss: 1.2484, test_f1: 0.5305
 epoch: 31, train_loss: 0.6687, test_loss: 1.5623, test_f1: 0.5207
 epoch: 32, train_loss: 0.6805, test_loss: 1.4090, test_f1: 0.4889
 epoch: 33, train_loss: 0.6472, test_loss: 1.3887, test_f1: 0.5318
 epoch: 34, train_loss: 0.6386, test_loss: 1.1361, test_f1: 0.5718
 epoch: 35, train_loss: 0.6215, test_loss: 1.1518, test_f1: 0.5796
 epoch: 36, train_loss: 0.6724, test_loss: 1.4430, test_f1: 0.4942
 epoch: 37, train_loss: 0.6666, test_loss: 1.3164, test_f1: 0.5353
 epoch: 38, train_loss: 0.6613, test_loss: 1.1139, test_f1: 0.5757
 epoch: 39, train_loss: 0.6320, test_loss: 1.2368, test_f1: 0.5399
 epoch: 40, train_loss: 0.6172, test_loss: 1.8270, test_f1: 0.4877
 epoch: 41, train_loss: 0.6870, test_loss: 1.9160, test_f1: 0.5349
 epoch: 42, train_loss: 0.6569, test_loss: 1.3129, test_f1: 0.5162
 epoch: 43, train_loss: 0.6303, test_loss: 1.1919, test_f1: 0.5742
 epoch: 44, train_loss: 0.6309, test_loss: 1.0448, test_f1: 0.6146
 epoch: 45, train_loss: 0.6284, test_loss: 1.1807, test_f1: 0.4626
 epoch: 46, train_loss: 0.6121, test_loss: 1.1947, test_f1: 0.5844
 epoch: 47, train_loss: 0.5861, test_loss: 1.2473, test_f1: 0.5709
 epoch: 48, train_loss: 0.5841, test_loss: 1.1716, test_f1: 0.6340
 epoch: 49, train_loss: 0.5556, test_loss: 1.2687, test_f1: 0.6382
 epoch: 50, train_loss: 0.5663, test_loss: 1.7292, test_f1: 0.5745
 epoch: 51, train_loss: 0.5408, test_loss: 1.5255, test_f1: 0.6015
 epoch: 52, train_loss: 0.5162, test_loss: 1.5297, test_f1: 0.6120
 epoch: 53, train_loss: 0.4999, test_loss: 1.5680, test_f1: 0.6177
 epoch: 54, train_loss: 0.5172, test_loss: 1.3215, test_f1: 0.6433
 epoch: 55, train_loss: 0.4979, test_loss: 1.2826, test_f1: 0.6394
 epoch: 56, train_loss: 0.5737, test_loss: 1.2300, test_f1: 0.6477
 epoch: 57, train_loss: 0.5075, test_loss: 1.0609, test_f1: 0.6508
 epoch: 58, train_loss: 0.5036, test_loss: 1.1603, test_f1: 0.6687
 epoch: 59, train_loss: 0.5070, test_loss: 1.1991, test_f1: 0.6364
 epoch: 60, train_loss: 0.5074, test_loss: 1.1557, test_f1: 0.6603
 epoch: 61, train_loss: 0.4948, test_loss: 1.2030, test_f1: 0.6427
 epoch: 62, train_loss: 0.4503, test_loss: 1.1374, test_f1: 0.6287
 epoch: 63, train_loss: 0.4584, test_loss: 1.2770, test_f1: 0.6074
 epoch: 64, train_loss: 0.4522, test_loss: 1.2794, test_f1: 0.6687
 epoch: 65, train_loss: 0.4397, test_loss: 1.2966, test_f1: 0.6539
 epoch: 66, train_loss: 0.4649, test_loss: 1.6520, test_f1: 0.5591
 epoch: 67, train_loss: 0.4674, test_loss: 1.3733, test_f1: 0.6133
 epoch: 68, train_loss: 0.4322, test_loss: 1.4109, test_f1: 0.6140
 epoch: 69, train_loss: 0.4720, test_loss: 1.2236, test_f1: 0.6156
 epoch: 70, train_loss: 0.4389, test_loss: 1.2306, test_f1: 0.6656
 epoch: 71, train_loss: 0.4480, test_loss: 1.2939, test_f1: 0.6075
 epoch: 72, train_loss: 0.4690, test_loss: 1.7731, test_f1: 0.6058
 epoch: 73, train_loss: 0.4127, test_loss: 1.9272, test_f1: 0.6194
 epoch: 74, train_loss: 0.4481, test_loss: 1.7062, test_f1: 0.5697
 epoch: 75, train_loss: 0.4208, test_loss: 1.6084, test_f1: 0.6040
 epoch: 76, train_loss: 0.4316, test_loss: 1.4548, test_f1: 0.5941
 epoch: 77, train_loss: 0.4372, test_loss: 1.4256, test_f1: 0.6045
 epoch: 78, train_loss: 0.4403, test_loss: 1.4148, test_f1: 0.6161
 epoch: 79, train_loss: 0.4659, test_loss: 1.6518, test_f1: 0.6056
 epoch: 80, train_loss: 0.4395, test_loss: 1.6870, test_f1: 0.5513
 epoch: 81, train_loss: 0.4173, test_loss: 1.6033, test_f1: 0.6070
 epoch: 82, train_loss: 0.4298, test_loss: 1.9849, test_f1: 0.5445
 epoch: 83, train_loss: 0.4365, test_loss: 1.8970, test_f1: 0.5620
 epoch: 84, train_loss: 0.4224, test_loss: 1.6500, test_f1: 0.5634
 epoch: 85, train_loss: 0.4313, test_loss: 1.4642, test_f1: 0.5889
 epoch: 86, train_loss: 0.4077, test_loss: 1.6365, test_f1: 0.5649
 epoch: 87, train_loss: 0.4106, test_loss: 1.7578, test_f1: 0.6124
 epoch: 88, train_loss: 0.4169, test_loss: 1.8884, test_f1: 0.6016
 epoch: 89, train_loss: 0.4039, test_loss: 1.4978, test_f1: 0.6305
 epoch: 90, train_loss: 0.4207, test_loss: 1.6849, test_f1: 0.5876
 epoch: 91, train_loss: 0.4265, test_loss: 1.9665, test_f1: 0.5349
 epoch: 92, train_loss: 0.4172, test_loss: 2.0489, test_f1: 0.5707
 epoch: 93, train_loss: 0.4168, test_loss: 1.6012, test_f1: 0.6652
 epoch: 94, train_loss: 0.4436, test_loss: 1.7377, test_f1: 0.6062
 epoch: 95, train_loss: 0.4326, test_loss: 1.7118, test_f1: 0.6193
 epoch: 96, train_loss: 0.4024, test_loss: 1.8707, test_f1: 0.6033
 epoch: 97, train_loss: 0.3803, test_loss: 1.7950, test_f1: 0.6249
 epoch: 98, train_loss: 0.3549, test_loss: 1.7323, test_f1: 0.6057
 epoch: 99, train_loss: 0.3590, test_loss: 1.8168, test_f1: 0.5565
##################ITERATION #7 ****************************************
 epoch: 0, train_loss: 1.7698, test_loss: 1.7272, test_f1: 0.3224
 epoch: 1, train_loss: 1.0204, test_loss: 1.2800, test_f1: 0.2722
 epoch: 2, train_loss: 0.9692, test_loss: 1.2955, test_f1: 0.2837
 epoch: 3, train_loss: 0.9397, test_loss: 1.2807, test_f1: 0.2744
 epoch: 4, train_loss: 0.9148, test_loss: 1.2809, test_f1: 0.3469
 epoch: 5, train_loss: 0.8889, test_loss: 1.6075, test_f1: 0.2492
 epoch: 6, train_loss: 0.8714, test_loss: 1.2939, test_f1: 0.4459
 epoch: 7, train_loss: 0.8441, test_loss: 1.1242, test_f1: 0.4940
 epoch: 8, train_loss: 0.8613, test_loss: 1.0894, test_f1: 0.5413
 epoch: 9, train_loss: 0.8527, test_loss: 1.0992, test_f1: 0.5115
 epoch: 10, train_loss: 0.8358, test_loss: 1.0803, test_f1: 0.5069
 epoch: 11, train_loss: 0.8103, test_loss: 1.1361, test_f1: 0.4571
 epoch: 12, train_loss: 0.7939, test_loss: 1.0499, test_f1: 0.5634
 epoch: 13, train_loss: 0.7827, test_loss: 1.2877, test_f1: 0.5127
 epoch: 14, train_loss: 0.7859, test_loss: 1.2185, test_f1: 0.5318
 epoch: 15, train_loss: 0.8009, test_loss: 1.4070, test_f1: 0.4440
 epoch: 16, train_loss: 0.7637, test_loss: 1.1874, test_f1: 0.4220
 epoch: 17, train_loss: 0.7294, test_loss: 1.7323, test_f1: 0.4189
 epoch: 18, train_loss: 0.7380, test_loss: 1.1217, test_f1: 0.5431
 epoch: 19, train_loss: 0.7273, test_loss: 1.0590, test_f1: 0.5622
 epoch: 20, train_loss: 0.7178, test_loss: 1.9425, test_f1: 0.3252
 epoch: 21, train_loss: 0.7269, test_loss: 1.0608, test_f1: 0.5747
 epoch: 22, train_loss: 0.7353, test_loss: 1.0284, test_f1: 0.5319
 epoch: 23, train_loss: 0.6905, test_loss: 1.1083, test_f1: 0.5495
 epoch: 24, train_loss: 0.6566, test_loss: 1.0436, test_f1: 0.5865
 epoch: 25, train_loss: 0.6977, test_loss: 1.1805, test_f1: 0.5217
 epoch: 26, train_loss: 0.6581, test_loss: 1.1264, test_f1: 0.4351
 epoch: 27, train_loss: 0.7138, test_loss: 1.1013, test_f1: 0.5478
 epoch: 28, train_loss: 0.6783, test_loss: 1.6063, test_f1: 0.4844
 epoch: 29, train_loss: 0.7005, test_loss: 1.4505, test_f1: 0.5474
 epoch: 30, train_loss: 0.6528, test_loss: 1.0738, test_f1: 0.5559
 epoch: 31, train_loss: 0.6659, test_loss: 1.1833, test_f1: 0.5270
 epoch: 32, train_loss: 0.6487, test_loss: 1.1718, test_f1: 0.5365
 epoch: 33, train_loss: 0.6095, test_loss: 0.9613, test_f1: 0.5977
 epoch: 34, train_loss: 0.6078, test_loss: 0.9998, test_f1: 0.6108
 epoch: 35, train_loss: 0.6267, test_loss: 1.2791, test_f1: 0.5358
 epoch: 36, train_loss: 0.5998, test_loss: 1.0224, test_f1: 0.6178
 epoch: 37, train_loss: 0.6046, test_loss: 1.2273, test_f1: 0.5362
 epoch: 38, train_loss: 0.6126, test_loss: 1.1496, test_f1: 0.5539
 epoch: 39, train_loss: 0.5893, test_loss: 1.0668, test_f1: 0.5515
 epoch: 40, train_loss: 0.6120, test_loss: 1.1671, test_f1: 0.4903
 epoch: 41, train_loss: 0.6315, test_loss: 1.1887, test_f1: 0.5526
 epoch: 42, train_loss: 0.6174, test_loss: 1.1352, test_f1: 0.5152
 epoch: 43, train_loss: 0.6176, test_loss: 1.3821, test_f1: 0.5218
 epoch: 44, train_loss: 0.6166, test_loss: 1.3424, test_f1: 0.5144
 epoch: 45, train_loss: 0.5711, test_loss: 1.5345, test_f1: 0.4674
 epoch: 46, train_loss: 0.5905, test_loss: 1.1043, test_f1: 0.5455
 epoch: 47, train_loss: 0.5984, test_loss: 1.5923, test_f1: 0.4604
 epoch: 48, train_loss: 0.5838, test_loss: 1.1144, test_f1: 0.5543
 epoch: 49, train_loss: 0.5651, test_loss: 1.0747, test_f1: 0.5735
 epoch: 50, train_loss: 0.5547, test_loss: 1.2828, test_f1: 0.4916
 epoch: 51, train_loss: 0.5536, test_loss: 1.2268, test_f1: 0.5478
 epoch: 52, train_loss: 0.5270, test_loss: 1.2896, test_f1: 0.5792
 epoch: 53, train_loss: 0.5232, test_loss: 1.1834, test_f1: 0.5973
 epoch: 54, train_loss: 0.5233, test_loss: 1.1841, test_f1: 0.6084
 epoch: 55, train_loss: 0.4995, test_loss: 1.0877, test_f1: 0.6037
 epoch: 56, train_loss: 0.5022, test_loss: 1.3704, test_f1: 0.5482
 epoch: 57, train_loss: 0.4904, test_loss: 1.1930, test_f1: 0.5725
 epoch: 58, train_loss: 0.5611, test_loss: 1.1842, test_f1: 0.5809
 epoch: 59, train_loss: 0.5373, test_loss: 1.1422, test_f1: 0.5841
 epoch: 60, train_loss: 0.4800, test_loss: 1.2578, test_f1: 0.5625
 epoch: 61, train_loss: 0.4840, test_loss: 1.1761, test_f1: 0.6197
 epoch: 62, train_loss: 0.4594, test_loss: 1.1693, test_f1: 0.6285
 epoch: 63, train_loss: 0.4755, test_loss: 1.2150, test_f1: 0.6039
 epoch: 64, train_loss: 0.4503, test_loss: 1.3782, test_f1: 0.5474
 epoch: 65, train_loss: 0.4673, test_loss: 1.2277, test_f1: 0.5793
 epoch: 66, train_loss: 0.4427, test_loss: 1.1737, test_f1: 0.6232
 epoch: 67, train_loss: 0.4273, test_loss: 1.2140, test_f1: 0.6130
 epoch: 68, train_loss: 0.4395, test_loss: 1.2516, test_f1: 0.6607
 epoch: 69, train_loss: 0.4106, test_loss: 1.2546, test_f1: 0.6408
 epoch: 70, train_loss: 0.3887, test_loss: 1.3351, test_f1: 0.6087
 epoch: 71, train_loss: 0.4242, test_loss: 1.3069, test_f1: 0.6173
 epoch: 72, train_loss: 0.4546, test_loss: 1.3362, test_f1: 0.6251
 epoch: 73, train_loss: 0.4750, test_loss: 1.3005, test_f1: 0.6242
 epoch: 74, train_loss: 0.4408, test_loss: 1.2166, test_f1: 0.5959
 epoch: 75, train_loss: 0.4414, test_loss: 1.2429, test_f1: 0.6215
 epoch: 76, train_loss: 0.4079, test_loss: 1.2627, test_f1: 0.6317
 epoch: 77, train_loss: 0.4004, test_loss: 1.2525, test_f1: 0.5841
 epoch: 78, train_loss: 0.4091, test_loss: 1.5303, test_f1: 0.5468
 epoch: 79, train_loss: 0.4147, test_loss: 1.3104, test_f1: 0.6129
 epoch: 80, train_loss: 0.4093, test_loss: 1.1803, test_f1: 0.6451
 epoch: 81, train_loss: 0.3895, test_loss: 1.3188, test_f1: 0.6383
 epoch: 82, train_loss: 0.3849, test_loss: 1.4171, test_f1: 0.6488
 epoch: 83, train_loss: 0.3687, test_loss: 1.4193, test_f1: 0.6442
 epoch: 84, train_loss: 0.3852, test_loss: 1.6020, test_f1: 0.6384
 epoch: 85, train_loss: 0.3808, test_loss: 1.6288, test_f1: 0.6464
 epoch: 86, train_loss: 0.3717, test_loss: 1.4425, test_f1: 0.5911
 epoch: 87, train_loss: 0.4014, test_loss: 1.6476, test_f1: 0.5767
 epoch: 88, train_loss: 0.4387, test_loss: 1.4990, test_f1: 0.6375
 epoch: 89, train_loss: 0.4144, test_loss: 1.5930, test_f1: 0.5977
 epoch: 90, train_loss: 0.4110, test_loss: 1.6877, test_f1: 0.5855
 epoch: 91, train_loss: 0.3627, test_loss: 1.6800, test_f1: 0.5696
 epoch: 92, train_loss: 0.3966, test_loss: 1.2786, test_f1: 0.6552
 epoch: 93, train_loss: 0.3798, test_loss: 1.4687, test_f1: 0.6435
 epoch: 94, train_loss: 0.3825, test_loss: 1.4635, test_f1: 0.6206
 epoch: 95, train_loss: 0.3641, test_loss: 1.4568, test_f1: 0.5972
 epoch: 96, train_loss: 0.3672, test_loss: 1.7238, test_f1: 0.5819
 epoch: 97, train_loss: 0.3584, test_loss: 1.8241, test_f1: 0.5737
 epoch: 98, train_loss: 0.3806, test_loss: 1.5599, test_f1: 0.5837
 epoch: 99, train_loss: 0.3647, test_loss: 1.5196, test_f1: 0.6268
##################ITERATION #8 ****************************************
 epoch: 0, train_loss: 1.3637, test_loss: 1.3558, test_f1: 0.3232
 epoch: 1, train_loss: 1.0475, test_loss: 1.2606, test_f1: 0.2281
 epoch: 2, train_loss: 0.9834, test_loss: 1.2968, test_f1: 0.2390
 epoch: 3, train_loss: 0.9376, test_loss: 1.3238, test_f1: 0.3398
 epoch: 4, train_loss: 0.9212, test_loss: 1.2213, test_f1: 0.3967
 epoch: 5, train_loss: 0.9059, test_loss: 1.0944, test_f1: 0.5024
 epoch: 6, train_loss: 0.8882, test_loss: 1.0340, test_f1: 0.5197
 epoch: 7, train_loss: 0.8753, test_loss: 1.0593, test_f1: 0.5777
 epoch: 8, train_loss: 0.8573, test_loss: 0.9952, test_f1: 0.5620
 epoch: 9, train_loss: 0.8416, test_loss: 1.0789, test_f1: 0.5665
 epoch: 10, train_loss: 0.8318, test_loss: 1.4027, test_f1: 0.4883
 epoch: 11, train_loss: 0.8265, test_loss: 1.4100, test_f1: 0.4472
 epoch: 12, train_loss: 0.8018, test_loss: 1.0038, test_f1: 0.6048
 epoch: 13, train_loss: 0.7816, test_loss: 1.1223, test_f1: 0.5618
 epoch: 14, train_loss: 0.7750, test_loss: 1.3009, test_f1: 0.5406
 epoch: 15, train_loss: 0.7637, test_loss: 1.4128, test_f1: 0.4919
 epoch: 16, train_loss: 0.7449, test_loss: 1.1482, test_f1: 0.4627
 epoch: 17, train_loss: 0.7316, test_loss: 1.5758, test_f1: 0.4659
 epoch: 18, train_loss: 0.7819, test_loss: 2.1024, test_f1: 0.3919
 epoch: 19, train_loss: 0.7432, test_loss: 1.6704, test_f1: 0.4613
 epoch: 20, train_loss: 0.7106, test_loss: 1.1403, test_f1: 0.5533
 epoch: 21, train_loss: 0.7001, test_loss: 1.0907, test_f1: 0.5621
 epoch: 22, train_loss: 0.7325, test_loss: 1.1760, test_f1: 0.5172
 epoch: 23, train_loss: 0.7513, test_loss: 1.2534, test_f1: 0.4537
 epoch: 24, train_loss: 0.7238, test_loss: 1.0789, test_f1: 0.5667
 epoch: 25, train_loss: 0.6830, test_loss: 1.0634, test_f1: 0.5230
 epoch: 26, train_loss: 0.6736, test_loss: 1.0862, test_f1: 0.4962
 epoch: 27, train_loss: 0.6620, test_loss: 1.3544, test_f1: 0.5009
 epoch: 28, train_loss: 0.6379, test_loss: 1.4998, test_f1: 0.4414
 epoch: 29, train_loss: 0.6644, test_loss: 2.0483, test_f1: 0.4176
 epoch: 30, train_loss: 0.6551, test_loss: 1.3884, test_f1: 0.4935
 epoch: 31, train_loss: 0.6293, test_loss: 1.1823, test_f1: 0.5128
 epoch: 32, train_loss: 0.6133, test_loss: 1.0506, test_f1: 0.5819
 epoch: 33, train_loss: 0.6067, test_loss: 1.0796, test_f1: 0.6132
 epoch: 34, train_loss: 0.6149, test_loss: 1.5424, test_f1: 0.5110
 epoch: 35, train_loss: 0.5998, test_loss: 1.7226, test_f1: 0.5040
 epoch: 36, train_loss: 0.5948, test_loss: 1.3346, test_f1: 0.5653
 epoch: 37, train_loss: 0.5984, test_loss: 1.9917, test_f1: 0.4266
 epoch: 38, train_loss: 0.5792, test_loss: 1.2832, test_f1: 0.5632
 epoch: 39, train_loss: 0.5965, test_loss: 1.3925, test_f1: 0.4900
 epoch: 40, train_loss: 0.6157, test_loss: 1.6318, test_f1: 0.4962
 epoch: 41, train_loss: 0.5980, test_loss: 1.4012, test_f1: 0.4934
 epoch: 42, train_loss: 0.6127, test_loss: 1.1191, test_f1: 0.5291
 epoch: 43, train_loss: 0.5808, test_loss: 0.9954, test_f1: 0.6504
 epoch: 44, train_loss: 0.5514, test_loss: 1.0935, test_f1: 0.5604
 epoch: 45, train_loss: 0.5391, test_loss: 1.1180, test_f1: 0.5495
 epoch: 46, train_loss: 0.5347, test_loss: 1.4259, test_f1: 0.5176
 epoch: 47, train_loss: 0.5528, test_loss: 1.3442, test_f1: 0.5664
 epoch: 48, train_loss: 0.5350, test_loss: 1.4960, test_f1: 0.4807
 epoch: 49, train_loss: 0.5506, test_loss: 1.2298, test_f1: 0.6113
 epoch: 50, train_loss: 0.5268, test_loss: 1.5635, test_f1: 0.5041
 epoch: 51, train_loss: 0.5071, test_loss: 1.2468, test_f1: 0.5967
 epoch: 52, train_loss: 0.4918, test_loss: 1.3053, test_f1: 0.6084
 epoch: 53, train_loss: 0.4774, test_loss: 1.3209, test_f1: 0.6027
 epoch: 54, train_loss: 0.4583, test_loss: 1.2902, test_f1: 0.6118
 epoch: 55, train_loss: 0.4319, test_loss: 1.3887, test_f1: 0.6078
 epoch: 56, train_loss: 0.4469, test_loss: 1.3904, test_f1: 0.5443
 epoch: 57, train_loss: 0.4601, test_loss: 1.4589, test_f1: 0.5407
 epoch: 58, train_loss: 0.4684, test_loss: 1.2815, test_f1: 0.6266
 epoch: 59, train_loss: 0.4553, test_loss: 1.3039, test_f1: 0.6077
 epoch: 60, train_loss: 0.4481, test_loss: 1.3752, test_f1: 0.5800
 epoch: 61, train_loss: 0.4467, test_loss: 1.4151, test_f1: 0.6232
 epoch: 62, train_loss: 0.4253, test_loss: 1.5606, test_f1: 0.6211
 epoch: 63, train_loss: 0.4235, test_loss: 1.6461, test_f1: 0.5972
 epoch: 64, train_loss: 0.4155, test_loss: 1.5556, test_f1: 0.5869
 epoch: 65, train_loss: 0.4342, test_loss: 1.6467, test_f1: 0.5833
 epoch: 66, train_loss: 0.4129, test_loss: 2.2613, test_f1: 0.4710
 epoch: 67, train_loss: 0.3844, test_loss: 1.9888, test_f1: 0.5754
 epoch: 68, train_loss: 0.4061, test_loss: 1.9643, test_f1: 0.6039
 epoch: 69, train_loss: 0.3759, test_loss: 1.8842, test_f1: 0.6009
 epoch: 70, train_loss: 0.3781, test_loss: 2.1141, test_f1: 0.5373
 epoch: 71, train_loss: 0.4010, test_loss: 1.8081, test_f1: 0.5906
 epoch: 72, train_loss: 0.3660, test_loss: 2.0740, test_f1: 0.6005
 epoch: 73, train_loss: 0.3523, test_loss: 1.7957, test_f1: 0.5784
 epoch: 74, train_loss: 0.3660, test_loss: 1.9215, test_f1: 0.5423
 epoch: 75, train_loss: 0.3819, test_loss: 1.9273, test_f1: 0.5467
 epoch: 76, train_loss: 0.4174, test_loss: 1.9323, test_f1: 0.5846
 epoch: 77, train_loss: 0.3947, test_loss: 1.8909, test_f1: 0.5702
 epoch: 78, train_loss: 0.3916, test_loss: 1.8291, test_f1: 0.5776
 epoch: 79, train_loss: 0.3781, test_loss: 1.7009, test_f1: 0.5934
 epoch: 80, train_loss: 0.3913, test_loss: 1.8249, test_f1: 0.5443
 epoch: 81, train_loss: 0.3908, test_loss: 1.9191, test_f1: 0.5793
 epoch: 82, train_loss: 0.3686, test_loss: 2.3799, test_f1: 0.5668
 epoch: 83, train_loss: 0.3601, test_loss: 2.6182, test_f1: 0.5699
 epoch: 84, train_loss: 0.3922, test_loss: 2.4885, test_f1: 0.5791
 epoch: 85, train_loss: 0.3981, test_loss: 2.6030, test_f1: 0.5430
 epoch: 86, train_loss: 0.3774, test_loss: 1.7518, test_f1: 0.6137
 epoch: 87, train_loss: 0.3923, test_loss: 1.7550, test_f1: 0.6092
 epoch: 88, train_loss: 0.3455, test_loss: 1.8083, test_f1: 0.5876
 epoch: 89, train_loss: 0.3481, test_loss: 2.0192, test_f1: 0.5736
 epoch: 90, train_loss: 0.3183, test_loss: 2.3894, test_f1: 0.5696
 epoch: 91, train_loss: 0.3327, test_loss: 2.3645, test_f1: 0.6010
 epoch: 92, train_loss: 0.3279, test_loss: 2.1180, test_f1: 0.6222
 epoch: 93, train_loss: 0.3231, test_loss: 2.4138, test_f1: 0.6232
 epoch: 94, train_loss: 0.3296, test_loss: 2.3293, test_f1: 0.6097
 epoch: 95, train_loss: 0.3199, test_loss: 1.9347, test_f1: 0.5610
 epoch: 96, train_loss: 0.3426, test_loss: 2.2479, test_f1: 0.5462
 epoch: 97, train_loss: 0.3424, test_loss: 1.9341, test_f1: 0.5456
 epoch: 98, train_loss: 0.3907, test_loss: 2.6052, test_f1: 0.5161
 epoch: 99, train_loss: 0.3570, test_loss: 2.2330, test_f1: 0.5927
##################ITERATION #9 ****************************************
 epoch: 0, train_loss: 1.5064, test_loss: 1.4320, test_f1: 0.3248
 epoch: 1, train_loss: 1.0592, test_loss: 1.4329, test_f1: 0.2378
 epoch: 2, train_loss: 0.9592, test_loss: 1.4640, test_f1: 0.3232
 epoch: 3, train_loss: 0.9387, test_loss: 1.3617, test_f1: 0.3188
 epoch: 4, train_loss: 0.9160, test_loss: 1.1967, test_f1: 0.4703
 epoch: 5, train_loss: 0.8703, test_loss: 1.0206, test_f1: 0.5694
 epoch: 6, train_loss: 0.8687, test_loss: 1.0095, test_f1: 0.5346
 epoch: 7, train_loss: 0.8462, test_loss: 1.0781, test_f1: 0.4902
 epoch: 8, train_loss: 0.8323, test_loss: 1.0231, test_f1: 0.5622
 epoch: 9, train_loss: 0.8313, test_loss: 1.2214, test_f1: 0.4470
 epoch: 10, train_loss: 0.8466, test_loss: 1.0649, test_f1: 0.5059
 epoch: 11, train_loss: 0.8198, test_loss: 1.2357, test_f1: 0.3871
 epoch: 12, train_loss: 0.8287, test_loss: 1.0479, test_f1: 0.4752
 epoch: 13, train_loss: 0.7804, test_loss: 1.0228, test_f1: 0.5004
 epoch: 14, train_loss: 0.7664, test_loss: 1.0198, test_f1: 0.5023
 epoch: 15, train_loss: 0.7417, test_loss: 1.1411, test_f1: 0.5280
 epoch: 16, train_loss: 0.7306, test_loss: 1.1121, test_f1: 0.5655
 epoch: 17, train_loss: 0.7553, test_loss: 1.2049, test_f1: 0.5396
 epoch: 18, train_loss: 0.7393, test_loss: 1.3843, test_f1: 0.4688
 epoch: 19, train_loss: 0.7686, test_loss: 1.0406, test_f1: 0.5798
 epoch: 20, train_loss: 0.7362, test_loss: 1.1120, test_f1: 0.4713
 epoch: 21, train_loss: 0.7517, test_loss: 1.1143, test_f1: 0.5178
 epoch: 22, train_loss: 0.7284, test_loss: 1.0666, test_f1: 0.5564
 epoch: 23, train_loss: 0.7217, test_loss: 1.0827, test_f1: 0.5146
 epoch: 24, train_loss: 0.6805, test_loss: 1.1053, test_f1: 0.5506
 epoch: 25, train_loss: 0.7204, test_loss: 1.2208, test_f1: 0.5590
 epoch: 26, train_loss: 0.7117, test_loss: 1.1073, test_f1: 0.5692
 epoch: 27, train_loss: 0.6682, test_loss: 1.0895, test_f1: 0.5496
 epoch: 28, train_loss: 0.6434, test_loss: 1.3942, test_f1: 0.3968
 epoch: 29, train_loss: 0.6420, test_loss: 1.1520, test_f1: 0.5295
 epoch: 30, train_loss: 0.6293, test_loss: 1.4040, test_f1: 0.4573
 epoch: 31, train_loss: 0.6628, test_loss: 1.2174, test_f1: 0.5056
 epoch: 32, train_loss: 0.6558, test_loss: 1.5563, test_f1: 0.4876
 epoch: 33, train_loss: 0.6111, test_loss: 1.3351, test_f1: 0.5314
 epoch: 34, train_loss: 0.6077, test_loss: 1.4822, test_f1: 0.5085
 epoch: 35, train_loss: 0.6114, test_loss: 1.3859, test_f1: 0.5478
 epoch: 36, train_loss: 0.6069, test_loss: 1.0368, test_f1: 0.6126
 epoch: 37, train_loss: 0.5718, test_loss: 0.8894, test_f1: 0.6968
 epoch: 38, train_loss: 0.5650, test_loss: 1.1856, test_f1: 0.5864
 epoch: 39, train_loss: 0.5688, test_loss: 1.1770, test_f1: 0.5846
 epoch: 40, train_loss: 0.5921, test_loss: 1.3342, test_f1: 0.5594
 epoch: 41, train_loss: 0.6427, test_loss: 1.6014, test_f1: 0.4486
 epoch: 42, train_loss: 0.6124, test_loss: 1.5850, test_f1: 0.4121
 epoch: 43, train_loss: 0.5965, test_loss: 1.1677, test_f1: 0.5914
 epoch: 44, train_loss: 0.6093, test_loss: 1.8086, test_f1: 0.4663
 epoch: 45, train_loss: 0.5696, test_loss: 1.8189, test_f1: 0.5057
 epoch: 46, train_loss: 0.5497, test_loss: 1.1310, test_f1: 0.5993
 epoch: 47, train_loss: 0.5278, test_loss: 1.2059, test_f1: 0.5310
 epoch: 48, train_loss: 0.5568, test_loss: 1.0603, test_f1: 0.5666
 epoch: 49, train_loss: 0.5327, test_loss: 1.0882, test_f1: 0.5834
 epoch: 50, train_loss: 0.5402, test_loss: 1.2139, test_f1: 0.5838
 epoch: 51, train_loss: 0.5387, test_loss: 1.4001, test_f1: 0.5734
 epoch: 52, train_loss: 0.5158, test_loss: 1.2792, test_f1: 0.6318
 epoch: 53, train_loss: 0.5074, test_loss: 1.3909, test_f1: 0.6210
 epoch: 54, train_loss: 0.4710, test_loss: 1.2556, test_f1: 0.6039
 epoch: 55, train_loss: 0.4874, test_loss: 1.2448, test_f1: 0.5951
 epoch: 56, train_loss: 0.4545, test_loss: 1.1825, test_f1: 0.5873
 epoch: 57, train_loss: 0.4216, test_loss: 1.2130, test_f1: 0.6355
 epoch: 58, train_loss: 0.4448, test_loss: 1.4088, test_f1: 0.6119
 epoch: 59, train_loss: 0.4165, test_loss: 1.4851, test_f1: 0.5914
 epoch: 60, train_loss: 0.4035, test_loss: 1.2891, test_f1: 0.6537
 epoch: 61, train_loss: 0.4672, test_loss: 1.1980, test_f1: 0.6372
 epoch: 62, train_loss: 0.4140, test_loss: 1.5463, test_f1: 0.6188
 epoch: 63, train_loss: 0.4350, test_loss: 1.7560, test_f1: 0.6013
 epoch: 64, train_loss: 0.4153, test_loss: 1.7397, test_f1: 0.6017
 epoch: 65, train_loss: 0.4036, test_loss: 1.5663, test_f1: 0.6128
 epoch: 66, train_loss: 0.4019, test_loss: 1.4637, test_f1: 0.6108
 epoch: 67, train_loss: 0.3901, test_loss: 1.6415, test_f1: 0.6374
 epoch: 68, train_loss: 0.4295, test_loss: 1.6078, test_f1: 0.6089
 epoch: 69, train_loss: 0.4053, test_loss: 1.6363, test_f1: 0.5927
 epoch: 70, train_loss: 0.4025, test_loss: 1.4319, test_f1: 0.6007
 epoch: 71, train_loss: 0.3865, test_loss: 1.4881, test_f1: 0.6205
 epoch: 72, train_loss: 0.3753, test_loss: 1.4427, test_f1: 0.6341
 epoch: 73, train_loss: 0.3587, test_loss: 1.5102, test_f1: 0.5909
 epoch: 74, train_loss: 0.3745, test_loss: 1.3487, test_f1: 0.6324
 epoch: 75, train_loss: 0.3580, test_loss: 1.3831, test_f1: 0.6436
 epoch: 76, train_loss: 0.3602, test_loss: 1.4373, test_f1: 0.6205
 epoch: 77, train_loss: 0.3206, test_loss: 1.4833, test_f1: 0.6367
 epoch: 78, train_loss: 0.3293, test_loss: 1.5073, test_f1: 0.6335
 epoch: 79, train_loss: 0.4065, test_loss: 1.4798, test_f1: 0.6097
 epoch: 80, train_loss: 0.4009, test_loss: 1.5976, test_f1: 0.6049
 epoch: 81, train_loss: 0.3677, test_loss: 1.5616, test_f1: 0.6110
 epoch: 82, train_loss: 0.3385, test_loss: 1.6467, test_f1: 0.6348
 epoch: 83, train_loss: 0.3739, test_loss: 1.8115, test_f1: 0.6104
 epoch: 84, train_loss: 0.4099, test_loss: 1.7805, test_f1: 0.6218
 epoch: 85, train_loss: 0.3325, test_loss: 1.7798, test_f1: 0.5625
 epoch: 86, train_loss: 0.4024, test_loss: 1.7848, test_f1: 0.5876
 epoch: 87, train_loss: 0.3708, test_loss: 1.4680, test_f1: 0.6281
 epoch: 88, train_loss: 0.3475, test_loss: 1.5615, test_f1: 0.5826
 epoch: 89, train_loss: 0.3205, test_loss: 1.6923, test_f1: 0.5525
 epoch: 90, train_loss: 0.3191, test_loss: 1.7162, test_f1: 0.6081
 epoch: 91, train_loss: 0.3330, test_loss: 1.9262, test_f1: 0.6008
 epoch: 92, train_loss: 0.3525, test_loss: 1.7580, test_f1: 0.6266
 epoch: 93, train_loss: 0.3434, test_loss: 1.5655, test_f1: 0.6013
 epoch: 94, train_loss: 0.3217, test_loss: 1.6801, test_f1: 0.6274
 epoch: 95, train_loss: 0.3057, test_loss: 1.6996, test_f1: 0.5892
 epoch: 96, train_loss: 0.3151, test_loss: 1.7684, test_f1: 0.6268
 epoch: 97, train_loss: 0.3022, test_loss: 1.8220, test_f1: 0.5869
 epoch: 98, train_loss: 0.3934, test_loss: 1.6192, test_f1: 0.5802
 epoch: 99, train_loss: 0.3579, test_loss: 2.1442, test_f1: 0.5712

Training completed in 296.82 seconds
Best F1: 0.6968 at epoch 37
Mean F1 across iterations: 0.6607  0.0138
========================FINAL RESULTS================================
FEGIN weighted F1: 0.6968  0.0138
python main.py --data ltspice_demos --representation component_pin_net --model FEGIN --layers 2 --hiddens 64 --batch_size 256 --lr 0.01 --emb_size 128 --epochs 100 --save_appendix component_pin_net_L2_H64_BS256_LR0.01_E128 --no_val
-----



STDERR:
  File "main.py", line 370, in <module>
    main()
  File "main.py", line 254, in main
    dataset = dataset_class(
  File "/home/philip/projects/ltspice_examples_code_repo/Circuit-Completion-Using-GNNs/component_classification_with_link_prediction_head/evaluation/FEGIN/kernel/circuit_datasets.py", line 15, in __init__
    self.data, self.slices = torch.load(self.processed_paths[0])
  File "/home/philip/.local/lib/python3.8/site-packages/torch/serialization.py", line 1040, in load
    warnings.warn(
  File "/usr/lib/python3.8/warnings.py", line 109, in _showwarnmsg
    sw(msg.message, msg.category, msg.filename, msg.lineno,
  File "main.py", line 47, in warn_with_traceback
    traceback.print_stack(file=log)
/home/philip/projects/ltspice_examples_code_repo/Circuit-Completion-Using-GNNs/component_classification_with_link_prediction_head/evaluation/FEGIN/kernel/circuit_datasets.py:15: FutureWarning: You are using `torch.load` with `weights_only=False` (the current default value), which uses the default pickle module implicitly. It is possible to construct malicious pickle data which will execute arbitrary code during unpickling (See https://github.com/pytorch/pytorch/blob/main/SECURITY.md#untrusted-models for more details). In a future release, the default value for `weights_only` will be flipped to `True`. This limits the functions that could be executed during unpickling. Arbitrary objects will no longer be allowed to be loaded via this mode unless they are explicitly allowlisted by the user via `torch.serialization.add_safe_globals`. We recommend you start setting `weights_only=True` for any use case where you don't have full control of the loaded file. Please open an issue on GitHub for any issues related to this experimental feature.
  self.data, self.slices = torch.load(self.processed_paths[0])
