STDOUT:
Results will be saved in /home/philip/projects/ltspice_examples_code_repo/Circuit-Completion-Using-GNNs/component_classification_with_link_prediction_head/evaluation/FEGIN/results/model_FEGIN_dataset_ltspice_demos
Command line input: python main.py --data ltspice_demos --representation component_net --model FEGIN --layers 5 --hiddens 64 --batch_size 64 --lr 0.001 --emb_size 512 --epochs 100 --save_appendix component_net_L5_H64_BS64_LR0.001_E512 --no_val
 is saved.
-----
ltspice_demos - FEGIN
Using 5 layers, 64 hidden units, h = 2
Loading component_net representation dataset
ENTERED
Training FEGIN on component_net representation
Train: 1565, Test: 383
##################ITERATION #0 ****************************************
 epoch: 0, train_loss: 1.2638, test_loss: 1.3146, test_f1: 0.1365
 epoch: 1, train_loss: 1.1482, test_loss: 1.2361, test_f1: 0.3052
 epoch: 2, train_loss: 1.1034, test_loss: 1.1725, test_f1: 0.4431
 epoch: 3, train_loss: 1.0795, test_loss: 1.1543, test_f1: 0.4952
 epoch: 4, train_loss: 1.0275, test_loss: 1.1003, test_f1: 0.5152
 epoch: 5, train_loss: 0.9938, test_loss: 1.0810, test_f1: 0.5355
 epoch: 6, train_loss: 0.9662, test_loss: 1.0437, test_f1: 0.5125
 epoch: 7, train_loss: 0.9454, test_loss: 1.1494, test_f1: 0.5433
 epoch: 8, train_loss: 0.9213, test_loss: 1.0272, test_f1: 0.5564
 epoch: 9, train_loss: 0.9129, test_loss: 1.1639, test_f1: 0.5655
 epoch: 10, train_loss: 0.8603, test_loss: 1.1117, test_f1: 0.5441
 epoch: 11, train_loss: 0.8435, test_loss: 1.1670, test_f1: 0.5652
 epoch: 12, train_loss: 0.8464, test_loss: 1.2262, test_f1: 0.5391
 epoch: 13, train_loss: 0.8702, test_loss: 1.1835, test_f1: 0.5614
 epoch: 14, train_loss: 0.8399, test_loss: 1.0894, test_f1: 0.5760
 epoch: 15, train_loss: 0.8162, test_loss: 1.1404, test_f1: 0.5738
 epoch: 16, train_loss: 0.7963, test_loss: 1.2195, test_f1: 0.5817
 epoch: 17, train_loss: 0.7858, test_loss: 1.3633, test_f1: 0.5616
 epoch: 18, train_loss: 0.7898, test_loss: 1.1902, test_f1: 0.5691
 epoch: 19, train_loss: 0.7608, test_loss: 1.1635, test_f1: 0.5997
 epoch: 20, train_loss: 0.7657, test_loss: 1.1802, test_f1: 0.5896
 epoch: 21, train_loss: 0.7532, test_loss: 1.3335, test_f1: 0.6053
 epoch: 22, train_loss: 0.7492, test_loss: 1.3173, test_f1: 0.5860
 epoch: 23, train_loss: 0.6990, test_loss: 1.2241, test_f1: 0.6355
 epoch: 24, train_loss: 0.7048, test_loss: 1.3391, test_f1: 0.5983
 epoch: 25, train_loss: 0.7216, test_loss: 1.3225, test_f1: 0.5800
 epoch: 26, train_loss: 0.6963, test_loss: 1.2169, test_f1: 0.6308
 epoch: 27, train_loss: 0.6752, test_loss: 1.3170, test_f1: 0.6230
 epoch: 28, train_loss: 0.6828, test_loss: 1.4239, test_f1: 0.5682
 epoch: 29, train_loss: 0.6522, test_loss: 1.4318, test_f1: 0.5881
 epoch: 30, train_loss: 0.6391, test_loss: 1.4156, test_f1: 0.5993
 epoch: 31, train_loss: 0.6477, test_loss: 1.5002, test_f1: 0.5637
 epoch: 32, train_loss: 0.6258, test_loss: 1.4607, test_f1: 0.5912
 epoch: 33, train_loss: 0.6284, test_loss: 1.4840, test_f1: 0.5790
 epoch: 34, train_loss: 0.6132, test_loss: 1.6559, test_f1: 0.6142
 epoch: 35, train_loss: 0.5908, test_loss: 1.6964, test_f1: 0.5694
 epoch: 36, train_loss: 0.6044, test_loss: 1.4698, test_f1: 0.6074
 epoch: 37, train_loss: 0.5774, test_loss: 1.8697, test_f1: 0.5773
 epoch: 38, train_loss: 0.6038, test_loss: 1.6121, test_f1: 0.5793
 epoch: 39, train_loss: 0.5835, test_loss: 1.7990, test_f1: 0.5568
 epoch: 40, train_loss: 0.5872, test_loss: 1.5505, test_f1: 0.5994
 epoch: 41, train_loss: 0.5735, test_loss: 1.5998, test_f1: 0.6039
 epoch: 42, train_loss: 0.5482, test_loss: 1.6857, test_f1: 0.5875
 epoch: 43, train_loss: 0.5322, test_loss: 1.7812, test_f1: 0.5852
 epoch: 44, train_loss: 0.5258, test_loss: 1.7193, test_f1: 0.5928
 epoch: 45, train_loss: 0.5212, test_loss: 1.7839, test_f1: 0.5662
 epoch: 46, train_loss: 0.5249, test_loss: 1.7995, test_f1: 0.5915
 epoch: 47, train_loss: 0.5066, test_loss: 1.8264, test_f1: 0.5563
 epoch: 48, train_loss: 0.4684, test_loss: 1.9214, test_f1: 0.5644
 epoch: 49, train_loss: 0.4637, test_loss: 2.0706, test_f1: 0.5771
 epoch: 50, train_loss: 0.4735, test_loss: 2.0097, test_f1: 0.5275
 epoch: 51, train_loss: 0.4369, test_loss: 1.8950, test_f1: 0.5811
 epoch: 52, train_loss: 0.4181, test_loss: 1.9923, test_f1: 0.6001
 epoch: 53, train_loss: 0.3940, test_loss: 1.9912, test_f1: 0.6223
 epoch: 54, train_loss: 0.3795, test_loss: 1.9130, test_f1: 0.6297
 epoch: 55, train_loss: 0.3815, test_loss: 2.1116, test_f1: 0.6097
 epoch: 56, train_loss: 0.3763, test_loss: 2.1376, test_f1: 0.5637
 epoch: 57, train_loss: 0.3737, test_loss: 2.2050, test_f1: 0.6051
 epoch: 58, train_loss: 0.3566, test_loss: 2.0449, test_f1: 0.6039
 epoch: 59, train_loss: 0.3563, test_loss: 2.2379, test_f1: 0.5894
 epoch: 60, train_loss: 0.3316, test_loss: 2.3239, test_f1: 0.6102
 epoch: 61, train_loss: 0.3451, test_loss: 2.3291, test_f1: 0.5763
 epoch: 62, train_loss: 0.3431, test_loss: 2.2652, test_f1: 0.5934
 epoch: 63, train_loss: 0.3508, test_loss: 2.2531, test_f1: 0.5980
 epoch: 64, train_loss: 0.3497, test_loss: 2.4281, test_f1: 0.5992
 epoch: 65, train_loss: 0.3399, test_loss: 2.4690, test_f1: 0.5952
 epoch: 66, train_loss: 0.3193, test_loss: 2.3964, test_f1: 0.5755
 epoch: 67, train_loss: 0.3131, test_loss: 2.3805, test_f1: 0.5725
 epoch: 68, train_loss: 0.3527, test_loss: 2.2187, test_f1: 0.5693
 epoch: 69, train_loss: 0.3200, test_loss: 2.4528, test_f1: 0.5766
 epoch: 70, train_loss: 0.3178, test_loss: 2.5711, test_f1: 0.5935
 epoch: 71, train_loss: 0.2986, test_loss: 2.4978, test_f1: 0.5795
 epoch: 72, train_loss: 0.2952, test_loss: 2.5590, test_f1: 0.5769
 epoch: 73, train_loss: 0.2814, test_loss: 2.6012, test_f1: 0.5624
 epoch: 74, train_loss: 0.2900, test_loss: 2.6593, test_f1: 0.5971
 epoch: 75, train_loss: 0.3111, test_loss: 2.7765, test_f1: 0.5991
 epoch: 76, train_loss: 0.3098, test_loss: 2.8858, test_f1: 0.5735
 epoch: 77, train_loss: 0.3005, test_loss: 2.6396, test_f1: 0.6038
 epoch: 78, train_loss: 0.2925, test_loss: 2.7978, test_f1: 0.5899
 epoch: 79, train_loss: 0.2991, test_loss: 2.8119, test_f1: 0.6028
 epoch: 80, train_loss: 0.2793, test_loss: 2.6841, test_f1: 0.6098
 epoch: 81, train_loss: 0.2881, test_loss: 2.6755, test_f1: 0.6178
 epoch: 82, train_loss: 0.2751, test_loss: 2.9122, test_f1: 0.5973
 epoch: 83, train_loss: 0.2496, test_loss: 2.8272, test_f1: 0.5839
 epoch: 84, train_loss: 0.2639, test_loss: 2.9663, test_f1: 0.6045
 epoch: 85, train_loss: 0.2524, test_loss: 3.0592, test_f1: 0.6050
 epoch: 86, train_loss: 0.2236, test_loss: 3.0837, test_f1: 0.5806
 epoch: 87, train_loss: 0.2636, test_loss: 2.7769, test_f1: 0.5845
 epoch: 88, train_loss: 0.2367, test_loss: 2.9818, test_f1: 0.6176
 epoch: 89, train_loss: 0.2445, test_loss: 2.8914, test_f1: 0.6012
 epoch: 90, train_loss: 0.2383, test_loss: 2.9733, test_f1: 0.6101
 epoch: 91, train_loss: 0.2432, test_loss: 2.9259, test_f1: 0.5634
 epoch: 92, train_loss: 0.2316, test_loss: 3.1873, test_f1: 0.5904
 epoch: 93, train_loss: 0.2413, test_loss: 3.0767, test_f1: 0.6074
 epoch: 94, train_loss: 0.2380, test_loss: 3.0515, test_f1: 0.5996
 epoch: 95, train_loss: 0.2164, test_loss: 3.8226, test_f1: 0.5733
 epoch: 96, train_loss: 0.2274, test_loss: 3.3057, test_f1: 0.5707
 epoch: 97, train_loss: 0.2208, test_loss: 3.8178, test_f1: 0.5679
 epoch: 98, train_loss: 0.2112, test_loss: 3.2118, test_f1: 0.6054
 epoch: 99, train_loss: 0.2360, test_loss: 3.4387, test_f1: 0.5928
##################ITERATION #1 ****************************************
 epoch: 0, train_loss: 1.1822, test_loss: 1.3262, test_f1: 0.3432
 epoch: 1, train_loss: 1.0605, test_loss: 1.1786, test_f1: 0.3915
 epoch: 2, train_loss: 1.0202, test_loss: 1.0770, test_f1: 0.4879
 epoch: 3, train_loss: 0.9841, test_loss: 1.0543, test_f1: 0.5266
 epoch: 4, train_loss: 0.9616, test_loss: 1.0491, test_f1: 0.5098
 epoch: 5, train_loss: 0.9448, test_loss: 1.1079, test_f1: 0.5313
 epoch: 6, train_loss: 0.9278, test_loss: 1.0457, test_f1: 0.5343
 epoch: 7, train_loss: 0.9111, test_loss: 1.0523, test_f1: 0.5376
 epoch: 8, train_loss: 0.8957, test_loss: 1.0906, test_f1: 0.5345
 epoch: 9, train_loss: 0.8821, test_loss: 1.0267, test_f1: 0.5233
 epoch: 10, train_loss: 0.8762, test_loss: 1.0729, test_f1: 0.5448
 epoch: 11, train_loss: 0.8586, test_loss: 1.0543, test_f1: 0.5358
 epoch: 12, train_loss: 0.8368, test_loss: 1.0275, test_f1: 0.5753
 epoch: 13, train_loss: 0.8346, test_loss: 1.1035, test_f1: 0.5271
 epoch: 14, train_loss: 0.8322, test_loss: 1.1302, test_f1: 0.5696
 epoch: 15, train_loss: 0.8119, test_loss: 1.0964, test_f1: 0.5614
 epoch: 16, train_loss: 0.8131, test_loss: 1.1365, test_f1: 0.5709
 epoch: 17, train_loss: 0.7927, test_loss: 1.0579, test_f1: 0.5736
 epoch: 18, train_loss: 0.7737, test_loss: 1.0727, test_f1: 0.5768
 epoch: 19, train_loss: 0.7439, test_loss: 1.1298, test_f1: 0.5694
 epoch: 20, train_loss: 0.7640, test_loss: 1.1356, test_f1: 0.5897
 epoch: 21, train_loss: 0.7491, test_loss: 1.0991, test_f1: 0.5752
 epoch: 22, train_loss: 0.7327, test_loss: 1.1210, test_f1: 0.5894
 epoch: 23, train_loss: 0.7186, test_loss: 1.1612, test_f1: 0.5779
 epoch: 24, train_loss: 0.7017, test_loss: 1.2482, test_f1: 0.5640
 epoch: 25, train_loss: 0.6906, test_loss: 1.2051, test_f1: 0.5939
 epoch: 26, train_loss: 0.6848, test_loss: 1.2614, test_f1: 0.6227
 epoch: 27, train_loss: 0.6771, test_loss: 1.3208, test_f1: 0.5710
 epoch: 28, train_loss: 0.6559, test_loss: 1.5769, test_f1: 0.5980
 epoch: 29, train_loss: 0.6502, test_loss: 1.2748, test_f1: 0.5954
 epoch: 30, train_loss: 0.6559, test_loss: 1.4782, test_f1: 0.5635
 epoch: 31, train_loss: 0.6165, test_loss: 1.2305, test_f1: 0.6217
 epoch: 32, train_loss: 0.6361, test_loss: 1.3484, test_f1: 0.6052
 epoch: 33, train_loss: 0.6433, test_loss: 1.4420, test_f1: 0.6172
 epoch: 34, train_loss: 0.6092, test_loss: 1.4471, test_f1: 0.5854
 epoch: 35, train_loss: 0.5798, test_loss: 1.5915, test_f1: 0.5773
 epoch: 36, train_loss: 0.5730, test_loss: 1.5159, test_f1: 0.6446
 epoch: 37, train_loss: 0.5672, test_loss: 1.5401, test_f1: 0.6085
 epoch: 38, train_loss: 0.5461, test_loss: 1.7435, test_f1: 0.5325
 epoch: 39, train_loss: 0.5570, test_loss: 1.5305, test_f1: 0.6153
 epoch: 40, train_loss: 0.5584, test_loss: 1.6882, test_f1: 0.6105
 epoch: 41, train_loss: 0.5235, test_loss: 1.6562, test_f1: 0.5987
 epoch: 42, train_loss: 0.5279, test_loss: 1.7668, test_f1: 0.6235
 epoch: 43, train_loss: 0.4949, test_loss: 1.6426, test_f1: 0.6344
 epoch: 44, train_loss: 0.5168, test_loss: 1.6876, test_f1: 0.5918
 epoch: 45, train_loss: 0.4815, test_loss: 1.7050, test_f1: 0.6403
 epoch: 46, train_loss: 0.5074, test_loss: 1.8480, test_f1: 0.6136
 epoch: 47, train_loss: 0.4990, test_loss: 1.7294, test_f1: 0.6365
 epoch: 48, train_loss: 0.4994, test_loss: 1.9906, test_f1: 0.5648
 epoch: 49, train_loss: 0.4669, test_loss: 1.7916, test_f1: 0.6244
 epoch: 50, train_loss: 0.4443, test_loss: 2.0078, test_f1: 0.6362
 epoch: 51, train_loss: 0.3968, test_loss: 2.0575, test_f1: 0.6254
 epoch: 52, train_loss: 0.3806, test_loss: 2.0876, test_f1: 0.6175
 epoch: 53, train_loss: 0.3872, test_loss: 2.1986, test_f1: 0.5994
 epoch: 54, train_loss: 0.3492, test_loss: 2.2571, test_f1: 0.6335
 epoch: 55, train_loss: 0.3737, test_loss: 2.2125, test_f1: 0.6148
 epoch: 56, train_loss: 0.3411, test_loss: 2.2623, test_f1: 0.6009
 epoch: 57, train_loss: 0.3227, test_loss: 2.3727, test_f1: 0.6384
 epoch: 58, train_loss: 0.3136, test_loss: 2.5822, test_f1: 0.5849
 epoch: 59, train_loss: 0.3546, test_loss: 2.4092, test_f1: 0.6359
 epoch: 60, train_loss: 0.3272, test_loss: 2.4700, test_f1: 0.6196
 epoch: 61, train_loss: 0.3228, test_loss: 2.4059, test_f1: 0.6014
 epoch: 62, train_loss: 0.3169, test_loss: 2.4381, test_f1: 0.6233
 epoch: 63, train_loss: 0.2888, test_loss: 2.5978, test_f1: 0.5952
 epoch: 64, train_loss: 0.3225, test_loss: 2.5318, test_f1: 0.5790
 epoch: 65, train_loss: 0.2983, test_loss: 2.6172, test_f1: 0.6240
 epoch: 66, train_loss: 0.2956, test_loss: 2.8188, test_f1: 0.5948
 epoch: 67, train_loss: 0.2881, test_loss: 2.7009, test_f1: 0.6159
 epoch: 68, train_loss: 0.2922, test_loss: 2.9749, test_f1: 0.6053
 epoch: 69, train_loss: 0.2843, test_loss: 2.9344, test_f1: 0.5875
 epoch: 70, train_loss: 0.2924, test_loss: 3.0339, test_f1: 0.6077
 epoch: 71, train_loss: 0.2723, test_loss: 2.6258, test_f1: 0.6252
 epoch: 72, train_loss: 0.2895, test_loss: 2.9704, test_f1: 0.5916
 epoch: 73, train_loss: 0.2721, test_loss: 2.7966, test_f1: 0.6168
 epoch: 74, train_loss: 0.2751, test_loss: 2.8101, test_f1: 0.5985
 epoch: 75, train_loss: 0.2759, test_loss: 2.6038, test_f1: 0.6119
 epoch: 76, train_loss: 0.2819, test_loss: 2.9803, test_f1: 0.6052
 epoch: 77, train_loss: 0.2337, test_loss: 3.2933, test_f1: 0.6123
 epoch: 78, train_loss: 0.2568, test_loss: 3.0450, test_f1: 0.5813
 epoch: 79, train_loss: 0.2525, test_loss: 3.2928, test_f1: 0.6327
 epoch: 80, train_loss: 0.2441, test_loss: 3.4765, test_f1: 0.5773
 epoch: 81, train_loss: 0.2398, test_loss: 3.0190, test_f1: 0.6093
 epoch: 82, train_loss: 0.2153, test_loss: 2.9842, test_f1: 0.6213
 epoch: 83, train_loss: 0.2017, test_loss: 3.1770, test_f1: 0.6283
 epoch: 84, train_loss: 0.2286, test_loss: 3.0513, test_f1: 0.6258
 epoch: 85, train_loss: 0.2397, test_loss: 3.1203, test_f1: 0.5869
 epoch: 86, train_loss: 0.2202, test_loss: 3.6218, test_f1: 0.5942
 epoch: 87, train_loss: 0.2317, test_loss: 3.6848, test_f1: 0.5980
 epoch: 88, train_loss: 0.2452, test_loss: 3.4986, test_f1: 0.6082
 epoch: 89, train_loss: 0.2625, test_loss: 3.7645, test_f1: 0.5776
 epoch: 90, train_loss: 0.2242, test_loss: 3.0907, test_f1: 0.5974
 epoch: 91, train_loss: 0.2318, test_loss: 3.7665, test_f1: 0.5946
 epoch: 92, train_loss: 0.2136, test_loss: 3.8338, test_f1: 0.5949
 epoch: 93, train_loss: 0.1943, test_loss: 3.5488, test_f1: 0.6208
 epoch: 94, train_loss: 0.2229, test_loss: 3.9362, test_f1: 0.5716
 epoch: 95, train_loss: 0.2202, test_loss: 3.7010, test_f1: 0.5846
 epoch: 96, train_loss: 0.1901, test_loss: 3.6787, test_f1: 0.5964
 epoch: 97, train_loss: 0.2149, test_loss: 4.1403, test_f1: 0.6088
 epoch: 98, train_loss: 0.1840, test_loss: 3.7347, test_f1: 0.5966
 epoch: 99, train_loss: 0.1725, test_loss: 3.9071, test_f1: 0.5958
##################ITERATION #2 ****************************************
 epoch: 0, train_loss: 1.2335, test_loss: 1.3296, test_f1: 0.1471
 epoch: 1, train_loss: 1.0771, test_loss: 1.1811, test_f1: 0.4011
 epoch: 2, train_loss: 1.0396, test_loss: 1.1376, test_f1: 0.4651
 epoch: 3, train_loss: 1.0227, test_loss: 1.1014, test_f1: 0.4815
 epoch: 4, train_loss: 0.9645, test_loss: 1.0862, test_f1: 0.5471
 epoch: 5, train_loss: 0.9376, test_loss: 1.0962, test_f1: 0.5637
 epoch: 6, train_loss: 0.9065, test_loss: 0.9977, test_f1: 0.5579
 epoch: 7, train_loss: 0.9112, test_loss: 1.0799, test_f1: 0.5449
 epoch: 8, train_loss: 0.8836, test_loss: 1.0247, test_f1: 0.5636
 epoch: 9, train_loss: 0.8735, test_loss: 1.0752, test_f1: 0.5809
 epoch: 10, train_loss: 0.8599, test_loss: 1.0117, test_f1: 0.5884
 epoch: 11, train_loss: 0.8280, test_loss: 1.1105, test_f1: 0.5311
 epoch: 12, train_loss: 0.8395, test_loss: 1.0716, test_f1: 0.5588
 epoch: 13, train_loss: 0.8071, test_loss: 1.1108, test_f1: 0.5220
 epoch: 14, train_loss: 0.8170, test_loss: 1.0983, test_f1: 0.5885
 epoch: 15, train_loss: 0.7922, test_loss: 1.1693, test_f1: 0.5496
 epoch: 16, train_loss: 0.7672, test_loss: 1.1223, test_f1: 0.5580
 epoch: 17, train_loss: 0.7657, test_loss: 1.1857, test_f1: 0.5472
 epoch: 18, train_loss: 0.7606, test_loss: 1.2060, test_f1: 0.5821
 epoch: 19, train_loss: 0.7527, test_loss: 1.2512, test_f1: 0.5242
 epoch: 20, train_loss: 0.7288, test_loss: 1.2108, test_f1: 0.5690
 epoch: 21, train_loss: 0.7478, test_loss: 1.1869, test_f1: 0.5633
 epoch: 22, train_loss: 0.7281, test_loss: 1.2120, test_f1: 0.5907
 epoch: 23, train_loss: 0.7032, test_loss: 1.2176, test_f1: 0.5832
 epoch: 24, train_loss: 0.7067, test_loss: 1.2248, test_f1: 0.5821
 epoch: 25, train_loss: 0.7039, test_loss: 1.1871, test_f1: 0.5743
 epoch: 26, train_loss: 0.6842, test_loss: 1.1757, test_f1: 0.6103
 epoch: 27, train_loss: 0.6759, test_loss: 1.4560, test_f1: 0.5837
 epoch: 28, train_loss: 0.6663, test_loss: 1.3252, test_f1: 0.5860
 epoch: 29, train_loss: 0.6405, test_loss: 1.4731, test_f1: 0.5930
 epoch: 30, train_loss: 0.6513, test_loss: 1.3929, test_f1: 0.5776
 epoch: 31, train_loss: 0.6096, test_loss: 1.5875, test_f1: 0.5542
 epoch: 32, train_loss: 0.6352, test_loss: 1.5470, test_f1: 0.5486
 epoch: 33, train_loss: 0.6343, test_loss: 1.5328, test_f1: 0.5501
 epoch: 34, train_loss: 0.6241, test_loss: 1.3546, test_f1: 0.5795
 epoch: 35, train_loss: 0.5910, test_loss: 1.6622, test_f1: 0.5414
 epoch: 36, train_loss: 0.6025, test_loss: 1.6908, test_f1: 0.5710
 epoch: 37, train_loss: 0.5979, test_loss: 1.5028, test_f1: 0.5350
 epoch: 38, train_loss: 0.5974, test_loss: 1.3933, test_f1: 0.6005
 epoch: 39, train_loss: 0.5674, test_loss: 1.4560, test_f1: 0.5927
 epoch: 40, train_loss: 0.5413, test_loss: 1.6483, test_f1: 0.5863
 epoch: 41, train_loss: 0.5604, test_loss: 1.4813, test_f1: 0.5869
 epoch: 42, train_loss: 0.5353, test_loss: 1.6780, test_f1: 0.5705
 epoch: 43, train_loss: 0.5509, test_loss: 1.7411, test_f1: 0.5842
 epoch: 44, train_loss: 0.5193, test_loss: 1.6562, test_f1: 0.5860
 epoch: 45, train_loss: 0.5241, test_loss: 1.6898, test_f1: 0.5950
 epoch: 46, train_loss: 0.5371, test_loss: 1.7789, test_f1: 0.5935
 epoch: 47, train_loss: 0.5343, test_loss: 1.6369, test_f1: 0.5482
 epoch: 48, train_loss: 0.4792, test_loss: 1.7173, test_f1: 0.5920
 epoch: 49, train_loss: 0.4842, test_loss: 1.7041, test_f1: 0.5347
 epoch: 50, train_loss: 0.4652, test_loss: 1.9632, test_f1: 0.5934
 epoch: 51, train_loss: 0.4491, test_loss: 1.9151, test_f1: 0.6087
 epoch: 52, train_loss: 0.4115, test_loss: 2.0123, test_f1: 0.6213
 epoch: 53, train_loss: 0.3968, test_loss: 1.8343, test_f1: 0.6171
 epoch: 54, train_loss: 0.3839, test_loss: 2.1869, test_f1: 0.5958
 epoch: 55, train_loss: 0.3729, test_loss: 2.1093, test_f1: 0.6283
 epoch: 56, train_loss: 0.4087, test_loss: 2.0809, test_f1: 0.5622
 epoch: 57, train_loss: 0.3879, test_loss: 1.9566, test_f1: 0.6141
 epoch: 58, train_loss: 0.3848, test_loss: 2.0225, test_f1: 0.6287
 epoch: 59, train_loss: 0.3741, test_loss: 1.8553, test_f1: 0.5957
 epoch: 60, train_loss: 0.3636, test_loss: 2.1939, test_f1: 0.6096
 epoch: 61, train_loss: 0.3476, test_loss: 1.9646, test_f1: 0.6243
 epoch: 62, train_loss: 0.3574, test_loss: 2.2893, test_f1: 0.5797
 epoch: 63, train_loss: 0.3533, test_loss: 2.0740, test_f1: 0.6261
 epoch: 64, train_loss: 0.3512, test_loss: 2.3505, test_f1: 0.6215
 epoch: 65, train_loss: 0.3444, test_loss: 1.9347, test_f1: 0.6045
 epoch: 66, train_loss: 0.3305, test_loss: 2.2553, test_f1: 0.6017
 epoch: 67, train_loss: 0.3266, test_loss: 2.4231, test_f1: 0.6054
 epoch: 68, train_loss: 0.3485, test_loss: 2.3181, test_f1: 0.5900
 epoch: 69, train_loss: 0.3183, test_loss: 2.3006, test_f1: 0.6285
 epoch: 70, train_loss: 0.3166, test_loss: 2.4054, test_f1: 0.6077
 epoch: 71, train_loss: 0.3087, test_loss: 2.4066, test_f1: 0.5883
 epoch: 72, train_loss: 0.3449, test_loss: 2.3479, test_f1: 0.6118
 epoch: 73, train_loss: 0.3453, test_loss: 2.3151, test_f1: 0.6062
 epoch: 74, train_loss: 0.3088, test_loss: 2.4175, test_f1: 0.5894
 epoch: 75, train_loss: 0.2946, test_loss: 2.3695, test_f1: 0.5803
 epoch: 76, train_loss: 0.2919, test_loss: 2.3386, test_f1: 0.5769
 epoch: 77, train_loss: 0.2902, test_loss: 2.6528, test_f1: 0.5953
 epoch: 78, train_loss: 0.2711, test_loss: 2.5956, test_f1: 0.5920
 epoch: 79, train_loss: 0.2551, test_loss: 2.6885, test_f1: 0.5894
 epoch: 80, train_loss: 0.3131, test_loss: 2.7699, test_f1: 0.5921
 epoch: 81, train_loss: 0.2760, test_loss: 2.5736, test_f1: 0.5875
 epoch: 82, train_loss: 0.2788, test_loss: 2.7246, test_f1: 0.6167
 epoch: 83, train_loss: 0.2664, test_loss: 2.5607, test_f1: 0.6012
 epoch: 84, train_loss: 0.2933, test_loss: 2.6100, test_f1: 0.5871
 epoch: 85, train_loss: 0.2727, test_loss: 2.7276, test_f1: 0.6028
 epoch: 86, train_loss: 0.2546, test_loss: 2.8587, test_f1: 0.6057
 epoch: 87, train_loss: 0.2442, test_loss: 2.8017, test_f1: 0.5946
 epoch: 88, train_loss: 0.2741, test_loss: 2.8602, test_f1: 0.5871
 epoch: 89, train_loss: 0.2560, test_loss: 2.8951, test_f1: 0.5914
 epoch: 90, train_loss: 0.2532, test_loss: 2.7171, test_f1: 0.6236
 epoch: 91, train_loss: 0.2471, test_loss: 3.0358, test_f1: 0.5854
 epoch: 92, train_loss: 0.2499, test_loss: 2.9454, test_f1: 0.5861
 epoch: 93, train_loss: 0.2471, test_loss: 2.9578, test_f1: 0.5957
 epoch: 94, train_loss: 0.2389, test_loss: 2.8476, test_f1: 0.6182
 epoch: 95, train_loss: 0.2457, test_loss: 3.0687, test_f1: 0.5942
 epoch: 96, train_loss: 0.2113, test_loss: 3.0534, test_f1: 0.5990
 epoch: 97, train_loss: 0.2553, test_loss: 2.9415, test_f1: 0.5789
 epoch: 98, train_loss: 0.2577, test_loss: 3.5671, test_f1: 0.5897
 epoch: 99, train_loss: 0.2242, test_loss: 2.9717, test_f1: 0.6030
##################ITERATION #3 ****************************************
 epoch: 0, train_loss: 1.2386, test_loss: 1.3019, test_f1: 0.1368
 epoch: 1, train_loss: 1.0945, test_loss: 1.2178, test_f1: 0.2378
 epoch: 2, train_loss: 1.0295, test_loss: 1.0571, test_f1: 0.4932
 epoch: 3, train_loss: 0.9903, test_loss: 1.0481, test_f1: 0.5175
 epoch: 4, train_loss: 0.9650, test_loss: 1.0321, test_f1: 0.5174
 epoch: 5, train_loss: 0.9497, test_loss: 1.0254, test_f1: 0.5325
 epoch: 6, train_loss: 0.9013, test_loss: 1.0277, test_f1: 0.5335
 epoch: 7, train_loss: 0.9035, test_loss: 1.0269, test_f1: 0.5462
 epoch: 8, train_loss: 0.8771, test_loss: 1.0229, test_f1: 0.5384
 epoch: 9, train_loss: 0.8913, test_loss: 0.9356, test_f1: 0.5875
 epoch: 10, train_loss: 0.8576, test_loss: 1.0402, test_f1: 0.5668
 epoch: 11, train_loss: 0.8493, test_loss: 1.0113, test_f1: 0.5577
 epoch: 12, train_loss: 0.8163, test_loss: 1.0271, test_f1: 0.5505
 epoch: 13, train_loss: 0.7965, test_loss: 1.0211, test_f1: 0.6002
 epoch: 14, train_loss: 0.7993, test_loss: 1.1134, test_f1: 0.5898
 epoch: 15, train_loss: 0.7989, test_loss: 1.0130, test_f1: 0.6198
 epoch: 16, train_loss: 0.7927, test_loss: 1.0986, test_f1: 0.5734
 epoch: 17, train_loss: 0.7752, test_loss: 1.0820, test_f1: 0.6037
 epoch: 18, train_loss: 0.7775, test_loss: 1.1000, test_f1: 0.6020
 epoch: 19, train_loss: 0.7551, test_loss: 1.1046, test_f1: 0.6176
 epoch: 20, train_loss: 0.7238, test_loss: 1.0363, test_f1: 0.6218
 epoch: 21, train_loss: 0.7322, test_loss: 1.3061, test_f1: 0.5336
 epoch: 22, train_loss: 0.7225, test_loss: 1.1149, test_f1: 0.6267
 epoch: 23, train_loss: 0.7027, test_loss: 1.0865, test_f1: 0.6214
 epoch: 24, train_loss: 0.6780, test_loss: 1.0970, test_f1: 0.6709
 epoch: 25, train_loss: 0.6658, test_loss: 1.2169, test_f1: 0.5899
 epoch: 26, train_loss: 0.6455, test_loss: 1.2862, test_f1: 0.6031
 epoch: 27, train_loss: 0.6311, test_loss: 1.1233, test_f1: 0.6118
 epoch: 28, train_loss: 0.6428, test_loss: 1.2421, test_f1: 0.6121
 epoch: 29, train_loss: 0.6435, test_loss: 1.2676, test_f1: 0.6109
 epoch: 30, train_loss: 0.6046, test_loss: 1.3594, test_f1: 0.5634
 epoch: 31, train_loss: 0.5890, test_loss: 1.2347, test_f1: 0.6353
 epoch: 32, train_loss: 0.5952, test_loss: 1.4212, test_f1: 0.5918
 epoch: 33, train_loss: 0.5894, test_loss: 1.3789, test_f1: 0.5880
 epoch: 34, train_loss: 0.5828, test_loss: 1.3126, test_f1: 0.5976
 epoch: 35, train_loss: 0.5886, test_loss: 1.3790, test_f1: 0.5758
 epoch: 36, train_loss: 0.5785, test_loss: 1.5103, test_f1: 0.6010
 epoch: 37, train_loss: 0.5637, test_loss: 1.3778, test_f1: 0.5859
 epoch: 38, train_loss: 0.5258, test_loss: 1.6047, test_f1: 0.6048
 epoch: 39, train_loss: 0.5485, test_loss: 1.4175, test_f1: 0.5934
 epoch: 40, train_loss: 0.5157, test_loss: 1.6645, test_f1: 0.5534
 epoch: 41, train_loss: 0.5186, test_loss: 1.5990, test_f1: 0.6097
 epoch: 42, train_loss: 0.5386, test_loss: 1.5041, test_f1: 0.5917
 epoch: 43, train_loss: 0.4973, test_loss: 1.6409, test_f1: 0.5960
 epoch: 44, train_loss: 0.4687, test_loss: 1.4915, test_f1: 0.6193
 epoch: 45, train_loss: 0.4628, test_loss: 1.7356, test_f1: 0.6146
 epoch: 46, train_loss: 0.4657, test_loss: 1.8038, test_f1: 0.5738
 epoch: 47, train_loss: 0.4697, test_loss: 1.7361, test_f1: 0.5669
 epoch: 48, train_loss: 0.4609, test_loss: 1.7042, test_f1: 0.5993
 epoch: 49, train_loss: 0.4593, test_loss: 1.7916, test_f1: 0.5877
 epoch: 50, train_loss: 0.4738, test_loss: 1.6130, test_f1: 0.6007
 epoch: 51, train_loss: 0.4341, test_loss: 1.8298, test_f1: 0.5837
 epoch: 52, train_loss: 0.4026, test_loss: 1.8271, test_f1: 0.6225
 epoch: 53, train_loss: 0.3638, test_loss: 1.8842, test_f1: 0.6016
 epoch: 54, train_loss: 0.3729, test_loss: 1.9319, test_f1: 0.5861
 epoch: 55, train_loss: 0.3337, test_loss: 1.9584, test_f1: 0.5899
 epoch: 56, train_loss: 0.3416, test_loss: 2.1128, test_f1: 0.5887
 epoch: 57, train_loss: 0.3439, test_loss: 1.9593, test_f1: 0.6097
 epoch: 58, train_loss: 0.3287, test_loss: 2.0083, test_f1: 0.6077
 epoch: 59, train_loss: 0.3250, test_loss: 2.0537, test_f1: 0.6161
 epoch: 60, train_loss: 0.3221, test_loss: 2.1648, test_f1: 0.5740
 epoch: 61, train_loss: 0.2993, test_loss: 2.1015, test_f1: 0.6027
 epoch: 62, train_loss: 0.2983, test_loss: 2.1448, test_f1: 0.5878
 epoch: 63, train_loss: 0.3171, test_loss: 2.2380, test_f1: 0.5827
 epoch: 64, train_loss: 0.3002, test_loss: 2.3448, test_f1: 0.5905
 epoch: 65, train_loss: 0.3030, test_loss: 2.3021, test_f1: 0.6050
 epoch: 66, train_loss: 0.2928, test_loss: 2.4777, test_f1: 0.6021
 epoch: 67, train_loss: 0.2926, test_loss: 2.4681, test_f1: 0.5861
 epoch: 68, train_loss: 0.2882, test_loss: 2.2585, test_f1: 0.6086
 epoch: 69, train_loss: 0.2972, test_loss: 2.3712, test_f1: 0.5866
 epoch: 70, train_loss: 0.3019, test_loss: 2.2866, test_f1: 0.5780
 epoch: 71, train_loss: 0.2732, test_loss: 2.4348, test_f1: 0.6080
 epoch: 72, train_loss: 0.2908, test_loss: 2.4490, test_f1: 0.6016
 epoch: 73, train_loss: 0.2706, test_loss: 2.6443, test_f1: 0.5606
 epoch: 74, train_loss: 0.2866, test_loss: 2.2917, test_f1: 0.5946
 epoch: 75, train_loss: 0.3032, test_loss: 2.5592, test_f1: 0.6294
 epoch: 76, train_loss: 0.2902, test_loss: 2.4137, test_f1: 0.5870
 epoch: 77, train_loss: 0.2669, test_loss: 2.6684, test_f1: 0.5692
 epoch: 78, train_loss: 0.2851, test_loss: 2.5824, test_f1: 0.5740
 epoch: 79, train_loss: 0.2390, test_loss: 2.6162, test_f1: 0.5690
 epoch: 80, train_loss: 0.2780, test_loss: 2.5056, test_f1: 0.5978
 epoch: 81, train_loss: 0.2701, test_loss: 2.6031, test_f1: 0.6055
 epoch: 82, train_loss: 0.2680, test_loss: 2.8263, test_f1: 0.5934
 epoch: 83, train_loss: 0.2476, test_loss: 2.6728, test_f1: 0.5821
 epoch: 84, train_loss: 0.2545, test_loss: 2.4907, test_f1: 0.5802
 epoch: 85, train_loss: 0.2515, test_loss: 2.5965, test_f1: 0.5640
 epoch: 86, train_loss: 0.2138, test_loss: 2.7385, test_f1: 0.5970
 epoch: 87, train_loss: 0.2428, test_loss: 2.9500, test_f1: 0.6057
 epoch: 88, train_loss: 0.2193, test_loss: 2.7324, test_f1: 0.5878
 epoch: 89, train_loss: 0.2482, test_loss: 3.1384, test_f1: 0.5743
 epoch: 90, train_loss: 0.2533, test_loss: 2.8211, test_f1: 0.5845
 epoch: 91, train_loss: 0.2361, test_loss: 2.6809, test_f1: 0.5763
 epoch: 92, train_loss: 0.2457, test_loss: 2.7412, test_f1: 0.5785
 epoch: 93, train_loss: 0.2118, test_loss: 2.9819, test_f1: 0.5791
 epoch: 94, train_loss: 0.2066, test_loss: 2.9456, test_f1: 0.5812
 epoch: 95, train_loss: 0.2449, test_loss: 3.0165, test_f1: 0.5864
 epoch: 96, train_loss: 0.2388, test_loss: 2.9428, test_f1: 0.6036
 epoch: 97, train_loss: 0.2438, test_loss: 3.3081, test_f1: 0.5914
 epoch: 98, train_loss: 0.2265, test_loss: 2.8875, test_f1: 0.5971
 epoch: 99, train_loss: 0.2196, test_loss: 3.0619, test_f1: 0.5937
##################ITERATION #4 ****************************************
 epoch: 0, train_loss: 1.2719, test_loss: 1.3004, test_f1: 0.3708
 epoch: 1, train_loss: 1.1249, test_loss: 1.2229, test_f1: 0.3567
 epoch: 2, train_loss: 1.0528, test_loss: 1.0923, test_f1: 0.5105
 epoch: 3, train_loss: 1.0116, test_loss: 1.1167, test_f1: 0.4365
 epoch: 4, train_loss: 0.9905, test_loss: 1.1554, test_f1: 0.5020
 epoch: 5, train_loss: 0.9785, test_loss: 1.1551, test_f1: 0.5035
 epoch: 6, train_loss: 0.9312, test_loss: 1.0029, test_f1: 0.5458
 epoch: 7, train_loss: 0.9189, test_loss: 0.9912, test_f1: 0.5667
 epoch: 8, train_loss: 0.9123, test_loss: 1.0705, test_f1: 0.5721
 epoch: 9, train_loss: 0.8829, test_loss: 1.0904, test_f1: 0.5470
 epoch: 10, train_loss: 0.8960, test_loss: 1.1160, test_f1: 0.5548
 epoch: 11, train_loss: 0.8696, test_loss: 1.0471, test_f1: 0.5584
 epoch: 12, train_loss: 0.8598, test_loss: 1.0353, test_f1: 0.5706
 epoch: 13, train_loss: 0.8412, test_loss: 1.0900, test_f1: 0.5574
 epoch: 14, train_loss: 0.8105, test_loss: 1.0346, test_f1: 0.5762
 epoch: 15, train_loss: 0.8129, test_loss: 1.0378, test_f1: 0.5953
 epoch: 16, train_loss: 0.8244, test_loss: 1.1215, test_f1: 0.5686
 epoch: 17, train_loss: 0.8044, test_loss: 1.0831, test_f1: 0.6045
 epoch: 18, train_loss: 0.7755, test_loss: 1.0684, test_f1: 0.5918
 epoch: 19, train_loss: 0.7794, test_loss: 1.0296, test_f1: 0.5962
 epoch: 20, train_loss: 0.7586, test_loss: 1.1729, test_f1: 0.5844
 epoch: 21, train_loss: 0.7460, test_loss: 1.1884, test_f1: 0.5832
 epoch: 22, train_loss: 0.7335, test_loss: 1.1128, test_f1: 0.6097
 epoch: 23, train_loss: 0.7418, test_loss: 1.1895, test_f1: 0.5991
 epoch: 24, train_loss: 0.7286, test_loss: 1.1544, test_f1: 0.5874
 epoch: 25, train_loss: 0.7168, test_loss: 1.1645, test_f1: 0.5921
 epoch: 26, train_loss: 0.7252, test_loss: 1.0704, test_f1: 0.5949
 epoch: 27, train_loss: 0.7150, test_loss: 1.1858, test_f1: 0.5664
 epoch: 28, train_loss: 0.6732, test_loss: 1.1901, test_f1: 0.6126
 epoch: 29, train_loss: 0.6890, test_loss: 1.2128, test_f1: 0.6316
 epoch: 30, train_loss: 0.6753, test_loss: 1.2093, test_f1: 0.5985
 epoch: 31, train_loss: 0.6692, test_loss: 1.2248, test_f1: 0.6126
 epoch: 32, train_loss: 0.6440, test_loss: 1.3182, test_f1: 0.5800
 epoch: 33, train_loss: 0.6402, test_loss: 1.4067, test_f1: 0.5529
 epoch: 34, train_loss: 0.6430, test_loss: 1.2665, test_f1: 0.5835
 epoch: 35, train_loss: 0.6277, test_loss: 1.3999, test_f1: 0.5637
 epoch: 36, train_loss: 0.6061, test_loss: 1.3570, test_f1: 0.6236
 epoch: 37, train_loss: 0.5905, test_loss: 1.5006, test_f1: 0.5901
 epoch: 38, train_loss: 0.6105, test_loss: 1.3962, test_f1: 0.5899
 epoch: 39, train_loss: 0.6019, test_loss: 1.5315, test_f1: 0.6007
 epoch: 40, train_loss: 0.5749, test_loss: 1.4178, test_f1: 0.5911
 epoch: 41, train_loss: 0.5544, test_loss: 1.6642, test_f1: 0.5603
 epoch: 42, train_loss: 0.5766, test_loss: 1.5848, test_f1: 0.5393
 epoch: 43, train_loss: 0.5763, test_loss: 1.4949, test_f1: 0.6187
 epoch: 44, train_loss: 0.5491, test_loss: 1.4341, test_f1: 0.6332
 epoch: 45, train_loss: 0.5481, test_loss: 1.6338, test_f1: 0.5625
 epoch: 46, train_loss: 0.5397, test_loss: 1.4268, test_f1: 0.6014
 epoch: 47, train_loss: 0.5473, test_loss: 1.5330, test_f1: 0.6082
 epoch: 48, train_loss: 0.5456, test_loss: 1.5411, test_f1: 0.6059
 epoch: 49, train_loss: 0.5292, test_loss: 1.6906, test_f1: 0.5714
 epoch: 50, train_loss: 0.5340, test_loss: 1.6320, test_f1: 0.5684
 epoch: 51, train_loss: 0.4874, test_loss: 1.6513, test_f1: 0.6042
 epoch: 52, train_loss: 0.4556, test_loss: 1.6420, test_f1: 0.6267
 epoch: 53, train_loss: 0.4365, test_loss: 1.7573, test_f1: 0.6340
 epoch: 54, train_loss: 0.4215, test_loss: 1.8000, test_f1: 0.6110
 epoch: 55, train_loss: 0.4294, test_loss: 1.7133, test_f1: 0.6375
 epoch: 56, train_loss: 0.4132, test_loss: 1.8917, test_f1: 0.6407
 epoch: 57, train_loss: 0.4085, test_loss: 1.8818, test_f1: 0.6359
 epoch: 58, train_loss: 0.4399, test_loss: 2.0468, test_f1: 0.6024
 epoch: 59, train_loss: 0.3935, test_loss: 1.9633, test_f1: 0.5935
 epoch: 60, train_loss: 0.3922, test_loss: 2.0076, test_f1: 0.6058
 epoch: 61, train_loss: 0.3759, test_loss: 2.0128, test_f1: 0.5866
 epoch: 62, train_loss: 0.3774, test_loss: 2.0489, test_f1: 0.6297
 epoch: 63, train_loss: 0.3822, test_loss: 2.1250, test_f1: 0.6018
 epoch: 64, train_loss: 0.3709, test_loss: 2.2311, test_f1: 0.5914
 epoch: 65, train_loss: 0.3497, test_loss: 2.1601, test_f1: 0.5886
 epoch: 66, train_loss: 0.3534, test_loss: 2.4638, test_f1: 0.5928
 epoch: 67, train_loss: 0.3572, test_loss: 2.2520, test_f1: 0.6086
 epoch: 68, train_loss: 0.3402, test_loss: 2.2350, test_f1: 0.5801
 epoch: 69, train_loss: 0.3501, test_loss: 2.4022, test_f1: 0.5810
 epoch: 70, train_loss: 0.3500, test_loss: 2.3918, test_f1: 0.5691
 epoch: 71, train_loss: 0.3553, test_loss: 2.3608, test_f1: 0.6004
 epoch: 72, train_loss: 0.3224, test_loss: 2.3540, test_f1: 0.5839
 epoch: 73, train_loss: 0.3167, test_loss: 2.5429, test_f1: 0.5956
 epoch: 74, train_loss: 0.3456, test_loss: 2.6320, test_f1: 0.5742
 epoch: 75, train_loss: 0.3455, test_loss: 2.4801, test_f1: 0.5828
 epoch: 76, train_loss: 0.3340, test_loss: 2.7475, test_f1: 0.5923
 epoch: 77, train_loss: 0.3315, test_loss: 2.7540, test_f1: 0.5592
 epoch: 78, train_loss: 0.3101, test_loss: 2.5304, test_f1: 0.5841
 epoch: 79, train_loss: 0.3470, test_loss: 2.5836, test_f1: 0.5960
 epoch: 80, train_loss: 0.2997, test_loss: 2.6621, test_f1: 0.5972
 epoch: 81, train_loss: 0.3046, test_loss: 2.7718, test_f1: 0.5864
 epoch: 82, train_loss: 0.2797, test_loss: 2.5598, test_f1: 0.5956
 epoch: 83, train_loss: 0.3000, test_loss: 2.7358, test_f1: 0.5880
 epoch: 84, train_loss: 0.2923, test_loss: 3.1106, test_f1: 0.5919
 epoch: 85, train_loss: 0.2692, test_loss: 3.1012, test_f1: 0.5898
 epoch: 86, train_loss: 0.2736, test_loss: 3.1207, test_f1: 0.5911
 epoch: 87, train_loss: 0.2731, test_loss: 2.8004, test_f1: 0.5734
 epoch: 88, train_loss: 0.2874, test_loss: 2.9066, test_f1: 0.6092
 epoch: 89, train_loss: 0.2825, test_loss: 3.1645, test_f1: 0.5729
 epoch: 90, train_loss: 0.2710, test_loss: 2.9630, test_f1: 0.5780
 epoch: 91, train_loss: 0.2638, test_loss: 2.8819, test_f1: 0.5916
 epoch: 92, train_loss: 0.2523, test_loss: 2.9349, test_f1: 0.5880
 epoch: 93, train_loss: 0.2623, test_loss: 3.1029, test_f1: 0.6001
 epoch: 94, train_loss: 0.2824, test_loss: 3.3317, test_f1: 0.5978
 epoch: 95, train_loss: 0.2654, test_loss: 3.3448, test_f1: 0.5921
 epoch: 96, train_loss: 0.2685, test_loss: 2.8678, test_f1: 0.5876
 epoch: 97, train_loss: 0.2705, test_loss: 3.0950, test_f1: 0.5897
 epoch: 98, train_loss: 0.2941, test_loss: 3.1704, test_f1: 0.5763
 epoch: 99, train_loss: 0.2662, test_loss: 3.0549, test_f1: 0.5546
##################ITERATION #5 ****************************************
 epoch: 0, train_loss: 1.3050, test_loss: 1.3362, test_f1: 0.1365
 epoch: 1, train_loss: 1.1084, test_loss: 1.2511, test_f1: 0.3757
 epoch: 2, train_loss: 1.0128, test_loss: 1.0917, test_f1: 0.5163
 epoch: 3, train_loss: 0.9890, test_loss: 1.0635, test_f1: 0.5293
 epoch: 4, train_loss: 0.9600, test_loss: 1.1721, test_f1: 0.5500
 epoch: 5, train_loss: 0.9381, test_loss: 1.0774, test_f1: 0.5350
 epoch: 6, train_loss: 0.8970, test_loss: 1.1105, test_f1: 0.5160
 epoch: 7, train_loss: 0.9069, test_loss: 1.0023, test_f1: 0.5305
 epoch: 8, train_loss: 0.8851, test_loss: 1.1107, test_f1: 0.5173
 epoch: 9, train_loss: 0.8583, test_loss: 1.0736, test_f1: 0.5572
 epoch: 10, train_loss: 0.8396, test_loss: 1.1710, test_f1: 0.5571
 epoch: 11, train_loss: 0.8179, test_loss: 1.1994, test_f1: 0.5384
 epoch: 12, train_loss: 0.8388, test_loss: 1.2236, test_f1: 0.5702
 epoch: 13, train_loss: 0.8140, test_loss: 1.1641, test_f1: 0.5934
 epoch: 14, train_loss: 0.8059, test_loss: 1.1350, test_f1: 0.5139
 epoch: 15, train_loss: 0.7980, test_loss: 1.1628, test_f1: 0.5723
 epoch: 16, train_loss: 0.7819, test_loss: 1.2098, test_f1: 0.5676
 epoch: 17, train_loss: 0.7763, test_loss: 1.2200, test_f1: 0.5758
 epoch: 18, train_loss: 0.7762, test_loss: 1.4552, test_f1: 0.4705
 epoch: 19, train_loss: 0.7673, test_loss: 1.1768, test_f1: 0.5861
 epoch: 20, train_loss: 0.7536, test_loss: 1.2025, test_f1: 0.5833
 epoch: 21, train_loss: 0.7759, test_loss: 1.2695, test_f1: 0.5468
 epoch: 22, train_loss: 0.7335, test_loss: 1.1942, test_f1: 0.5905
 epoch: 23, train_loss: 0.7315, test_loss: 1.2973, test_f1: 0.5934
 epoch: 24, train_loss: 0.7307, test_loss: 1.3870, test_f1: 0.5067
 epoch: 25, train_loss: 0.7112, test_loss: 1.1788, test_f1: 0.5833
 epoch: 26, train_loss: 0.6883, test_loss: 1.1977, test_f1: 0.5832
 epoch: 27, train_loss: 0.7107, test_loss: 1.2738, test_f1: 0.5698
 epoch: 28, train_loss: 0.6958, test_loss: 1.3400, test_f1: 0.5344
 epoch: 29, train_loss: 0.7144, test_loss: 1.2331, test_f1: 0.6107
 epoch: 30, train_loss: 0.7002, test_loss: 1.4298, test_f1: 0.5662
 epoch: 31, train_loss: 0.6709, test_loss: 1.3297, test_f1: 0.5551
 epoch: 32, train_loss: 0.6339, test_loss: 1.3358, test_f1: 0.5953
 epoch: 33, train_loss: 0.6459, test_loss: 1.4048, test_f1: 0.5476
 epoch: 34, train_loss: 0.6334, test_loss: 1.4410, test_f1: 0.6090
 epoch: 35, train_loss: 0.6506, test_loss: 1.4050, test_f1: 0.5430
 epoch: 36, train_loss: 0.6177, test_loss: 1.4640, test_f1: 0.5750
 epoch: 37, train_loss: 0.6144, test_loss: 1.4384, test_f1: 0.6041
 epoch: 38, train_loss: 0.6252, test_loss: 1.4805, test_f1: 0.5668
 epoch: 39, train_loss: 0.5749, test_loss: 1.4303, test_f1: 0.6198
 epoch: 40, train_loss: 0.5774, test_loss: 1.8565, test_f1: 0.5825
 epoch: 41, train_loss: 0.5806, test_loss: 1.8010, test_f1: 0.5246
 epoch: 42, train_loss: 0.5888, test_loss: 1.5346, test_f1: 0.5894
 epoch: 43, train_loss: 0.5825, test_loss: 1.5127, test_f1: 0.5786
 epoch: 44, train_loss: 0.5407, test_loss: 1.3845, test_f1: 0.6145
 epoch: 45, train_loss: 0.5531, test_loss: 1.5784, test_f1: 0.6139
 epoch: 46, train_loss: 0.5567, test_loss: 1.5982, test_f1: 0.6066
 epoch: 47, train_loss: 0.5356, test_loss: 1.6471, test_f1: 0.5799
 epoch: 48, train_loss: 0.5302, test_loss: 1.6688, test_f1: 0.5940
 epoch: 49, train_loss: 0.5693, test_loss: 1.4635, test_f1: 0.6184
 epoch: 50, train_loss: 0.5663, test_loss: 1.4553, test_f1: 0.6400
 epoch: 51, train_loss: 0.5213, test_loss: 1.5973, test_f1: 0.5954
 epoch: 52, train_loss: 0.4807, test_loss: 1.4549, test_f1: 0.6091
 epoch: 53, train_loss: 0.4520, test_loss: 1.4558, test_f1: 0.6194
 epoch: 54, train_loss: 0.4509, test_loss: 1.7862, test_f1: 0.6111
 epoch: 55, train_loss: 0.4388, test_loss: 1.6253, test_f1: 0.6228
 epoch: 56, train_loss: 0.4200, test_loss: 1.7019, test_f1: 0.6381
 epoch: 57, train_loss: 0.4052, test_loss: 1.7849, test_f1: 0.6058
 epoch: 58, train_loss: 0.4126, test_loss: 1.6757, test_f1: 0.6125
 epoch: 59, train_loss: 0.4152, test_loss: 1.6653, test_f1: 0.6230
 epoch: 60, train_loss: 0.4088, test_loss: 1.8750, test_f1: 0.6017
 epoch: 61, train_loss: 0.3995, test_loss: 1.7860, test_f1: 0.6304
 epoch: 62, train_loss: 0.3830, test_loss: 1.7355, test_f1: 0.6174
 epoch: 63, train_loss: 0.3796, test_loss: 1.9489, test_f1: 0.6197
 epoch: 64, train_loss: 0.3823, test_loss: 1.7507, test_f1: 0.6321
 epoch: 65, train_loss: 0.3908, test_loss: 1.7544, test_f1: 0.6480
 epoch: 66, train_loss: 0.3647, test_loss: 2.0232, test_f1: 0.6054
 epoch: 67, train_loss: 0.3607, test_loss: 2.0015, test_f1: 0.6003
 epoch: 68, train_loss: 0.3465, test_loss: 1.9437, test_f1: 0.6494
 epoch: 69, train_loss: 0.3519, test_loss: 2.1180, test_f1: 0.6325
 epoch: 70, train_loss: 0.3417, test_loss: 2.0402, test_f1: 0.6189
 epoch: 71, train_loss: 0.3536, test_loss: 2.0391, test_f1: 0.6361
 epoch: 72, train_loss: 0.3500, test_loss: 2.1175, test_f1: 0.6254
 epoch: 73, train_loss: 0.3142, test_loss: 2.2029, test_f1: 0.6157
 epoch: 74, train_loss: 0.3275, test_loss: 2.2282, test_f1: 0.6110
 epoch: 75, train_loss: 0.3255, test_loss: 2.1674, test_f1: 0.6041
 epoch: 76, train_loss: 0.3340, test_loss: 2.2175, test_f1: 0.5866
 epoch: 77, train_loss: 0.3176, test_loss: 2.1956, test_f1: 0.6246
 epoch: 78, train_loss: 0.3278, test_loss: 2.2346, test_f1: 0.6305
 epoch: 79, train_loss: 0.3038, test_loss: 2.1548, test_f1: 0.6341
 epoch: 80, train_loss: 0.3273, test_loss: 2.2230, test_f1: 0.6199
 epoch: 81, train_loss: 0.3033, test_loss: 2.1318, test_f1: 0.6310
 epoch: 82, train_loss: 0.2890, test_loss: 2.3079, test_f1: 0.5945
 epoch: 83, train_loss: 0.3062, test_loss: 2.5115, test_f1: 0.6039
 epoch: 84, train_loss: 0.3135, test_loss: 2.2693, test_f1: 0.6370
 epoch: 85, train_loss: 0.3327, test_loss: 2.6406, test_f1: 0.5621
 epoch: 86, train_loss: 0.2858, test_loss: 2.2653, test_f1: 0.6543
 epoch: 87, train_loss: 0.2952, test_loss: 2.4406, test_f1: 0.6261
 epoch: 88, train_loss: 0.2792, test_loss: 2.2385, test_f1: 0.6419
 epoch: 89, train_loss: 0.2772, test_loss: 2.4477, test_f1: 0.6030
 epoch: 90, train_loss: 0.2704, test_loss: 2.4858, test_f1: 0.6307
 epoch: 91, train_loss: 0.2644, test_loss: 2.3427, test_f1: 0.6567
 epoch: 92, train_loss: 0.2591, test_loss: 2.4361, test_f1: 0.6367
 epoch: 93, train_loss: 0.2502, test_loss: 2.4380, test_f1: 0.6084
 epoch: 94, train_loss: 0.2463, test_loss: 2.6023, test_f1: 0.6176
 epoch: 95, train_loss: 0.2586, test_loss: 2.8667, test_f1: 0.5943
 epoch: 96, train_loss: 0.2585, test_loss: 2.7015, test_f1: 0.6183
 epoch: 97, train_loss: 0.2440, test_loss: 2.7624, test_f1: 0.6111
 epoch: 98, train_loss: 0.2273, test_loss: 2.6680, test_f1: 0.6249
 epoch: 99, train_loss: 0.2590, test_loss: 2.7726, test_f1: 0.6156
##################ITERATION #6 ****************************************
 epoch: 0, train_loss: 1.2939, test_loss: 1.2642, test_f1: 0.2108
 epoch: 1, train_loss: 1.0912, test_loss: 1.1521, test_f1: 0.3450
 epoch: 2, train_loss: 1.0234, test_loss: 1.0968, test_f1: 0.4683
 epoch: 3, train_loss: 1.0040, test_loss: 1.0240, test_f1: 0.5445
 epoch: 4, train_loss: 0.9730, test_loss: 1.0875, test_f1: 0.5218
 epoch: 5, train_loss: 0.9530, test_loss: 1.0435, test_f1: 0.5709
 epoch: 6, train_loss: 0.9435, test_loss: 1.1024, test_f1: 0.5647
 epoch: 7, train_loss: 0.9255, test_loss: 1.0667, test_f1: 0.5583
 epoch: 8, train_loss: 0.9108, test_loss: 1.0142, test_f1: 0.5414
 epoch: 9, train_loss: 0.8963, test_loss: 1.0512, test_f1: 0.5588
 epoch: 10, train_loss: 0.9001, test_loss: 1.0974, test_f1: 0.5350
 epoch: 11, train_loss: 0.8823, test_loss: 1.0341, test_f1: 0.5793
 epoch: 12, train_loss: 0.8699, test_loss: 1.0547, test_f1: 0.5258
 epoch: 13, train_loss: 0.8492, test_loss: 1.0996, test_f1: 0.5746
 epoch: 14, train_loss: 0.8319, test_loss: 1.0020, test_f1: 0.6073
 epoch: 15, train_loss: 0.8391, test_loss: 0.9898, test_f1: 0.5874
 epoch: 16, train_loss: 0.8316, test_loss: 1.0400, test_f1: 0.5781
 epoch: 17, train_loss: 0.8099, test_loss: 1.1231, test_f1: 0.5804
 epoch: 18, train_loss: 0.7958, test_loss: 1.0984, test_f1: 0.5914
 epoch: 19, train_loss: 0.7893, test_loss: 1.0658, test_f1: 0.5689
 epoch: 20, train_loss: 0.7969, test_loss: 1.0136, test_f1: 0.6253
 epoch: 21, train_loss: 0.7871, test_loss: 1.1004, test_f1: 0.5931
 epoch: 22, train_loss: 0.7788, test_loss: 1.1545, test_f1: 0.5898
 epoch: 23, train_loss: 0.7606, test_loss: 1.1558, test_f1: 0.6076
 epoch: 24, train_loss: 0.7460, test_loss: 1.0825, test_f1: 0.6032
 epoch: 25, train_loss: 0.7302, test_loss: 1.1732, test_f1: 0.6150
 epoch: 26, train_loss: 0.7522, test_loss: 1.1123, test_f1: 0.5776
 epoch: 27, train_loss: 0.7421, test_loss: 1.2206, test_f1: 0.5839
 epoch: 28, train_loss: 0.7125, test_loss: 1.0781, test_f1: 0.6353
 epoch: 29, train_loss: 0.6918, test_loss: 1.2683, test_f1: 0.5974
 epoch: 30, train_loss: 0.6866, test_loss: 1.2652, test_f1: 0.6089
 epoch: 31, train_loss: 0.6917, test_loss: 1.1543, test_f1: 0.5966
 epoch: 32, train_loss: 0.6644, test_loss: 1.2638, test_f1: 0.5904
 epoch: 33, train_loss: 0.6622, test_loss: 1.2446, test_f1: 0.6385
 epoch: 34, train_loss: 0.6637, test_loss: 1.2597, test_f1: 0.5504
 epoch: 35, train_loss: 0.6545, test_loss: 1.3733, test_f1: 0.6003
 epoch: 36, train_loss: 0.6422, test_loss: 1.2832, test_f1: 0.5920
 epoch: 37, train_loss: 0.6177, test_loss: 1.2958, test_f1: 0.6017
 epoch: 38, train_loss: 0.6247, test_loss: 1.2945, test_f1: 0.6314
 epoch: 39, train_loss: 0.6202, test_loss: 1.3410, test_f1: 0.6303
 epoch: 40, train_loss: 0.6186, test_loss: 1.3280, test_f1: 0.6027
 epoch: 41, train_loss: 0.6317, test_loss: 1.2787, test_f1: 0.6241
 epoch: 42, train_loss: 0.6027, test_loss: 1.4417, test_f1: 0.5675
 epoch: 43, train_loss: 0.5944, test_loss: 1.4450, test_f1: 0.6142
 epoch: 44, train_loss: 0.5774, test_loss: 1.6017, test_f1: 0.6043
 epoch: 45, train_loss: 0.5543, test_loss: 1.4841, test_f1: 0.5900
 epoch: 46, train_loss: 0.5861, test_loss: 1.4932, test_f1: 0.5606
 epoch: 47, train_loss: 0.5550, test_loss: 1.4755, test_f1: 0.6283
 epoch: 48, train_loss: 0.5506, test_loss: 1.5825, test_f1: 0.6072
 epoch: 49, train_loss: 0.5531, test_loss: 1.4263, test_f1: 0.5892
 epoch: 50, train_loss: 0.5594, test_loss: 1.5017, test_f1: 0.6375
 epoch: 51, train_loss: 0.4864, test_loss: 1.4497, test_f1: 0.6157
 epoch: 52, train_loss: 0.4718, test_loss: 1.4549, test_f1: 0.6343
 epoch: 53, train_loss: 0.4549, test_loss: 1.6153, test_f1: 0.6098
 epoch: 54, train_loss: 0.4282, test_loss: 1.7336, test_f1: 0.6021
 epoch: 55, train_loss: 0.4338, test_loss: 1.6898, test_f1: 0.6100
 epoch: 56, train_loss: 0.4176, test_loss: 1.6643, test_f1: 0.5921
 epoch: 57, train_loss: 0.4395, test_loss: 1.7993, test_f1: 0.6211
 epoch: 58, train_loss: 0.4232, test_loss: 1.7263, test_f1: 0.6067
 epoch: 59, train_loss: 0.4248, test_loss: 1.8175, test_f1: 0.5986
 epoch: 60, train_loss: 0.4003, test_loss: 1.7618, test_f1: 0.5866
 epoch: 61, train_loss: 0.4130, test_loss: 1.8096, test_f1: 0.5914
 epoch: 62, train_loss: 0.3969, test_loss: 1.9610, test_f1: 0.6162
 epoch: 63, train_loss: 0.3771, test_loss: 2.0354, test_f1: 0.5957
 epoch: 64, train_loss: 0.4020, test_loss: 1.9411, test_f1: 0.5989
 epoch: 65, train_loss: 0.3785, test_loss: 1.9481, test_f1: 0.5786
 epoch: 66, train_loss: 0.3793, test_loss: 2.0953, test_f1: 0.5938
 epoch: 67, train_loss: 0.3768, test_loss: 1.9322, test_f1: 0.5888
 epoch: 68, train_loss: 0.3503, test_loss: 2.0349, test_f1: 0.6086
 epoch: 69, train_loss: 0.3425, test_loss: 1.9775, test_f1: 0.6165
 epoch: 70, train_loss: 0.3879, test_loss: 1.9513, test_f1: 0.5860
 epoch: 71, train_loss: 0.3626, test_loss: 2.2266, test_f1: 0.5884
 epoch: 72, train_loss: 0.3744, test_loss: 2.2350, test_f1: 0.5758
 epoch: 73, train_loss: 0.3579, test_loss: 2.2699, test_f1: 0.6129
 epoch: 74, train_loss: 0.3739, test_loss: 2.1290, test_f1: 0.5760
 epoch: 75, train_loss: 0.3734, test_loss: 2.0451, test_f1: 0.6078
 epoch: 76, train_loss: 0.3545, test_loss: 2.1289, test_f1: 0.5784
 epoch: 77, train_loss: 0.3473, test_loss: 2.3761, test_f1: 0.6043
 epoch: 78, train_loss: 0.3159, test_loss: 2.3951, test_f1: 0.5820
 epoch: 79, train_loss: 0.3159, test_loss: 2.0739, test_f1: 0.5984
 epoch: 80, train_loss: 0.3128, test_loss: 2.2393, test_f1: 0.6096
 epoch: 81, train_loss: 0.3493, test_loss: 2.4533, test_f1: 0.5864
 epoch: 82, train_loss: 0.3284, test_loss: 2.3566, test_f1: 0.5855
 epoch: 83, train_loss: 0.3076, test_loss: 2.3743, test_f1: 0.5767
 epoch: 84, train_loss: 0.3153, test_loss: 2.4911, test_f1: 0.5477
 epoch: 85, train_loss: 0.3618, test_loss: 2.6164, test_f1: 0.5798
 epoch: 86, train_loss: 0.3362, test_loss: 2.4874, test_f1: 0.5800
 epoch: 87, train_loss: 0.2944, test_loss: 2.3803, test_f1: 0.5836
 epoch: 88, train_loss: 0.2979, test_loss: 2.6140, test_f1: 0.5839
 epoch: 89, train_loss: 0.3095, test_loss: 2.5806, test_f1: 0.5869
 epoch: 90, train_loss: 0.2769, test_loss: 2.5036, test_f1: 0.5969
 epoch: 91, train_loss: 0.2818, test_loss: 2.5435, test_f1: 0.5663
 epoch: 92, train_loss: 0.2847, test_loss: 2.4667, test_f1: 0.5921
 epoch: 93, train_loss: 0.2978, test_loss: 2.5265, test_f1: 0.5883
 epoch: 94, train_loss: 0.2866, test_loss: 2.5746, test_f1: 0.5817
 epoch: 95, train_loss: 0.2739, test_loss: 2.5632, test_f1: 0.5727
 epoch: 96, train_loss: 0.2557, test_loss: 2.8154, test_f1: 0.5801
 epoch: 97, train_loss: 0.2349, test_loss: 2.7784, test_f1: 0.5807
 epoch: 98, train_loss: 0.2708, test_loss: 2.9511, test_f1: 0.5839
 epoch: 99, train_loss: 0.2880, test_loss: 2.8669, test_f1: 0.6036
##################ITERATION #7 ****************************************
 epoch: 0, train_loss: 1.3481, test_loss: 1.3210, test_f1: 0.1365
 epoch: 1, train_loss: 1.1396, test_loss: 1.2993, test_f1: 0.3266
 epoch: 2, train_loss: 1.0710, test_loss: 1.1888, test_f1: 0.4248
 epoch: 3, train_loss: 1.0216, test_loss: 1.1054, test_f1: 0.5169
 epoch: 4, train_loss: 0.9994, test_loss: 1.1374, test_f1: 0.5364
 epoch: 5, train_loss: 0.9770, test_loss: 1.1128, test_f1: 0.5109
 epoch: 6, train_loss: 0.9587, test_loss: 1.1851, test_f1: 0.5276
 epoch: 7, train_loss: 0.9447, test_loss: 1.0648, test_f1: 0.5523
 epoch: 8, train_loss: 0.9120, test_loss: 1.1283, test_f1: 0.5603
 epoch: 9, train_loss: 0.8968, test_loss: 1.1464, test_f1: 0.5964
 epoch: 10, train_loss: 0.9052, test_loss: 1.1063, test_f1: 0.5297
 epoch: 11, train_loss: 0.8712, test_loss: 1.0461, test_f1: 0.5833
 epoch: 12, train_loss: 0.8510, test_loss: 1.0919, test_f1: 0.6034
 epoch: 13, train_loss: 0.8437, test_loss: 1.0914, test_f1: 0.5773
 epoch: 14, train_loss: 0.8209, test_loss: 1.0502, test_f1: 0.6177
 epoch: 15, train_loss: 0.8242, test_loss: 1.0479, test_f1: 0.5960
 epoch: 16, train_loss: 0.8289, test_loss: 1.2285, test_f1: 0.4959
 epoch: 17, train_loss: 0.8207, test_loss: 1.1704, test_f1: 0.5756
 epoch: 18, train_loss: 0.7801, test_loss: 1.1064, test_f1: 0.6238
 epoch: 19, train_loss: 0.7895, test_loss: 1.1606, test_f1: 0.5527
 epoch: 20, train_loss: 0.7832, test_loss: 1.1680, test_f1: 0.5994
 epoch: 21, train_loss: 0.7654, test_loss: 1.1563, test_f1: 0.5650
 epoch: 22, train_loss: 0.7524, test_loss: 1.1354, test_f1: 0.6328
 epoch: 23, train_loss: 0.7353, test_loss: 1.1459, test_f1: 0.6482
 epoch: 24, train_loss: 0.7169, test_loss: 1.1869, test_f1: 0.5109
 epoch: 25, train_loss: 0.7126, test_loss: 1.2166, test_f1: 0.5833
 epoch: 26, train_loss: 0.6854, test_loss: 1.2327, test_f1: 0.6140
 epoch: 27, train_loss: 0.6639, test_loss: 1.1899, test_f1: 0.6012
 epoch: 28, train_loss: 0.6561, test_loss: 1.2540, test_f1: 0.6037
 epoch: 29, train_loss: 0.6743, test_loss: 1.1949, test_f1: 0.6256
 epoch: 30, train_loss: 0.6876, test_loss: 1.1202, test_f1: 0.6386
 epoch: 31, train_loss: 0.6597, test_loss: 1.1738, test_f1: 0.6051
 epoch: 32, train_loss: 0.6580, test_loss: 1.1477, test_f1: 0.5735
 epoch: 33, train_loss: 0.6394, test_loss: 1.5191, test_f1: 0.5773
 epoch: 34, train_loss: 0.6121, test_loss: 1.3820, test_f1: 0.5485
 epoch: 35, train_loss: 0.6200, test_loss: 1.3159, test_f1: 0.6362
 epoch: 36, train_loss: 0.6129, test_loss: 1.3090, test_f1: 0.6239
 epoch: 37, train_loss: 0.6236, test_loss: 1.3355, test_f1: 0.6313
 epoch: 38, train_loss: 0.6257, test_loss: 1.4011, test_f1: 0.5991
 epoch: 39, train_loss: 0.5999, test_loss: 1.3619, test_f1: 0.6157
 epoch: 40, train_loss: 0.5660, test_loss: 1.3901, test_f1: 0.6234
 epoch: 41, train_loss: 0.5624, test_loss: 1.4146, test_f1: 0.6434
 epoch: 42, train_loss: 0.5487, test_loss: 1.3534, test_f1: 0.6506
 epoch: 43, train_loss: 0.5776, test_loss: 1.3979, test_f1: 0.6433
 epoch: 44, train_loss: 0.5594, test_loss: 1.3627, test_f1: 0.6322
 epoch: 45, train_loss: 0.5518, test_loss: 1.3989, test_f1: 0.6284
 epoch: 46, train_loss: 0.5565, test_loss: 1.4322, test_f1: 0.6361
 epoch: 47, train_loss: 0.5252, test_loss: 1.7953, test_f1: 0.5576
 epoch: 48, train_loss: 0.5467, test_loss: 1.4481, test_f1: 0.6439
 epoch: 49, train_loss: 0.4988, test_loss: 1.4195, test_f1: 0.6290
 epoch: 50, train_loss: 0.5065, test_loss: 1.7946, test_f1: 0.5715
 epoch: 51, train_loss: 0.4767, test_loss: 1.5807, test_f1: 0.6122
 epoch: 52, train_loss: 0.4586, test_loss: 1.6789, test_f1: 0.6138
 epoch: 53, train_loss: 0.4379, test_loss: 1.6523, test_f1: 0.6041
 epoch: 54, train_loss: 0.4378, test_loss: 1.6708, test_f1: 0.6212
 epoch: 55, train_loss: 0.4073, test_loss: 1.6926, test_f1: 0.6220
 epoch: 56, train_loss: 0.4056, test_loss: 1.5825, test_f1: 0.6444
 epoch: 57, train_loss: 0.3936, test_loss: 1.6300, test_f1: 0.6045
 epoch: 58, train_loss: 0.3875, test_loss: 1.8816, test_f1: 0.6301
 epoch: 59, train_loss: 0.3855, test_loss: 1.7381, test_f1: 0.6275
 epoch: 60, train_loss: 0.3919, test_loss: 1.7527, test_f1: 0.6241
 epoch: 61, train_loss: 0.3873, test_loss: 1.9553, test_f1: 0.6041
 epoch: 62, train_loss: 0.3714, test_loss: 1.8134, test_f1: 0.6444
 epoch: 63, train_loss: 0.3733, test_loss: 1.9235, test_f1: 0.6315
 epoch: 64, train_loss: 0.3899, test_loss: 1.8971, test_f1: 0.6051
 epoch: 65, train_loss: 0.3857, test_loss: 1.9955, test_f1: 0.5971
 epoch: 66, train_loss: 0.3847, test_loss: 2.1379, test_f1: 0.5792
 epoch: 67, train_loss: 0.3971, test_loss: 1.9877, test_f1: 0.5971
 epoch: 68, train_loss: 0.3662, test_loss: 2.0122, test_f1: 0.6278
 epoch: 69, train_loss: 0.3558, test_loss: 2.1889, test_f1: 0.5967
 epoch: 70, train_loss: 0.3692, test_loss: 1.9797, test_f1: 0.6246
 epoch: 71, train_loss: 0.3630, test_loss: 1.9697, test_f1: 0.6334
 epoch: 72, train_loss: 0.3420, test_loss: 1.9915, test_f1: 0.6070
 epoch: 73, train_loss: 0.3606, test_loss: 2.1067, test_f1: 0.6242
 epoch: 74, train_loss: 0.3495, test_loss: 2.0141, test_f1: 0.5894
 epoch: 75, train_loss: 0.3356, test_loss: 2.2294, test_f1: 0.6114
 epoch: 76, train_loss: 0.3484, test_loss: 2.0902, test_f1: 0.5948
 epoch: 77, train_loss: 0.3364, test_loss: 2.2887, test_f1: 0.6197
 epoch: 78, train_loss: 0.3114, test_loss: 2.1830, test_f1: 0.6099
 epoch: 79, train_loss: 0.3046, test_loss: 2.4535, test_f1: 0.5868
 epoch: 80, train_loss: 0.3096, test_loss: 2.2595, test_f1: 0.6277
 epoch: 81, train_loss: 0.3232, test_loss: 2.3096, test_f1: 0.6074
 epoch: 82, train_loss: 0.3350, test_loss: 2.3183, test_f1: 0.5925
 epoch: 83, train_loss: 0.3436, test_loss: 2.4352, test_f1: 0.5910
 epoch: 84, train_loss: 0.3116, test_loss: 2.3067, test_f1: 0.6087
 epoch: 85, train_loss: 0.3108, test_loss: 2.3093, test_f1: 0.6069
 epoch: 86, train_loss: 0.3000, test_loss: 2.4859, test_f1: 0.5981
 epoch: 87, train_loss: 0.3074, test_loss: 2.3486, test_f1: 0.6070
 epoch: 88, train_loss: 0.2776, test_loss: 2.4751, test_f1: 0.5984
 epoch: 89, train_loss: 0.2736, test_loss: 2.1981, test_f1: 0.6218
 epoch: 90, train_loss: 0.3188, test_loss: 2.4930, test_f1: 0.6019
 epoch: 91, train_loss: 0.3019, test_loss: 2.2349, test_f1: 0.6301
 epoch: 92, train_loss: 0.2902, test_loss: 2.4412, test_f1: 0.6024
 epoch: 93, train_loss: 0.3132, test_loss: 2.4001, test_f1: 0.5879
 epoch: 94, train_loss: 0.3119, test_loss: 2.4618, test_f1: 0.6007
 epoch: 95, train_loss: 0.2625, test_loss: 2.1724, test_f1: 0.6247
 epoch: 96, train_loss: 0.3005, test_loss: 2.6430, test_f1: 0.5521
 epoch: 97, train_loss: 0.3117, test_loss: 2.5244, test_f1: 0.6102
 epoch: 98, train_loss: 0.3001, test_loss: 2.3426, test_f1: 0.5924
 epoch: 99, train_loss: 0.2798, test_loss: 2.6357, test_f1: 0.5862
##################ITERATION #8 ****************************************
 epoch: 0, train_loss: 1.3117, test_loss: 1.3765, test_f1: 0.1365
 epoch: 1, train_loss: 1.1014, test_loss: 1.2285, test_f1: 0.3189
 epoch: 2, train_loss: 1.0177, test_loss: 1.1139, test_f1: 0.4640
 epoch: 3, train_loss: 0.9757, test_loss: 1.0527, test_f1: 0.5199
 epoch: 4, train_loss: 0.9646, test_loss: 1.0566, test_f1: 0.5290
 epoch: 5, train_loss: 0.9241, test_loss: 1.0847, test_f1: 0.5258
 epoch: 6, train_loss: 0.8941, test_loss: 1.1333, test_f1: 0.5335
 epoch: 7, train_loss: 0.8732, test_loss: 1.0275, test_f1: 0.5676
 epoch: 8, train_loss: 0.8439, test_loss: 1.0621, test_f1: 0.5881
 epoch: 9, train_loss: 0.8331, test_loss: 1.1288, test_f1: 0.5455
 epoch: 10, train_loss: 0.8253, test_loss: 1.1162, test_f1: 0.5716
 epoch: 11, train_loss: 0.8045, test_loss: 1.0466, test_f1: 0.5528
 epoch: 12, train_loss: 0.8015, test_loss: 1.0913, test_f1: 0.6245
 epoch: 13, train_loss: 0.8111, test_loss: 1.1089, test_f1: 0.5880
 epoch: 14, train_loss: 0.7853, test_loss: 1.0581, test_f1: 0.5643
 epoch: 15, train_loss: 0.7676, test_loss: 1.1396, test_f1: 0.5924
 epoch: 16, train_loss: 0.7796, test_loss: 1.1357, test_f1: 0.5727
 epoch: 17, train_loss: 0.7551, test_loss: 1.1365, test_f1: 0.5705
 epoch: 18, train_loss: 0.7546, test_loss: 1.1281, test_f1: 0.5390
 epoch: 19, train_loss: 0.7269, test_loss: 1.1867, test_f1: 0.5923
 epoch: 20, train_loss: 0.7262, test_loss: 1.1236, test_f1: 0.5992
 epoch: 21, train_loss: 0.7061, test_loss: 1.1173, test_f1: 0.6170
 epoch: 22, train_loss: 0.6940, test_loss: 1.2062, test_f1: 0.6420
 epoch: 23, train_loss: 0.6744, test_loss: 1.1730, test_f1: 0.6247
 epoch: 24, train_loss: 0.6579, test_loss: 1.2151, test_f1: 0.5785
 epoch: 25, train_loss: 0.6765, test_loss: 1.1639, test_f1: 0.5662
 epoch: 26, train_loss: 0.6591, test_loss: 1.3330, test_f1: 0.5125
 epoch: 27, train_loss: 0.6606, test_loss: 1.1244, test_f1: 0.5989
 epoch: 28, train_loss: 0.6318, test_loss: 1.3729, test_f1: 0.5729
 epoch: 29, train_loss: 0.6324, test_loss: 1.1918, test_f1: 0.6202
 epoch: 30, train_loss: 0.6107, test_loss: 1.5826, test_f1: 0.5349
 epoch: 31, train_loss: 0.6172, test_loss: 1.3164, test_f1: 0.6428
 epoch: 32, train_loss: 0.6025, test_loss: 1.2505, test_f1: 0.6010
 epoch: 33, train_loss: 0.6156, test_loss: 1.5233, test_f1: 0.5228
 epoch: 34, train_loss: 0.6062, test_loss: 1.2379, test_f1: 0.5773
 epoch: 35, train_loss: 0.5708, test_loss: 1.4550, test_f1: 0.6038
 epoch: 36, train_loss: 0.5712, test_loss: 1.5896, test_f1: 0.5725
 epoch: 37, train_loss: 0.5516, test_loss: 1.4092, test_f1: 0.6010
 epoch: 38, train_loss: 0.5534, test_loss: 1.5029, test_f1: 0.6010
 epoch: 39, train_loss: 0.5723, test_loss: 1.5107, test_f1: 0.5923
 epoch: 40, train_loss: 0.5470, test_loss: 1.5092, test_f1: 0.6080
 epoch: 41, train_loss: 0.5599, test_loss: 1.4248, test_f1: 0.5808
 epoch: 42, train_loss: 0.5317, test_loss: 1.4857, test_f1: 0.5681
 epoch: 43, train_loss: 0.5337, test_loss: 1.5701, test_f1: 0.6073
 epoch: 44, train_loss: 0.5097, test_loss: 1.4744, test_f1: 0.6145
 epoch: 45, train_loss: 0.5015, test_loss: 1.5301, test_f1: 0.5922
 epoch: 46, train_loss: 0.5109, test_loss: 1.5062, test_f1: 0.5939
 epoch: 47, train_loss: 0.5087, test_loss: 1.5790, test_f1: 0.5903
 epoch: 48, train_loss: 0.5236, test_loss: 1.5461, test_f1: 0.6130
 epoch: 49, train_loss: 0.4597, test_loss: 1.7040, test_f1: 0.6193
 epoch: 50, train_loss: 0.4963, test_loss: 1.6228, test_f1: 0.6032
 epoch: 51, train_loss: 0.4303, test_loss: 1.5215, test_f1: 0.6259
 epoch: 52, train_loss: 0.4152, test_loss: 1.6170, test_f1: 0.6244
 epoch: 53, train_loss: 0.3803, test_loss: 1.8443, test_f1: 0.5940
 epoch: 54, train_loss: 0.4068, test_loss: 1.7975, test_f1: 0.5993
 epoch: 55, train_loss: 0.3842, test_loss: 1.8446, test_f1: 0.5918
 epoch: 56, train_loss: 0.3799, test_loss: 1.7622, test_f1: 0.6240
 epoch: 57, train_loss: 0.3686, test_loss: 1.7690, test_f1: 0.6157
 epoch: 58, train_loss: 0.3663, test_loss: 1.8573, test_f1: 0.6237
 epoch: 59, train_loss: 0.3448, test_loss: 1.9314, test_f1: 0.6050
 epoch: 60, train_loss: 0.3714, test_loss: 1.8178, test_f1: 0.5805
 epoch: 61, train_loss: 0.3394, test_loss: 1.9836, test_f1: 0.6117
 epoch: 62, train_loss: 0.3339, test_loss: 2.0652, test_f1: 0.6069
 epoch: 63, train_loss: 0.3746, test_loss: 2.0752, test_f1: 0.6157
 epoch: 64, train_loss: 0.3520, test_loss: 2.0876, test_f1: 0.6036
 epoch: 65, train_loss: 0.3452, test_loss: 2.0055, test_f1: 0.6114
 epoch: 66, train_loss: 0.3389, test_loss: 2.0696, test_f1: 0.6175
 epoch: 67, train_loss: 0.3476, test_loss: 2.0216, test_f1: 0.6088
 epoch: 68, train_loss: 0.3196, test_loss: 2.0522, test_f1: 0.5867
 epoch: 69, train_loss: 0.3214, test_loss: 2.1336, test_f1: 0.6073
 epoch: 70, train_loss: 0.3457, test_loss: 2.2468, test_f1: 0.5912
 epoch: 71, train_loss: 0.3198, test_loss: 2.3182, test_f1: 0.5868
 epoch: 72, train_loss: 0.3168, test_loss: 2.3879, test_f1: 0.6154
 epoch: 73, train_loss: 0.3250, test_loss: 2.4063, test_f1: 0.6090
 epoch: 74, train_loss: 0.3409, test_loss: 2.3858, test_f1: 0.5920
 epoch: 75, train_loss: 0.3168, test_loss: 2.4407, test_f1: 0.6073
 epoch: 76, train_loss: 0.3342, test_loss: 2.0081, test_f1: 0.6149
 epoch: 77, train_loss: 0.3076, test_loss: 2.4582, test_f1: 0.5921
 epoch: 78, train_loss: 0.3148, test_loss: 2.1778, test_f1: 0.6008
 epoch: 79, train_loss: 0.3006, test_loss: 2.1438, test_f1: 0.6064
 epoch: 80, train_loss: 0.3016, test_loss: 2.3582, test_f1: 0.5905
 epoch: 81, train_loss: 0.3037, test_loss: 2.4634, test_f1: 0.5977
 epoch: 82, train_loss: 0.3216, test_loss: 2.6992, test_f1: 0.5891
 epoch: 83, train_loss: 0.2915, test_loss: 2.7988, test_f1: 0.6091
 epoch: 84, train_loss: 0.3023, test_loss: 2.7200, test_f1: 0.6172
 epoch: 85, train_loss: 0.3007, test_loss: 2.4279, test_f1: 0.6143
 epoch: 86, train_loss: 0.3092, test_loss: 2.5719, test_f1: 0.5854
 epoch: 87, train_loss: 0.2908, test_loss: 2.9973, test_f1: 0.5888
 epoch: 88, train_loss: 0.2706, test_loss: 2.9493, test_f1: 0.5939
 epoch: 89, train_loss: 0.2821, test_loss: 2.4376, test_f1: 0.6172
 epoch: 90, train_loss: 0.2642, test_loss: 2.7337, test_f1: 0.6204
 epoch: 91, train_loss: 0.2889, test_loss: 2.7668, test_f1: 0.6141
 epoch: 92, train_loss: 0.2752, test_loss: 2.6647, test_f1: 0.6132
 epoch: 93, train_loss: 0.2816, test_loss: 2.6199, test_f1: 0.6082
 epoch: 94, train_loss: 0.2666, test_loss: 2.9465, test_f1: 0.5917
 epoch: 95, train_loss: 0.2800, test_loss: 2.9417, test_f1: 0.6249
 epoch: 96, train_loss: 0.2413, test_loss: 2.9116, test_f1: 0.6028
 epoch: 97, train_loss: 0.2477, test_loss: 2.6069, test_f1: 0.5850
 epoch: 98, train_loss: 0.2524, test_loss: 3.2631, test_f1: 0.5919
 epoch: 99, train_loss: 0.2240, test_loss: 2.6909, test_f1: 0.5886
##################ITERATION #9 ****************************************
 epoch: 0, train_loss: 1.4405, test_loss: 1.4531, test_f1: 0.1580
 epoch: 1, train_loss: 1.2013, test_loss: 1.3034, test_f1: 0.3376
 epoch: 2, train_loss: 1.0781, test_loss: 1.1762, test_f1: 0.4584
 epoch: 3, train_loss: 1.0327, test_loss: 1.0865, test_f1: 0.5354
 epoch: 4, train_loss: 0.9817, test_loss: 1.1167, test_f1: 0.5272
 epoch: 5, train_loss: 0.9724, test_loss: 1.0747, test_f1: 0.5273
 epoch: 6, train_loss: 0.9374, test_loss: 1.0954, test_f1: 0.5384
 epoch: 7, train_loss: 0.9460, test_loss: 1.1247, test_f1: 0.4607
 epoch: 8, train_loss: 0.9046, test_loss: 1.0895, test_f1: 0.5737
 epoch: 9, train_loss: 0.8922, test_loss: 1.1230, test_f1: 0.5366
 epoch: 10, train_loss: 0.8682, test_loss: 1.1201, test_f1: 0.5093
 epoch: 11, train_loss: 0.8637, test_loss: 1.1257, test_f1: 0.5398
 epoch: 12, train_loss: 0.8620, test_loss: 1.0568, test_f1: 0.5711
 epoch: 13, train_loss: 0.8570, test_loss: 1.0753, test_f1: 0.5811
 epoch: 14, train_loss: 0.8318, test_loss: 1.1342, test_f1: 0.5626
 epoch: 15, train_loss: 0.8413, test_loss: 0.9928, test_f1: 0.5903
 epoch: 16, train_loss: 0.8106, test_loss: 1.1039, test_f1: 0.5848
 epoch: 17, train_loss: 0.7873, test_loss: 1.0596, test_f1: 0.5412
 epoch: 18, train_loss: 0.8244, test_loss: 1.0831, test_f1: 0.5702
 epoch: 19, train_loss: 0.7924, test_loss: 1.1058, test_f1: 0.5445
 epoch: 20, train_loss: 0.7888, test_loss: 1.1472, test_f1: 0.5457
 epoch: 21, train_loss: 0.7555, test_loss: 1.0835, test_f1: 0.5770
 epoch: 22, train_loss: 0.7675, test_loss: 1.1273, test_f1: 0.5920
 epoch: 23, train_loss: 0.7314, test_loss: 1.1552, test_f1: 0.5688
 epoch: 24, train_loss: 0.6999, test_loss: 1.1739, test_f1: 0.5773
 epoch: 25, train_loss: 0.6967, test_loss: 1.1542, test_f1: 0.5933
 epoch: 26, train_loss: 0.6948, test_loss: 1.1469, test_f1: 0.6131
 epoch: 27, train_loss: 0.6828, test_loss: 1.2653, test_f1: 0.5750
 epoch: 28, train_loss: 0.7121, test_loss: 1.2704, test_f1: 0.5840
 epoch: 29, train_loss: 0.7153, test_loss: 1.2363, test_f1: 0.5853
 epoch: 30, train_loss: 0.6507, test_loss: 1.2664, test_f1: 0.6097
 epoch: 31, train_loss: 0.6553, test_loss: 1.2673, test_f1: 0.5696
 epoch: 32, train_loss: 0.6205, test_loss: 1.2234, test_f1: 0.5804
 epoch: 33, train_loss: 0.6516, test_loss: 1.2717, test_f1: 0.5570
 epoch: 34, train_loss: 0.6125, test_loss: 1.3822, test_f1: 0.5770
 epoch: 35, train_loss: 0.6579, test_loss: 1.4125, test_f1: 0.5597
 epoch: 36, train_loss: 0.6231, test_loss: 1.2765, test_f1: 0.6166
 epoch: 37, train_loss: 0.5987, test_loss: 1.4106, test_f1: 0.5466
 epoch: 38, train_loss: 0.5965, test_loss: 1.3076, test_f1: 0.6120
 epoch: 39, train_loss: 0.5779, test_loss: 1.3885, test_f1: 0.5117
 epoch: 40, train_loss: 0.5943, test_loss: 1.3587, test_f1: 0.5908
 epoch: 41, train_loss: 0.6201, test_loss: 1.1816, test_f1: 0.6236
 epoch: 42, train_loss: 0.5793, test_loss: 1.4664, test_f1: 0.5399
 epoch: 43, train_loss: 0.5596, test_loss: 1.4170, test_f1: 0.5928
 epoch: 44, train_loss: 0.5266, test_loss: 1.4214, test_f1: 0.5491
 epoch: 45, train_loss: 0.5688, test_loss: 1.5628, test_f1: 0.5399
 epoch: 46, train_loss: 0.5385, test_loss: 1.5467, test_f1: 0.5971
 epoch: 47, train_loss: 0.5680, test_loss: 1.5569, test_f1: 0.5527
 epoch: 48, train_loss: 0.5671, test_loss: 1.4044, test_f1: 0.5948
 epoch: 49, train_loss: 0.5525, test_loss: 1.3536, test_f1: 0.5799
 epoch: 50, train_loss: 0.5000, test_loss: 1.4913, test_f1: 0.5824
 epoch: 51, train_loss: 0.4649, test_loss: 1.5441, test_f1: 0.5905
 epoch: 52, train_loss: 0.4766, test_loss: 1.4743, test_f1: 0.6175
 epoch: 53, train_loss: 0.4379, test_loss: 1.5236, test_f1: 0.6077
 epoch: 54, train_loss: 0.4424, test_loss: 1.6029, test_f1: 0.5844
 epoch: 55, train_loss: 0.4280, test_loss: 1.6262, test_f1: 0.5759
 epoch: 56, train_loss: 0.4120, test_loss: 1.6731, test_f1: 0.6145
 epoch: 57, train_loss: 0.4329, test_loss: 1.7355, test_f1: 0.5652
 epoch: 58, train_loss: 0.4261, test_loss: 1.7338, test_f1: 0.5815
 epoch: 59, train_loss: 0.4126, test_loss: 1.6799, test_f1: 0.6178
 epoch: 60, train_loss: 0.4228, test_loss: 1.6856, test_f1: 0.5965
 epoch: 61, train_loss: 0.3994, test_loss: 1.6410, test_f1: 0.6103
 epoch: 62, train_loss: 0.3868, test_loss: 1.7064, test_f1: 0.5935
 epoch: 63, train_loss: 0.3679, test_loss: 1.6558, test_f1: 0.6286
 epoch: 64, train_loss: 0.3645, test_loss: 1.7645, test_f1: 0.6203
 epoch: 65, train_loss: 0.3767, test_loss: 1.7357, test_f1: 0.6184
 epoch: 66, train_loss: 0.3540, test_loss: 1.9585, test_f1: 0.5759
 epoch: 67, train_loss: 0.3698, test_loss: 1.7991, test_f1: 0.5786
 epoch: 68, train_loss: 0.3650, test_loss: 1.8172, test_f1: 0.6122
 epoch: 69, train_loss: 0.3622, test_loss: 1.9811, test_f1: 0.5554
 epoch: 70, train_loss: 0.3439, test_loss: 2.0449, test_f1: 0.5877
 epoch: 71, train_loss: 0.3659, test_loss: 1.8553, test_f1: 0.6025
 epoch: 72, train_loss: 0.3649, test_loss: 1.6579, test_f1: 0.6223
 epoch: 73, train_loss: 0.3564, test_loss: 1.9117, test_f1: 0.6114
 epoch: 74, train_loss: 0.3410, test_loss: 1.9730, test_f1: 0.5869
 epoch: 75, train_loss: 0.3679, test_loss: 1.7417, test_f1: 0.6000
 epoch: 76, train_loss: 0.3308, test_loss: 1.8036, test_f1: 0.5859
 epoch: 77, train_loss: 0.3307, test_loss: 1.9667, test_f1: 0.5961
 epoch: 78, train_loss: 0.3092, test_loss: 1.8908, test_f1: 0.6229
 epoch: 79, train_loss: 0.3359, test_loss: 2.0190, test_f1: 0.5908
 epoch: 80, train_loss: 0.3475, test_loss: 2.1032, test_f1: 0.5788
 epoch: 81, train_loss: 0.3229, test_loss: 2.1739, test_f1: 0.5976
 epoch: 82, train_loss: 0.3149, test_loss: 1.9003, test_f1: 0.5740
 epoch: 83, train_loss: 0.3207, test_loss: 1.9596, test_f1: 0.6002
 epoch: 84, train_loss: 0.3271, test_loss: 1.8689, test_f1: 0.6115
 epoch: 85, train_loss: 0.3172, test_loss: 2.0305, test_f1: 0.5899
 epoch: 86, train_loss: 0.2895, test_loss: 2.2710, test_f1: 0.5691
 epoch: 87, train_loss: 0.2792, test_loss: 2.0333, test_f1: 0.5984
 epoch: 88, train_loss: 0.2729, test_loss: 2.1780, test_f1: 0.5993
 epoch: 89, train_loss: 0.2784, test_loss: 2.3563, test_f1: 0.5907
 epoch: 90, train_loss: 0.2889, test_loss: 2.2197, test_f1: 0.6111
 epoch: 91, train_loss: 0.3213, test_loss: 2.2270, test_f1: 0.5846
 epoch: 92, train_loss: 0.2827, test_loss: 2.3431, test_f1: 0.6055
 epoch: 93, train_loss: 0.2935, test_loss: 2.2877, test_f1: 0.5756
 epoch: 94, train_loss: 0.2973, test_loss: 2.0709, test_f1: 0.6144
 epoch: 95, train_loss: 0.2955, test_loss: 2.0530, test_f1: 0.6035
 epoch: 96, train_loss: 0.2882, test_loss: 2.2595, test_f1: 0.6001
 epoch: 97, train_loss: 0.2560, test_loss: 2.1913, test_f1: 0.6023
 epoch: 98, train_loss: 0.2616, test_loss: 2.3054, test_f1: 0.5903
 epoch: 99, train_loss: 0.2472, test_loss: 2.4068, test_f1: 0.5844

Training completed in 497.77 seconds
Best F1: 0.6709 at epoch 24
Mean F1 across iterations: 0.6438  0.0123
========================FINAL RESULTS================================
FEGIN weighted F1: 0.6709  0.0123
python main.py --data ltspice_demos --representation component_net --model FEGIN --layers 5 --hiddens 64 --batch_size 64 --lr 0.001 --emb_size 512 --epochs 100 --save_appendix component_net_L5_H64_BS64_LR0.001_E512 --no_val
-----



STDERR:
  File "main.py", line 370, in <module>
    main()
  File "main.py", line 254, in main
    dataset = dataset_class(
  File "/home/philip/projects/ltspice_examples_code_repo/Circuit-Completion-Using-GNNs/component_classification_with_link_prediction_head/evaluation/FEGIN/kernel/circuit_datasets.py", line 15, in __init__
    self.data, self.slices = torch.load(self.processed_paths[0])
  File "/home/philip/.local/lib/python3.8/site-packages/torch/serialization.py", line 1040, in load
    warnings.warn(
  File "/usr/lib/python3.8/warnings.py", line 109, in _showwarnmsg
    sw(msg.message, msg.category, msg.filename, msg.lineno,
  File "main.py", line 47, in warn_with_traceback
    traceback.print_stack(file=log)
/home/philip/projects/ltspice_examples_code_repo/Circuit-Completion-Using-GNNs/component_classification_with_link_prediction_head/evaluation/FEGIN/kernel/circuit_datasets.py:15: FutureWarning: You are using `torch.load` with `weights_only=False` (the current default value), which uses the default pickle module implicitly. It is possible to construct malicious pickle data which will execute arbitrary code during unpickling (See https://github.com/pytorch/pytorch/blob/main/SECURITY.md#untrusted-models for more details). In a future release, the default value for `weights_only` will be flipped to `True`. This limits the functions that could be executed during unpickling. Arbitrary objects will no longer be allowed to be loaded via this mode unless they are explicitly allowlisted by the user via `torch.serialization.add_safe_globals`. We recommend you start setting `weights_only=True` for any use case where you don't have full control of the loaded file. Please open an issue on GitHub for any issues related to this experimental feature.
  self.data, self.slices = torch.load(self.processed_paths[0])
