STDOUT:
Results will be saved in /home/philip/projects/ltspice_examples_code_repo/Circuit-Completion-Using-GNNs/component_classification_with_link_prediction_head/evaluation/FEGIN/results/model_FEGIN_dataset_ltspice_demos
Command line input: python main.py --data ltspice_demos --representation component_net --model FEGIN --layers 4 --hiddens 16 --batch_size 64 --lr 0.01 --emb_size 250 --epochs 100 --save_appendix component_net_L4_H16_BS64_LR0.01_E250 --no_val
 is saved.
-----
ltspice_demos - FEGIN
Using 4 layers, 16 hidden units, h = 2
Loading component_net representation dataset
ENTERED
Training FEGIN on component_net representation
Train: 1565, Test: 383
##################ITERATION #0 ****************************************
 epoch: 0, train_loss: 1.2958, test_loss: 1.3124, test_f1: 0.1401
 epoch: 1, train_loss: 1.1734, test_loss: 1.2512, test_f1: 0.2281
 epoch: 2, train_loss: 1.1430, test_loss: 1.2500, test_f1: 0.2281
 epoch: 3, train_loss: 1.1139, test_loss: 1.1623, test_f1: 0.4150
 epoch: 4, train_loss: 1.0645, test_loss: 1.1941, test_f1: 0.4102
 epoch: 5, train_loss: 1.0252, test_loss: 1.3526, test_f1: 0.3710
 epoch: 6, train_loss: 1.0115, test_loss: 1.0600, test_f1: 0.4365
 epoch: 7, train_loss: 0.9757, test_loss: 1.0836, test_f1: 0.3400
 epoch: 8, train_loss: 0.9873, test_loss: 1.1412, test_f1: 0.4266
 epoch: 9, train_loss: 0.9809, test_loss: 1.0311, test_f1: 0.5280
 epoch: 10, train_loss: 0.9613, test_loss: 1.1417, test_f1: 0.3882
 epoch: 11, train_loss: 0.9539, test_loss: 1.0509, test_f1: 0.4320
 epoch: 12, train_loss: 0.9583, test_loss: 1.0226, test_f1: 0.4261
 epoch: 13, train_loss: 0.9429, test_loss: 1.0600, test_f1: 0.4330
 epoch: 14, train_loss: 0.9283, test_loss: 1.0823, test_f1: 0.5109
 epoch: 15, train_loss: 0.9343, test_loss: 1.0358, test_f1: 0.4989
 epoch: 16, train_loss: 0.9328, test_loss: 1.2285, test_f1: 0.3816
 epoch: 17, train_loss: 0.9194, test_loss: 1.1057, test_f1: 0.5313
 epoch: 18, train_loss: 0.9121, test_loss: 1.0271, test_f1: 0.5413
 epoch: 19, train_loss: 0.9166, test_loss: 1.0356, test_f1: 0.5586
 epoch: 20, train_loss: 0.9047, test_loss: 1.0082, test_f1: 0.5720
 epoch: 21, train_loss: 0.9022, test_loss: 1.0280, test_f1: 0.5379
 epoch: 22, train_loss: 0.8888, test_loss: 0.9995, test_f1: 0.5668
 epoch: 23, train_loss: 0.8745, test_loss: 1.0797, test_f1: 0.5186
 epoch: 24, train_loss: 0.8753, test_loss: 1.1671, test_f1: 0.5469
 epoch: 25, train_loss: 0.8757, test_loss: 1.0776, test_f1: 0.5726
 epoch: 26, train_loss: 0.8976, test_loss: 1.0284, test_f1: 0.5596
 epoch: 27, train_loss: 0.8704, test_loss: 1.0637, test_f1: 0.5743
 epoch: 28, train_loss: 0.8562, test_loss: 1.0593, test_f1: 0.5452
 epoch: 29, train_loss: 0.8652, test_loss: 1.0445, test_f1: 0.5397
 epoch: 30, train_loss: 0.8644, test_loss: 1.2106, test_f1: 0.5128
 epoch: 31, train_loss: 0.8737, test_loss: 1.1042, test_f1: 0.5479
 epoch: 32, train_loss: 0.8615, test_loss: 1.0852, test_f1: 0.5122
 epoch: 33, train_loss: 0.8375, test_loss: 1.3218, test_f1: 0.5235
 epoch: 34, train_loss: 0.8619, test_loss: 1.3887, test_f1: 0.4606
 epoch: 35, train_loss: 0.8696, test_loss: 1.1213, test_f1: 0.5731
 epoch: 36, train_loss: 0.8431, test_loss: 1.0808, test_f1: 0.5657
 epoch: 37, train_loss: 0.8425, test_loss: 1.1324, test_f1: 0.5530
 epoch: 38, train_loss: 0.8286, test_loss: 1.2482, test_f1: 0.5561
 epoch: 39, train_loss: 0.8185, test_loss: 1.0267, test_f1: 0.5689
 epoch: 40, train_loss: 0.8132, test_loss: 1.1592, test_f1: 0.5410
 epoch: 41, train_loss: 0.8299, test_loss: 0.9857, test_f1: 0.6034
 epoch: 42, train_loss: 0.8105, test_loss: 1.2128, test_f1: 0.5709
 epoch: 43, train_loss: 0.8048, test_loss: 1.2856, test_f1: 0.5434
 epoch: 44, train_loss: 0.8182, test_loss: 1.1057, test_f1: 0.5513
 epoch: 45, train_loss: 0.8092, test_loss: 1.2493, test_f1: 0.5387
 epoch: 46, train_loss: 0.8142, test_loss: 1.0054, test_f1: 0.5711
 epoch: 47, train_loss: 0.8130, test_loss: 1.1131, test_f1: 0.5869
 epoch: 48, train_loss: 0.8334, test_loss: 1.5227, test_f1: 0.4607
 epoch: 49, train_loss: 0.8748, test_loss: 1.1468, test_f1: 0.5216
 epoch: 50, train_loss: 0.8255, test_loss: 1.2000, test_f1: 0.5241
 epoch: 51, train_loss: 0.8025, test_loss: 1.1703, test_f1: 0.5697
 epoch: 52, train_loss: 0.7699, test_loss: 1.1466, test_f1: 0.5702
 epoch: 53, train_loss: 0.7829, test_loss: 1.1765, test_f1: 0.5596
 epoch: 54, train_loss: 0.7649, test_loss: 1.2381, test_f1: 0.5830
 epoch: 55, train_loss: 0.7641, test_loss: 1.3239, test_f1: 0.5561
 epoch: 56, train_loss: 0.7627, test_loss: 1.1971, test_f1: 0.5757
 epoch: 57, train_loss: 0.7491, test_loss: 1.3846, test_f1: 0.5473
 epoch: 58, train_loss: 0.7503, test_loss: 1.2804, test_f1: 0.5504
 epoch: 59, train_loss: 0.7327, test_loss: 1.3593, test_f1: 0.5209
 epoch: 60, train_loss: 0.7396, test_loss: 1.2417, test_f1: 0.5464
 epoch: 61, train_loss: 0.7533, test_loss: 1.5866, test_f1: 0.5053
 epoch: 62, train_loss: 0.7438, test_loss: 1.2274, test_f1: 0.5649
 epoch: 63, train_loss: 0.7323, test_loss: 1.3346, test_f1: 0.5273
 epoch: 64, train_loss: 0.7207, test_loss: 1.2580, test_f1: 0.5628
 epoch: 65, train_loss: 0.7357, test_loss: 1.3450, test_f1: 0.5450
 epoch: 66, train_loss: 0.7343, test_loss: 1.2442, test_f1: 0.5790
 epoch: 67, train_loss: 0.7126, test_loss: 1.3873, test_f1: 0.5869
 epoch: 68, train_loss: 0.7125, test_loss: 1.4710, test_f1: 0.5701
 epoch: 69, train_loss: 0.7277, test_loss: 1.3613, test_f1: 0.4900
 epoch: 70, train_loss: 0.7349, test_loss: 1.3798, test_f1: 0.5969
 epoch: 71, train_loss: 0.7244, test_loss: 1.5043, test_f1: 0.5303
 epoch: 72, train_loss: 0.7251, test_loss: 1.4734, test_f1: 0.5513
 epoch: 73, train_loss: 0.7291, test_loss: 1.3936, test_f1: 0.5530
 epoch: 74, train_loss: 0.7259, test_loss: 1.6160, test_f1: 0.5408
 epoch: 75, train_loss: 0.7043, test_loss: 1.1444, test_f1: 0.6045
 epoch: 76, train_loss: 0.7231, test_loss: 1.4091, test_f1: 0.5814
 epoch: 77, train_loss: 0.6872, test_loss: 1.2500, test_f1: 0.5639
 epoch: 78, train_loss: 0.6782, test_loss: 1.4578, test_f1: 0.6008
 epoch: 79, train_loss: 0.6843, test_loss: 1.3721, test_f1: 0.5789
 epoch: 80, train_loss: 0.6705, test_loss: 1.2407, test_f1: 0.5784
 epoch: 81, train_loss: 0.6871, test_loss: 1.4957, test_f1: 0.5183
 epoch: 82, train_loss: 0.6912, test_loss: 1.2456, test_f1: 0.5831
 epoch: 83, train_loss: 0.6814, test_loss: 1.3546, test_f1: 0.4989
 epoch: 84, train_loss: 0.6904, test_loss: 1.3807, test_f1: 0.5353
 epoch: 85, train_loss: 0.6771, test_loss: 1.2731, test_f1: 0.5543
 epoch: 86, train_loss: 0.6773, test_loss: 1.6167, test_f1: 0.5739
 epoch: 87, train_loss: 0.6948, test_loss: 1.3862, test_f1: 0.5709
 epoch: 88, train_loss: 0.6940, test_loss: 1.3456, test_f1: 0.5380
 epoch: 89, train_loss: 0.6632, test_loss: 1.3873, test_f1: 0.5517
 epoch: 90, train_loss: 0.6696, test_loss: 1.2791, test_f1: 0.5408
 epoch: 91, train_loss: 0.6871, test_loss: 1.2986, test_f1: 0.5936
 epoch: 92, train_loss: 0.6962, test_loss: 1.5695, test_f1: 0.5994
 epoch: 93, train_loss: 0.6597, test_loss: 1.4572, test_f1: 0.5936
 epoch: 94, train_loss: 0.6668, test_loss: 1.7532, test_f1: 0.5405
 epoch: 95, train_loss: 0.6690, test_loss: 1.2846, test_f1: 0.5725
 epoch: 96, train_loss: 0.6773, test_loss: 1.7877, test_f1: 0.5653
 epoch: 97, train_loss: 0.6477, test_loss: 1.3725, test_f1: 0.5970
 epoch: 98, train_loss: 0.6670, test_loss: 1.5777, test_f1: 0.5707
 epoch: 99, train_loss: 0.6448, test_loss: 1.3301, test_f1: 0.6065
##################ITERATION #1 ****************************************
 epoch: 0, train_loss: 1.1863, test_loss: 1.3276, test_f1: 0.1729
 epoch: 1, train_loss: 1.0993, test_loss: 1.1895, test_f1: 0.4097
 epoch: 2, train_loss: 1.0478, test_loss: 1.2104, test_f1: 0.3525
 epoch: 3, train_loss: 1.0046, test_loss: 1.1836, test_f1: 0.4371
 epoch: 4, train_loss: 1.0064, test_loss: 1.0790, test_f1: 0.5091
 epoch: 5, train_loss: 0.9725, test_loss: 1.0364, test_f1: 0.5107
 epoch: 6, train_loss: 0.9767, test_loss: 1.0175, test_f1: 0.4893
 epoch: 7, train_loss: 0.9518, test_loss: 1.0285, test_f1: 0.5187
 epoch: 8, train_loss: 0.9384, test_loss: 1.0620, test_f1: 0.4824
 epoch: 9, train_loss: 0.9158, test_loss: 1.0297, test_f1: 0.5120
 epoch: 10, train_loss: 0.9290, test_loss: 1.0547, test_f1: 0.5284
 epoch: 11, train_loss: 0.9598, test_loss: 1.0171, test_f1: 0.5388
 epoch: 12, train_loss: 0.9221, test_loss: 1.0200, test_f1: 0.5518
 epoch: 13, train_loss: 0.9176, test_loss: 1.0978, test_f1: 0.4299
 epoch: 14, train_loss: 0.9160, test_loss: 1.0708, test_f1: 0.5432
 epoch: 15, train_loss: 0.9038, test_loss: 1.0828, test_f1: 0.5443
 epoch: 16, train_loss: 0.9027, test_loss: 1.0899, test_f1: 0.4701
 epoch: 17, train_loss: 0.9051, test_loss: 0.9927, test_f1: 0.5372
 epoch: 18, train_loss: 0.9135, test_loss: 1.0238, test_f1: 0.4979
 epoch: 19, train_loss: 0.8875, test_loss: 1.0897, test_f1: 0.5365
 epoch: 20, train_loss: 0.8820, test_loss: 1.0426, test_f1: 0.5323
 epoch: 21, train_loss: 0.8932, test_loss: 1.0394, test_f1: 0.5894
 epoch: 22, train_loss: 0.8889, test_loss: 1.0809, test_f1: 0.5317
 epoch: 23, train_loss: 0.8718, test_loss: 0.9572, test_f1: 0.5775
 epoch: 24, train_loss: 0.8743, test_loss: 1.0040, test_f1: 0.5313
 epoch: 25, train_loss: 0.8428, test_loss: 1.0526, test_f1: 0.5791
 epoch: 26, train_loss: 0.8609, test_loss: 1.0124, test_f1: 0.5933
 epoch: 27, train_loss: 0.8722, test_loss: 1.1663, test_f1: 0.5038
 epoch: 28, train_loss: 0.8627, test_loss: 1.0181, test_f1: 0.5473
 epoch: 29, train_loss: 0.8684, test_loss: 1.1832, test_f1: 0.5511
 epoch: 30, train_loss: 0.8696, test_loss: 1.0651, test_f1: 0.5556
 epoch: 31, train_loss: 0.8660, test_loss: 1.0982, test_f1: 0.5459
 epoch: 32, train_loss: 0.8749, test_loss: 1.0683, test_f1: 0.5462
 epoch: 33, train_loss: 0.8518, test_loss: 1.1434, test_f1: 0.5661
 epoch: 34, train_loss: 0.8404, test_loss: 1.1248, test_f1: 0.5267
 epoch: 35, train_loss: 0.8359, test_loss: 1.1002, test_f1: 0.5624
 epoch: 36, train_loss: 0.8241, test_loss: 1.0905, test_f1: 0.5706
 epoch: 37, train_loss: 0.8500, test_loss: 1.1464, test_f1: 0.5077
 epoch: 38, train_loss: 0.8445, test_loss: 1.0764, test_f1: 0.5664
 epoch: 39, train_loss: 0.8290, test_loss: 1.0692, test_f1: 0.5375
 epoch: 40, train_loss: 0.8345, test_loss: 1.0823, test_f1: 0.5730
 epoch: 41, train_loss: 0.8577, test_loss: 1.0841, test_f1: 0.5536
 epoch: 42, train_loss: 0.8394, test_loss: 1.0417, test_f1: 0.5869
 epoch: 43, train_loss: 0.8172, test_loss: 1.1765, test_f1: 0.5051
 epoch: 44, train_loss: 0.8556, test_loss: 1.1651, test_f1: 0.5503
 epoch: 45, train_loss: 0.8318, test_loss: 1.0887, test_f1: 0.5884
 epoch: 46, train_loss: 0.8284, test_loss: 1.2247, test_f1: 0.4570
 epoch: 47, train_loss: 0.8218, test_loss: 1.1104, test_f1: 0.5402
 epoch: 48, train_loss: 0.8145, test_loss: 1.0692, test_f1: 0.5999
 epoch: 49, train_loss: 0.8163, test_loss: 1.0921, test_f1: 0.5475
 epoch: 50, train_loss: 0.7872, test_loss: 1.1341, test_f1: 0.5856
 epoch: 51, train_loss: 0.7937, test_loss: 1.1672, test_f1: 0.5598
 epoch: 52, train_loss: 0.7667, test_loss: 1.1502, test_f1: 0.5640
 epoch: 53, train_loss: 0.7599, test_loss: 1.1942, test_f1: 0.5479
 epoch: 54, train_loss: 0.7688, test_loss: 1.1097, test_f1: 0.5603
 epoch: 55, train_loss: 0.7616, test_loss: 1.2106, test_f1: 0.5517
 epoch: 56, train_loss: 0.7751, test_loss: 1.1279, test_f1: 0.5766
 epoch: 57, train_loss: 0.7619, test_loss: 1.1061, test_f1: 0.5586
 epoch: 58, train_loss: 0.7589, test_loss: 1.1802, test_f1: 0.5561
 epoch: 59, train_loss: 0.7317, test_loss: 1.1854, test_f1: 0.5454
 epoch: 60, train_loss: 0.7487, test_loss: 1.1465, test_f1: 0.5522
 epoch: 61, train_loss: 0.7603, test_loss: 1.0636, test_f1: 0.5400
 epoch: 62, train_loss: 0.7262, test_loss: 1.2732, test_f1: 0.5616
 epoch: 63, train_loss: 0.7561, test_loss: 1.2186, test_f1: 0.5520
 epoch: 64, train_loss: 0.7237, test_loss: 1.3114, test_f1: 0.5641
 epoch: 65, train_loss: 0.7146, test_loss: 1.1909, test_f1: 0.5366
 epoch: 66, train_loss: 0.7190, test_loss: 1.3591, test_f1: 0.5100
 epoch: 67, train_loss: 0.8191, test_loss: 1.3128, test_f1: 0.5510
 epoch: 68, train_loss: 0.7524, test_loss: 1.2029, test_f1: 0.5620
 epoch: 69, train_loss: 0.7499, test_loss: 1.1873, test_f1: 0.5808
 epoch: 70, train_loss: 0.7199, test_loss: 1.2790, test_f1: 0.5387
 epoch: 71, train_loss: 0.7164, test_loss: 1.2147, test_f1: 0.5618
 epoch: 72, train_loss: 0.7046, test_loss: 1.2869, test_f1: 0.5603
 epoch: 73, train_loss: 0.7163, test_loss: 1.3056, test_f1: 0.5251
 epoch: 74, train_loss: 0.7121, test_loss: 1.3948, test_f1: 0.5565
 epoch: 75, train_loss: 0.7078, test_loss: 1.3272, test_f1: 0.5479
 epoch: 76, train_loss: 0.6964, test_loss: 1.3596, test_f1: 0.5331
 epoch: 77, train_loss: 0.7135, test_loss: 1.3909, test_f1: 0.5306
 epoch: 78, train_loss: 0.7015, test_loss: 1.2963, test_f1: 0.5146
 epoch: 79, train_loss: 0.6834, test_loss: 1.3603, test_f1: 0.5573
 epoch: 80, train_loss: 0.7142, test_loss: 1.3461, test_f1: 0.5322
 epoch: 81, train_loss: 0.6938, test_loss: 1.3796, test_f1: 0.5631
 epoch: 82, train_loss: 0.6813, test_loss: 1.5100, test_f1: 0.5361
 epoch: 83, train_loss: 0.6933, test_loss: 1.2999, test_f1: 0.5580
 epoch: 84, train_loss: 0.6776, test_loss: 1.3217, test_f1: 0.5441
 epoch: 85, train_loss: 0.6859, test_loss: 1.3955, test_f1: 0.5535
 epoch: 86, train_loss: 0.6981, test_loss: 1.4046, test_f1: 0.5421
 epoch: 87, train_loss: 0.6793, test_loss: 1.3975, test_f1: 0.5462
 epoch: 88, train_loss: 0.6787, test_loss: 1.4646, test_f1: 0.5684
 epoch: 89, train_loss: 0.6646, test_loss: 1.3143, test_f1: 0.5721
 epoch: 90, train_loss: 0.6645, test_loss: 1.2064, test_f1: 0.5772
 epoch: 91, train_loss: 0.6741, test_loss: 1.3272, test_f1: 0.5393
 epoch: 92, train_loss: 0.6693, test_loss: 1.5343, test_f1: 0.5631
 epoch: 93, train_loss: 0.6366, test_loss: 1.4316, test_f1: 0.5694
 epoch: 94, train_loss: 0.6442, test_loss: 1.3598, test_f1: 0.5545
 epoch: 95, train_loss: 0.6759, test_loss: 1.4671, test_f1: 0.5446
 epoch: 96, train_loss: 0.6471, test_loss: 1.5314, test_f1: 0.5349
 epoch: 97, train_loss: 0.6575, test_loss: 1.4372, test_f1: 0.5695
 epoch: 98, train_loss: 0.6408, test_loss: 1.3742, test_f1: 0.5479
 epoch: 99, train_loss: 0.6432, test_loss: 1.4574, test_f1: 0.5459
##################ITERATION #2 ****************************************
 epoch: 0, train_loss: 1.2071, test_loss: 1.2187, test_f1: 0.3508
 epoch: 1, train_loss: 1.0765, test_loss: 1.1340, test_f1: 0.4425
 epoch: 2, train_loss: 1.0176, test_loss: 1.0562, test_f1: 0.5058
 epoch: 3, train_loss: 1.0057, test_loss: 1.1462, test_f1: 0.4693
 epoch: 4, train_loss: 0.9817, test_loss: 1.1864, test_f1: 0.4731
 epoch: 5, train_loss: 0.9701, test_loss: 1.1279, test_f1: 0.5156
 epoch: 6, train_loss: 0.9643, test_loss: 1.0342, test_f1: 0.5343
 epoch: 7, train_loss: 0.9456, test_loss: 1.1798, test_f1: 0.5183
 epoch: 8, train_loss: 0.9460, test_loss: 1.1327, test_f1: 0.5283
 epoch: 9, train_loss: 0.9445, test_loss: 1.1163, test_f1: 0.3903
 epoch: 10, train_loss: 0.9459, test_loss: 1.3655, test_f1: 0.4309
 epoch: 11, train_loss: 0.9443, test_loss: 1.0333, test_f1: 0.4619
 epoch: 12, train_loss: 0.9370, test_loss: 1.0891, test_f1: 0.5418
 epoch: 13, train_loss: 0.9193, test_loss: 1.0805, test_f1: 0.5564
 epoch: 14, train_loss: 0.9125, test_loss: 1.3717, test_f1: 0.3968
 epoch: 15, train_loss: 0.8939, test_loss: 1.1487, test_f1: 0.5171
 epoch: 16, train_loss: 0.8827, test_loss: 1.1890, test_f1: 0.5546
 epoch: 17, train_loss: 0.9061, test_loss: 1.1065, test_f1: 0.5517
 epoch: 18, train_loss: 0.8910, test_loss: 1.0674, test_f1: 0.5738
 epoch: 19, train_loss: 0.8690, test_loss: 1.1902, test_f1: 0.5462
 epoch: 20, train_loss: 0.8573, test_loss: 1.1220, test_f1: 0.5977
 epoch: 21, train_loss: 0.8762, test_loss: 1.1817, test_f1: 0.5047
 epoch: 22, train_loss: 0.8657, test_loss: 1.2494, test_f1: 0.5254
 epoch: 23, train_loss: 0.8772, test_loss: 1.1766, test_f1: 0.5458
 epoch: 24, train_loss: 0.8658, test_loss: 1.0444, test_f1: 0.5973
 epoch: 25, train_loss: 0.8520, test_loss: 1.0958, test_f1: 0.5397
 epoch: 26, train_loss: 0.8477, test_loss: 1.1930, test_f1: 0.5390
 epoch: 27, train_loss: 0.8253, test_loss: 1.1087, test_f1: 0.5863
 epoch: 28, train_loss: 0.8311, test_loss: 1.1392, test_f1: 0.5700
 epoch: 29, train_loss: 0.8296, test_loss: 1.1815, test_f1: 0.5264
 epoch: 30, train_loss: 0.8441, test_loss: 1.0720, test_f1: 0.5517
 epoch: 31, train_loss: 0.8451, test_loss: 1.0568, test_f1: 0.5598
 epoch: 32, train_loss: 0.8316, test_loss: 1.1325, test_f1: 0.5530
 epoch: 33, train_loss: 0.8097, test_loss: 1.0988, test_f1: 0.4994
 epoch: 34, train_loss: 0.8179, test_loss: 1.2274, test_f1: 0.5342
 epoch: 35, train_loss: 0.8038, test_loss: 1.0890, test_f1: 0.5537
 epoch: 36, train_loss: 0.8245, test_loss: 1.1159, test_f1: 0.5519
 epoch: 37, train_loss: 0.7917, test_loss: 1.1106, test_f1: 0.5489
 epoch: 38, train_loss: 0.7956, test_loss: 1.0518, test_f1: 0.5861
 epoch: 39, train_loss: 0.7983, test_loss: 1.2061, test_f1: 0.5527
 epoch: 40, train_loss: 0.7853, test_loss: 1.0770, test_f1: 0.5446
 epoch: 41, train_loss: 0.7759, test_loss: 1.2175, test_f1: 0.5500
 epoch: 42, train_loss: 0.7714, test_loss: 1.2208, test_f1: 0.5249
 epoch: 43, train_loss: 0.7760, test_loss: 1.1647, test_f1: 0.5288
 epoch: 44, train_loss: 0.7904, test_loss: 1.0877, test_f1: 0.5574
 epoch: 45, train_loss: 0.7572, test_loss: 1.1332, test_f1: 0.5979
 epoch: 46, train_loss: 0.7749, test_loss: 1.3640, test_f1: 0.5125
 epoch: 47, train_loss: 0.7741, test_loss: 1.1077, test_f1: 0.4782
 epoch: 48, train_loss: 0.7572, test_loss: 1.2931, test_f1: 0.5500
 epoch: 49, train_loss: 0.7717, test_loss: 1.0463, test_f1: 0.5475
 epoch: 50, train_loss: 0.7434, test_loss: 1.0732, test_f1: 0.5624
 epoch: 51, train_loss: 0.7557, test_loss: 1.2384, test_f1: 0.5751
 epoch: 52, train_loss: 0.7143, test_loss: 1.0628, test_f1: 0.5839
 epoch: 53, train_loss: 0.7147, test_loss: 1.1902, test_f1: 0.5614
 epoch: 54, train_loss: 0.6909, test_loss: 1.0899, test_f1: 0.5900
 epoch: 55, train_loss: 0.6888, test_loss: 1.2590, test_f1: 0.5825
 epoch: 56, train_loss: 0.6917, test_loss: 1.4209, test_f1: 0.5004
 epoch: 57, train_loss: 0.6684, test_loss: 1.2330, test_f1: 0.5845
 epoch: 58, train_loss: 0.6983, test_loss: 1.3096, test_f1: 0.5215
 epoch: 59, train_loss: 0.6744, test_loss: 1.2522, test_f1: 0.5531
 epoch: 60, train_loss: 0.6740, test_loss: 1.1425, test_f1: 0.5640
 epoch: 61, train_loss: 0.6696, test_loss: 1.2223, test_f1: 0.5846
 epoch: 62, train_loss: 0.6604, test_loss: 1.2662, test_f1: 0.5663
 epoch: 63, train_loss: 0.6701, test_loss: 1.1891, test_f1: 0.5482
 epoch: 64, train_loss: 0.6781, test_loss: 1.3332, test_f1: 0.5431
 epoch: 65, train_loss: 0.6802, test_loss: 1.3718, test_f1: 0.5515
 epoch: 66, train_loss: 0.6611, test_loss: 1.2469, test_f1: 0.6124
 epoch: 67, train_loss: 0.6588, test_loss: 1.3608, test_f1: 0.5172
 epoch: 68, train_loss: 0.6643, test_loss: 1.1642, test_f1: 0.5894
 epoch: 69, train_loss: 0.6418, test_loss: 1.3523, test_f1: 0.6150
 epoch: 70, train_loss: 0.6374, test_loss: 1.3755, test_f1: 0.5659
 epoch: 71, train_loss: 0.6416, test_loss: 1.2599, test_f1: 0.5611
 epoch: 72, train_loss: 0.6601, test_loss: 1.2850, test_f1: 0.5740
 epoch: 73, train_loss: 0.6281, test_loss: 1.3405, test_f1: 0.5671
 epoch: 74, train_loss: 0.6419, test_loss: 1.2545, test_f1: 0.5820
 epoch: 75, train_loss: 0.6473, test_loss: 1.2068, test_f1: 0.5434
 epoch: 76, train_loss: 0.6332, test_loss: 1.2458, test_f1: 0.5839
 epoch: 77, train_loss: 0.6236, test_loss: 1.2618, test_f1: 0.5975
 epoch: 78, train_loss: 0.6288, test_loss: 1.5439, test_f1: 0.5020
 epoch: 79, train_loss: 0.6699, test_loss: 1.3161, test_f1: 0.5918
 epoch: 80, train_loss: 0.6386, test_loss: 1.2502, test_f1: 0.6027
 epoch: 81, train_loss: 0.6326, test_loss: 1.2913, test_f1: 0.5732
 epoch: 82, train_loss: 0.6632, test_loss: 1.1232, test_f1: 0.5898
 epoch: 83, train_loss: 0.6259, test_loss: 1.3009, test_f1: 0.5760
 epoch: 84, train_loss: 0.5974, test_loss: 1.2056, test_f1: 0.5634
 epoch: 85, train_loss: 0.5894, test_loss: 1.3556, test_f1: 0.5789
 epoch: 86, train_loss: 0.6101, test_loss: 1.4640, test_f1: 0.5732
 epoch: 87, train_loss: 0.6097, test_loss: 1.3498, test_f1: 0.5538
 epoch: 88, train_loss: 0.6291, test_loss: 1.2007, test_f1: 0.6114
 epoch: 89, train_loss: 0.6198, test_loss: 1.1864, test_f1: 0.6163
 epoch: 90, train_loss: 0.6161, test_loss: 1.4520, test_f1: 0.5580
 epoch: 91, train_loss: 0.6219, test_loss: 1.2233, test_f1: 0.5863
 epoch: 92, train_loss: 0.6613, test_loss: 1.1267, test_f1: 0.6298
 epoch: 93, train_loss: 0.6022, test_loss: 1.1265, test_f1: 0.6186
 epoch: 94, train_loss: 0.5724, test_loss: 1.1890, test_f1: 0.6088
 epoch: 95, train_loss: 0.5950, test_loss: 1.4314, test_f1: 0.5689
 epoch: 96, train_loss: 0.5949, test_loss: 1.4027, test_f1: 0.5618
 epoch: 97, train_loss: 0.6111, test_loss: 1.1786, test_f1: 0.6230
 epoch: 98, train_loss: 0.5994, test_loss: 1.3792, test_f1: 0.6092
 epoch: 99, train_loss: 0.5887, test_loss: 1.1438, test_f1: 0.5895
##################ITERATION #3 ****************************************
 epoch: 0, train_loss: 1.2307, test_loss: 1.3050, test_f1: 0.2722
 epoch: 1, train_loss: 1.0860, test_loss: 1.1715, test_f1: 0.4510
 epoch: 2, train_loss: 1.0421, test_loss: 1.1113, test_f1: 0.4692
 epoch: 3, train_loss: 1.0064, test_loss: 1.1083, test_f1: 0.5048
 epoch: 4, train_loss: 0.9779, test_loss: 1.0751, test_f1: 0.4826
 epoch: 5, train_loss: 0.9737, test_loss: 1.0754, test_f1: 0.4158
 epoch: 6, train_loss: 0.9669, test_loss: 1.0566, test_f1: 0.5084
 epoch: 7, train_loss: 0.9518, test_loss: 1.0692, test_f1: 0.5085
 epoch: 8, train_loss: 0.9332, test_loss: 1.0576, test_f1: 0.4445
 epoch: 9, train_loss: 0.9162, test_loss: 1.0633, test_f1: 0.5355
 epoch: 10, train_loss: 0.9316, test_loss: 1.0537, test_f1: 0.5013
 epoch: 11, train_loss: 0.9203, test_loss: 1.0234, test_f1: 0.5229
 epoch: 12, train_loss: 0.9342, test_loss: 1.0562, test_f1: 0.5252
 epoch: 13, train_loss: 0.9106, test_loss: 1.0782, test_f1: 0.5049
 epoch: 14, train_loss: 0.9018, test_loss: 1.0898, test_f1: 0.4531
 epoch: 15, train_loss: 0.8919, test_loss: 1.0044, test_f1: 0.5324
 epoch: 16, train_loss: 0.8700, test_loss: 1.0236, test_f1: 0.5157
 epoch: 17, train_loss: 0.8829, test_loss: 1.0076, test_f1: 0.5306
 epoch: 18, train_loss: 0.8849, test_loss: 0.9642, test_f1: 0.5769
 epoch: 19, train_loss: 0.8724, test_loss: 0.9877, test_f1: 0.5596
 epoch: 20, train_loss: 0.8567, test_loss: 0.9429, test_f1: 0.5520
 epoch: 21, train_loss: 0.8345, test_loss: 1.0560, test_f1: 0.5400
 epoch: 22, train_loss: 0.8181, test_loss: 1.0233, test_f1: 0.5313
 epoch: 23, train_loss: 0.8265, test_loss: 0.9617, test_f1: 0.5436
 epoch: 24, train_loss: 0.8353, test_loss: 0.9513, test_f1: 0.5304
 epoch: 25, train_loss: 0.8107, test_loss: 1.0307, test_f1: 0.5299
 epoch: 26, train_loss: 0.8055, test_loss: 0.9775, test_f1: 0.5675
 epoch: 27, train_loss: 0.7961, test_loss: 1.0565, test_f1: 0.4307
 epoch: 28, train_loss: 0.7779, test_loss: 0.9484, test_f1: 0.5759
 epoch: 29, train_loss: 0.7749, test_loss: 1.0167, test_f1: 0.5383
 epoch: 30, train_loss: 0.7900, test_loss: 1.0239, test_f1: 0.5640
 epoch: 31, train_loss: 0.7852, test_loss: 1.0843, test_f1: 0.4717
 epoch: 32, train_loss: 0.7804, test_loss: 1.0977, test_f1: 0.5564
 epoch: 33, train_loss: 0.7885, test_loss: 1.0554, test_f1: 0.5565
 epoch: 34, train_loss: 0.7893, test_loss: 1.0258, test_f1: 0.5477
 epoch: 35, train_loss: 0.7717, test_loss: 1.0027, test_f1: 0.5340
 epoch: 36, train_loss: 0.8018, test_loss: 0.9956, test_f1: 0.5636
 epoch: 37, train_loss: 0.7742, test_loss: 1.0124, test_f1: 0.5448
 epoch: 38, train_loss: 0.7796, test_loss: 1.1198, test_f1: 0.5298
 epoch: 39, train_loss: 0.7886, test_loss: 1.0093, test_f1: 0.5282
 epoch: 40, train_loss: 0.7442, test_loss: 0.9690, test_f1: 0.5532
 epoch: 41, train_loss: 0.7300, test_loss: 1.0574, test_f1: 0.5512
 epoch: 42, train_loss: 0.7569, test_loss: 1.0514, test_f1: 0.5528
 epoch: 43, train_loss: 0.7458, test_loss: 0.9946, test_f1: 0.5427
 epoch: 44, train_loss: 0.7497, test_loss: 1.0129, test_f1: 0.5481
 epoch: 45, train_loss: 0.7820, test_loss: 1.1973, test_f1: 0.5541
 epoch: 46, train_loss: 0.7562, test_loss: 1.1514, test_f1: 0.5580
 epoch: 47, train_loss: 0.7749, test_loss: 1.1673, test_f1: 0.5295
 epoch: 48, train_loss: 0.7659, test_loss: 1.0303, test_f1: 0.5627
 epoch: 49, train_loss: 0.7529, test_loss: 1.0750, test_f1: 0.5708
 epoch: 50, train_loss: 0.7340, test_loss: 1.1183, test_f1: 0.5561
 epoch: 51, train_loss: 0.7260, test_loss: 0.9895, test_f1: 0.5760
 epoch: 52, train_loss: 0.7073, test_loss: 0.9968, test_f1: 0.6110
 epoch: 53, train_loss: 0.6942, test_loss: 1.0204, test_f1: 0.6018
 epoch: 54, train_loss: 0.6899, test_loss: 1.0584, test_f1: 0.5997
 epoch: 55, train_loss: 0.7136, test_loss: 1.0111, test_f1: 0.6033
 epoch: 56, train_loss: 0.6796, test_loss: 1.0612, test_f1: 0.5875
 epoch: 57, train_loss: 0.6784, test_loss: 1.0365, test_f1: 0.6043
 epoch: 58, train_loss: 0.6581, test_loss: 1.0545, test_f1: 0.5865
 epoch: 59, train_loss: 0.6961, test_loss: 1.1683, test_f1: 0.5496
 epoch: 60, train_loss: 0.6854, test_loss: 1.0747, test_f1: 0.5749
 epoch: 61, train_loss: 0.6667, test_loss: 1.0106, test_f1: 0.6102
 epoch: 62, train_loss: 0.6626, test_loss: 1.0381, test_f1: 0.5948
 epoch: 63, train_loss: 0.6604, test_loss: 1.0742, test_f1: 0.5818
 epoch: 64, train_loss: 0.6616, test_loss: 1.1136, test_f1: 0.5660
 epoch: 65, train_loss: 0.6590, test_loss: 1.1585, test_f1: 0.5709
 epoch: 66, train_loss: 0.6513, test_loss: 1.0688, test_f1: 0.5767
 epoch: 67, train_loss: 0.6501, test_loss: 1.0363, test_f1: 0.5815
 epoch: 68, train_loss: 0.6754, test_loss: 1.0648, test_f1: 0.5816
 epoch: 69, train_loss: 0.6628, test_loss: 1.1449, test_f1: 0.5797
 epoch: 70, train_loss: 0.6767, test_loss: 1.0946, test_f1: 0.5740
 epoch: 71, train_loss: 0.6578, test_loss: 1.0837, test_f1: 0.5827
 epoch: 72, train_loss: 0.6719, test_loss: 1.0782, test_f1: 0.5939
 epoch: 73, train_loss: 0.6460, test_loss: 1.1143, test_f1: 0.5878
 epoch: 74, train_loss: 0.6307, test_loss: 1.0823, test_f1: 0.5670
 epoch: 75, train_loss: 0.6584, test_loss: 1.0596, test_f1: 0.5846
 epoch: 76, train_loss: 0.6764, test_loss: 1.1755, test_f1: 0.5656
 epoch: 77, train_loss: 0.6741, test_loss: 1.2247, test_f1: 0.5763
 epoch: 78, train_loss: 0.6554, test_loss: 1.0521, test_f1: 0.5885
 epoch: 79, train_loss: 0.6368, test_loss: 1.0405, test_f1: 0.5957
 epoch: 80, train_loss: 0.6490, test_loss: 1.0827, test_f1: 0.6079
 epoch: 81, train_loss: 0.6673, test_loss: 1.1540, test_f1: 0.5754
 epoch: 82, train_loss: 0.6541, test_loss: 1.0995, test_f1: 0.5695
 epoch: 83, train_loss: 0.6505, test_loss: 1.1544, test_f1: 0.5527
 epoch: 84, train_loss: 0.6055, test_loss: 1.0777, test_f1: 0.5921
 epoch: 85, train_loss: 0.6116, test_loss: 1.1628, test_f1: 0.5834
 epoch: 86, train_loss: 0.6313, test_loss: 1.2135, test_f1: 0.5702
 epoch: 87, train_loss: 0.6240, test_loss: 1.2265, test_f1: 0.5893
 epoch: 88, train_loss: 0.6179, test_loss: 1.1259, test_f1: 0.5977
 epoch: 89, train_loss: 0.6259, test_loss: 1.2392, test_f1: 0.5971
 epoch: 90, train_loss: 0.6383, test_loss: 1.1610, test_f1: 0.5763
 epoch: 91, train_loss: 0.6304, test_loss: 1.1942, test_f1: 0.5702
 epoch: 92, train_loss: 0.6233, test_loss: 1.0901, test_f1: 0.6017
 epoch: 93, train_loss: 0.6309, test_loss: 1.0964, test_f1: 0.5845
 epoch: 94, train_loss: 0.6316, test_loss: 1.1098, test_f1: 0.6076
 epoch: 95, train_loss: 0.6269, test_loss: 1.3501, test_f1: 0.5533
 epoch: 96, train_loss: 0.6223, test_loss: 1.2162, test_f1: 0.5853
 epoch: 97, train_loss: 0.6104, test_loss: 1.1839, test_f1: 0.6036
 epoch: 98, train_loss: 0.5997, test_loss: 1.2079, test_f1: 0.5750
 epoch: 99, train_loss: 0.6063, test_loss: 1.2667, test_f1: 0.5867
##################ITERATION #4 ****************************************
 epoch: 0, train_loss: 1.2976, test_loss: 1.3816, test_f1: 0.2802
 epoch: 1, train_loss: 1.1459, test_loss: 1.1669, test_f1: 0.3670
 epoch: 2, train_loss: 1.0625, test_loss: 1.1257, test_f1: 0.4155
 epoch: 3, train_loss: 1.0476, test_loss: 1.1379, test_f1: 0.4174
 epoch: 4, train_loss: 1.0022, test_loss: 1.1992, test_f1: 0.4272
 epoch: 5, train_loss: 0.9781, test_loss: 1.0718, test_f1: 0.5017
 epoch: 6, train_loss: 0.9878, test_loss: 1.0673, test_f1: 0.4781
 epoch: 7, train_loss: 0.9669, test_loss: 1.0461, test_f1: 0.4893
 epoch: 8, train_loss: 0.9584, test_loss: 1.0912, test_f1: 0.4819
 epoch: 9, train_loss: 0.9509, test_loss: 1.1141, test_f1: 0.5082
 epoch: 10, train_loss: 0.9220, test_loss: 1.1913, test_f1: 0.5037
 epoch: 11, train_loss: 0.9388, test_loss: 1.0726, test_f1: 0.5431
 epoch: 12, train_loss: 0.9243, test_loss: 1.1120, test_f1: 0.4323
 epoch: 13, train_loss: 0.9376, test_loss: 1.0663, test_f1: 0.5116
 epoch: 14, train_loss: 0.9273, test_loss: 1.1583, test_f1: 0.4964
 epoch: 15, train_loss: 0.9306, test_loss: 1.1487, test_f1: 0.5049
 epoch: 16, train_loss: 0.9278, test_loss: 1.0833, test_f1: 0.5253
 epoch: 17, train_loss: 0.9108, test_loss: 1.1531, test_f1: 0.4994
 epoch: 18, train_loss: 0.9102, test_loss: 1.1313, test_f1: 0.4771
 epoch: 19, train_loss: 0.9358, test_loss: 1.1267, test_f1: 0.4969
 epoch: 20, train_loss: 0.9107, test_loss: 1.1152, test_f1: 0.5318
 epoch: 21, train_loss: 0.8799, test_loss: 1.0734, test_f1: 0.5340
 epoch: 22, train_loss: 0.9118, test_loss: 1.1217, test_f1: 0.4969
 epoch: 23, train_loss: 0.8791, test_loss: 1.2795, test_f1: 0.5275
 epoch: 24, train_loss: 0.9151, test_loss: 1.0524, test_f1: 0.5745
 epoch: 25, train_loss: 0.8673, test_loss: 1.0855, test_f1: 0.5330
 epoch: 26, train_loss: 0.8573, test_loss: 1.2156, test_f1: 0.5180
 epoch: 27, train_loss: 0.8809, test_loss: 1.0171, test_f1: 0.5152
 epoch: 28, train_loss: 0.8436, test_loss: 1.1273, test_f1: 0.5122
 epoch: 29, train_loss: 0.8582, test_loss: 1.1269, test_f1: 0.5562
 epoch: 30, train_loss: 0.8533, test_loss: 1.0403, test_f1: 0.5529
 epoch: 31, train_loss: 0.8741, test_loss: 1.1793, test_f1: 0.5381
 epoch: 32, train_loss: 0.8909, test_loss: 1.1439, test_f1: 0.5297
 epoch: 33, train_loss: 0.8683, test_loss: 1.1183, test_f1: 0.5099
 epoch: 34, train_loss: 0.8328, test_loss: 1.0839, test_f1: 0.5221
 epoch: 35, train_loss: 0.8233, test_loss: 1.0807, test_f1: 0.5487
 epoch: 36, train_loss: 0.8221, test_loss: 1.1629, test_f1: 0.5257
 epoch: 37, train_loss: 0.8250, test_loss: 1.1892, test_f1: 0.4955
 epoch: 38, train_loss: 0.8420, test_loss: 1.1360, test_f1: 0.5280
 epoch: 39, train_loss: 0.7969, test_loss: 1.1430, test_f1: 0.5341
 epoch: 40, train_loss: 0.7903, test_loss: 1.1553, test_f1: 0.4894
 epoch: 41, train_loss: 0.8225, test_loss: 1.1319, test_f1: 0.5077
 epoch: 42, train_loss: 0.8119, test_loss: 1.1668, test_f1: 0.5071
 epoch: 43, train_loss: 0.7867, test_loss: 1.1146, test_f1: 0.5360
 epoch: 44, train_loss: 0.7879, test_loss: 1.0884, test_f1: 0.5641
 epoch: 45, train_loss: 0.7925, test_loss: 1.1683, test_f1: 0.5482
 epoch: 46, train_loss: 0.7922, test_loss: 1.1877, test_f1: 0.5558
 epoch: 47, train_loss: 0.7793, test_loss: 1.2228, test_f1: 0.5168
 epoch: 48, train_loss: 0.7923, test_loss: 1.0973, test_f1: 0.5383
 epoch: 49, train_loss: 0.7612, test_loss: 1.1372, test_f1: 0.5153
 epoch: 50, train_loss: 0.7720, test_loss: 1.1686, test_f1: 0.5200
 epoch: 51, train_loss: 0.7501, test_loss: 1.2027, test_f1: 0.5525
 epoch: 52, train_loss: 0.7453, test_loss: 1.2417, test_f1: 0.5468
 epoch: 53, train_loss: 0.7455, test_loss: 1.1576, test_f1: 0.5598
 epoch: 54, train_loss: 0.7474, test_loss: 1.1097, test_f1: 0.5549
 epoch: 55, train_loss: 0.7518, test_loss: 1.1086, test_f1: 0.5754
 epoch: 56, train_loss: 0.7403, test_loss: 1.2376, test_f1: 0.5550
 epoch: 57, train_loss: 0.7210, test_loss: 1.2029, test_f1: 0.5668
 epoch: 58, train_loss: 0.7202, test_loss: 1.1772, test_f1: 0.5585
 epoch: 59, train_loss: 0.7039, test_loss: 1.2559, test_f1: 0.5598
 epoch: 60, train_loss: 0.7042, test_loss: 1.2669, test_f1: 0.5484
 epoch: 61, train_loss: 0.7394, test_loss: 1.1369, test_f1: 0.5575
 epoch: 62, train_loss: 0.7474, test_loss: 1.2541, test_f1: 0.5187
 epoch: 63, train_loss: 0.7238, test_loss: 1.2645, test_f1: 0.5381
 epoch: 64, train_loss: 0.7226, test_loss: 1.2882, test_f1: 0.5409
 epoch: 65, train_loss: 0.7065, test_loss: 1.1725, test_f1: 0.5333
 epoch: 66, train_loss: 0.7089, test_loss: 1.1497, test_f1: 0.5515
 epoch: 67, train_loss: 0.7110, test_loss: 1.2676, test_f1: 0.5078
 epoch: 68, train_loss: 0.7049, test_loss: 1.1924, test_f1: 0.5567
 epoch: 69, train_loss: 0.7203, test_loss: 1.2080, test_f1: 0.5526
 epoch: 70, train_loss: 0.7040, test_loss: 1.1639, test_f1: 0.5579
 epoch: 71, train_loss: 0.7207, test_loss: 1.3121, test_f1: 0.5012
 epoch: 72, train_loss: 0.6960, test_loss: 1.2109, test_f1: 0.5160
 epoch: 73, train_loss: 0.7150, test_loss: 1.2904, test_f1: 0.5311
 epoch: 74, train_loss: 0.6984, test_loss: 1.1475, test_f1: 0.5596
 epoch: 75, train_loss: 0.6957, test_loss: 1.3646, test_f1: 0.5680
 epoch: 76, train_loss: 0.7244, test_loss: 1.2109, test_f1: 0.5269
 epoch: 77, train_loss: 0.7083, test_loss: 1.1940, test_f1: 0.5440
 epoch: 78, train_loss: 0.7134, test_loss: 1.2041, test_f1: 0.5139
 epoch: 79, train_loss: 0.6779, test_loss: 1.1845, test_f1: 0.5499
 epoch: 80, train_loss: 0.7099, test_loss: 1.2512, test_f1: 0.5375
 epoch: 81, train_loss: 0.6884, test_loss: 1.2012, test_f1: 0.5536
 epoch: 82, train_loss: 0.6716, test_loss: 1.3069, test_f1: 0.5468
 epoch: 83, train_loss: 0.6612, test_loss: 1.2223, test_f1: 0.5484
 epoch: 84, train_loss: 0.6959, test_loss: 1.2200, test_f1: 0.5665
 epoch: 85, train_loss: 0.6918, test_loss: 1.2988, test_f1: 0.5404
 epoch: 86, train_loss: 0.7028, test_loss: 1.2598, test_f1: 0.5673
 epoch: 87, train_loss: 0.6734, test_loss: 1.2246, test_f1: 0.5369
 epoch: 88, train_loss: 0.7139, test_loss: 1.2019, test_f1: 0.5519
 epoch: 89, train_loss: 0.7283, test_loss: 1.2125, test_f1: 0.5473
 epoch: 90, train_loss: 0.6803, test_loss: 1.1750, test_f1: 0.5690
 epoch: 91, train_loss: 0.6804, test_loss: 1.2244, test_f1: 0.5252
 epoch: 92, train_loss: 0.6760, test_loss: 1.2573, test_f1: 0.5240
 epoch: 93, train_loss: 0.6746, test_loss: 1.2817, test_f1: 0.5450
 epoch: 94, train_loss: 0.6606, test_loss: 1.2933, test_f1: 0.5844
 epoch: 95, train_loss: 0.6696, test_loss: 1.3868, test_f1: 0.5621
 epoch: 96, train_loss: 0.6788, test_loss: 1.3700, test_f1: 0.5520
 epoch: 97, train_loss: 0.6685, test_loss: 1.2418, test_f1: 0.5590
 epoch: 98, train_loss: 0.6621, test_loss: 1.4771, test_f1: 0.5352
 epoch: 99, train_loss: 0.6642, test_loss: 1.1912, test_f1: 0.5980
##################ITERATION #5 ****************************************
 epoch: 0, train_loss: 1.2162, test_loss: 1.2586, test_f1: 0.2831
 epoch: 1, train_loss: 1.1106, test_loss: 1.1842, test_f1: 0.4010
 epoch: 2, train_loss: 1.0681, test_loss: 1.1105, test_f1: 0.4671
 epoch: 3, train_loss: 1.0225, test_loss: 1.0912, test_f1: 0.4572
 epoch: 4, train_loss: 0.9957, test_loss: 1.0886, test_f1: 0.4818
 epoch: 5, train_loss: 1.0006, test_loss: 1.0668, test_f1: 0.4966
 epoch: 6, train_loss: 0.9718, test_loss: 1.0701, test_f1: 0.5194
 epoch: 7, train_loss: 0.9630, test_loss: 1.0445, test_f1: 0.4974
 epoch: 8, train_loss: 0.9549, test_loss: 1.0462, test_f1: 0.5161
 epoch: 9, train_loss: 0.9649, test_loss: 1.0270, test_f1: 0.4488
 epoch: 10, train_loss: 0.9407, test_loss: 1.0540, test_f1: 0.5083
 epoch: 11, train_loss: 0.9354, test_loss: 1.0113, test_f1: 0.5508
 epoch: 12, train_loss: 0.9279, test_loss: 1.0162, test_f1: 0.5354
 epoch: 13, train_loss: 0.9342, test_loss: 1.0199, test_f1: 0.5255
 epoch: 14, train_loss: 0.9258, test_loss: 1.0469, test_f1: 0.5152
 epoch: 15, train_loss: 0.9182, test_loss: 1.0247, test_f1: 0.5230
 epoch: 16, train_loss: 0.9106, test_loss: 1.0132, test_f1: 0.5489
 epoch: 17, train_loss: 0.8999, test_loss: 1.0250, test_f1: 0.5579
 epoch: 18, train_loss: 0.8813, test_loss: 1.1048, test_f1: 0.5593
 epoch: 19, train_loss: 0.8963, test_loss: 1.0329, test_f1: 0.5447
 epoch: 20, train_loss: 0.8709, test_loss: 1.0580, test_f1: 0.5644
 epoch: 21, train_loss: 0.8530, test_loss: 1.0563, test_f1: 0.5288
 epoch: 22, train_loss: 0.8681, test_loss: 1.0716, test_f1: 0.5245
 epoch: 23, train_loss: 0.8604, test_loss: 1.0358, test_f1: 0.5345
 epoch: 24, train_loss: 0.8420, test_loss: 1.1235, test_f1: 0.4862
 epoch: 25, train_loss: 0.8551, test_loss: 1.1889, test_f1: 0.5522
 epoch: 26, train_loss: 0.8618, test_loss: 1.0486, test_f1: 0.5400
 epoch: 27, train_loss: 0.8401, test_loss: 1.1388, test_f1: 0.5050
 epoch: 28, train_loss: 0.8389, test_loss: 1.2076, test_f1: 0.5092
 epoch: 29, train_loss: 0.8368, test_loss: 1.1814, test_f1: 0.5167
 epoch: 30, train_loss: 0.8113, test_loss: 0.9770, test_f1: 0.5623
 epoch: 31, train_loss: 0.8185, test_loss: 1.0972, test_f1: 0.5533
 epoch: 32, train_loss: 0.8154, test_loss: 1.1806, test_f1: 0.5472
 epoch: 33, train_loss: 0.8135, test_loss: 1.1714, test_f1: 0.5334
 epoch: 34, train_loss: 0.7928, test_loss: 1.3328, test_f1: 0.5189
 epoch: 35, train_loss: 0.8150, test_loss: 1.1453, test_f1: 0.5567
 epoch: 36, train_loss: 0.7986, test_loss: 1.0610, test_f1: 0.5583
 epoch: 37, train_loss: 0.7920, test_loss: 1.0901, test_f1: 0.5622
 epoch: 38, train_loss: 0.7846, test_loss: 1.1338, test_f1: 0.5694
 epoch: 39, train_loss: 0.7822, test_loss: 1.1120, test_f1: 0.5656
 epoch: 40, train_loss: 0.7589, test_loss: 1.1129, test_f1: 0.5620
 epoch: 41, train_loss: 0.7433, test_loss: 1.2566, test_f1: 0.5358
 epoch: 42, train_loss: 0.7561, test_loss: 1.1362, test_f1: 0.5658
 epoch: 43, train_loss: 0.7646, test_loss: 1.2070, test_f1: 0.5333
 epoch: 44, train_loss: 0.7672, test_loss: 0.9950, test_f1: 0.6017
 epoch: 45, train_loss: 0.7507, test_loss: 1.0896, test_f1: 0.5604
 epoch: 46, train_loss: 0.7471, test_loss: 1.0600, test_f1: 0.6120
 epoch: 47, train_loss: 0.7396, test_loss: 1.0375, test_f1: 0.5931
 epoch: 48, train_loss: 0.7336, test_loss: 1.1391, test_f1: 0.5813
 epoch: 49, train_loss: 0.7171, test_loss: 1.1482, test_f1: 0.5435
 epoch: 50, train_loss: 0.7238, test_loss: 1.1466, test_f1: 0.5735
 epoch: 51, train_loss: 0.7178, test_loss: 1.0922, test_f1: 0.5672
 epoch: 52, train_loss: 0.7128, test_loss: 1.0900, test_f1: 0.6102
 epoch: 53, train_loss: 0.7003, test_loss: 1.2156, test_f1: 0.5765
 epoch: 54, train_loss: 0.6944, test_loss: 1.1354, test_f1: 0.5820
 epoch: 55, train_loss: 0.6630, test_loss: 1.2256, test_f1: 0.5612
 epoch: 56, train_loss: 0.7030, test_loss: 1.1298, test_f1: 0.6137
 epoch: 57, train_loss: 0.6718, test_loss: 1.3144, test_f1: 0.5776
 epoch: 58, train_loss: 0.6593, test_loss: 1.2133, test_f1: 0.5986
 epoch: 59, train_loss: 0.6669, test_loss: 1.0918, test_f1: 0.5694
 epoch: 60, train_loss: 0.6844, test_loss: 1.1347, test_f1: 0.5818
 epoch: 61, train_loss: 0.6692, test_loss: 1.1114, test_f1: 0.5974
 epoch: 62, train_loss: 0.6782, test_loss: 1.1589, test_f1: 0.5674
 epoch: 63, train_loss: 0.6597, test_loss: 1.1046, test_f1: 0.5868
 epoch: 64, train_loss: 0.6463, test_loss: 1.4106, test_f1: 0.5496
 epoch: 65, train_loss: 0.6546, test_loss: 1.2817, test_f1: 0.5861
 epoch: 66, train_loss: 0.6477, test_loss: 1.2248, test_f1: 0.5967
 epoch: 67, train_loss: 0.6406, test_loss: 1.1942, test_f1: 0.5760
 epoch: 68, train_loss: 0.6580, test_loss: 1.2895, test_f1: 0.5420
 epoch: 69, train_loss: 0.6559, test_loss: 1.1018, test_f1: 0.6311
 epoch: 70, train_loss: 0.6251, test_loss: 1.2605, test_f1: 0.5898
 epoch: 71, train_loss: 0.6274, test_loss: 1.1364, test_f1: 0.6123
 epoch: 72, train_loss: 0.6642, test_loss: 1.3096, test_f1: 0.5731
 epoch: 73, train_loss: 0.6396, test_loss: 1.3481, test_f1: 0.5570
 epoch: 74, train_loss: 0.6496, test_loss: 1.1876, test_f1: 0.5917
 epoch: 75, train_loss: 0.6631, test_loss: 1.2435, test_f1: 0.5885
 epoch: 76, train_loss: 0.6383, test_loss: 1.5652, test_f1: 0.5851
 epoch: 77, train_loss: 0.6506, test_loss: 1.2599, test_f1: 0.5761
 epoch: 78, train_loss: 0.6369, test_loss: 1.2878, test_f1: 0.6206
 epoch: 79, train_loss: 0.6272, test_loss: 1.2415, test_f1: 0.6007
 epoch: 80, train_loss: 0.6295, test_loss: 1.2453, test_f1: 0.6089
 epoch: 81, train_loss: 0.6278, test_loss: 1.1214, test_f1: 0.6085
 epoch: 82, train_loss: 0.6195, test_loss: 1.4492, test_f1: 0.5585
 epoch: 83, train_loss: 0.6243, test_loss: 1.2806, test_f1: 0.6199
 epoch: 84, train_loss: 0.6024, test_loss: 1.5348, test_f1: 0.5496
 epoch: 85, train_loss: 0.6249, test_loss: 1.5634, test_f1: 0.5546
 epoch: 86, train_loss: 0.6216, test_loss: 1.4299, test_f1: 0.5798
 epoch: 87, train_loss: 0.6002, test_loss: 1.1955, test_f1: 0.6174
 epoch: 88, train_loss: 0.6359, test_loss: 1.3698, test_f1: 0.5829
 epoch: 89, train_loss: 0.6245, test_loss: 1.3860, test_f1: 0.5260
 epoch: 90, train_loss: 0.6028, test_loss: 1.1241, test_f1: 0.6361
 epoch: 91, train_loss: 0.6152, test_loss: 1.4535, test_f1: 0.5605
 epoch: 92, train_loss: 0.5911, test_loss: 1.0707, test_f1: 0.6644
 epoch: 93, train_loss: 0.6261, test_loss: 1.3166, test_f1: 0.5779
 epoch: 94, train_loss: 0.6260, test_loss: 1.2576, test_f1: 0.5569
 epoch: 95, train_loss: 0.6101, test_loss: 1.2831, test_f1: 0.5676
 epoch: 96, train_loss: 0.5804, test_loss: 1.2268, test_f1: 0.6128
 epoch: 97, train_loss: 0.5991, test_loss: 1.2368, test_f1: 0.6311
 epoch: 98, train_loss: 0.5962, test_loss: 1.2769, test_f1: 0.5804
 epoch: 99, train_loss: 0.5942, test_loss: 1.2130, test_f1: 0.5975
##################ITERATION #6 ****************************************
 epoch: 0, train_loss: 1.2465, test_loss: 1.2447, test_f1: 0.3269
 epoch: 1, train_loss: 1.1021, test_loss: 1.1432, test_f1: 0.3647
 epoch: 2, train_loss: 1.0588, test_loss: 1.1433, test_f1: 0.4216
 epoch: 3, train_loss: 1.0341, test_loss: 1.0879, test_f1: 0.4373
 epoch: 4, train_loss: 1.0208, test_loss: 1.1242, test_f1: 0.4798
 epoch: 5, train_loss: 0.9862, test_loss: 1.0513, test_f1: 0.4979
 epoch: 6, train_loss: 0.9732, test_loss: 1.1706, test_f1: 0.4892
 epoch: 7, train_loss: 0.9574, test_loss: 1.0764, test_f1: 0.4881
 epoch: 8, train_loss: 0.9607, test_loss: 1.0721, test_f1: 0.4840
 epoch: 9, train_loss: 0.9464, test_loss: 1.0304, test_f1: 0.5408
 epoch: 10, train_loss: 0.9441, test_loss: 1.0728, test_f1: 0.5283
 epoch: 11, train_loss: 0.9323, test_loss: 1.0718, test_f1: 0.5348
 epoch: 12, train_loss: 0.9184, test_loss: 1.0499, test_f1: 0.5026
 epoch: 13, train_loss: 0.9147, test_loss: 1.0595, test_f1: 0.5441
 epoch: 14, train_loss: 0.9122, test_loss: 1.1539, test_f1: 0.5195
 epoch: 15, train_loss: 0.9057, test_loss: 1.1015, test_f1: 0.4822
 epoch: 16, train_loss: 0.9172, test_loss: 1.0609, test_f1: 0.5444
 epoch: 17, train_loss: 0.8983, test_loss: 1.0694, test_f1: 0.5453
 epoch: 18, train_loss: 0.8801, test_loss: 1.0693, test_f1: 0.5095
 epoch: 19, train_loss: 0.8849, test_loss: 1.1318, test_f1: 0.5129
 epoch: 20, train_loss: 0.8874, test_loss: 1.1065, test_f1: 0.5746
 epoch: 21, train_loss: 0.8741, test_loss: 1.0070, test_f1: 0.5717
 epoch: 22, train_loss: 0.8901, test_loss: 0.9756, test_f1: 0.6172
 epoch: 23, train_loss: 0.8401, test_loss: 1.0486, test_f1: 0.5905
 epoch: 24, train_loss: 0.8348, test_loss: 1.0432, test_f1: 0.5408
 epoch: 25, train_loss: 0.8468, test_loss: 1.0034, test_f1: 0.5713
 epoch: 26, train_loss: 0.8539, test_loss: 0.9979, test_f1: 0.5731
 epoch: 27, train_loss: 0.8219, test_loss: 1.0183, test_f1: 0.5571
 epoch: 28, train_loss: 0.8070, test_loss: 1.0160, test_f1: 0.5834
 epoch: 29, train_loss: 0.8385, test_loss: 1.1192, test_f1: 0.5274
 epoch: 30, train_loss: 0.8179, test_loss: 1.0518, test_f1: 0.5675
 epoch: 31, train_loss: 0.7912, test_loss: 1.0590, test_f1: 0.5725
 epoch: 32, train_loss: 0.8067, test_loss: 1.0224, test_f1: 0.5692
 epoch: 33, train_loss: 0.8265, test_loss: 1.0244, test_f1: 0.5791
 epoch: 34, train_loss: 0.7859, test_loss: 1.0869, test_f1: 0.5944
 epoch: 35, train_loss: 0.7572, test_loss: 1.0632, test_f1: 0.5891
 epoch: 36, train_loss: 0.7643, test_loss: 1.0860, test_f1: 0.5532
 epoch: 37, train_loss: 0.7799, test_loss: 1.2351, test_f1: 0.5095
 epoch: 38, train_loss: 0.7968, test_loss: 1.1613, test_f1: 0.5656
 epoch: 39, train_loss: 0.7811, test_loss: 1.0205, test_f1: 0.5582
 epoch: 40, train_loss: 0.7658, test_loss: 1.0802, test_f1: 0.6068
 epoch: 41, train_loss: 0.7537, test_loss: 1.0818, test_f1: 0.5860
 epoch: 42, train_loss: 0.7800, test_loss: 1.0596, test_f1: 0.5750
 epoch: 43, train_loss: 0.7515, test_loss: 1.0250, test_f1: 0.5609
 epoch: 44, train_loss: 0.7264, test_loss: 1.0868, test_f1: 0.5534
 epoch: 45, train_loss: 0.7487, test_loss: 1.1517, test_f1: 0.5744
 epoch: 46, train_loss: 0.7727, test_loss: 1.0326, test_f1: 0.5842
 epoch: 47, train_loss: 0.7250, test_loss: 1.0823, test_f1: 0.5983
 epoch: 48, train_loss: 0.7255, test_loss: 1.1299, test_f1: 0.5682
 epoch: 49, train_loss: 0.7584, test_loss: 1.0749, test_f1: 0.5833
 epoch: 50, train_loss: 0.7247, test_loss: 1.1095, test_f1: 0.5780
 epoch: 51, train_loss: 0.7167, test_loss: 1.0977, test_f1: 0.5590
 epoch: 52, train_loss: 0.7076, test_loss: 1.1245, test_f1: 0.5634
 epoch: 53, train_loss: 0.6905, test_loss: 1.1308, test_f1: 0.5327
 epoch: 54, train_loss: 0.6754, test_loss: 1.0855, test_f1: 0.5865
 epoch: 55, train_loss: 0.6709, test_loss: 1.1385, test_f1: 0.5415
 epoch: 56, train_loss: 0.6726, test_loss: 1.1534, test_f1: 0.5445
 epoch: 57, train_loss: 0.6882, test_loss: 1.2567, test_f1: 0.5225
 epoch: 58, train_loss: 0.6972, test_loss: 1.1293, test_f1: 0.5716
 epoch: 59, train_loss: 0.6865, test_loss: 1.0847, test_f1: 0.5958
 epoch: 60, train_loss: 0.6616, test_loss: 1.1078, test_f1: 0.5511
 epoch: 61, train_loss: 0.6626, test_loss: 1.0937, test_f1: 0.5625
 epoch: 62, train_loss: 0.6781, test_loss: 1.0895, test_f1: 0.5621
 epoch: 63, train_loss: 0.6521, test_loss: 1.1843, test_f1: 0.5693
 epoch: 64, train_loss: 0.6549, test_loss: 1.1295, test_f1: 0.5705
 epoch: 65, train_loss: 0.6834, test_loss: 1.1174, test_f1: 0.5851
 epoch: 66, train_loss: 0.6619, test_loss: 1.1085, test_f1: 0.5701
 epoch: 67, train_loss: 0.6628, test_loss: 1.1832, test_f1: 0.5965
 epoch: 68, train_loss: 0.6589, test_loss: 1.1100, test_f1: 0.5775
 epoch: 69, train_loss: 0.6626, test_loss: 1.1000, test_f1: 0.5989
 epoch: 70, train_loss: 0.6289, test_loss: 1.1967, test_f1: 0.5406
 epoch: 71, train_loss: 0.6430, test_loss: 1.2024, test_f1: 0.5883
 epoch: 72, train_loss: 0.6326, test_loss: 1.1873, test_f1: 0.5616
 epoch: 73, train_loss: 0.6421, test_loss: 1.2195, test_f1: 0.5902
 epoch: 74, train_loss: 0.6618, test_loss: 1.1641, test_f1: 0.5872
 epoch: 75, train_loss: 0.6210, test_loss: 1.1394, test_f1: 0.5902
 epoch: 76, train_loss: 0.6442, test_loss: 1.1693, test_f1: 0.5675
 epoch: 77, train_loss: 0.6166, test_loss: 1.1308, test_f1: 0.6004
 epoch: 78, train_loss: 0.6551, test_loss: 1.1438, test_f1: 0.5622
 epoch: 79, train_loss: 0.6354, test_loss: 1.1482, test_f1: 0.5795
 epoch: 80, train_loss: 0.6301, test_loss: 1.2654, test_f1: 0.5778
 epoch: 81, train_loss: 0.6210, test_loss: 1.2083, test_f1: 0.6045
 epoch: 82, train_loss: 0.6225, test_loss: 1.2586, test_f1: 0.5800
 epoch: 83, train_loss: 0.6180, test_loss: 1.3736, test_f1: 0.5712
 epoch: 84, train_loss: 0.6033, test_loss: 1.4252, test_f1: 0.4909
 epoch: 85, train_loss: 0.6136, test_loss: 1.2063, test_f1: 0.5938
 epoch: 86, train_loss: 0.6073, test_loss: 1.3369, test_f1: 0.5735
 epoch: 87, train_loss: 0.6201, test_loss: 1.2201, test_f1: 0.5762
 epoch: 88, train_loss: 0.6424, test_loss: 1.3692, test_f1: 0.5293
 epoch: 89, train_loss: 0.6287, test_loss: 1.1729, test_f1: 0.5826
 epoch: 90, train_loss: 0.6260, test_loss: 1.2732, test_f1: 0.5732
 epoch: 91, train_loss: 0.6169, test_loss: 1.2448, test_f1: 0.5866
 epoch: 92, train_loss: 0.6341, test_loss: 1.2943, test_f1: 0.5565
 epoch: 93, train_loss: 0.6026, test_loss: 1.3350, test_f1: 0.5940
 epoch: 94, train_loss: 0.6234, test_loss: 1.2803, test_f1: 0.5889
 epoch: 95, train_loss: 0.6131, test_loss: 1.3124, test_f1: 0.5876
 epoch: 96, train_loss: 0.6120, test_loss: 1.3173, test_f1: 0.5588
 epoch: 97, train_loss: 0.6123, test_loss: 1.2636, test_f1: 0.5795
 epoch: 98, train_loss: 0.6205, test_loss: 1.3339, test_f1: 0.5744
 epoch: 99, train_loss: 0.6043, test_loss: 1.2108, test_f1: 0.5935
##################ITERATION #7 ****************************************
 epoch: 0, train_loss: 1.2653, test_loss: 1.2582, test_f1: 0.2281
 epoch: 1, train_loss: 1.0808, test_loss: 1.0958, test_f1: 0.4174
 epoch: 2, train_loss: 1.0220, test_loss: 1.0656, test_f1: 0.4731
 epoch: 3, train_loss: 1.0020, test_loss: 1.0231, test_f1: 0.4661
 epoch: 4, train_loss: 0.9859, test_loss: 1.0392, test_f1: 0.5095
 epoch: 5, train_loss: 0.9688, test_loss: 1.2239, test_f1: 0.3807
 epoch: 6, train_loss: 0.9784, test_loss: 1.1459, test_f1: 0.4617
 epoch: 7, train_loss: 0.9648, test_loss: 1.0775, test_f1: 0.4593
 epoch: 8, train_loss: 0.9519, test_loss: 1.0180, test_f1: 0.5183
 epoch: 9, train_loss: 0.9535, test_loss: 1.0337, test_f1: 0.5203
 epoch: 10, train_loss: 0.9440, test_loss: 0.9882, test_f1: 0.5224
 epoch: 11, train_loss: 0.9389, test_loss: 1.0194, test_f1: 0.5415
 epoch: 12, train_loss: 0.9203, test_loss: 0.9963, test_f1: 0.5161
 epoch: 13, train_loss: 0.9009, test_loss: 0.9681, test_f1: 0.5414
 epoch: 14, train_loss: 0.8964, test_loss: 1.0458, test_f1: 0.5317
 epoch: 15, train_loss: 0.8924, test_loss: 1.0237, test_f1: 0.5087
 epoch: 16, train_loss: 0.8789, test_loss: 0.9542, test_f1: 0.5548
 epoch: 17, train_loss: 0.8958, test_loss: 1.1159, test_f1: 0.5117
 epoch: 18, train_loss: 0.8960, test_loss: 1.0255, test_f1: 0.5413
 epoch: 19, train_loss: 0.8910, test_loss: 0.9552, test_f1: 0.5769
 epoch: 20, train_loss: 0.8426, test_loss: 1.0052, test_f1: 0.5504
 epoch: 21, train_loss: 0.8189, test_loss: 0.9593, test_f1: 0.5677
 epoch: 22, train_loss: 0.8308, test_loss: 1.0499, test_f1: 0.5008
 epoch: 23, train_loss: 0.8680, test_loss: 1.0316, test_f1: 0.5490
 epoch: 24, train_loss: 0.8435, test_loss: 0.9555, test_f1: 0.5608
 epoch: 25, train_loss: 0.8365, test_loss: 1.0118, test_f1: 0.5556
 epoch: 26, train_loss: 0.8436, test_loss: 1.0952, test_f1: 0.5163
 epoch: 27, train_loss: 0.8310, test_loss: 0.9616, test_f1: 0.5408
 epoch: 28, train_loss: 0.8053, test_loss: 0.9904, test_f1: 0.5611
 epoch: 29, train_loss: 0.8007, test_loss: 0.9539, test_f1: 0.5648
 epoch: 30, train_loss: 0.7934, test_loss: 1.0025, test_f1: 0.5975
 epoch: 31, train_loss: 0.7992, test_loss: 1.1727, test_f1: 0.5153
 epoch: 32, train_loss: 0.8096, test_loss: 0.9758, test_f1: 0.5455
 epoch: 33, train_loss: 0.8026, test_loss: 0.9795, test_f1: 0.5786
 epoch: 34, train_loss: 0.7869, test_loss: 1.0250, test_f1: 0.5680
 epoch: 35, train_loss: 0.7642, test_loss: 1.0014, test_f1: 0.5890
 epoch: 36, train_loss: 0.7846, test_loss: 1.0064, test_f1: 0.6006
 epoch: 37, train_loss: 0.7857, test_loss: 1.0102, test_f1: 0.5971
 epoch: 38, train_loss: 0.7949, test_loss: 1.0093, test_f1: 0.5938
 epoch: 39, train_loss: 0.7690, test_loss: 1.1629, test_f1: 0.5100
 epoch: 40, train_loss: 0.7916, test_loss: 1.0327, test_f1: 0.5704
 epoch: 41, train_loss: 0.7864, test_loss: 1.1221, test_f1: 0.5161
 epoch: 42, train_loss: 0.7723, test_loss: 1.0893, test_f1: 0.5675
 epoch: 43, train_loss: 0.7818, test_loss: 1.0620, test_f1: 0.5806
 epoch: 44, train_loss: 0.7420, test_loss: 1.0427, test_f1: 0.5912
 epoch: 45, train_loss: 0.7732, test_loss: 1.0142, test_f1: 0.5874
 epoch: 46, train_loss: 0.7629, test_loss: 1.2260, test_f1: 0.5014
 epoch: 47, train_loss: 0.7555, test_loss: 1.0206, test_f1: 0.5718
 epoch: 48, train_loss: 0.7529, test_loss: 1.1275, test_f1: 0.5697
 epoch: 49, train_loss: 0.7258, test_loss: 1.0957, test_f1: 0.5851
 epoch: 50, train_loss: 0.7481, test_loss: 1.1881, test_f1: 0.5582
 epoch: 51, train_loss: 0.7393, test_loss: 1.0518, test_f1: 0.5784
 epoch: 52, train_loss: 0.7125, test_loss: 1.0577, test_f1: 0.5856
 epoch: 53, train_loss: 0.7096, test_loss: 1.0950, test_f1: 0.5985
 epoch: 54, train_loss: 0.6939, test_loss: 1.1323, test_f1: 0.5992
 epoch: 55, train_loss: 0.7084, test_loss: 1.1362, test_f1: 0.5712
 epoch: 56, train_loss: 0.6997, test_loss: 1.0703, test_f1: 0.5937
 epoch: 57, train_loss: 0.6836, test_loss: 1.1025, test_f1: 0.5798
 epoch: 58, train_loss: 0.6916, test_loss: 1.0960, test_f1: 0.6045
 epoch: 59, train_loss: 0.6844, test_loss: 1.0617, test_f1: 0.6163
 epoch: 60, train_loss: 0.6970, test_loss: 1.1149, test_f1: 0.5904
 epoch: 61, train_loss: 0.6813, test_loss: 1.1477, test_f1: 0.5684
 epoch: 62, train_loss: 0.6990, test_loss: 1.1283, test_f1: 0.6006
 epoch: 63, train_loss: 0.6853, test_loss: 1.1060, test_f1: 0.6140
 epoch: 64, train_loss: 0.6943, test_loss: 1.0890, test_f1: 0.5825
 epoch: 65, train_loss: 0.6925, test_loss: 1.1203, test_f1: 0.6047
 epoch: 66, train_loss: 0.6916, test_loss: 1.1407, test_f1: 0.5585
 epoch: 67, train_loss: 0.7106, test_loss: 1.1994, test_f1: 0.5822
 epoch: 68, train_loss: 0.6869, test_loss: 1.1170, test_f1: 0.6137
 epoch: 69, train_loss: 0.6778, test_loss: 1.1681, test_f1: 0.5739
 epoch: 70, train_loss: 0.6855, test_loss: 1.1470, test_f1: 0.6167
 epoch: 71, train_loss: 0.6791, test_loss: 1.1230, test_f1: 0.6137
 epoch: 72, train_loss: 0.6839, test_loss: 1.1703, test_f1: 0.5832
 epoch: 73, train_loss: 0.6678, test_loss: 1.1684, test_f1: 0.6220
 epoch: 74, train_loss: 0.6626, test_loss: 1.2680, test_f1: 0.5714
 epoch: 75, train_loss: 0.6840, test_loss: 1.1873, test_f1: 0.5670
 epoch: 76, train_loss: 0.6952, test_loss: 1.1741, test_f1: 0.5986
 epoch: 77, train_loss: 0.6591, test_loss: 1.1412, test_f1: 0.5898
 epoch: 78, train_loss: 0.6583, test_loss: 1.2058, test_f1: 0.5095
 epoch: 79, train_loss: 0.6675, test_loss: 1.1744, test_f1: 0.5796
 epoch: 80, train_loss: 0.6547, test_loss: 1.1453, test_f1: 0.6139
 epoch: 81, train_loss: 0.6584, test_loss: 1.1764, test_f1: 0.5818
 epoch: 82, train_loss: 0.6542, test_loss: 1.2820, test_f1: 0.5622
 epoch: 83, train_loss: 0.6602, test_loss: 1.2001, test_f1: 0.5820
 epoch: 84, train_loss: 0.6558, test_loss: 1.2123, test_f1: 0.5967
 epoch: 85, train_loss: 0.6650, test_loss: 1.2024, test_f1: 0.5606
 epoch: 86, train_loss: 0.6420, test_loss: 1.1857, test_f1: 0.6180
 epoch: 87, train_loss: 0.6443, test_loss: 1.1845, test_f1: 0.5762
 epoch: 88, train_loss: 0.6545, test_loss: 1.2640, test_f1: 0.5692
 epoch: 89, train_loss: 0.6580, test_loss: 1.3109, test_f1: 0.5735
 epoch: 90, train_loss: 0.6469, test_loss: 1.1836, test_f1: 0.6072
 epoch: 91, train_loss: 0.6567, test_loss: 1.2089, test_f1: 0.5871
 epoch: 92, train_loss: 0.6700, test_loss: 1.2307, test_f1: 0.5911
 epoch: 93, train_loss: 0.6171, test_loss: 1.2369, test_f1: 0.6258
 epoch: 94, train_loss: 0.6645, test_loss: 1.2328, test_f1: 0.5757
 epoch: 95, train_loss: 0.6433, test_loss: 1.3200, test_f1: 0.5540
 epoch: 96, train_loss: 0.6505, test_loss: 1.2585, test_f1: 0.5493
 epoch: 97, train_loss: 0.6595, test_loss: 1.2765, test_f1: 0.5961
 epoch: 98, train_loss: 0.6588, test_loss: 1.2488, test_f1: 0.5737
 epoch: 99, train_loss: 0.6325, test_loss: 1.2196, test_f1: 0.5652
##################ITERATION #8 ****************************************
 epoch: 0, train_loss: 1.2563, test_loss: 1.3683, test_f1: 0.2587
 epoch: 1, train_loss: 1.0559, test_loss: 1.2315, test_f1: 0.3334
 epoch: 2, train_loss: 1.0092, test_loss: 1.1669, test_f1: 0.5096
 epoch: 3, train_loss: 1.0090, test_loss: 1.1566, test_f1: 0.4068
 epoch: 4, train_loss: 0.9747, test_loss: 1.1630, test_f1: 0.4865
 epoch: 5, train_loss: 0.9734, test_loss: 1.0322, test_f1: 0.4764
 epoch: 6, train_loss: 0.9636, test_loss: 1.0297, test_f1: 0.5321
 epoch: 7, train_loss: 0.9397, test_loss: 1.0736, test_f1: 0.4804
 epoch: 8, train_loss: 0.9455, test_loss: 1.0038, test_f1: 0.5587
 epoch: 9, train_loss: 0.9521, test_loss: 1.0942, test_f1: 0.4374
 epoch: 10, train_loss: 0.9592, test_loss: 1.0326, test_f1: 0.5114
 epoch: 11, train_loss: 0.9136, test_loss: 1.0085, test_f1: 0.5589
 epoch: 12, train_loss: 0.9242, test_loss: 1.1292, test_f1: 0.5053
 epoch: 13, train_loss: 0.9430, test_loss: 0.9990, test_f1: 0.5129
 epoch: 14, train_loss: 0.9251, test_loss: 1.0588, test_f1: 0.5444
 epoch: 15, train_loss: 0.8977, test_loss: 0.9701, test_f1: 0.5692
 epoch: 16, train_loss: 0.9076, test_loss: 0.9843, test_f1: 0.5515
 epoch: 17, train_loss: 0.9202, test_loss: 1.1661, test_f1: 0.5260
 epoch: 18, train_loss: 0.9363, test_loss: 1.0368, test_f1: 0.5694
 epoch: 19, train_loss: 0.8954, test_loss: 1.0027, test_f1: 0.5831
 epoch: 20, train_loss: 0.8719, test_loss: 1.0465, test_f1: 0.5692
 epoch: 21, train_loss: 0.8650, test_loss: 1.0250, test_f1: 0.5595
 epoch: 22, train_loss: 0.8612, test_loss: 0.9675, test_f1: 0.5914
 epoch: 23, train_loss: 0.8635, test_loss: 1.0466, test_f1: 0.5319
 epoch: 24, train_loss: 0.8719, test_loss: 0.9539, test_f1: 0.5751
 epoch: 25, train_loss: 0.8513, test_loss: 1.0132, test_f1: 0.5713
 epoch: 26, train_loss: 0.8238, test_loss: 1.0991, test_f1: 0.4972
 epoch: 27, train_loss: 0.8416, test_loss: 1.1488, test_f1: 0.5192
 epoch: 28, train_loss: 0.8644, test_loss: 1.0695, test_f1: 0.5660
 epoch: 29, train_loss: 0.8478, test_loss: 1.0040, test_f1: 0.5817
 epoch: 30, train_loss: 0.8498, test_loss: 0.9568, test_f1: 0.5851
 epoch: 31, train_loss: 0.8200, test_loss: 1.0385, test_f1: 0.5466
 epoch: 32, train_loss: 0.8022, test_loss: 1.0414, test_f1: 0.5683
 epoch: 33, train_loss: 0.8021, test_loss: 1.1138, test_f1: 0.5491
 epoch: 34, train_loss: 0.7934, test_loss: 1.0520, test_f1: 0.4799
 epoch: 35, train_loss: 0.8189, test_loss: 1.0003, test_f1: 0.5746
 epoch: 36, train_loss: 0.8266, test_loss: 1.0264, test_f1: 0.5760
 epoch: 37, train_loss: 0.8046, test_loss: 1.0863, test_f1: 0.5846
 epoch: 38, train_loss: 0.7589, test_loss: 0.9354, test_f1: 0.6015
 epoch: 39, train_loss: 0.7470, test_loss: 0.9981, test_f1: 0.5841
 epoch: 40, train_loss: 0.7742, test_loss: 1.0525, test_f1: 0.5802
 epoch: 41, train_loss: 0.7850, test_loss: 0.9544, test_f1: 0.5262
 epoch: 42, train_loss: 0.7971, test_loss: 1.1317, test_f1: 0.5634
 epoch: 43, train_loss: 0.7713, test_loss: 1.0634, test_f1: 0.5647
 epoch: 44, train_loss: 0.7599, test_loss: 1.1347, test_f1: 0.6000
 epoch: 45, train_loss: 0.7502, test_loss: 1.2001, test_f1: 0.5135
 epoch: 46, train_loss: 0.8051, test_loss: 1.0596, test_f1: 0.5310
 epoch: 47, train_loss: 0.7673, test_loss: 1.1428, test_f1: 0.5592
 epoch: 48, train_loss: 0.7857, test_loss: 1.1029, test_f1: 0.4932
 epoch: 49, train_loss: 0.7540, test_loss: 1.2113, test_f1: 0.5934
 epoch: 50, train_loss: 0.7630, test_loss: 1.1424, test_f1: 0.5710
 epoch: 51, train_loss: 0.7188, test_loss: 1.0248, test_f1: 0.5981
 epoch: 52, train_loss: 0.7252, test_loss: 1.0435, test_f1: 0.6141
 epoch: 53, train_loss: 0.6895, test_loss: 1.0880, test_f1: 0.5994
 epoch: 54, train_loss: 0.6933, test_loss: 1.1614, test_f1: 0.6074
 epoch: 55, train_loss: 0.6845, test_loss: 1.1004, test_f1: 0.6002
 epoch: 56, train_loss: 0.6806, test_loss: 1.2271, test_f1: 0.5973
 epoch: 57, train_loss: 0.6783, test_loss: 1.1367, test_f1: 0.5988
 epoch: 58, train_loss: 0.6782, test_loss: 1.1480, test_f1: 0.6136
 epoch: 59, train_loss: 0.6820, test_loss: 1.2574, test_f1: 0.5817
 epoch: 60, train_loss: 0.6611, test_loss: 1.2377, test_f1: 0.5569
 epoch: 61, train_loss: 0.6723, test_loss: 1.1204, test_f1: 0.6146
 epoch: 62, train_loss: 0.6577, test_loss: 1.1687, test_f1: 0.6056
 epoch: 63, train_loss: 0.6670, test_loss: 1.2292, test_f1: 0.5984
 epoch: 64, train_loss: 0.6712, test_loss: 1.2095, test_f1: 0.5635
 epoch: 65, train_loss: 0.6710, test_loss: 1.2759, test_f1: 0.5555
 epoch: 66, train_loss: 0.6754, test_loss: 1.2016, test_f1: 0.5783
 epoch: 67, train_loss: 0.6598, test_loss: 1.3392, test_f1: 0.5205
 epoch: 68, train_loss: 0.6329, test_loss: 1.1795, test_f1: 0.5727
 epoch: 69, train_loss: 0.6486, test_loss: 1.3067, test_f1: 0.5593
 epoch: 70, train_loss: 0.6515, test_loss: 1.1788, test_f1: 0.6220
 epoch: 71, train_loss: 0.6346, test_loss: 1.2495, test_f1: 0.6245
 epoch: 72, train_loss: 0.6568, test_loss: 1.4323, test_f1: 0.5485
 epoch: 73, train_loss: 0.6453, test_loss: 1.4339, test_f1: 0.5004
 epoch: 74, train_loss: 0.6489, test_loss: 1.2835, test_f1: 0.5785
 epoch: 75, train_loss: 0.6618, test_loss: 1.1524, test_f1: 0.6121
 epoch: 76, train_loss: 0.6258, test_loss: 1.1850, test_f1: 0.6085
 epoch: 77, train_loss: 0.6400, test_loss: 1.2021, test_f1: 0.6076
 epoch: 78, train_loss: 0.6418, test_loss: 1.2178, test_f1: 0.6121
 epoch: 79, train_loss: 0.6119, test_loss: 1.2312, test_f1: 0.5738
 epoch: 80, train_loss: 0.6448, test_loss: 1.1711, test_f1: 0.6205
 epoch: 81, train_loss: 0.6299, test_loss: 1.2501, test_f1: 0.5790
 epoch: 82, train_loss: 0.6229, test_loss: 1.2274, test_f1: 0.6020
 epoch: 83, train_loss: 0.6028, test_loss: 1.2603, test_f1: 0.5620
 epoch: 84, train_loss: 0.6167, test_loss: 1.3097, test_f1: 0.6085
 epoch: 85, train_loss: 0.6041, test_loss: 1.3749, test_f1: 0.5530
 epoch: 86, train_loss: 0.6003, test_loss: 1.2150, test_f1: 0.5743
 epoch: 87, train_loss: 0.6232, test_loss: 1.3148, test_f1: 0.5887
 epoch: 88, train_loss: 0.6211, test_loss: 1.2367, test_f1: 0.6287
 epoch: 89, train_loss: 0.6242, test_loss: 1.3086, test_f1: 0.5747
 epoch: 90, train_loss: 0.6155, test_loss: 1.1802, test_f1: 0.6387
 epoch: 91, train_loss: 0.6113, test_loss: 1.2644, test_f1: 0.5919
 epoch: 92, train_loss: 0.5849, test_loss: 1.2725, test_f1: 0.6126
 epoch: 93, train_loss: 0.5685, test_loss: 1.3216, test_f1: 0.6018
 epoch: 94, train_loss: 0.6079, test_loss: 1.2176, test_f1: 0.6040
 epoch: 95, train_loss: 0.6028, test_loss: 1.1802, test_f1: 0.6368
 epoch: 96, train_loss: 0.5820, test_loss: 1.2128, test_f1: 0.6309
 epoch: 97, train_loss: 0.5599, test_loss: 1.2653, test_f1: 0.6278
 epoch: 98, train_loss: 0.5767, test_loss: 1.3224, test_f1: 0.6078
 epoch: 99, train_loss: 0.5756, test_loss: 1.2361, test_f1: 0.6197
##################ITERATION #9 ****************************************
 epoch: 0, train_loss: 1.2397, test_loss: 1.2777, test_f1: 0.2722
 epoch: 1, train_loss: 1.1333, test_loss: 1.1956, test_f1: 0.3670
 epoch: 2, train_loss: 1.0758, test_loss: 1.0863, test_f1: 0.4818
 epoch: 3, train_loss: 1.0464, test_loss: 1.1421, test_f1: 0.4876
 epoch: 4, train_loss: 1.0115, test_loss: 1.0435, test_f1: 0.5061
 epoch: 5, train_loss: 1.0042, test_loss: 1.1820, test_f1: 0.4586
 epoch: 6, train_loss: 0.9747, test_loss: 1.0040, test_f1: 0.4460
 epoch: 7, train_loss: 0.9497, test_loss: 1.1906, test_f1: 0.4186
 epoch: 8, train_loss: 0.9705, test_loss: 1.0280, test_f1: 0.4877
 epoch: 9, train_loss: 0.9414, test_loss: 0.9866, test_f1: 0.5160
 epoch: 10, train_loss: 0.9258, test_loss: 1.0469, test_f1: 0.5047
 epoch: 11, train_loss: 0.9518, test_loss: 0.9733, test_f1: 0.5256
 epoch: 12, train_loss: 0.9385, test_loss: 0.9858, test_f1: 0.4800
 epoch: 13, train_loss: 0.9375, test_loss: 1.0466, test_f1: 0.5548
 epoch: 14, train_loss: 0.9259, test_loss: 0.9748, test_f1: 0.5420
 epoch: 15, train_loss: 0.9241, test_loss: 0.9807, test_f1: 0.5587
 epoch: 16, train_loss: 0.9064, test_loss: 1.0194, test_f1: 0.5388
 epoch: 17, train_loss: 0.9125, test_loss: 1.1219, test_f1: 0.4911
 epoch: 18, train_loss: 0.9290, test_loss: 1.0516, test_f1: 0.5641
 epoch: 19, train_loss: 0.9034, test_loss: 1.1003, test_f1: 0.5337
 epoch: 20, train_loss: 0.9160, test_loss: 0.9681, test_f1: 0.5342
 epoch: 21, train_loss: 0.9023, test_loss: 1.1364, test_f1: 0.5211
 epoch: 22, train_loss: 0.8839, test_loss: 1.0385, test_f1: 0.5550
 epoch: 23, train_loss: 0.8563, test_loss: 1.1696, test_f1: 0.5001
 epoch: 24, train_loss: 0.8658, test_loss: 1.0228, test_f1: 0.5941
 epoch: 25, train_loss: 0.8548, test_loss: 1.2078, test_f1: 0.5474
 epoch: 26, train_loss: 0.8426, test_loss: 1.0819, test_f1: 0.5779
 epoch: 27, train_loss: 0.8357, test_loss: 1.1297, test_f1: 0.5012
 epoch: 28, train_loss: 0.8225, test_loss: 1.0901, test_f1: 0.5368
 epoch: 29, train_loss: 0.8291, test_loss: 1.0315, test_f1: 0.5768
 epoch: 30, train_loss: 0.8294, test_loss: 1.3798, test_f1: 0.5238
 epoch: 31, train_loss: 0.8186, test_loss: 1.0450, test_f1: 0.6086
 epoch: 32, train_loss: 0.8155, test_loss: 1.0679, test_f1: 0.5523
 epoch: 33, train_loss: 0.8270, test_loss: 1.0258, test_f1: 0.5164
 epoch: 34, train_loss: 0.8457, test_loss: 1.0513, test_f1: 0.5865
 epoch: 35, train_loss: 0.8113, test_loss: 1.0945, test_f1: 0.5472
 epoch: 36, train_loss: 0.7954, test_loss: 1.0487, test_f1: 0.6009
 epoch: 37, train_loss: 0.8023, test_loss: 1.0933, test_f1: 0.5732
 epoch: 38, train_loss: 0.7911, test_loss: 1.0890, test_f1: 0.5527
 epoch: 39, train_loss: 0.7601, test_loss: 1.1824, test_f1: 0.5484
 epoch: 40, train_loss: 0.7827, test_loss: 0.9789, test_f1: 0.5434
 epoch: 41, train_loss: 0.8041, test_loss: 0.9330, test_f1: 0.5793
 epoch: 42, train_loss: 0.7903, test_loss: 1.0501, test_f1: 0.5909
 epoch: 43, train_loss: 0.7884, test_loss: 1.2020, test_f1: 0.5388
 epoch: 44, train_loss: 0.7769, test_loss: 0.9651, test_f1: 0.5873
 epoch: 45, train_loss: 0.7630, test_loss: 1.1042, test_f1: 0.5746
 epoch: 46, train_loss: 0.7671, test_loss: 1.0912, test_f1: 0.5685
 epoch: 47, train_loss: 0.7450, test_loss: 1.0209, test_f1: 0.5885
 epoch: 48, train_loss: 0.7438, test_loss: 1.1588, test_f1: 0.5585
 epoch: 49, train_loss: 0.7657, test_loss: 1.0362, test_f1: 0.5206
 epoch: 50, train_loss: 0.7843, test_loss: 1.1283, test_f1: 0.5576
 epoch: 51, train_loss: 0.7553, test_loss: 1.0565, test_f1: 0.5364
 epoch: 52, train_loss: 0.7283, test_loss: 1.0586, test_f1: 0.5750
 epoch: 53, train_loss: 0.7388, test_loss: 1.1048, test_f1: 0.5854
 epoch: 54, train_loss: 0.7125, test_loss: 1.0504, test_f1: 0.5416
 epoch: 55, train_loss: 0.7069, test_loss: 1.1494, test_f1: 0.5639
 epoch: 56, train_loss: 0.7121, test_loss: 1.1229, test_f1: 0.5609
 epoch: 57, train_loss: 0.7142, test_loss: 1.0353, test_f1: 0.5834
 epoch: 58, train_loss: 0.7004, test_loss: 1.0156, test_f1: 0.5702
 epoch: 59, train_loss: 0.6995, test_loss: 1.0787, test_f1: 0.5689
 epoch: 60, train_loss: 0.6822, test_loss: 1.2026, test_f1: 0.5763
 epoch: 61, train_loss: 0.7024, test_loss: 1.0500, test_f1: 0.5773
 epoch: 62, train_loss: 0.6973, test_loss: 1.1561, test_f1: 0.5720
 epoch: 63, train_loss: 0.6849, test_loss: 1.0855, test_f1: 0.5658
 epoch: 64, train_loss: 0.6631, test_loss: 1.2787, test_f1: 0.5244
 epoch: 65, train_loss: 0.6729, test_loss: 1.1499, test_f1: 0.5407
 epoch: 66, train_loss: 0.7041, test_loss: 1.2388, test_f1: 0.5296
 epoch: 67, train_loss: 0.6896, test_loss: 1.2438, test_f1: 0.5265
 epoch: 68, train_loss: 0.6975, test_loss: 1.0741, test_f1: 0.5766
 epoch: 69, train_loss: 0.7004, test_loss: 1.1656, test_f1: 0.5558
 epoch: 70, train_loss: 0.6920, test_loss: 1.2030, test_f1: 0.5222
 epoch: 71, train_loss: 0.6936, test_loss: 1.2142, test_f1: 0.5446
 epoch: 72, train_loss: 0.6810, test_loss: 1.4018, test_f1: 0.5444
 epoch: 73, train_loss: 0.6756, test_loss: 1.0967, test_f1: 0.5608
 epoch: 74, train_loss: 0.6933, test_loss: 1.3591, test_f1: 0.5301
 epoch: 75, train_loss: 0.6762, test_loss: 1.1798, test_f1: 0.5322
 epoch: 76, train_loss: 0.6605, test_loss: 1.2288, test_f1: 0.5432
 epoch: 77, train_loss: 0.6558, test_loss: 1.1855, test_f1: 0.5614
 epoch: 78, train_loss: 0.6844, test_loss: 1.1200, test_f1: 0.5784
 epoch: 79, train_loss: 0.6505, test_loss: 1.2136, test_f1: 0.5485
 epoch: 80, train_loss: 0.6308, test_loss: 1.0976, test_f1: 0.5680
 epoch: 81, train_loss: 0.6667, test_loss: 1.1450, test_f1: 0.5384
 epoch: 82, train_loss: 0.6636, test_loss: 1.2001, test_f1: 0.5801
 epoch: 83, train_loss: 0.6509, test_loss: 1.3850, test_f1: 0.5706
 epoch: 84, train_loss: 0.6550, test_loss: 1.0664, test_f1: 0.5707
 epoch: 85, train_loss: 0.6594, test_loss: 1.1398, test_f1: 0.5783
 epoch: 86, train_loss: 0.6720, test_loss: 1.1866, test_f1: 0.5841
 epoch: 87, train_loss: 0.6618, test_loss: 1.1841, test_f1: 0.5480
 epoch: 88, train_loss: 0.6183, test_loss: 1.1023, test_f1: 0.5864
 epoch: 89, train_loss: 0.6706, test_loss: 1.1438, test_f1: 0.5536
 epoch: 90, train_loss: 0.6482, test_loss: 1.1514, test_f1: 0.5738
 epoch: 91, train_loss: 0.6439, test_loss: 1.1114, test_f1: 0.5923
 epoch: 92, train_loss: 0.6239, test_loss: 1.1949, test_f1: 0.5943
 epoch: 93, train_loss: 0.6554, test_loss: 1.1974, test_f1: 0.5568
 epoch: 94, train_loss: 0.6505, test_loss: 1.0786, test_f1: 0.5574
 epoch: 95, train_loss: 0.6469, test_loss: 1.1462, test_f1: 0.6021
 epoch: 96, train_loss: 0.6255, test_loss: 1.1596, test_f1: 0.5997
 epoch: 97, train_loss: 0.6294, test_loss: 1.0754, test_f1: 0.5926
 epoch: 98, train_loss: 0.6285, test_loss: 1.1239, test_f1: 0.5701
 epoch: 99, train_loss: 0.6045, test_loss: 1.0435, test_f1: 0.6008

Training completed in 626.67 seconds
Best F1: 0.6644 at epoch 92
Mean F1 across iterations: 0.6200  0.0193
========================FINAL RESULTS================================
FEGIN weighted F1: 0.6644  0.0193
python main.py --data ltspice_demos --representation component_net --model FEGIN --layers 4 --hiddens 16 --batch_size 64 --lr 0.01 --emb_size 250 --epochs 100 --save_appendix component_net_L4_H16_BS64_LR0.01_E250 --no_val
-----



STDERR:
  File "main.py", line 370, in <module>
    main()
  File "main.py", line 254, in main
    dataset = dataset_class(
  File "/home/philip/projects/ltspice_examples_code_repo/Circuit-Completion-Using-GNNs/component_classification_with_link_prediction_head/evaluation/FEGIN/kernel/circuit_datasets.py", line 15, in __init__
    self.data, self.slices = torch.load(self.processed_paths[0])
  File "/home/philip/.local/lib/python3.8/site-packages/torch/serialization.py", line 1040, in load
    warnings.warn(
  File "/usr/lib/python3.8/warnings.py", line 109, in _showwarnmsg
    sw(msg.message, msg.category, msg.filename, msg.lineno,
  File "main.py", line 47, in warn_with_traceback
    traceback.print_stack(file=log)
/home/philip/projects/ltspice_examples_code_repo/Circuit-Completion-Using-GNNs/component_classification_with_link_prediction_head/evaluation/FEGIN/kernel/circuit_datasets.py:15: FutureWarning: You are using `torch.load` with `weights_only=False` (the current default value), which uses the default pickle module implicitly. It is possible to construct malicious pickle data which will execute arbitrary code during unpickling (See https://github.com/pytorch/pytorch/blob/main/SECURITY.md#untrusted-models for more details). In a future release, the default value for `weights_only` will be flipped to `True`. This limits the functions that could be executed during unpickling. Arbitrary objects will no longer be allowed to be loaded via this mode unless they are explicitly allowlisted by the user via `torch.serialization.add_safe_globals`. We recommend you start setting `weights_only=True` for any use case where you don't have full control of the loaded file. Please open an issue on GitHub for any issues related to this experimental feature.
  self.data, self.slices = torch.load(self.processed_paths[0])
